{"timestamp":"2026-03-21T02:57:52+01:00","experiment_id":"2026-03-21-keep-remove-runtime-typing-imports","hypothesis":"Because `satsolver.py`, `satsolver_fast.py`, and `satsolver_core.py` all use postponed annotations under `from __future__ import annotations`, removing runtime `typing` imports and switching to `| None` plus `collections.abc.Iterable` should shave exact-CLI startup cost without changing solver behavior.","change_summary":"Removed runtime `typing` imports from the promoted wrapper path and the shared core, replaced `Optional[...]` annotations with `| None`, moved the core's iterable type hint to `collections.abc.Iterable`, measured the startup-sensitive root-hit exact-CLI slice and the mixed nine-case hotspot slice against a frozen `HEAD` baseline, then confirmed the change on the full repeat-aware exact-CLI 59-case suite and refreshed `out_cli_extended.txt`.","files_changed":["agent_log.md","benchmark_summary.md","experiments.jsonl","next_steps.md","out_cli_extended.txt","satsolver.py","satsolver_fast.py","satsolver_core.py"],"datasets":["small/test_1.cnf","small/test_5.cnf","small/test_6.cnf","small/test_9.cnf","medium/test_8.cnf","medium/test_9.cnf","large/test_1.cnf","large/test_2.cnf","large/test_5.cnf","large/test_7.cnf","large/test_9.cnf","special/easy.cnf","small/test_10.cnf","medium/test_3.cnf","medium/test_4.cnf","large/test_6.cnf","large/test_8.cnf","large/test_10.cnf","special/hard.cnf","special/tseitin.cnf","small","medium","large","special","satlib_subset","satlib_more"],"commands":["python -X importtime -c \"import satsolver\"","python -X importtime -c \"import satsolver_core\"","python -m py_compile satsolver.py satsolver_fast.py satsolver_core.py","git show HEAD:satsolver.py > /tmp/satsolver_head_typing_baseline/satsolver.py","git show HEAD:satsolver_core.py > /tmp/satsolver_head_typing_baseline/satsolver_core.py","python tools/hotspot_compare.py --baseline-cli-script /tmp/satsolver_head_typing_baseline/satsolver.py --candidate-cli-script satsolver.py --repeat 2 small/test_1.cnf small/test_5.cnf small/test_6.cnf small/test_9.cnf medium/test_8.cnf medium/test_9.cnf large/test_1.cnf large/test_2.cnf large/test_5.cnf large/test_7.cnf large/test_9.cnf special/easy.cnf","python tools/hotspot_compare.py --baseline-cli-script /tmp/satsolver_head_typing_baseline/satsolver.py --candidate-cli-script satsolver.py small/test_1.cnf small/test_10.cnf medium/test_3.cnf medium/test_4.cnf large/test_6.cnf large/test_8.cnf large/test_10.cnf special/hard.cnf special/tseitin.cnf","python benchmark_suite.py satsolver /tmp/typing_baseline_cli_repeat2_full.txt small medium large special satlib_subset satlib_more --cli-script /tmp/satsolver_head_typing_baseline/satsolver.py --repeat 2","python benchmark_suite.py satsolver /tmp/typing_candidate_cli_repeat2_full.txt small medium large special satlib_subset satlib_more --cli-script satsolver.py --repeat 2","python -m unittest discover -s tests -v"],"metrics_before":{"unit_test_count":48,"root_hit_slice_two_order_avg_baseline_s":0.4338,"mixed_slice_two_order_avg_baseline_s":24.5782,"repeat2_exact_cli_59case_baseline_s":28.3088},"metrics_after":{"unit_test_count":48,"root_hit_slice_two_order_avg_candidate_s":0.3878,"mixed_slice_two_order_avg_candidate_s":24.4033,"repeat2_exact_cli_59case_candidate_s":27.9510},"correctness_status":"the import-cleanup branch preserved solver behavior, stayed 59/59 correct on the repeat-aware exact-CLI full suite, refreshed the exact-CLI benchmark artifact, and still passed all 48 regression tests","decision":"keep","notes":"This is a small but real exact-CLI startup-path keep against the promoted wrapper baseline, not a new historical best. The broad win is only about 1.26%, so future startup-path work should still demand same-day 59-case confirmation instead of relying on import-time traces or slice-local wins alone."}
{"timestamp":"2026-03-21T03:12:44+01:00","experiment_id":"2026-03-21-reject-strip-remaining-top-level-imports","hypothesis":"Because `Iterable` is still only used in postponed annotations and `sys`/`os` are only needed in a few CLI-only or portfolio-gate locations, stripping the remaining top-level imports from `satsolver_core.py`, `satsolver_fast.py`, and `satsolver.py` might shave a little more exact-CLI startup cost without changing solver behavior.","change_summary":"Confirmed with a one-off Python snippet that unresolved annotation names still compile under `from __future__ import annotations`, then temporarily removed the remaining top-level wrapper/core imports that only fed annotations or CLI entrypoints, benchmarked the branch against a frozen `HEAD` baseline on the SAT-heavy root-hit exact-CLI slice and the mixed nine-case hotspot slice, and reverted the code after the mixed hotspot gate regressed.","files_changed":["agent_log.md","benchmark_summary.md","experiments.jsonl","next_steps.md"],"datasets":["small/test_1.cnf","small/test_5.cnf","small/test_6.cnf","small/test_9.cnf","medium/test_8.cnf","medium/test_9.cnf","large/test_1.cnf","large/test_2.cnf","large/test_5.cnf","large/test_7.cnf","large/test_9.cnf","special/easy.cnf","small/test_10.cnf","medium/test_3.cnf","medium/test_4.cnf","large/test_6.cnf","large/test_8.cnf","large/test_10.cnf","special/hard.cnf","special/tseitin.cnf"],"commands":["python - <<'PY' ... unresolved annotation compile smoke ... PY","python -m py_compile satsolver.py satsolver_fast.py satsolver_core.py","git show HEAD:satsolver.py > /tmp/satsolver_head_importtrim_baseline/satsolver.py","git show HEAD:satsolver_core.py > /tmp/satsolver_head_importtrim_baseline/satsolver_core.py","python tools/hotspot_compare.py --baseline-cli-script /tmp/satsolver_head_importtrim_baseline/satsolver.py --candidate-cli-script satsolver.py --repeat 2 small/test_1.cnf small/test_5.cnf small/test_6.cnf small/test_9.cnf medium/test_8.cnf medium/test_9.cnf large/test_1.cnf large/test_2.cnf large/test_5.cnf large/test_7.cnf large/test_9.cnf special/easy.cnf","python tools/hotspot_compare.py --baseline-cli-script /tmp/satsolver_head_importtrim_baseline/satsolver.py --candidate-cli-script satsolver.py small/test_1.cnf small/test_10.cnf medium/test_3.cnf medium/test_4.cnf large/test_6.cnf large/test_8.cnf large/test_10.cnf special/hard.cnf special/tseitin.cnf","python -m py_compile satsolver.py satsolver_fast.py satsolver_core.py","python -m unittest discover -s tests -v"],"metrics_before":{"unit_test_count":48,"root_hit_slice_two_order_avg_baseline_s":0.4387,"mixed_slice_two_order_avg_baseline_s":23.9617,"mixed_slice_forward_baseline_s":24.2388,"mixed_slice_reverse_baseline_s":23.6845},"metrics_after":{"unit_test_count":48,"root_hit_slice_two_order_avg_candidate_s":0.4052,"mixed_slice_two_order_avg_candidate_s":24.2357,"mixed_slice_forward_candidate_s":24.5233,"mixed_slice_reverse_candidate_s":23.9482},"correctness_status":"the temporary branch compiled and produced checker-valid hotspot outputs, but it was reverted after the mixed exact-CLI hotspot gate regressed; the reverted repository still passes all 48 regression tests","decision":"discard","notes":"This is the follow-on stopping point for the startup lane: after the kept runtime-`typing` cleanup, the remaining import trimming still made the startup-sensitive slice prettier but hurt the broader solver path, so future startup work should demand a broader win than import shaving alone."}
{"timestamp":"2026-03-21T03:15:42+01:00","experiment_id":"2026-03-21-reject-lean-fast-wrapper","hypothesis":"Because `tests/test_solver_fast.py` only relies on the parser helpers plus `solve_cnf`, a lean alternate exact-CLI wrapper that keeps the same byte parser, structural presolvers, and solve path but drops most of the broad exported alias surface might reduce startup cost enough to matter on the SAT-heavy root-hit slice.","change_summary":"Created `scratch_satsolver_leanfast.py` as a lean wrapper over `satsolver_core`, validated SAT and UNSAT smoke cases plus checker output, measured import-time smoke, benchmarked it against retained `satsolver_fast.py` on the 12-case SAT-heavy root-hit exact-CLI slice, then tried a follow-up version that reintroduced only the hot internal aliases while still omitting the broad export surface. The follow-up still lost the same root-hit gate, so the scratch file was deleted and the retained solver files were left unchanged.","files_changed":["agent_log.md","benchmark_summary.md","experiments.jsonl","next_steps.md"],"datasets":["small/test_1.cnf","small/test_5.cnf","small/test_6.cnf","small/test_9.cnf","medium/test_8.cnf","medium/test_9.cnf","large/test_1.cnf","large/test_2.cnf","large/test_5.cnf","large/test_7.cnf","large/test_9.cnf","special/easy.cnf","special/tseitin.cnf"],"commands":["python -m cProfile -s tottime satsolver_fast.py large/test_6.cnf /tmp/profile_fast_large6_out.txt","python -m py_compile scratch_satsolver_leanfast.py","python scratch_satsolver_leanfast.py small/test_1.cnf /tmp/leanfast_sat.txt","python tools/checker.py small/test_1.cnf /tmp/leanfast_sat.txt","python scratch_satsolver_leanfast.py special/tseitin.cnf /tmp/leanfast_unsat.txt","python tools/checker.py special/tseitin.cnf /tmp/leanfast_unsat.txt --bruteforce-var-limit 0","python -X importtime -c \"import scratch_satsolver_leanfast\"","python tools/hotspot_compare.py --baseline-cli-script satsolver_fast.py --candidate-cli-script scratch_satsolver_leanfast.py --repeat 2 small/test_1.cnf small/test_5.cnf small/test_6.cnf small/test_9.cnf medium/test_8.cnf medium/test_9.cnf large/test_1.cnf large/test_2.cnf large/test_5.cnf large/test_7.cnf large/test_9.cnf special/easy.cnf","python -m py_compile scratch_satsolver_leanfast.py","python -X importtime -c \"import scratch_satsolver_leanfast\"","python tools/hotspot_compare.py --baseline-cli-script satsolver_fast.py --candidate-cli-script scratch_satsolver_leanfast.py --repeat 2 small/test_1.cnf small/test_5.cnf small/test_6.cnf small/test_9.cnf medium/test_8.cnf medium/test_9.cnf large/test_1.cnf large/test_2.cnf large/test_5.cnf large/test_7.cnf large/test_9.cnf special/easy.cnf"],"metrics_before":{"unit_test_count":48,"first_variant_root_hit_two_order_avg_baseline_s":0.3571,"first_variant_root_hit_forward_baseline_s":0.3741,"first_variant_root_hit_reverse_baseline_s":0.3401,"root_hit_two_order_avg_baseline_s":0.3474,"root_hit_forward_baseline_s":0.3444,"root_hit_reverse_baseline_s":0.3504,"first_variant_importtime_module_us":2666,"first_variant_importtime_core_us":2340},"metrics_after":{"unit_test_count":48,"first_variant_root_hit_two_order_avg_candidate_s":0.3623,"first_variant_root_hit_forward_candidate_s":0.3504,"first_variant_root_hit_reverse_candidate_s":0.3742,"root_hit_two_order_avg_candidate_s":0.3530,"root_hit_forward_candidate_s":0.3624,"root_hit_reverse_candidate_s":0.3435,"second_variant_importtime_module_us":4577,"second_variant_importtime_core_us":4045},"correctness_status":"the scratch wrapper variants compiled cleanly, checker validation stayed SAT-correct across the root-hit slice, the initial lean wrapper also produced checker-valid SAT and UNSAT smoke outputs, and the repository returned to the retained committed solver files after both root-hit gates failed","decision":"discard","notes":"Both variants failed before any mixed-slice or full-suite run. The first lean wrapper only looked good in one order, and the follow-up hot-alias version still lost overall while also making the import-time smoke check worse, so export-surface trimming does not look like a meaningful exact-CLI lever by itself."}
{"timestamp":"2026-03-21T03:23:52+01:00","experiment_id":"2026-03-21-reject-reduce-database-locked-marks","hypothesis":"Because `reduce_database()` still rebuilds a Python `set` of locked clause IDs from `self.reason` on every real reduction, replacing that with reusable tokenized clause marks might preserve the same search path while shaving enough bookkeeping to help the mixed exact-CLI hotspot slice.","change_summary":"Profiled the retained main wrapper, temporarily patched `satsolver_core.py` so `Solver` maintained reusable `clause_marks` / `clause_mark_token` state and used tokenized marks inside `reduce_database()` instead of rebuilding a Python `set`, validated SAT and UNSAT smoke cases plus checker output, benchmarked the branch against a frozen `HEAD` baseline on the mixed nine-case exact-CLI hotspot slice, then reverted `satsolver_core.py` after the slice regressed.","files_changed":["agent_log.md","benchmark_summary.md","experiments.jsonl","next_steps.md"],"datasets":["small/test_1.cnf","special/tseitin.cnf","small/test_10.cnf","medium/test_3.cnf","medium/test_4.cnf","large/test_6.cnf","large/test_8.cnf","large/test_10.cnf","special/hard.cnf"],"commands":["python -m cProfile -s tottime satsolver.py large/test_6.cnf /tmp/current_main_profile_out.txt","python -m py_compile satsolver.py satsolver_core.py satsolver_fast.py","python satsolver.py small/test_1.cnf /tmp/lockedmarks_sat.txt","python tools/checker.py small/test_1.cnf /tmp/lockedmarks_sat.txt","python satsolver.py special/tseitin.cnf /tmp/lockedmarks_unsat.txt","python tools/checker.py special/tseitin.cnf /tmp/lockedmarks_unsat.txt --bruteforce-var-limit 0","git show HEAD:satsolver.py > /tmp/satsolver_lockedmarks_baseline/satsolver.py","git show HEAD:satsolver_core.py > /tmp/satsolver_lockedmarks_baseline/satsolver_core.py","python tools/hotspot_compare.py --baseline-cli-script /tmp/satsolver_lockedmarks_baseline/satsolver.py --candidate-cli-script satsolver.py small/test_1.cnf small/test_10.cnf medium/test_3.cnf medium/test_4.cnf large/test_6.cnf large/test_8.cnf large/test_10.cnf special/hard.cnf special/tseitin.cnf"],"metrics_before":{"unit_test_count":48,"mixed_slice_two_order_avg_baseline_s":24.9111,"mixed_slice_forward_baseline_s":25.1938,"mixed_slice_reverse_baseline_s":24.6283,"large_test_6_forward_baseline_s":12.5500,"large_test_6_reverse_baseline_s":12.1653},"metrics_after":{"unit_test_count":48,"mixed_slice_two_order_avg_candidate_s":25.8251,"mixed_slice_forward_candidate_s":24.9983,"mixed_slice_reverse_candidate_s":26.6520,"large_test_6_forward_candidate_s":12.4953,"large_test_6_reverse_candidate_s":14.3797},"correctness_status":"the temporary branch compiled and stayed checker-valid on SAT and UNSAT smoke cases, but it was reverted after the mixed exact-CLI hotspot gate regressed; the retained repository returned to the committed solver baseline before final validation","decision":"discard","notes":"The idea looked like a same-search bookkeeping cleanup, but the two-order hotspot average still moved the wrong way and the reverse-order `large/test_6.cnf` regression was too large to justify a full-suite run."}
{"timestamp":"2026-03-21T03:29:36+01:00","experiment_id":"2026-03-21-reject-parse-time-structural-stats-wrapper","hypothesis":"Because `satsolver_fast.py` currently rescans the parsed clause list for pigeonhole, XOR, and portfolio gating, an alternate exact-CLI wrapper that collects those structural summaries incrementally during parsing might reduce startup cost enough to help the SAT-heavy root-hit slice without changing the solve path itself.","change_summary":"Copied `satsolver_fast.py` to `scratch_satsolver_statsfast.py`, added `FormulaStats`, parse-time structural summary collection, summary-based pigeonhole/XOR checks, and summary-based portfolio gating, validated SAT and UNSAT smoke cases plus checker output, measured import-time smoke, benchmarked the scratch wrapper against retained `satsolver_fast.py` on the 12-case SAT-heavy exact-CLI root-hit slice, and deleted the scratch file after it lost the first gate.","files_changed":["agent_log.md","benchmark_summary.md","experiments.jsonl","next_steps.md"],"datasets":["small/test_1.cnf","small/test_5.cnf","small/test_6.cnf","small/test_9.cnf","medium/test_8.cnf","medium/test_9.cnf","large/test_1.cnf","large/test_2.cnf","large/test_5.cnf","large/test_7.cnf","large/test_9.cnf","special/easy.cnf","special/tseitin.cnf"],"commands":["cp satsolver_fast.py scratch_satsolver_statsfast.py","python -m py_compile scratch_satsolver_statsfast.py","python scratch_satsolver_statsfast.py small/test_1.cnf /tmp/statsfast_sat.txt","python tools/checker.py small/test_1.cnf /tmp/statsfast_sat.txt","python scratch_satsolver_statsfast.py special/tseitin.cnf /tmp/statsfast_unsat.txt","python tools/checker.py special/tseitin.cnf /tmp/statsfast_unsat.txt --bruteforce-var-limit 0","python -X importtime -c \"import scratch_satsolver_statsfast\"","python tools/hotspot_compare.py --baseline-cli-script satsolver_fast.py --candidate-cli-script scratch_satsolver_statsfast.py --repeat 2 small/test_1.cnf small/test_5.cnf small/test_6.cnf small/test_9.cnf medium/test_8.cnf medium/test_9.cnf large/test_1.cnf large/test_2.cnf large/test_5.cnf large/test_7.cnf large/test_9.cnf special/easy.cnf"],"metrics_before":{"unit_test_count":48,"root_hit_two_order_avg_baseline_s":0.3818,"root_hit_forward_baseline_s":0.3660,"root_hit_reverse_baseline_s":0.3977},"metrics_after":{"unit_test_count":48,"root_hit_two_order_avg_candidate_s":0.4267,"root_hit_forward_candidate_s":0.4120,"root_hit_reverse_candidate_s":0.4415,"importtime_module_us":2644},"correctness_status":"the scratch wrapper compiled cleanly, checker validation stayed SAT-correct and UNSAT-correct on smoke cases, and the repository returned to the retained committed solver files after the root-hit gate failed","decision":"discard","notes":"The candidate's import-time smoke check was competitive, so the loss came from doing heavier per-clause work in the parser. Folding the structural presolve scans into parsing is therefore not a free startup win on this workload."}
{"timestamp":"2026-03-21T03:37:34+01:00","experiment_id":"2026-03-21-reject-main-lazy-export-forwarding","hypothesis":"Because the promoted `satsolver.py` still binds many aliases mainly for tests and tooling, replacing that broad top-level alias surface with lazy module `__getattr__` forwarding while keeping patch-friendly fallbacks for `Solver` and `find_iterative_root_pure_literals` might reduce exact-CLI startup work without changing solver semantics.","change_summary":"Temporarily patched `satsolver.py` to replace the broad top-level alias block with `_FORWARDED_EXPORTS` plus module `__getattr__`, switched the exact-CLI path to `base.*` where appropriate, and used `globals().get(..., base....)` in `solve_cnf_serial()` / `solve_cnf_fast_serial()` so the existing regression tests' `mock.patch(\"satsolver.Solver\", ...)` and `mock.patch(\"satsolver.find_iterative_root_pure_literals\", ...)` behavior would still work. Benchmarked the branch against a frozen `HEAD` baseline on the 12-case SAT-heavy exact-CLI root-hit slice and the mixed nine-case hotspot slice, then reverted `satsolver.py` after the mixed slice regressed.","files_changed":["agent_log.md","benchmark_summary.md","experiments.jsonl","next_steps.md"],"datasets":["small/test_1.cnf","special/tseitin.cnf","small/test_5.cnf","small/test_6.cnf","small/test_9.cnf","medium/test_8.cnf","medium/test_9.cnf","large/test_1.cnf","large/test_2.cnf","large/test_5.cnf","large/test_7.cnf","large/test_9.cnf","special/easy.cnf","small/test_10.cnf","medium/test_3.cnf","medium/test_4.cnf","large/test_6.cnf","large/test_8.cnf","large/test_10.cnf","special/hard.cnf"],"commands":["python -m py_compile satsolver.py satsolver_core.py satsolver_fast.py","git show HEAD:satsolver.py > /tmp/satsolver_lazyexports_baseline/satsolver.py","git show HEAD:satsolver_core.py > /tmp/satsolver_lazyexports_baseline/satsolver_core.py","python satsolver.py small/test_1.cnf /tmp/lazyexports_sat.txt","python tools/checker.py small/test_1.cnf /tmp/lazyexports_sat.txt","python satsolver.py special/tseitin.cnf /tmp/lazyexports_unsat.txt","python tools/checker.py special/tseitin.cnf /tmp/lazyexports_unsat.txt --bruteforce-var-limit 0","python -X importtime -c \"import satsolver\"","python tools/hotspot_compare.py --baseline-cli-script /tmp/satsolver_lazyexports_baseline/satsolver.py --candidate-cli-script satsolver.py --repeat 2 small/test_1.cnf small/test_5.cnf small/test_6.cnf small/test_9.cnf medium/test_8.cnf medium/test_9.cnf large/test_1.cnf large/test_2.cnf large/test_5.cnf large/test_7.cnf large/test_9.cnf special/easy.cnf","python tools/hotspot_compare.py --baseline-cli-script /tmp/satsolver_lazyexports_baseline/satsolver.py --candidate-cli-script satsolver.py small/test_1.cnf small/test_10.cnf medium/test_3.cnf medium/test_4.cnf large/test_6.cnf large/test_8.cnf large/test_10.cnf special/hard.cnf special/tseitin.cnf"],"metrics_before":{"unit_test_count":48,"root_hit_two_order_avg_baseline_s":0.3592,"root_hit_forward_baseline_s":0.3659,"root_hit_reverse_baseline_s":0.3526,"mixed_slice_two_order_avg_baseline_s":24.1326,"mixed_slice_forward_baseline_s":24.1847,"mixed_slice_reverse_baseline_s":24.0805},"metrics_after":{"unit_test_count":48,"root_hit_two_order_avg_candidate_s":0.3524,"root_hit_forward_candidate_s":0.3871,"root_hit_reverse_candidate_s":0.3176,"mixed_slice_two_order_avg_candidate_s":24.4102,"mixed_slice_forward_candidate_s":24.2247,"mixed_slice_reverse_candidate_s":24.5957,"importtime_module_us":3017},"correctness_status":"the temporary branch compiled cleanly, stayed checker-valid on SAT and UNSAT smoke cases, but was reverted after the mixed exact-CLI hotspot slice regressed; the retained repository returned to the committed solver baseline before final validation","decision":"discard","notes":"This was a startup-sensitive near-win that still lost the broader exact-CLI solver path. The reverse-order root-hit improvement did not survive the mixed nine-case gate, and the import-time smoke check was not better overall anyway."}
