{"timestamp":"2026-03-21T04:34:18+01:00","experiment_id":"2026-03-21-reject-propagate-quaternary-fast-path","hypothesis":"Because the kept immutable `Clause.ternary` flag paid off inside `propagate()`, adding the next fixed watched-clause family, `Clause.quaternary`, plus a dedicated exact-4-literal watcher branch may reduce generic propagation overhead without changing solver semantics.","change_summary":"Created scratch candidates `scratch_satsolver_core_quaternaryflag.py` and `scratch_satsolver_quaternaryflag.py`, added immutable `Clause.quaternary` metadata and a dedicated exact-4-literal watched-clause branch in `propagate()`, validated SAT and UNSAT smoke cases, benchmarked the branch against retained `satsolver.py` on the mixed nine-case exact-CLI hotspot slice and the 12-case SAT-heavy root-hit slice, then ran same-day repeat-aware exact-CLI 59-case baseline-vs-candidate suites and deleted the scratch files after the broad suite regressed.","files_changed":["agent_log.md","benchmark_summary.md","experiments.jsonl","next_steps.md"],"datasets":["small/test_1.cnf","special/tseitin.cnf","small/test_10.cnf","medium/test_3.cnf","medium/test_4.cnf","large/test_6.cnf","large/test_8.cnf","large/test_10.cnf","special/hard.cnf","small/test_5.cnf","small/test_6.cnf","small/test_9.cnf","medium/test_8.cnf","medium/test_9.cnf","large/test_1.cnf","large/test_2.cnf","large/test_5.cnf","large/test_7.cnf","large/test_9.cnf","special/easy.cnf","small","medium","large","special","satlib_subset","satlib_more"],"commands":["cp satsolver_core.py scratch_satsolver_core_quaternaryflag.py","cp satsolver.py scratch_satsolver_quaternaryflag.py","python -m py_compile scratch_satsolver_quaternaryflag.py scratch_satsolver_core_quaternaryflag.py","python scratch_satsolver_quaternaryflag.py small/test_1.cnf /tmp/quaternaryflag_sat.txt","python tools/checker.py small/test_1.cnf /tmp/quaternaryflag_sat.txt","python scratch_satsolver_quaternaryflag.py special/tseitin.cnf /tmp/quaternaryflag_unsat.txt","python tools/checker.py special/tseitin.cnf /tmp/quaternaryflag_unsat.txt --bruteforce-var-limit 0","python tools/hotspot_compare.py --baseline-cli-script satsolver.py --candidate-cli-script scratch_satsolver_quaternaryflag.py small/test_1.cnf small/test_10.cnf medium/test_3.cnf medium/test_4.cnf large/test_6.cnf large/test_8.cnf large/test_10.cnf special/hard.cnf special/tseitin.cnf","python tools/hotspot_compare.py --baseline-cli-script satsolver.py --candidate-cli-script scratch_satsolver_quaternaryflag.py --repeat 2 small/test_1.cnf small/test_5.cnf small/test_6.cnf small/test_9.cnf medium/test_8.cnf medium/test_9.cnf large/test_1.cnf large/test_2.cnf large/test_5.cnf large/test_7.cnf large/test_9.cnf special/easy.cnf","python benchmark_suite.py satsolver /tmp/quaternaryflag_baseline_cli_repeat2.txt small medium large special satlib_subset satlib_more --bruteforce-var-limit 16 --cli-script satsolver.py --repeat 2","python benchmark_suite.py scratch_satsolver_quaternaryflag /tmp/quaternaryflag_candidate_cli_repeat2.txt small medium large special satlib_subset satlib_more --bruteforce-var-limit 16 --cli-script scratch_satsolver_quaternaryflag.py --repeat 2"],"metrics_before":{"mixed_slice_two_order_avg_baseline_s":23.8342,"mixed_slice_forward_baseline_s":23.8778,"mixed_slice_reverse_baseline_s":23.7906,"root_hit_two_order_avg_baseline_s":0.3453,"root_hit_forward_baseline_s":0.3396,"root_hit_reverse_baseline_s":0.3509,"full_exact_cli_repeat2_baseline_s":26.8303,"full_exact_cli_repeat2_measured_baseline_s":53.6605},"metrics_after":{"mixed_slice_two_order_avg_candidate_s":23.6216,"mixed_slice_forward_candidate_s":23.6392,"mixed_slice_reverse_candidate_s":23.6040,"root_hit_two_order_avg_candidate_s":0.3528,"root_hit_forward_candidate_s":0.3334,"root_hit_reverse_candidate_s":0.3722,"full_exact_cli_repeat2_candidate_s":27.4920,"full_exact_cli_repeat2_measured_candidate_s":54.9841,"large_test_6_repeat2_baseline_s":11.7643,"large_test_6_repeat2_candidate_s":12.2309,"special_hard_repeat2_baseline_s":8.0258,"special_hard_repeat2_candidate_s":8.0231,"medium_test_4_repeat2_baseline_s":1.6916,"medium_test_4_repeat2_candidate_s":1.7577,"large_test_10_repeat2_baseline_s":1.5759,"large_test_10_repeat2_candidate_s":1.6618,"large_test_8_repeat2_baseline_s":0.2603,"large_test_8_repeat2_candidate_s":0.2729},"correctness_status":"the scratch candidate compiled cleanly, stayed checker-valid on SAT and UNSAT smoke cases, and solved 59/59 correctly on the repeat-aware exact-CLI full-suite comparison, but it was deleted after the broader suite regressed","decision":"discard","notes":"This is another hotspot-overfit reject. The exact 4-literal watched-clause fast path did help the mixed exact-CLI hotspot slice, but the startup-sensitive root-hit slice regressed and the broad repeat-aware exact-CLI suite moved the wrong way overall, with the main damage concentrated on `large/test_6.cnf`, `medium/test_4.cnf`, and `large/test_10.cnf`."}
{"timestamp":"2026-03-21T04:41:09+01:00","experiment_id":"2026-03-21-reject-propagate-local-append-pop-aliases","hypothesis":"Because `propagate()` still dominates runtime and raw list `append()` / `pop()` calls are among the largest remaining Python-level costs on the dense bottlenecks, localizing `trail.append` and per-watcher-list `watchers.pop` inside the hot loop may shave enough pure overhead to matter without changing solver semantics.","change_summary":"Created scratch candidates `scratch_satsolver_core_propagatelocals.py` and `scratch_satsolver_propagatelocals.py`, patched only `propagate()` to use local `trail_append` and per-watcher-list `watchers_pop` aliases, validated SAT and UNSAT smoke cases, benchmarked the branch against retained `satsolver.py` on the mixed nine-case exact-CLI hotspot slice, and deleted the scratch files after the two-order average still regressed.","files_changed":["agent_log.md","benchmark_summary.md","experiments.jsonl","next_steps.md"],"datasets":["small/test_1.cnf","special/tseitin.cnf","small/test_10.cnf","medium/test_3.cnf","medium/test_4.cnf","large/test_6.cnf","large/test_8.cnf","large/test_10.cnf","special/hard.cnf"],"commands":["python -m cProfile -s tottime satsolver.py large/test_6.cnf /tmp/current_cycle_large6_profile.txt","python -m cProfile -s tottime satsolver.py special/hard.cnf /tmp/current_cycle_hard_profile.txt","cp satsolver_core.py scratch_satsolver_core_propagatelocals.py","cp satsolver.py scratch_satsolver_propagatelocals.py","python -m py_compile scratch_satsolver_propagatelocals.py scratch_satsolver_core_propagatelocals.py","python scratch_satsolver_propagatelocals.py small/test_1.cnf /tmp/propagatelocals_sat.txt","python tools/checker.py small/test_1.cnf /tmp/propagatelocals_sat.txt","python scratch_satsolver_propagatelocals.py special/tseitin.cnf /tmp/propagatelocals_unsat.txt","python tools/checker.py special/tseitin.cnf /tmp/propagatelocals_unsat.txt --bruteforce-var-limit 0","python tools/hotspot_compare.py --baseline-cli-script satsolver.py --candidate-cli-script scratch_satsolver_propagatelocals.py small/test_1.cnf small/test_10.cnf medium/test_3.cnf medium/test_4.cnf large/test_6.cnf large/test_8.cnf large/test_10.cnf special/hard.cnf special/tseitin.cnf"],"metrics_before":{"mixed_slice_two_order_avg_baseline_s":24.1557,"mixed_slice_forward_baseline_s":25.1835,"mixed_slice_reverse_baseline_s":23.1279},"metrics_after":{"mixed_slice_two_order_avg_candidate_s":24.2120,"mixed_slice_forward_candidate_s":24.5555,"mixed_slice_reverse_candidate_s":23.8686,"medium_test_3_forward_baseline_s":1.3872,"medium_test_3_forward_candidate_s":1.1335,"medium_test_4_forward_baseline_s":2.8343,"medium_test_4_forward_candidate_s":1.8080,"large_test_6_forward_baseline_s":11.2736,"large_test_6_forward_candidate_s":11.7422,"special_hard_forward_baseline_s":7.7105,"special_hard_forward_candidate_s":7.8894,"large_test_6_reverse_baseline_s":11.2801,"large_test_6_reverse_candidate_s":11.6826,"special_hard_reverse_baseline_s":7.6457,"special_hard_reverse_candidate_s":7.7991},"correctness_status":"the scratch candidate compiled cleanly, stayed checker-valid on SAT and UNSAT smoke cases, and was deleted after the mixed exact-CLI hotspot gate split by order and still regressed on the two-order average","decision":"discard","notes":"This is a pure-overhead micro-optimization reject. Even with `append()` and `pop()` high in cProfile, simply rebinding them inside `propagate()` was too small and too unstable to produce a reliable end-to-end win on the real exact-CLI hotspot slice."}
{"timestamp":"2026-03-21T04:54:48+01:00","experiment_id":"2026-03-21-keep-import-gated-main-wrapper","hypothesis":"Because the retained main wrapper still trails the leaner alternate wrapper on same-day exact-CLI slices, building the broad alias surface and root-pure-enabled `solve_cnf_serial()` helper only in import mode may cut `satsolver.py` startup overhead on the required CLI path without breaking tests and tooling that import the module.","change_summary":"Created `scratch_satsolver_importgated.py`, made the CLI path use `satsolver_core` symbols directly while only exposing the broad alias surface plus `solve_cnf_serial()` when imported, validated SAT and UNSAT smoke cases, benchmarked the scratch candidate against retained `satsolver.py` on the SAT-heavy root-hit slice, the mixed nine-case exact-CLI hotspot slice, and a same-day repeat-aware exact-CLI 59-case baseline-vs-candidate comparison, then merged the change into tracked `satsolver.py`, refreshed `out_cli_extended.txt`, and deleted the scratch file.","files_changed":["satsolver.py","out_cli_extended.txt","agent_log.md","benchmark_summary.md","experiments.jsonl","next_steps.md"],"datasets":["small/test_1.cnf","special/tseitin.cnf","small/test_5.cnf","small/test_6.cnf","small/test_9.cnf","medium/test_8.cnf","medium/test_9.cnf","large/test_1.cnf","large/test_2.cnf","large/test_5.cnf","large/test_7.cnf","large/test_9.cnf","special/easy.cnf","small/test_10.cnf","medium/test_3.cnf","medium/test_4.cnf","large/test_6.cnf","large/test_8.cnf","large/test_10.cnf","special/hard.cnf","small","medium","large","special","satlib_subset","satlib_more"],"commands":["cp satsolver.py scratch_satsolver_importgated.py","python -m py_compile scratch_satsolver_importgated.py","python scratch_satsolver_importgated.py small/test_1.cnf /tmp/importgated_sat.txt","python tools/checker.py small/test_1.cnf /tmp/importgated_sat.txt","python scratch_satsolver_importgated.py special/tseitin.cnf /tmp/importgated_unsat.txt","python tools/checker.py special/tseitin.cnf /tmp/importgated_unsat.txt --bruteforce-var-limit 0","python tools/hotspot_compare.py --baseline-cli-script satsolver.py --candidate-cli-script scratch_satsolver_importgated.py --repeat 2 small/test_1.cnf small/test_5.cnf small/test_6.cnf small/test_9.cnf medium/test_8.cnf medium/test_9.cnf large/test_1.cnf large/test_2.cnf large/test_5.cnf large/test_7.cnf large/test_9.cnf special/easy.cnf","python tools/hotspot_compare.py --baseline-cli-script satsolver.py --candidate-cli-script scratch_satsolver_importgated.py small/test_1.cnf small/test_10.cnf medium/test_3.cnf medium/test_4.cnf large/test_6.cnf large/test_8.cnf large/test_10.cnf special/hard.cnf special/tseitin.cnf","python benchmark_suite.py satsolver /tmp/importgated_baseline_cli_repeat2.txt small medium large special satlib_subset satlib_more --bruteforce-var-limit 16 --cli-script satsolver.py --repeat 2","python benchmark_suite.py scratch_satsolver_importgated /tmp/importgated_candidate_cli_repeat2.txt small medium large special satlib_subset satlib_more --bruteforce-var-limit 16 --cli-script scratch_satsolver_importgated.py --repeat 2","python -m py_compile satsolver.py satsolver_core.py satsolver_fast.py","python -m unittest discover -s tests -v","python satsolver.py small/test_1.cnf /tmp/kept_cycle_sat.txt","python tools/checker.py small/test_1.cnf /tmp/kept_cycle_sat.txt","python satsolver.py special/tseitin.cnf /tmp/kept_cycle_unsat.txt","python tools/checker.py special/tseitin.cnf /tmp/kept_cycle_unsat.txt --bruteforce-var-limit 0","python benchmark_suite.py satsolver out_cli_extended.txt small medium large special satlib_subset satlib_more --bruteforce-var-limit 16 --cli-script satsolver.py --repeat 2"],"metrics_before":{"root_hit_two_order_avg_baseline_s":0.3905,"mixed_slice_two_order_avg_baseline_s":25.2601,"full_exact_cli_repeat2_baseline_s":27.6064},"metrics_after":{"root_hit_two_order_avg_candidate_s":0.3842,"mixed_slice_two_order_avg_candidate_s":23.5388,"full_exact_cli_repeat2_candidate_s":27.5425,"refreshed_retained_exact_cli_repeat2_s":26.4762,"refreshed_retained_exact_cli_repeat2_measured_s":52.9525},"correctness_status":"the scratch candidate stayed checker-valid on SAT and UNSAT smoke cases, the retained repo passed all 49 tests after merge, and both the temp full-suite comparison and the refreshed retained artifact stayed 59/59 correct","decision":"keep","notes":"This keep is a wrapper-architecture win rather than a solver-core search-path change. Unlike the earlier lazy-export and alias-trimming rejects, explicit CLI-mode/import-mode separation stayed positive on the startup-heavy root-hit slice, the mixed exact-CLI hotspot slice, and the same-day repeat-aware exact-CLI full-suite comparison, while preserving the rich import-time API for tests and tooling."}
{"timestamp":"2026-03-21T05:03:29+01:00","experiment_id":"2026-03-21-reject-core-no-cli-surface","hypothesis":"Because the real `satsolver.py` submission path never calls the standalone text parser, standalone solve helpers, standalone write path, or `main()` in `satsolver_core.py`, skipping that dead surface when the core is imported by the wrappers may cut startup overhead without touching solver logic.","change_summary":"Created scratch candidates `scratch_satsolver_core_noclisurface.py` and `scratch_satsolver_noclisurface.py`, made imported core mode omit the standalone parser/solver/writer/main surface while leaving the real wrapper solve path unchanged, validated SAT and UNSAT smoke cases, benchmarked the branch against retained `satsolver.py` on the 12-case SAT-heavy root-hit exact-CLI slice and the mixed nine-case exact-CLI hotspot slice, then deleted the scratch files after both gates failed overall.","files_changed":["agent_log.md","benchmark_summary.md","experiments.jsonl","next_steps.md"],"datasets":["small/test_1.cnf","special/tseitin.cnf","small/test_5.cnf","small/test_6.cnf","small/test_9.cnf","medium/test_8.cnf","medium/test_9.cnf","large/test_1.cnf","large/test_2.cnf","large/test_5.cnf","large/test_7.cnf","large/test_9.cnf","special/easy.cnf","small/test_10.cnf","medium/test_3.cnf","medium/test_4.cnf","large/test_6.cnf","large/test_8.cnf","large/test_10.cnf","special/hard.cnf"],"commands":["cp satsolver_core.py scratch_satsolver_core_noclisurface.py","cp satsolver.py scratch_satsolver_noclisurface.py","python -m py_compile scratch_satsolver_core_noclisurface.py scratch_satsolver_noclisurface.py","python scratch_satsolver_noclisurface.py small/test_1.cnf /tmp/noclisurface_sat.txt","python tools/checker.py small/test_1.cnf /tmp/noclisurface_sat.txt","python scratch_satsolver_noclisurface.py special/tseitin.cnf /tmp/noclisurface_unsat.txt","python tools/checker.py special/tseitin.cnf /tmp/noclisurface_unsat.txt --bruteforce-var-limit 0","python tools/hotspot_compare.py --baseline-cli-script satsolver.py --candidate-cli-script scratch_satsolver_noclisurface.py --repeat 2 small/test_1.cnf small/test_5.cnf small/test_6.cnf small/test_9.cnf medium/test_8.cnf medium/test_9.cnf large/test_1.cnf large/test_2.cnf large/test_5.cnf large/test_7.cnf large/test_9.cnf special/easy.cnf","python tools/hotspot_compare.py --baseline-cli-script satsolver.py --candidate-cli-script scratch_satsolver_noclisurface.py small/test_1.cnf small/test_10.cnf medium/test_3.cnf medium/test_4.cnf large/test_6.cnf large/test_8.cnf large/test_10.cnf special/hard.cnf special/tseitin.cnf"],"metrics_before":{"root_hit_two_order_avg_baseline_s":0.3984,"root_hit_forward_baseline_s":0.3762,"root_hit_reverse_baseline_s":0.4207,"mixed_slice_two_order_avg_baseline_s":24.5731,"mixed_slice_forward_baseline_s":23.7285,"mixed_slice_reverse_baseline_s":25.4178},"metrics_after":{"root_hit_two_order_avg_candidate_s":0.4108,"root_hit_forward_candidate_s":0.4028,"root_hit_reverse_candidate_s":0.4188,"mixed_slice_two_order_avg_candidate_s":26.5896,"mixed_slice_forward_candidate_s":23.5264,"mixed_slice_reverse_candidate_s":29.6529,"large_test_6_reverse_baseline_s":11.8065,"large_test_6_reverse_candidate_s":15.7812},"correctness_status":"the scratch candidate compiled cleanly, stayed checker-valid on SAT and UNSAT smoke cases, and was deleted after both exact-CLI slice gates regressed overall","decision":"discard","notes":"This branch changed imported core surface only, not search logic, yet still moved the exact-CLI gates the wrong way. That makes dead standalone helper definitions in imported `satsolver_core.py` look like another unreliable startup lever, even though the kept main-wrapper import gating remains valuable."}
