{"timestamp":"2026-03-20T08:38:24+01:00","experiment_id":"2026-03-20-keep-tiny-reason-minimize-fast-path","hypothesis":"A narrow binary/ternary fast path inside the existing one-hop minimize_learnt() logic should keep the same search behavior while shaving Python overhead on the dense UNSAT cases, because `2..3`-literal reasons dominate successful minimization removals.","change_summary":"Added binary and ternary reason fast paths to minimize_learnt() in satsolver.py, mirrored them in tools/profile_solver.py, added a direct regression test for binary/ternary reason handling, and refreshed repeat-aware benchmark artifacts.","files_changed":["satsolver.py","tools/profile_solver.py","tests/test_solver_regressions.py","out_extended.txt","out_cli_extended.txt","agent_log.md","experiments.jsonl","benchmark_summary.md","next_steps.md"],"datasets":["large/test_6.cnf","special/hard.cnf","medium/test_4.cnf","large/test_10.cnf","large/test_8.cnf","small/test_1.cnf","special/tseitin.cnf","small","medium","large","special","satlib_subset","satlib_more"],"commands":["python - <<'PY' ... same-run baseline vs FastMinOnlySolver over the serial five-case slice ... PY","python - <<'PY' ... reversed-order same-run FastMinOnlySolver vs baseline over the serial five-case slice ... PY","python -m unittest discover -s tests -v","python satsolver.py small/test_1.cnf /tmp/cycle_sat.txt","python tools/checker.py small/test_1.cnf /tmp/cycle_sat.txt","python satsolver.py special/tseitin.cnf /tmp/cycle_unsat.txt","python tools/checker.py special/tseitin.cnf /tmp/cycle_unsat.txt --bruteforce-var-limit 0","python satsolver.py large/test_8.cnf /tmp/cycle_large8.txt","python tools/checker.py large/test_8.cnf /tmp/cycle_large8.txt","python tools/profile_solver.py large/test_6.cnf special/hard.cnf medium/test_4.cnf large/test_8.cnf","python benchmark_suite.py satsolver out_extended.txt small medium large special satlib_subset satlib_more --bruteforce-var-limit 16 --repeat 2","python benchmark_suite.py satsolver out_cli_extended.txt small medium large special satlib_subset satlib_more --bruteforce-var-limit 16 --cli-script satsolver.py --repeat 2","python benchmark_suite.py satsolver out_cli_extended.txt small medium large special satlib_subset satlib_more --bruteforce-var-limit 16 --cli-script satsolver.py --repeat 2"],"metrics_before":{"focused_baseline_first_total_s":27.4198,"focused_baseline_second_total_s":27.8022,"repeat2_inprocess_total_s":26.4508,"repeat2_inprocess_measured_total_s":52.9016,"repeat2_exact_cli_best_total_s":28.7122,"best_single_run_inprocess_total_s":26.4178,"best_single_run_exact_cli_total_s":28.4550},"metrics_after":{"focused_fast_second_total_s":27.2886,"focused_fast_first_total_s":27.4137,"repeat2_inprocess_total_s":26.2118,"repeat2_inprocess_measured_total_s":52.4236,"repeat2_inprocess_wall_clock_s":52.5767,"latest_repeat2_exact_cli_total_s":28.9681,"latest_repeat2_exact_cli_measured_total_s":57.9363,"latest_repeat2_exact_cli_wall_clock_s":58.1687,"first_repeat2_exact_cli_total_s":28.8855,"large_test_6_repeat2_inprocess_s":12.2643,"special_hard_repeat2_inprocess_s":8.1921,"large_test_8_repeat2_inprocess_s":0.2365,"unit_test_count":22},"correctness_status":"passed 22 regression tests, SAT/UNSAT checker spot checks on small/test_1.cnf, special/tseitin.cnf, and large/test_8.cnf, and validated 59/59 repeat-aware full-suite runs in both in-process and exact-CLI modes","decision":"keep","notes":"The solver-core signal is positive and consistent on same-run hotspot A/B plus the repeat-aware in-process full suite, but the exact-CLI repeat-aware path did not set a new best. This keep should be treated as a narrow in-process win with a caution flag for future sub-1% changes."}
{"timestamp":"2026-03-20T08:49:03+01:00","experiment_id":"2026-03-20-rejected-branch-best-variable-hint-cache","hypothesis":"Because pick_branch_literal() still consumes noticeable CPU time, a very cheap cached best-variable hint updated on activity bumps and backtracks might reduce branch-selection overhead without needing the heavier lazy-heap structure that already regressed.","change_summary":"Measured a temporary HintBranchSolver subclass that cached a candidate best unassigned variable and reused it in pick_branch_literal(), plus a profiled variant to compare search counts on the main hotspots. No production solver code was changed.","files_changed":["agent_log.md","experiments.jsonl","benchmark_summary.md","next_steps.md"],"datasets":["large/test_6.cnf","special/hard.cnf","medium/test_4.cnf","large/test_10.cnf","large/test_8.cnf","small/test_1.cnf","special/tseitin.cnf"],"commands":["python - <<'PY' ... cProfile solve_cnf_serial on large/test_6.cnf ... PY","python - <<'PY' ... cProfile solve_cnf_serial on special/hard.cnf ... PY","python - <<'PY' ... same-run serial five-case baseline vs temporary HintBranchSolver ... PY","python - <<'PY' ... baseline ProfiledSolver vs temporary HintBranchProfiledSolver on large/test_6.cnf, special/hard.cnf, and large/test_8.cnf ... PY","python -m unittest discover -s tests -v","python satsolver.py small/test_1.cnf /tmp/reject_cycle_sat.txt","python tools/checker.py small/test_1.cnf /tmp/reject_cycle_sat.txt","python satsolver.py special/tseitin.cnf /tmp/reject_cycle_unsat.txt","python tools/checker.py special/tseitin.cnf /tmp/reject_cycle_unsat.txt --bruteforce-var-limit 0"],"metrics_before":{"cprofile_pick_branch_large_test_6_tottime_s":1.359,"cprofile_pick_branch_special_hard_tottime_s":0.753,"focused_five_case_total_s":28.1285,"large_test_6_s":12.9481,"special_hard_s":8.2892,"medium_test_4_s":1.7342,"large_test_10_s":1.5898,"large_test_8_s":3.5673,"profile_large_test_6_time_s":19.4633,"profile_large_test_6_decisions":72886,"profile_large_test_6_conflicts":59201,"profile_special_hard_time_s":13.8532,"profile_special_hard_decisions":54245,"profile_special_hard_conflicts":44619,"profile_large_test_8_time_s":5.0324,"profile_large_test_8_decisions":21526,"profile_large_test_8_conflicts":16430},"metrics_after":{"hint_five_case_total_s":28.5193,"hint_large_test_6_s":13.0692,"hint_special_hard_s":8.6220,"hint_medium_test_4_s":1.7610,"hint_large_test_10_s":1.6559,"hint_large_test_8_s":3.4112,"profile_hint_large_test_6_time_s":20.0181,"profile_hint_large_test_6_decisions":72886,"profile_hint_large_test_6_conflicts":59201,"profile_hint_special_hard_time_s":15.6658,"profile_hint_special_hard_decisions":54245,"profile_hint_special_hard_conflicts":44619,"profile_hint_large_test_8_time_s":5.2531,"profile_hint_large_test_8_decisions":21526,"profile_hint_large_test_8_conflicts":16430,"unit_test_count":22},"correctness_status":"temporary subclasses preserved SAT/UNSAT outcomes on the measured hotspot cases, and the retained production solver still passed 22 regression tests plus SAT/UNSAT checker spot checks","decision":"discard","notes":"The hint cache failed even when it preserved identical decisions and conflicts on the main hotspot cases, which means it added overhead without buying search improvements. Lightweight best-variable caches should be treated as another dead end unless a materially different design appears."}
{"timestamp":"2026-03-20T08:56:21+01:00","experiment_id":"2026-03-20-binary-vs-ternary-reason-profiler-split","hypothesis":"If the old conflict-analysis `2..3` reason bucket is split into exact `2` and exact `3`, it will show whether future analyze/minimize work should target binary or ternary reasons instead of treating them as one class.","change_summary":"Extended tools/profile_solver.py so reason-size profiling now reports exact `2`, exact `3`, `4..9`, and `10+` buckets for analyze() traversals and minimize_learnt() kept/removed literals, added a boundary regression test, and reran the profiler on the main hotspot cases.","files_changed":["tools/profile_solver.py","tests/test_profile_solver.py","agent_log.md","experiments.jsonl","benchmark_summary.md","next_steps.md"],"datasets":["large/test_6.cnf","special/hard.cnf","medium/test_4.cnf","large/test_8.cnf"],"commands":["python -m unittest discover -s tests -v","python tools/profile_solver.py large/test_6.cnf special/hard.cnf medium/test_4.cnf large/test_8.cnf"],"metrics_before":{"reported_reason_buckets":["2..3","4..9","10+"],"unit_test_count":22,"large_test_6_analyze_reason_2_3":931316,"large_test_6_min_drop_2_3":112785,"special_hard_analyze_reason_2_3":658449,"special_hard_min_drop_2_3":86242,"medium_test_4_analyze_reason_2_3":160254,"medium_test_4_min_drop_2_3":19271},"metrics_after":{"reported_reason_buckets":["2","3","4..9","10+"],"unit_test_count":23,"large_test_6_analyze_reason_2":1248,"large_test_6_analyze_reason_3":930068,"large_test_6_min_drop_2":12293,"large_test_6_min_drop_3":100492,"special_hard_analyze_reason_2":1418,"special_hard_analyze_reason_3":657031,"special_hard_min_drop_2":7985,"special_hard_min_drop_3":78257,"medium_test_4_analyze_reason_2":165,"medium_test_4_analyze_reason_3":160089,"medium_test_4_min_drop_2":1861,"medium_test_4_min_drop_3":17410,"large_test_8_analyze_reason_2":0,"large_test_8_analyze_reason_3":305701,"large_test_8_min_keep_10_plus":19467,"large_test_8_min_drop_10_plus":2856},"correctness_status":"passed 23 regression tests including the new bucket-boundary check, and the upgraded profiler produced valid output on the main hotspot cases","decision":"keep","notes":"The old `2..3` bucket turns out to be overwhelmingly ternary, not binary. That makes binary-specific conflict-analysis tuning low priority and points future analyze/minimize work toward narrow ternary fast paths instead."}
{"timestamp":"2026-03-20T09:06:13+01:00","experiment_id":"2026-03-20-rejected-narrow-ternary-analyze-fast-path","hypothesis":"Because ternary reasons dominate conflict-analysis traversals, a very narrow analyze() fast path for exact ternary reason clauses might trim loop overhead without repeating the broader manual unroll that already regressed.","change_summary":"Measured an out-of-tree TernaryAnalyzeSolver subclass that special-cased exact ternary reason clauses inside analyze(), compared it against the retained baseline in both run orders on the serial five-case hotspot slice, and checked search counts on the main profiled cases. No production solver code was changed.","files_changed":["agent_log.md","experiments.jsonl","benchmark_summary.md","next_steps.md"],"datasets":["large/test_6.cnf","special/hard.cnf","medium/test_4.cnf","large/test_10.cnf","large/test_8.cnf","small/test_1.cnf","special/tseitin.cnf"],"commands":["python - <<'PY' ... same-run five-case timing baseline then TernaryAnalyzeSolver ... PY","python - <<'PY' ... same-run five-case timing TernaryAnalyzeSolver then baseline ... PY","python - <<'PY' ... profiled comparison on large/test_6.cnf, special/hard.cnf, and large/test_8.cnf ... PY","python -m unittest discover -s tests -v","python satsolver.py small/test_1.cnf /tmp/cycle_sat_check.txt","python tools/checker.py small/test_1.cnf /tmp/cycle_sat_check.txt","python satsolver.py special/tseitin.cnf /tmp/cycle_unsat_check.txt","python tools/checker.py special/tseitin.cnf /tmp/cycle_unsat_check.txt --bruteforce-var-limit 0"],"metrics_before":{"forward_baseline_total_s":28.4376,"forward_large_test_6_s":12.5091,"forward_special_hard_s":8.5143,"forward_medium_test_4_s":1.7443,"forward_large_test_10_s":1.6580,"forward_large_test_8_s":4.0119,"reverse_baseline_total_s":28.4714,"reverse_large_test_6_s":13.0150,"reverse_special_hard_s":8.3433,"reverse_medium_test_4_s":1.7542,"reverse_large_test_10_s":1.7215,"reverse_large_test_8_s":3.6375,"profile_large_test_6_decisions":72886,"profile_large_test_6_conflicts":59201,"profile_special_hard_decisions":54245,"profile_special_hard_conflicts":44619,"profile_large_test_8_decisions":21526,"profile_large_test_8_conflicts":16430,"unit_test_count":23},"metrics_after":{"forward_experimental_total_s":28.0914,"forward_experimental_large_test_6_s":12.6150,"forward_experimental_special_hard_s":8.4488,"forward_experimental_medium_test_4_s":1.7555,"forward_experimental_large_test_10_s":1.6985,"forward_experimental_large_test_8_s":3.5736,"reverse_experimental_total_s":29.1584,"reverse_experimental_large_test_6_s":13.4371,"reverse_experimental_special_hard_s":8.4806,"reverse_experimental_medium_test_4_s":1.8326,"reverse_experimental_large_test_10_s":1.7588,"reverse_experimental_large_test_8_s":3.6491,"average_baseline_total_s":28.4545,"average_experimental_total_s":28.6249,"profile_experimental_large_test_6_decisions":72886,"profile_experimental_large_test_6_conflicts":59201,"profile_experimental_special_hard_decisions":54245,"profile_experimental_special_hard_conflicts":44619,"profile_experimental_large_test_8_decisions":21526,"profile_experimental_large_test_8_conflicts":16430,"unit_test_count":23},"correctness_status":"temporary subclass preserved SAT/UNSAT outcomes on the measured cases, kept identical search counts on the main profiled hotspots, and the retained production solver still passed 23 regression tests plus SAT/UNSAT checker spot checks","decision":"discard","notes":"The first run order looked mildly positive, but the reversed-order rerun erased that signal and the average moved slightly backward. This specific ternary analyze rewrite appears to add overhead without changing the search path."}
{"timestamp":"2026-03-20T09:16:20+01:00","experiment_id":"2026-03-20-rejected-lazy-watched-slot-normalization","hypothesis":"Because propagate() still spends most of the time in watched-clause traversal, avoiding the unconditional watched-slot normalization swap unless a clause actually relocates a watch might cut Python-side list writes enough to beat the added branch.","change_summary":"Measured an out-of-tree LazyNormalizeSolver subclass that kept watcher payloads unchanged but stopped normalizing watched-slot order on every visit unless relocation happened. No production solver code was changed.","files_changed":["agent_log.md","experiments.jsonl","benchmark_summary.md","next_steps.md"],"datasets":["large/test_6.cnf","special/hard.cnf","medium/test_4.cnf","large/test_10.cnf","large/test_8.cnf","small/test_1.cnf","special/tseitin.cnf"],"commands":["python - <<'PY' ... same-run five-case timing baseline then LazyNormalizeSolver ... PY","python -m unittest discover -s tests -v","python satsolver.py small/test_1.cnf /tmp/cycle_sat_check2.txt","python tools/checker.py small/test_1.cnf /tmp/cycle_sat_check2.txt","python satsolver.py special/tseitin.cnf /tmp/cycle_unsat_check2.txt","python tools/checker.py special/tseitin.cnf /tmp/cycle_unsat_check2.txt --bruteforce-var-limit 0"],"metrics_before":{"focused_five_case_total_s":27.8534,"large_test_6_s":12.5657,"special_hard_s":8.4037,"medium_test_4_s":1.8342,"large_test_10_s":1.7134,"large_test_8_s":3.3363,"unit_test_count":23},"metrics_after":{"lazy_normalize_total_s":28.3930,"lazy_normalize_large_test_6_s":12.4609,"lazy_normalize_special_hard_s":8.7962,"lazy_normalize_medium_test_4_s":1.8474,"lazy_normalize_large_test_10_s":1.7426,"lazy_normalize_large_test_8_s":3.5459,"unit_test_count":23},"correctness_status":"temporary subclass preserved SAT/UNSAT outcomes on the measured cases, and the retained production solver still passed 23 regression tests plus SAT/UNSAT checker spot checks","decision":"discard","notes":"The saved normalization writes did not offset the extra false-slot branching and handling. This specific lazy-normalization propagation rewrite is another dead end, especially on special/hard.cnf and large/test_8.cnf."}
{"timestamp":"2026-03-20T09:21:20+01:00","experiment_id":"2026-03-20-watch-normalization-profiler-upgrade","hypothesis":"If the profiler records how often watched-slot normalization happens, how often it is ternary vs large, and how often it is immediately followed by a satisfied skip, it will clarify whether more lazy-normalization work is worth considering.","change_summary":"Extended tools/profile_solver.py with watched-slot normalization counters plus normalized-satisfied-skip tracking, added regression invariants in tests/test_profile_solver.py, and reran the profiler on the main hotspot cases.","files_changed":["tools/profile_solver.py","tests/test_profile_solver.py","agent_log.md","experiments.jsonl","benchmark_summary.md","next_steps.md"],"datasets":["large/test_6.cnf","special/hard.cnf","medium/test_4.cnf","large/test_8.cnf"],"commands":["python -m unittest discover -s tests -v","python tools/profile_solver.py large/test_6.cnf special/hard.cnf medium/test_4.cnf large/test_8.cnf"],"metrics_before":{"reported_watch_metrics":["watch_visits","ternary_visits","large_visits","satisfied_skips","watch_relocations","watch_units","watch_conflicts"],"unit_test_count":23},"metrics_after":{"reported_watch_metrics":["watch_visits","ternary_visits","large_visits","satisfied_skips","watch_normalizations","ternary_normalizations","large_normalizations","normalized_satisfied_skips","watch_relocations","watch_units","watch_conflicts"],"unit_test_count":23,"large_test_6_watch_normalizations":4097859,"large_test_6_ternary_normalizations":3037779,"large_test_6_large_normalizations":1060080,"large_test_6_normalized_satisfied_skips":820227,"special_hard_watch_normalizations":2747520,"special_hard_normalized_satisfied_skips":730699,"medium_test_4_watch_normalizations":591235,"medium_test_4_normalized_satisfied_skips":142915,"large_test_8_watch_normalizations":927548,"large_test_8_ternary_normalizations":740507,"large_test_8_normalized_satisfied_skips":199008},"correctness_status":"passed 23 regression tests including the new normalization invariants, and the upgraded profiler produced valid output on the main hotspot cases","decision":"keep","notes":"Normalization is frequent, but only about 20%..27% of those normalizations are immediately followed by a satisfied skip on the hotspot cases. Most still feed relocation/unit/conflict work, which helps explain why the lazy-normalization branch regressed."}
{"timestamp":"2026-03-20T09:30:20+01:00","experiment_id":"2026-03-20-rejected-propagate-lits-len-local-cache","hypothesis":"Because cProfile still shows visible len() traffic around watched-clause traversal, caching len(lits) once per watched-clause visit inside propagate() might trim hot-loop overhead without changing the search path.","change_summary":"Measured an out-of-tree LenCachedSolver subclass that cached lits_len = len(lits) once per watched-clause visit and reused it for the ternary check plus replacement scan bounds. No production solver code was changed.","files_changed":["agent_log.md","experiments.jsonl","benchmark_summary.md","next_steps.md"],"datasets":["large/test_6.cnf","special/hard.cnf","medium/test_4.cnf","large/test_10.cnf","large/test_8.cnf","small/test_1.cnf","special/tseitin.cnf"],"commands":["python tools/profile_solver.py large/test_6.cnf special/hard.cnf medium/test_4.cnf large/test_8.cnf","python - <<'PY' ... same-run five-case timing baseline then LenCachedSolver ... PY","python -m unittest discover -s tests -v","python satsolver.py small/test_1.cnf /tmp/cycle_sat_check3.txt","python tools/checker.py small/test_1.cnf /tmp/cycle_sat_check3.txt","python satsolver.py special/tseitin.cnf /tmp/cycle_unsat_check3.txt","python tools/checker.py special/tseitin.cnf /tmp/cycle_unsat_check3.txt --bruteforce-var-limit 0"],"metrics_before":{"focused_five_case_total_s":27.5712,"large_test_6_s":12.3785,"special_hard_s":8.2641,"medium_test_4_s":1.7486,"large_test_10_s":1.7007,"large_test_8_s":3.4794,"unit_test_count":23},"metrics_after":{"len_cached_total_s":29.1215,"len_cached_large_test_6_s":12.7961,"len_cached_special_hard_s":8.6783,"len_cached_medium_test_4_s":1.9761,"len_cached_large_test_10_s":1.7271,"len_cached_large_test_8_s":3.9439,"unit_test_count":23},"correctness_status":"temporary subclass preserved SAT/UNSAT outcomes on the measured cases, and the retained production solver still passed 23 regression tests plus SAT/UNSAT checker spot checks","decision":"discard","notes":"A tiny per-visit len(lits) cache was another pure-overhead loser. Even though len() remains visible in cProfile, this local propagation micro-cache regressed every hotspot case enough that it is not worth revisiting in its simple form."}
