{"timestamp":"2026-03-20T06:37:55+01:00","experiment_id":"2026-03-20-rejected-clause-size-slot","hypothesis":"Caching clause length directly in each Clause as a size slot should remove much of the remaining len(clause.lits) overhead inside propagate(), attach_clause(), and reduce_database() without duplicating mutable watcher state or changing the search path.","change_summary":"Added a cached Clause.size field, switched the hot path to read that cached length, validated correctness, benchmarked the hotspot slice plus a validated full-suite run, and then reverted after the end-to-end wall-clock evidence failed to beat the retained baseline.","files_changed":["satsolver.py","out_extended.txt","agent_log.md","experiments.jsonl","benchmark_summary.md","next_steps.md"],"datasets":["large/test_6.cnf","special/hard.cnf","medium/test_4.cnf","large/test_10.cnf","large/test_8.cnf","small/test_1.cnf","special/tseitin.cnf","small","medium","large","special","satlib_subset","satlib_more"],"commands":["python - <<'PY' ... clean baseline five-case serial timing script ... PY","python -m unittest discover -s tests -v","python satsolver.py small/test_1.cnf /tmp/cycle19_sat.txt","python tools/checker.py small/test_1.cnf /tmp/cycle19_sat.txt","python satsolver.py special/tseitin.cnf /tmp/cycle19_unsat.txt","python tools/checker.py special/tseitin.cnf /tmp/cycle19_unsat.txt --bruteforce-var-limit 0","python satsolver.py large/test_8.cnf /tmp/cycle19_large8.txt","python tools/checker.py large/test_8.cnf /tmp/cycle19_large8.txt","python - <<'PY' ... clean experimental five-case serial timing script ... PY","python tools/profile_solver.py large/test_6.cnf special/hard.cnf medium/test_4.cnf","python - <<'PY' ... cProfile solve_cnf_serial on large/test_6.cnf experimental ... PY","python - <<'PY' ... second clean experimental five-case serial timing script ... PY","python benchmark_suite.py satsolver out_extended.txt small medium large special satlib_subset satlib_more --bruteforce-var-limit 16","python -m unittest discover -s tests -v","python satsolver.py small/test_1.cnf /tmp/cycle19_revert_sat.txt","python tools/checker.py small/test_1.cnf /tmp/cycle19_revert_sat.txt","python satsolver.py special/tseitin.cnf /tmp/cycle19_revert_unsat.txt","python tools/checker.py special/tseitin.cnf /tmp/cycle19_revert_unsat.txt --bruteforce-var-limit 0","python satsolver.py large/test_8.cnf /tmp/cycle19_revert_large8.txt","python tools/checker.py large/test_8.cnf /tmp/cycle19_revert_large8.txt","python - <<'PY' ... post-revert serial sanity timing on large/test_6.cnf, special/hard.cnf, large/test_8.cnf ... PY"],"metrics_before":{"baseline_dense_four_case_total_s":26.6121,"baseline_mixed_five_case_total_s":30.1984,"baseline_large_test_6_serial_s":13.9904,"baseline_special_hard_serial_s":9.0926,"baseline_medium_test_4_serial_s":1.7868,"baseline_large_test_10_serial_s":1.7423,"baseline_large_test_8_serial_s":3.5862,"baseline_profiled_hotspot_total_s":30.8177,"baseline_large_test_6_profile_s":17.0944,"baseline_special_hard_profile_s":11.4704,"baseline_medium_test_4_profile_s":2.2529,"baseline_large_test_6_cprofile_calls":60213022,"baseline_large_test_6_cprofile_len_calls":18646469,"baseline_large_test_6_cprofile_propagate_tottime_s":13.606,"best_inprocess_validated_total_s":27.3023},"metrics_after":{"experimental_first_dense_four_case_total_s":26.722,"experimental_first_mixed_five_case_total_s":30.535,"experimental_first_large_test_6_serial_s":13.8727,"experimental_first_special_hard_serial_s":8.9989,"experimental_first_medium_test_4_serial_s":1.9877,"experimental_first_large_test_10_serial_s":1.8627,"experimental_first_large_test_8_serial_s":3.813,"experimental_second_dense_four_case_total_s":24.938,"experimental_second_mixed_five_case_total_s":28.49,"experimental_second_large_test_6_serial_s":12.5629,"experimental_second_special_hard_serial_s":8.6803,"experimental_second_medium_test_4_serial_s":1.9387,"experimental_second_large_test_10_serial_s":1.7561,"experimental_second_large_test_8_serial_s":3.552,"experimental_profiled_hotspot_total_s":30.6057,"experimental_large_test_6_profile_s":17.3009,"experimental_special_hard_profile_s":11.1281,"experimental_medium_test_4_profile_s":2.1767,"experimental_large_test_6_cprofile_calls":48171759,"experimental_large_test_6_cprofile_len_calls":6605206,"experimental_large_test_6_cprofile_propagate_tottime_s":11.863,"experimental_inprocess_full_suite_total_s":28.0041,"experimental_full_suite_solved_correctly":59,"experimental_full_suite_errors":0},"correctness_status":"passed 16 regression tests and SAT/UNSAT checker spot checks before and after revert; the experimental solver also completed a validated 59/59 full-suite run before being discarded for performance","decision":"discard","notes":"This was another false friend: the size slot clearly reduced Python helper overhead, but the end-to-end wall-clock evidence stayed too weak and noisy to justify keeping extra clause metadata. Treat cached Clause.size alone as a dead end unless paired with a more direct clause representation."}
{"timestamp":"2026-03-20T06:48:40+01:00","experiment_id":"2026-03-20-rejected-blocker-watch-tuples","hypothesis":"Because the watched-literal hot path touches many already-satisfied clauses, storing non-binary watch entries as (clause_id, blocker_literal) pairs and checking the blocker first might skip enough clause reads to speed up ternary-heavy propagation on the dense hotspots.","change_summary":"Changed watch lists from plain clause IDs to tuple-based blocker entries, updated attach_clause() and propagate() to use blocker literals for early satisfied-clause skips, validated correctness, benchmarked the hotspot slice and profiled UNSAT cases, then reverted after the change badly regressed the dense UNSAT search path.","files_changed":["satsolver.py","agent_log.md","experiments.jsonl","benchmark_summary.md","next_steps.md"],"datasets":["large/test_6.cnf","special/hard.cnf","medium/test_4.cnf","large/test_10.cnf","large/test_8.cnf","small/test_1.cnf","special/tseitin.cnf"],"commands":["python - <<'PY' ... clean baseline five-case serial timing script ... PY","python tools/profile_solver.py large/test_6.cnf special/hard.cnf medium/test_4.cnf","python -m unittest discover -s tests -v","python satsolver.py small/test_1.cnf /tmp/cycle20_sat.txt","python tools/checker.py small/test_1.cnf /tmp/cycle20_sat.txt","python satsolver.py special/tseitin.cnf /tmp/cycle20_unsat.txt","python tools/checker.py special/tseitin.cnf /tmp/cycle20_unsat.txt --bruteforce-var-limit 0","python satsolver.py large/test_8.cnf /tmp/cycle20_large8.txt","python tools/checker.py large/test_8.cnf /tmp/cycle20_large8.txt","python - <<'PY' ... clean experimental five-case serial timing script ... PY","python tools/profile_solver.py large/test_6.cnf special/hard.cnf medium/test_4.cnf","python - <<'PY' ... cProfile solve_cnf_serial on large/test_6.cnf experimental ... PY","python -m unittest discover -s tests -v","python satsolver.py small/test_1.cnf /tmp/cycle20_revert_sat.txt","python tools/checker.py small/test_1.cnf /tmp/cycle20_revert_sat.txt","python satsolver.py special/tseitin.cnf /tmp/cycle20_revert_unsat.txt","python tools/checker.py special/tseitin.cnf /tmp/cycle20_revert_unsat.txt --bruteforce-var-limit 0","python satsolver.py large/test_8.cnf /tmp/cycle20_revert_large8.txt","python tools/checker.py large/test_8.cnf /tmp/cycle20_revert_large8.txt","python - <<'PY' ... post-revert serial sanity timing on large/test_6.cnf, special/hard.cnf, large/test_8.cnf ... PY"],"metrics_before":{"baseline_dense_four_case_total_s":27.6382,"baseline_mixed_five_case_total_s":31.6482,"baseline_large_test_6_serial_s":14.1359,"baseline_special_hard_serial_s":9.4415,"baseline_medium_test_4_serial_s":2.0564,"baseline_large_test_10_serial_s":2.0044,"baseline_large_test_8_serial_s":4.01,"baseline_profiled_hotspot_total_s":30.106,"baseline_large_test_6_profile_s":16.399,"baseline_special_hard_profile_s":11.4599,"baseline_medium_test_4_profile_s":2.2471,"baseline_large_test_6_decisions":72886,"baseline_large_test_6_conflicts":59201,"baseline_large_test_6_processed_literals":2431409,"baseline_special_hard_decisions":54245,"baseline_special_hard_conflicts":44619,"baseline_special_hard_processed_literals":1737825,"baseline_medium_test_4_decisions":13510,"baseline_medium_test_4_conflicts":10995,"baseline_medium_test_4_processed_literals":396463},"metrics_after":{"experimental_dense_four_case_total_s":36.8277,"experimental_mixed_five_case_total_s":38.7381,"experimental_large_test_6_serial_s":20.2104,"experimental_special_hard_serial_s":11.9502,"experimental_medium_test_4_serial_s":2.8121,"experimental_large_test_10_serial_s":1.855,"experimental_large_test_8_serial_s":1.9104,"experimental_profiled_hotspot_total_s":43.2104,"experimental_large_test_6_profile_s":24.9045,"experimental_special_hard_profile_s":15.141,"experimental_medium_test_4_profile_s":3.1649,"experimental_large_test_6_decisions":89078,"experimental_large_test_6_conflicts":72547,"experimental_large_test_6_processed_literals":2962836,"experimental_special_hard_decisions":63470,"experimental_special_hard_conflicts":51968,"experimental_special_hard_processed_literals":2019956,"experimental_medium_test_4_decisions":16968,"experimental_medium_test_4_conflicts":13830,"experimental_medium_test_4_processed_literals":494833,"experimental_large_test_6_cprofile_total_s":42.821,"experimental_large_test_6_cprofile_calls":73480592,"experimental_large_test_6_cprofile_propagate_tottime_s":20.065},"correctness_status":"passed 16 regression tests and SAT/UNSAT checker spot checks before and after revert; experiment was discarded for performance, not correctness","decision":"discard","notes":"This version of blocker watches was not a pure micro-optimization. It materially changed search counts on the dense UNSAT families and lost badly overall, even though it improved large/test_8.cnf. Treat tuple-based blocker watch payloads as a dead end unless a future design uses a very different representation."}
{"timestamp":"2026-03-20T06:58:31+01:00","experiment_id":"2026-03-20-rejected-flat-clause-storage","hypothesis":"Replacing Clause objects with plain literal lists plus parallel learnt/activity/lbd/deleted arrays should remove hot-path object indirection in propagate(), analyze(), minimize_learnt(), and reduce_database(), yielding a clearer wall-clock win than earlier partial metadata caches.","change_summary":"Temporarily flattened clause storage into raw literal lists with parallel metadata arrays, updated the profiler and one regression to match, validated correctness, benchmarked the hotspot slice and a full validated in-process suite, then reverted after the full-suite result stayed worse than the retained baseline.","files_changed":["satsolver.py","tools/profile_solver.py","tests/test_solver_regressions.py","out_extended.txt","agent_log.md","experiments.jsonl","benchmark_summary.md","next_steps.md"],"datasets":["large/test_6.cnf","special/hard.cnf","medium/test_4.cnf","large/test_10.cnf","large/test_8.cnf","small/test_1.cnf","special/tseitin.cnf","small","medium","large","special","satlib_subset","satlib_more"],"commands":["python - <<'PY' ... retained-baseline five-case serial timing script ... PY","python tools/profile_solver.py large/test_6.cnf special/hard.cnf medium/test_4.cnf","python -m unittest discover -s tests -v","python satsolver.py small/test_1.cnf /tmp/cycle21_sat.txt","python tools/checker.py small/test_1.cnf /tmp/cycle21_sat.txt","python satsolver.py special/tseitin.cnf /tmp/cycle21_unsat.txt","python tools/checker.py special/tseitin.cnf /tmp/cycle21_unsat.txt --bruteforce-var-limit 0","python satsolver.py large/test_8.cnf /tmp/cycle21_large8.txt","python tools/checker.py large/test_8.cnf /tmp/cycle21_large8.txt","python - <<'PY' ... first clean experimental five-case serial timing script ... PY","python tools/profile_solver.py large/test_6.cnf special/hard.cnf medium/test_4.cnf","python - <<'PY' ... cProfile solve_cnf_serial on large/test_6.cnf experimental ... PY","python - <<'PY' ... second clean experimental five-case serial timing script ... PY","python benchmark_suite.py satsolver out_extended.txt small medium large special satlib_subset satlib_more --bruteforce-var-limit 16","python -m unittest discover -s tests -v","python satsolver.py small/test_1.cnf /tmp/cycle21_revert_sat.txt","python tools/checker.py small/test_1.cnf /tmp/cycle21_revert_sat.txt","python satsolver.py special/tseitin.cnf /tmp/cycle21_revert_unsat.txt","python tools/checker.py special/tseitin.cnf /tmp/cycle21_revert_unsat.txt --bruteforce-var-limit 0","python satsolver.py large/test_8.cnf /tmp/cycle21_revert_large8.txt","python tools/checker.py large/test_8.cnf /tmp/cycle21_revert_large8.txt","python - <<'PY' ... post-revert serial sanity timing on large/test_6.cnf, special/hard.cnf, large/test_8.cnf ... PY"],"metrics_before":{"baseline_dense_four_case_total_s":27.6382,"baseline_mixed_five_case_total_s":31.6482,"baseline_large_test_6_serial_s":14.1359,"baseline_special_hard_serial_s":9.4415,"baseline_medium_test_4_serial_s":2.0564,"baseline_large_test_10_serial_s":2.0044,"baseline_large_test_8_serial_s":4.01,"baseline_profiled_hotspot_total_s":30.9492,"baseline_large_test_6_profile_s":17.0666,"baseline_special_hard_profile_s":11.5015,"baseline_medium_test_4_profile_s":2.3811,"baseline_large_test_6_decisions":72886,"baseline_large_test_6_conflicts":59201,"baseline_large_test_6_processed_literals":2431409,"best_inprocess_validated_total_s":27.3023},"metrics_after":{"experimental_first_dense_four_case_total_s":27.3304,"experimental_first_mixed_five_case_total_s":31.0997,"experimental_first_large_test_6_serial_s":14.263,"experimental_first_special_hard_serial_s":9.1897,"experimental_first_medium_test_4_serial_s":1.9771,"experimental_first_large_test_10_serial_s":1.9006,"experimental_first_large_test_8_serial_s":3.7692,"experimental_second_dense_four_case_total_s":25.4796,"experimental_second_mixed_five_case_total_s":29.1097,"experimental_second_large_test_6_serial_s":13.1431,"experimental_second_special_hard_serial_s":8.7671,"experimental_second_medium_test_4_serial_s":1.8201,"experimental_second_large_test_10_serial_s":1.7493,"experimental_second_large_test_8_serial_s":3.6301,"experimental_profiled_hotspot_total_s":30.3395,"experimental_large_test_6_profile_s":16.8734,"experimental_special_hard_profile_s":11.1525,"experimental_medium_test_4_profile_s":2.3136,"experimental_large_test_6_decisions":72886,"experimental_large_test_6_conflicts":59201,"experimental_large_test_6_processed_literals":2431409,"experimental_large_test_6_cprofile_total_s":32.529,"experimental_large_test_6_cprofile_propagate_tottime_s":14.453,"experimental_inprocess_full_suite_total_s":28.2906,"experimental_full_suite_solved_correctly":59,"experimental_full_suite_errors":0},"correctness_status":"passed 16 regression tests and SAT/UNSAT checker spot checks before and after revert; the experimental solver also completed a validated 59/59 in-process full-suite run before being discarded for performance","decision":"discard","notes":"This was the stronger form of the earlier clause-layout idea, and it still did not beat the retained full-suite baseline. Hotspot runs looked somewhat better, but the validated 59-case suite stayed slower overall, so plain raw-literal clause storage plus simple parallel metadata is not enough by itself."}
{"timestamp":"2026-03-20T07:12:33+01:00","experiment_id":"2026-03-20-repeat-capable-benchmark-suite","hypothesis":"If benchmark_suite.py can repeat each case and report median representative times plus full measured totals, future solver keep/revert decisions will be more trustworthy than one-off full-suite timings alone.","change_summary":"Added --repeat support to benchmark_suite.py, made the report include per-case time samples and repeat-aware summary totals, added regression tests for repeat mode and repeat validation, and refreshed both in-process and exact-CLI benchmark artifacts with repeat=2.","files_changed":["benchmark_suite.py","tests/test_benchmark_suite.py","out_extended.txt","out_cli_extended.txt","agent_log.md","experiments.jsonl","benchmark_summary.md","next_steps.md"],"datasets":["small","medium","large","special","satlib_subset","satlib_more"],"commands":["python -m unittest discover -s tests -v","python benchmark_suite.py satsolver out_extended.txt small medium large special satlib_subset satlib_more --bruteforce-var-limit 16 --repeat 2","python benchmark_suite.py satsolver out_cli_extended.txt small medium large special satlib_subset satlib_more --bruteforce-var-limit 16 --cli-script satsolver.py --repeat 2"],"metrics_before":{"best_single_run_inprocess_total_s":27.3023,"best_single_run_exact_cli_total_s":30.1080,"dense_five_case_default_s":29.0347,"dense_five_case_phase_bias_s":30.7907,"dense_five_case_all_true_s":29.8937,"dense_five_case_all_false_s":43.1369},"metrics_after":{"repeat2_inprocess_total_s":28.9770,"repeat2_inprocess_measured_total_s":57.9540,"repeat2_inprocess_wall_clock_s":58.1751,"repeat2_inprocess_worst_case_s":13.4683,"repeat2_exact_cli_total_s":31.5848,"repeat2_exact_cli_measured_total_s":63.1696,"repeat2_exact_cli_wall_clock_s":63.3896,"repeat2_exact_cli_worst_case_s":13.8780,"unit_test_count":18},"correctness_status":"passed 18 regression tests and solved 59/59 correctly in both repeat-aware full-suite benchmark modes","decision":"keep","notes":"The repeat-aware totals are intentionally tracked separately from the historical best single-run solver snapshots because the measurement methodology changed. The early fixed-phase resweep again showed no simple alternate worker worth adding right now."}
{"timestamp":"2026-03-20T07:28:40+01:00","experiment_id":"2026-03-20-watch-path-profiler-upgrade","hypothesis":"If the profiler reports watched-clause workload and learnt-shrink detail instead of only coarse runtime counts, it will identify whether the next solver win should come from watched-clause traversal or from shortening learnt clauses.","change_summary":"Extended tools/profile_solver.py with binary-vs-watch counters, ternary-vs-generic watch visit counts, relocation/unit/conflict outcomes, and learnt-minimization shrinkage totals, then added a regression test covering a tiny pure-ternary UNSAT case.","files_changed":["tools/profile_solver.py","tests/test_profile_solver.py","agent_log.md","experiments.jsonl","benchmark_summary.md","next_steps.md"],"datasets":["large/test_6.cnf","special/hard.cnf","medium/test_4.cnf"],"commands":["python -m unittest discover -s tests -v","python tools/profile_solver.py large/test_6.cnf special/hard.cnf medium/test_4.cnf"],"metrics_before":{"reported_profile_metrics":["time","decisions","conflicts","processed_literals","propagations","restarts","reductions","learnts_added","live_learnts","max_live_learnts","max_trail"],"large_test_6_profile_time_s":16.2349,"special_hard_profile_time_s":11.4804,"medium_test_4_profile_time_s":2.3486},"metrics_after":{"unit_test_count":19,"large_test_6_watch_visits":13435147,"large_test_6_ternary_visits":7904849,"large_test_6_large_visits":1939491,"large_test_6_satisfied_skips":3474649,"large_test_6_watch_relocations":6556559,"large_test_6_watch_units":3228584,"large_test_6_binary_checks":11953,"large_test_6_deleted_watch_skips":116158,"large_test_6_avg_learnt_before":14.31,"large_test_6_avg_learnt_after":11.87,"large_test_6_removed_by_min":144647,"special_hard_watch_visits":9550550,"special_hard_ternary_visits":4427121,"special_hard_large_visits":1725097,"special_hard_satisfied_skips":3311070,"special_hard_watch_relocations":3919510,"special_hard_watch_units":2188116,"special_hard_binary_checks":14395,"special_hard_avg_learnt_before":13.80,"special_hard_avg_learnt_after":11.31,"special_hard_removed_by_min":111028,"medium_test_4_watch_visits":1967684,"medium_test_4_ternary_visits":1113100,"medium_test_4_large_visits":229521,"medium_test_4_watch_relocations":826585,"medium_test_4_watch_units":505043,"medium_test_4_binary_checks":1796,"medium_test_4_avg_learnt_before":12.51,"medium_test_4_avg_learnt_after":10.29,"medium_test_4_removed_by_min":24351},"correctness_status":"passed 19 regression tests, including the new profile_solver regression, and the upgraded profiler produced valid output on the three main dense UNSAT bottlenecks","decision":"keep","notes":"The profiler overhead is higher than the production solver path, so the new timing numbers are for inspection rather than benchmarking. The important outcome is structural: watched-clause traversal dominates, while binary and deleted-watch work are comparatively small."}
