{"timestamp":"2026-03-20T15:30:04+01:00","experiment_id":"2026-03-20-keep-large-watch-size-buckets","hypothesis":"If active learnt large-clause watch traffic is dominated by 4-literal clauses, a narrow 4-literal propagation fast path might still be worth prototyping; if the traffic is spread across `4`, `5..9`, and `10+`, then future large-clause work needs a broader size-aware story and should not assume a tiny fast path covers most of the cost.","change_summary":"Refreshed `cProfile` and hotspot profiler baselines, extended `tools/profile_solver.py` to bucket active large watched-clause visits into `4`, `5..9`, and `10+`, added regression coverage in `tests/test_profile_solver.py`, and reran the hotspot profiler. The production solver stayed unchanged.","files_changed":["tools/profile_solver.py","tests/test_profile_solver.py","agent_log.md","experiments.jsonl","benchmark_summary.md","next_steps.md"],"datasets":["large/test_6.cnf","special/hard.cnf","medium/test_4.cnf","large/test_8.cnf"],"commands":["python -m cProfile -s tottime satsolver.py large/test_6.cnf /tmp/cprofile_large6_cycle.out","python tools/profile_solver.py large/test_6.cnf special/hard.cnf medium/test_4.cnf large/test_8.cnf","python -m py_compile tools/profile_solver.py tests/test_profile_solver.py","python -m unittest discover -s tests -v","python tools/profile_solver.py large/test_6.cnf special/hard.cnf medium/test_4.cnf large/test_8.cnf"],"metrics_before":{"unit_test_count":31},"metrics_after":{"unit_test_count":33,"profile_large_test_6_propagate_tottime_s":14.348,"profile_large_test_6_analyze_tottime_s":2.331,"large_test_6_large_watch_len4_visits":638300,"large_test_6_large_watch_len5_9_visits":761325,"large_test_6_large_watch_len10_plus_visits":539866,"special_hard_large_watch_len4_visits":526229,"special_hard_large_watch_len5_9_visits":764961,"special_hard_large_watch_len10_plus_visits":433907,"medium_test_4_large_watch_len4_visits":56771,"medium_test_4_large_watch_len5_9_visits":103916,"medium_test_4_large_watch_len10_plus_visits":68834,"large_test_8_large_watch_len4_visits":85215,"large_test_8_large_watch_len5_9_visits":115147,"large_test_8_large_watch_len10_plus_visits":135806},"correctness_status":"the production solver was unchanged and still passed 33 regression tests; the new large-watch bucket counters are covered by the profiler regression suite","decision":"keep","notes":"This is a profiling upgrade, not a solver-speed change. The new split says the active learnt large-clause path is not mostly 4-literal: length `4` is only about `24.7%..32.9%` of large-watch visits on the main hotspot cases, `5..9` is usually the largest bucket, and `10+` remains substantial, especially on `large/test_8.cnf`."}
{"timestamp":"2026-03-20T15:42:35+01:00","experiment_id":"2026-03-20-reject-large-scan-head-unroll","hypothesis":"Because active learnt large-clause replacement scans usually succeed or fail within the first few candidates, manually handling candidates `2` and `3` before the general scan loop might cut Python loop overhead without changing the search path.","change_summary":"Built and removed a temporary `scratch/exp_large_scan_unroll.py` harness implementing an out-of-tree `UnrolledLargeScanSolver` with the first two large-clause replacement candidates spelled out explicitly, then compared it against the retained solver on the five-case serial hotspot slice in both forward and reverse order. The production solver stayed unchanged after the experiment.","files_changed":["agent_log.md","experiments.jsonl","benchmark_summary.md","next_steps.md"],"datasets":["large/test_6.cnf","special/hard.cnf","medium/test_4.cnf","large/test_10.cnf","large/test_8.cnf"],"commands":["python -m cProfile -s tottime satsolver.py special/hard.cnf /tmp/cprofile_hard_cycle.out","python tools/profile_solver.py large/test_6.cnf special/hard.cnf medium/test_4.cnf large/test_8.cnf","python -m py_compile scratch/exp_large_scan_unroll.py","PYTHONPATH=. python scratch/exp_large_scan_unroll.py","python -m unittest discover -s tests -v"],"metrics_before":{"forward_total_s":28.3822,"forward_large_test_6_s":12.9821,"forward_special_hard_s":8.3740,"forward_medium_test_4_s":1.8898,"forward_large_test_10_s":1.6713,"forward_large_test_8_s":3.4652,"reverse_total_s":30.2405,"reverse_large_test_8_s":3.8766,"reverse_large_test_10_s":1.8634,"reverse_medium_test_4_s":1.8888,"reverse_special_hard_s":9.0114,"reverse_large_test_6_s":13.6003,"unit_test_count":33},"metrics_after":{"forward_total_s":29.6272,"forward_large_test_6_s":13.0915,"forward_special_hard_s":8.6766,"forward_medium_test_4_s":1.7972,"forward_large_test_10_s":2.0074,"forward_large_test_8_s":4.0545,"reverse_total_s":31.4678,"reverse_large_test_8_s":3.6118,"reverse_large_test_10_s":1.8715,"reverse_medium_test_4_s":2.0275,"reverse_special_hard_s":10.0698,"reverse_large_test_6_s":13.8872,"same_conflicts_all_cases":true,"unit_test_count":33},"correctness_status":"the temporary branch preserved identical conflict counts and SAT/UNSAT outcomes on the full five-case serial hotspot slice, and the retained production solver still passed all 33 regression tests after the scratch harness was removed","decision":"discard","notes":"This was a clean same-search overhead regression. Even with average large-clause probe depth only around `2.3..3.4`, manually spelling out the first two scan steps in Python made the hotspot slice slower in both orders, so low average probe depth alone is not enough to justify a scan-head unroll."}
{"timestamp":"2026-03-20T15:50:56+01:00","experiment_id":"2026-03-20-keep-large-probe-success-depth-profiler","hypothesis":"If successful learnt large-clause relocations are mostly landing in the first one or two probe steps, then the failed scan-head unroll can be interpreted more precisely: head-heavy success distribution may be real, but any future large-clause optimization still needs to remove more than just Python loop-head overhead.","change_summary":"Extended `tools/profile_solver.py` to bucket successful large-clause relocations by probe depth (`1`, `2`, `3..4`, `5+`), added regression coverage in `tests/test_profile_solver.py`, reran the profiler on the main hotspot cases, and updated the repo notes. The production solver was unchanged.","files_changed":["tools/profile_solver.py","tests/test_profile_solver.py","agent_log.md","experiments.jsonl","benchmark_summary.md","next_steps.md"],"datasets":["large/test_6.cnf","special/hard.cnf","medium/test_4.cnf","large/test_8.cnf"],"commands":["python -m py_compile tools/profile_solver.py tests/test_profile_solver.py","python -m unittest discover -s tests -v","python tools/profile_solver.py large/test_6.cnf special/hard.cnf medium/test_4.cnf large/test_8.cnf"],"metrics_before":{"unit_test_count":33},"metrics_after":{"unit_test_count":35,"large_test_6_large_relocations":1743065,"large_test_6_probe_success_step1":822180,"large_test_6_probe_success_step2":495302,"large_test_6_probe_success_step3_4":255684,"large_test_6_probe_success_step5_plus":169899,"large_test_6_probe_success_step1_2_share":0.7559,"special_hard_large_relocations":1535648,"special_hard_probe_success_step1":697056,"special_hard_probe_success_step2":451738,"special_hard_probe_success_step3_4":252094,"special_hard_probe_success_step5_plus":134760,"special_hard_probe_success_step1_2_share":0.7481,"medium_test_4_large_relocations":201004,"medium_test_4_probe_success_step1":83754,"medium_test_4_probe_success_step2":56442,"medium_test_4_probe_success_step3_4":37351,"medium_test_4_probe_success_step5_plus":23457,"medium_test_4_probe_success_step1_2_share":0.6975,"large_test_8_large_relocations":293157,"large_test_8_probe_success_step1":112968,"large_test_8_probe_success_step2":71022,"large_test_8_probe_success_step3_4":49653,"large_test_8_probe_success_step5_plus":59514,"large_test_8_probe_success_step1_2_share":0.6276,"large_test_8_probe_success_step5_plus_share":0.2030},"correctness_status":"the production solver was unchanged and still passed 35 regression tests; the new profiler counters are covered by the profiler regression suite","decision":"keep","notes":"This is a profiling upgrade, not a solver-speed keep. The first two probe steps really do dominate successful large relocations on the dense UNSAT hotspots, but the earlier manual scan-head unroll still lost cleanly, so future learnt-large work needs a broader structural simplification than spelling out the scan head in Python."}
{"timestamp":"2026-03-20T16:11:47+01:00","experiment_id":"2026-03-20-reject-root-pure-shrink-ratio-gate","hypothesis":"If the current root pure-literal presolve is gated not just by `>= 2` assignments but also by a minimum removed-clause ratio computed inside the same fixpoint, it might keep the real pure-hit wins while filtering out low-yield search-path perturbation cases better than assignment count alone.","change_summary":"Built a temporary `/tmp/satsolver_rootpure_ratio.py` variant that counts removed normalized clauses inside the iterative root-pure fixpoint and gates the presolve with `SATSOLVER_ROOT_PURE_MIN_REMOVAL_RATIO`, swept several ratio thresholds on exact-CLI pure-hit and mixed slices, then ran a full repeat-aware exact-CLI 59-case suite on the best slice candidate (`0.08`). The production solver stayed unchanged.","files_changed":["agent_log.md","experiments.jsonl","benchmark_summary.md","next_steps.md"],"datasets":["small/test_1.cnf","small/test_5.cnf","small/test_6.cnf","small/test_9.cnf","medium/test_8.cnf","medium/test_9.cnf","large/test_1.cnf","large/test_2.cnf","large/test_5.cnf","large/test_7.cnf","large/test_9.cnf","special/easy.cnf","large/test_6.cnf","special/hard.cnf","medium/test_4.cnf","large/test_8.cnf","small","medium","large","special","satlib_subset","satlib_more"],"commands":["python - <<'PY' ... exact-CLI pure-hit threshold sweep for `0.00/0.05/0.08/0.10/0.15` on `/tmp/satsolver_rootpure_ratio.py` ... PY","python - <<'PY' ... exact-CLI mixed-slice threshold sweep for `0.00/0.05/0.08/0.10` on `/tmp/satsolver_rootpure_ratio.py` ... PY","python - <<'PY' ... forward/reverse exact-CLI A/B for `0.00` vs `0.08` on the mixed slice ... PY","SATSOLVER_ROOT_PURE_MIN_REMOVAL_RATIO=0.08 python benchmark_suite.py satsolver /tmp/out_cli_rootpure_ratio.txt small medium large special satlib_subset satlib_more --bruteforce-var-limit 16 --cli-script /tmp/satsolver_rootpure_ratio.py --repeat 2","python -m unittest discover -s tests -v","python satsolver.py small/test_1.cnf /tmp/rootratio_cycle_sat.txt","python tools/checker.py small/test_1.cnf /tmp/rootratio_cycle_sat.txt","python satsolver.py special/tseitin.cnf /tmp/rootratio_cycle_unsat.txt","python tools/checker.py special/tseitin.cnf /tmp/rootratio_cycle_unsat.txt --bruteforce-var-limit 0"],"metrics_before":{"pure_hit_slice_threshold_0_00_s":0.5957,"mixed_slice_threshold_0_00_s":26.0581,"forward_mixed_baseline_s":25.2493,"reverse_mixed_baseline_s":25.8285,"retained_exact_cli_repeat_best_s":27.1974,"retained_exact_cli_repeat_recent_s":27.6136,"unit_test_count":35},"metrics_after":{"pure_hit_slice_threshold_0_10_s":0.5361,"mixed_slice_threshold_0_08_s":25.4692,"forward_mixed_threshold_0_08_s":25.0454,"reverse_mixed_threshold_0_08_s":25.3225,"forward_large_test_6_threshold_0_08_s":13.0595,"forward_special_hard_threshold_0_08_s":9.0756,"forward_medium_test_4_threshold_0_08_s":1.9768,"forward_large_test_8_threshold_0_08_s":0.3491,"reverse_large_test_6_threshold_0_08_s":13.8249,"reverse_special_hard_threshold_0_08_s":8.8323,"reverse_medium_test_4_threshold_0_08_s":1.8612,"reverse_large_test_8_threshold_0_08_s":0.2982,"full_exact_cli_repeat_candidate_s":31.4387,"full_exact_cli_repeat_candidate_measured_s":62.8773,"full_exact_cli_repeat_candidate_wall_s":63.096,"full_exact_cli_repeat_candidate_solved_correctly":59,"unit_test_count":35},"correctness_status":"the temporary candidate stayed `59/59` correct on the full repeat-aware exact-CLI suite, and the retained production solver still passed 35 regression tests plus SAT/UNSAT checker spot checks","decision":"discard","notes":"The stronger classifier looked real on the pure-hit and mixed slices, but it still failed badly on the full exact-CLI suite. That makes assignment count plus removed-clause ratio another insufficient root-pure classifier, even when the ratio is computed inside the same fixpoint rather than via an extra prescan."}
{"timestamp":"2026-03-20T16:21:10+01:00","experiment_id":"2026-03-20-reject-active-unassigned-branch-picker","hypothesis":"Because `pick_branch_literal()` still costs real time in `cProfile`, keeping an explicit active prefix of currently unassigned variables might reduce branch-selection overhead enough to matter while preserving the current smallest-variable tie break among equal-activity maxima.","change_summary":"Built and removed a temporary `scratch/exp_active_unassigned_branch.py` harness that maintained an explicit active prefix of unassigned variables and scanned only that prefix in `pick_branch_literal()`. Discarded it immediately after the first dense hotspot gate because it both regressed badly and perturbed the search path.","files_changed":["agent_log.md","experiments.jsonl","benchmark_summary.md","next_steps.md"],"datasets":["large/test_6.cnf","special/hard.cnf","medium/test_4.cnf","large/test_8.cnf","small/test_1.cnf","special/tseitin.cnf"],"commands":["python -m cProfile -s tottime satsolver.py large/test_6.cnf /tmp/cprofile_large6_now.out","python tools/profile_solver.py large/test_6.cnf special/hard.cnf medium/test_4.cnf large/test_8.cnf","python -m py_compile scratch/exp_active_unassigned_branch.py","python -u scratch/exp_active_unassigned_branch.py","pkill -f 'python -u scratch/exp_active_unassigned_branch.py'","python -m unittest discover -s tests -v","python satsolver.py small/test_1.cnf /tmp/active_unassigned_cycle_sat.txt","python tools/checker.py small/test_1.cnf /tmp/active_unassigned_cycle_sat.txt","python satsolver.py special/tseitin.cnf /tmp/active_unassigned_cycle_unsat.txt","python tools/checker.py special/tseitin.cnf /tmp/active_unassigned_cycle_unsat.txt --bruteforce-var-limit 0"],"metrics_before":{"large_test_6_baseline_time_s":15.0435,"large_test_6_baseline_decisions":72886,"large_test_6_baseline_conflicts":59201,"unit_test_count":35},"metrics_after":{"large_test_6_experimental_time_s":28.8075,"large_test_6_experimental_decisions":134042,"large_test_6_experimental_conflicts":108066,"first_gate_same_search":false,"unit_test_count":35},"correctness_status":"the production solver was unchanged, still passed 35 regression tests, and still produced checker-valid SAT and UNSAT spot-check outputs after the scratch harness was removed","decision":"discard","notes":"This failed the first hotspot gate hard enough that it never earned a wider run. Explicit unassigned-set maintenance did not just add overhead; it changed the search path dramatically on `large/test_6.cnf`, so future branch-picker work should be skeptical of mutable active-set schemes unless they come with a much stronger invariance story."}
{"timestamp":"2026-03-20T16:28:32+01:00","experiment_id":"2026-03-20-keep-branch-frontier-profiler","hypothesis":"If branch selection is dominated by wide best-activity ties or frequent zero-activity fallback decisions, then future `pick_branch_literal()` work should target those cases; if the best activity is almost always unique, then mutable active-set schemes are probably adding more risk than they remove.","change_summary":"Extended `tools/profile_solver.py` to record decision-frontier size, zero-activity unassigned counts, best-activity tie size, multiway-tie frequency, and zero-activity branch-choice frequency; added regression coverage in `tests/test_profile_solver.py`; reran the hotspot profiler; and updated the repo notes. The production solver stayed unchanged.","files_changed":["tools/profile_solver.py","tests/test_profile_solver.py","agent_log.md","experiments.jsonl","benchmark_summary.md","next_steps.md"],"datasets":["large/test_6.cnf","special/hard.cnf","medium/test_4.cnf","large/test_8.cnf"],"commands":["python -m py_compile tools/profile_solver.py tests/test_profile_solver.py","python -m unittest discover -s tests -v","python tools/profile_solver.py large/test_6.cnf special/hard.cnf medium/test_4.cnf large/test_8.cnf"],"metrics_before":{"unit_test_count":35},"metrics_after":{"unit_test_count":36,"large_test_6_avg_branch_unassigned":237.71,"large_test_6_branch_multiway_best_ties":9,"large_test_6_branch_zero_activity_choices":0,"special_hard_avg_branch_unassigned":166.5,"special_hard_branch_multiway_best_ties":13,"special_hard_branch_zero_activity_choices":0,"medium_test_4_avg_branch_unassigned":161.67,"medium_test_4_branch_multiway_best_ties":15,"medium_test_4_branch_zero_activity_choices":0,"large_test_8_avg_branch_unassigned":247.72,"large_test_8_branch_multiway_best_ties":15,"large_test_8_branch_zero_activity_choices":0},"correctness_status":"the production solver was unchanged and still passed 36 regression tests; the new branch-frontier counters are covered by the profiler regression suite","decision":"keep","notes":"This is a profiling upgrade, not a solver-speed keep. The hotspot branch frontiers are still wide, but the winning best-activity variable is almost always unique and zero-activity branch choices are absent, so future branching work should not target tie handling or zero-activity fallback first."}
{"timestamp":"2026-03-20T21:27:01+01:00","experiment_id":"2026-03-20-keep-ternary-satisfied-skip-profiler","hypothesis":"If problem-ternary trigger events are mostly satisfied skips, then future ternary work should focus on that early exit; if satisfied skips are only a minority, then the real remaining cost is deeper relocation, unit propagation, and conflict handling.","change_summary":"Extended `tools/profile_solver.py` to split satisfied-watch skips by clause family, including problem ternary versus learnt ternary, added regression coverage in `tests/test_profile_solver.py`, reran the hotspot profiler, and updated the repo notes. The production solver stayed unchanged.","files_changed":["tools/profile_solver.py","tests/test_profile_solver.py","agent_log.md","experiments.jsonl","benchmark_summary.md","next_steps.md"],"datasets":["large/test_6.cnf","special/hard.cnf","medium/test_4.cnf","large/test_8.cnf"],"commands":["python -m py_compile tools/profile_solver.py tests/test_profile_solver.py","python -m unittest discover -s tests -v","python tools/profile_solver.py large/test_6.cnf special/hard.cnf medium/test_4.cnf large/test_8.cnf"],"metrics_before":{"unit_test_count":36},"metrics_after":{"unit_test_count":37,"large_test_6_problem_ternary_satisfied_skip_share":0.1943,"large_test_6_learnt_ternary_satisfied_skip_share":0.3647,"special_hard_problem_ternary_satisfied_skip_share":0.2636,"special_hard_learnt_ternary_satisfied_skip_share":0.4474,"medium_test_4_problem_ternary_satisfied_skip_share":0.2459,"medium_test_4_learnt_ternary_satisfied_skip_share":0.4844,"large_test_8_problem_ternary_satisfied_skip_share":0.241,"large_test_8_learnt_ternary_satisfied_skip_share":0.4101},"correctness_status":"the production solver was unchanged and still passed 37 regression tests; the new clause-family satisfied-skip counters are covered by the profiler regression suite","decision":"keep","notes":"This is a profiling upgrade, not a solver-speed keep. On the main hotspots, only about a fifth to a quarter of problem-ternary trigger events end in an immediate satisfied skip, so future original-ternary work should focus more on the deeper relocation/unit/conflict path than on the early satisfied-skip exit."}
