{"timestamp":"2026-03-20T13:23:59+01:00","experiment_id":"2026-03-20-reject-large-scan-hint","hypothesis":"Because large learnt clauses still account for millions of replacement-scan probe steps, especially on `large/test_8.cnf`, remembering a rotating scan hint per clause may reduce repeated scans from index `2` without changing solver correctness.","change_summary":"Ran a quick structural screen for complementary ternary pairs that would derive binary clauses, found that they are absent on the main bottlenecks, then measured an out-of-tree `LargeScanHintSolver` that added a per-clause rotating replacement-scan hint for large clauses; discarded it after it regressed the serial five-case hotspot slice badly in both orders.","files_changed":["agent_log.md","experiments.jsonl","benchmark_summary.md","next_steps.md"],"datasets":["large/test_6.cnf","special/hard.cnf","medium/test_4.cnf","large/test_10.cnf","large/test_8.cnf","small/test_1.cnf","special/tseitin.cnf","small","medium","large","special","satlib_subset","satlib_more"],"commands":["python - <<'PY' ... complementary-ternary derived-binary scan on hotspot cases ... PY","python - <<'PY' ... complementary-ternary derived-binary scan on the full 59-case corpus ... PY","PYTHONPATH=. python scratch/exp_large_scan_hint.py","python -m unittest discover -s tests -v","python satsolver.py small/test_1.cnf /tmp/cycle_sat.txt","python tools/checker.py small/test_1.cnf /tmp/cycle_sat.txt","python satsolver.py special/tseitin.cnf /tmp/cycle_unsat.txt","python tools/checker.py special/tseitin.cnf /tmp/cycle_unsat.txt --bruteforce-var-limit 0"],"metrics_before":{"serial_hotspot_forward_total_s":31.2931,"serial_hotspot_reverse_total_s":30.5534,"serial_hotspot_avg_total_s":30.9232,"serial_hotspot_forward_large_test_6_s":14.0336,"serial_hotspot_forward_special_hard_s":9.4903,"serial_hotspot_forward_medium_test_4_s":1.9605,"serial_hotspot_forward_large_test_10_s":1.8613,"serial_hotspot_forward_large_test_8_s":3.9475,"serial_hotspot_reverse_large_test_8_s":3.8142,"serial_hotspot_reverse_large_test_10_s":1.8343,"serial_hotspot_reverse_medium_test_4_s":1.9202,"serial_hotspot_reverse_special_hard_s":9.3524,"serial_hotspot_reverse_large_test_6_s":13.6323,"derived_binary_pairs_large_test_6":0,"derived_binary_pairs_special_hard":0,"derived_binary_pairs_medium_test_4":0,"derived_binary_pairs_large_test_10":1,"derived_binary_pairs_large_test_8":0,"derived_binary_pairs_full_suite":59,"unit_test_count":27},"metrics_after":{"serial_hotspot_forward_total_s":43.5937,"serial_hotspot_reverse_total_s":44.6141,"serial_hotspot_avg_total_s":44.1039,"serial_hotspot_forward_large_test_6_s":19.4124,"serial_hotspot_forward_special_hard_s":13.5490,"serial_hotspot_forward_medium_test_4_s":2.4543,"serial_hotspot_forward_large_test_10_s":1.3444,"serial_hotspot_forward_large_test_8_s":6.8336,"serial_hotspot_reverse_large_test_8_s":7.0244,"serial_hotspot_reverse_large_test_10_s":1.2882,"serial_hotspot_reverse_medium_test_4_s":2.4700,"serial_hotspot_reverse_special_hard_s":13.7203,"serial_hotspot_reverse_large_test_6_s":20.1112,"unit_test_count":27},"correctness_status":"the out-of-tree benchmark stayed SAT/UNSAT-correct on the hotspot slice, and the retained production solver still passed all 27 regression tests plus SAT/UNSAT checker spot checks after the scratch experiment was removed","decision":"discard","notes":"This is another strong negative result for mutable side-state on the propagation path. A rotating large-clause scan hint hurt every real bottleneck except `large/test_10.cnf`, and the quick complementary-ternary screen says derived-binary preprocessing is too sparse on the main hard cases to prioritize right now."}
{"timestamp":"2026-03-20T13:34:18+01:00","experiment_id":"2026-03-20-reject-problem-ternary-trigger-network","hypothesis":"Because the dominant hotspot work is original-clause ternary propagation, replacing watched-literal handling for problem 3-clauses with a fixed per-literal ternary trigger network may remove normalization, relocation, and watcher-list mutation overhead without hurting correctness.","change_summary":"Measured an out-of-tree `ProblemTernaryTriggerSolver` that stored each problem ternary clause in three static per-literal trigger lists instead of the normal watched-literal path; discarded it after the first same-day serial hotspot gate nearly doubled total runtime and severely worsened search counts on the main bottlenecks.","files_changed":["agent_log.md","experiments.jsonl","benchmark_summary.md","next_steps.md"],"datasets":["large/test_6.cnf","special/hard.cnf","medium/test_4.cnf","large/test_10.cnf","large/test_8.cnf","small/test_1.cnf","special/tseitin.cnf"],"commands":["PYTHONPATH=. python -u - <<'PY' ... small SAT/UNSAT scratch correctness checks for ProblemTernaryTriggerSolver ... PY","PYTHONPATH=. python -u - <<'PY' ... forward serial hotspot A/B for Solver vs ProblemTernaryTriggerSolver over large/test_6.cnf, special/hard.cnf, medium/test_4.cnf, large/test_10.cnf, large/test_8.cnf ... PY","python -m unittest discover -s tests -v","python satsolver.py small/test_1.cnf /tmp/cycle_sat.txt","python tools/checker.py small/test_1.cnf /tmp/cycle_sat.txt","python satsolver.py special/tseitin.cnf /tmp/cycle_unsat.txt","python tools/checker.py special/tseitin.cnf /tmp/cycle_unsat.txt --bruteforce-var-limit 0"],"metrics_before":{"serial_hotspot_forward_total_s":29.8075,"serial_hotspot_forward_large_test_6_s":13.6006,"serial_hotspot_forward_special_hard_s":8.8652,"serial_hotspot_forward_medium_test_4_s":1.8705,"serial_hotspot_forward_large_test_10_s":1.8093,"serial_hotspot_forward_large_test_8_s":3.6618,"large_test_6_conflicts":59201,"special_hard_conflicts":44619,"medium_test_4_conflicts":10995,"large_test_10_conflicts":9650,"large_test_8_conflicts":16430,"unit_test_count":27},"metrics_after":{"serial_hotspot_forward_total_s":57.8977,"serial_hotspot_forward_large_test_6_s":14.6982,"serial_hotspot_forward_special_hard_s":11.2639,"serial_hotspot_forward_medium_test_4_s":1.7459,"serial_hotspot_forward_large_test_10_s":1.8434,"serial_hotspot_forward_large_test_8_s":28.3463,"large_test_6_conflicts":64397,"special_hard_conflicts":55387,"medium_test_4_conflicts":9982,"large_test_10_conflicts":10495,"large_test_8_conflicts":113573,"unit_test_count":27},"correctness_status":"the scratch variant still solved `small/test_1.cnf` as SAT and `special/tseitin.cnf` as UNSAT, and the retained production solver passed all 27 regression tests plus SAT/UNSAT checker spot checks after the scratch experiment was removed","decision":"discard","notes":"This is a strong negative result against fixed per-literal ternary trigger networks in pure Python. The branch did not just add overhead; it materially worsened the search path on the main hotspot families, especially `large/test_8.cnf`."}
{"timestamp":"2026-03-20T13:41:57+01:00","experiment_id":"2026-03-20-keep-problem-ternary-clause-concentration-profiler","hypothesis":"If the hard cases repeatedly hammer only a small subset of original ternary problem clauses or problem-clause reasons, a clause-targeted cache or ordering heuristic might still be viable; if clause coverage is near-total and the hottest share is tiny, future work should favor broad propagation/conflict-analysis simplifications instead.","change_summary":"Extended `tools/profile_solver.py` to record problem-ternary clause coverage and hottest-clause share for both watched propagation traffic and problem-clause reason traversals, added regression coverage, and used the new counters to show that hotspot traffic is diffuse across almost every problem ternary clause rather than concentrated on a few pathologies.","files_changed":["tools/profile_solver.py","tests/test_profile_solver.py","agent_log.md","experiments.jsonl","benchmark_summary.md","next_steps.md"],"datasets":["large/test_6.cnf","special/hard.cnf","medium/test_4.cnf","large/test_8.cnf","small/test_1.cnf","special/tseitin.cnf"],"commands":["python -m py_compile tools/profile_solver.py tests/test_profile_solver.py","python -m unittest discover -s tests -v","python tools/profile_solver.py large/test_6.cnf special/hard.cnf medium/test_4.cnf large/test_8.cnf","python satsolver.py small/test_1.cnf /tmp/profile_cycle_sat.txt","python tools/checker.py small/test_1.cnf /tmp/profile_cycle_sat.txt","python satsolver.py special/tseitin.cnf /tmp/profile_cycle_unsat.txt","python tools/checker.py special/tseitin.cnf /tmp/profile_cycle_unsat.txt --bruteforce-var-limit 0"],"metrics_before":{"unit_test_count":27},"metrics_after":{"unit_test_count":27,"large_test_6_problem_ternary_clause_count":1393,"large_test_6_problem_ternary_distinct_clauses_visited":1393,"large_test_6_max_problem_ternary_clause_visits":12368,"large_test_6_problem_ternary_hot_share":0.0016,"large_test_6_analyze_problem_reason_distinct_clauses":1386,"large_test_6_max_analyze_problem_reason_clause_traversals":3016,"large_test_6_analyze_problem_reason_hot_share":0.0034,"special_hard_problem_ternary_clause_count":850,"special_hard_problem_ternary_distinct_clauses_visited":850,"special_hard_max_problem_ternary_clause_visits":10925,"special_hard_problem_ternary_hot_share":0.0026,"special_hard_analyze_problem_reason_distinct_clauses":850,"special_hard_max_analyze_problem_reason_clause_traversals":3331,"special_hard_analyze_problem_reason_hot_share":0.0054,"medium_test_4_problem_ternary_clause_count":886,"medium_test_4_problem_ternary_distinct_clauses_visited":886,"medium_test_4_max_problem_ternary_clause_visits":2764,"medium_test_4_problem_ternary_hot_share":0.0026,"medium_test_4_analyze_problem_reason_distinct_clauses":885,"medium_test_4_max_analyze_problem_reason_clause_traversals":907,"medium_test_4_analyze_problem_reason_hot_share":0.0060,"large_test_8_problem_ternary_clause_count":1210,"large_test_8_problem_ternary_distinct_clauses_visited":1210,"large_test_8_max_problem_ternary_clause_visits":3867,"large_test_8_problem_ternary_hot_share":0.0020,"large_test_8_analyze_problem_reason_distinct_clauses":1198,"large_test_8_max_analyze_problem_reason_clause_traversals":1431,"large_test_8_analyze_problem_reason_hot_share":0.0049},"correctness_status":"the production solver was unchanged and still passed all 27 regression tests plus SAT/UNSAT checker spot checks; the new profiler counters are covered by the existing profiler regression suite","decision":"keep","notes":"This is a measurement upgrade, not a solver-speed change. The new data says original ternary traffic is extremely diffuse across the hard cases, which lowers the priority of clause-specific caches or ordering heuristics and points back toward generic hot-loop savings."}
{"timestamp":"2026-03-20T13:47:40+01:00","experiment_id":"2026-03-20-keep-problem-ternary-trigger-literal-profiler","hypothesis":"If only a small subset of signed literals accounts for most original problem-ternary visits, a literal-targeted watch-list/data-layout optimization might still be viable; if trigger-literal coverage is near-total and the hottest share is tiny, future work should stay focused on generic hot-loop savings instead.","change_summary":"Extended `tools/profile_solver.py` to record problem-ternary trigger-literal coverage and hottest-literal share, added regression coverage, and used the new counters to show that hotspot traffic is diffuse across trigger literals/watch lists as well as across clauses.","files_changed":["tools/profile_solver.py","tests/test_profile_solver.py","agent_log.md","experiments.jsonl","benchmark_summary.md","next_steps.md"],"datasets":["large/test_6.cnf","special/hard.cnf","medium/test_4.cnf","large/test_8.cnf","small/test_1.cnf","special/tseitin.cnf"],"commands":["python -m py_compile tools/profile_solver.py tests/test_profile_solver.py","python -m unittest discover -s tests -v","python tools/profile_solver.py large/test_6.cnf special/hard.cnf medium/test_4.cnf large/test_8.cnf","python satsolver.py small/test_1.cnf /tmp/lit_profile_sat.txt","python tools/checker.py small/test_1.cnf /tmp/lit_profile_sat.txt","python satsolver.py special/tseitin.cnf /tmp/lit_profile_unsat.txt","python tools/checker.py special/tseitin.cnf /tmp/lit_profile_unsat.txt --bruteforce-var-limit 0"],"metrics_before":{"unit_test_count":27},"metrics_after":{"unit_test_count":27,"large_test_6_problem_ternary_literal_count":541,"large_test_6_problem_ternary_distinct_trigger_literals":540,"large_test_6_max_problem_ternary_trigger_literal_visits":31508,"large_test_6_problem_ternary_trigger_hot_share":0.0041,"special_hard_problem_ternary_literal_count":400,"special_hard_problem_ternary_distinct_trigger_literals":400,"special_hard_max_problem_ternary_trigger_literal_visits":27723,"special_hard_problem_ternary_trigger_hot_share":0.0066,"medium_test_4_problem_ternary_literal_count":382,"medium_test_4_problem_ternary_distinct_trigger_literals":382,"medium_test_4_max_problem_ternary_trigger_literal_visits":7092,"medium_test_4_problem_ternary_trigger_hot_share":0.0067,"large_test_8_problem_ternary_literal_count":595,"large_test_8_problem_ternary_distinct_trigger_literals":594,"large_test_8_max_problem_ternary_trigger_literal_visits":8817,"large_test_8_problem_ternary_trigger_hot_share":0.0045},"correctness_status":"the production solver was unchanged and still passed all 27 regression tests plus SAT/UNSAT checker spot checks; the new profiler counters are covered by the profiler regression suite","decision":"keep","notes":"This is another measurement upgrade, not a solver-speed change. The new data says original ternary traffic is diffuse across trigger literals/watch lists too, which lowers the priority of literal-specific watch-list tricks and points back toward generic hot-loop savings."}
{"timestamp":"2026-03-20T13:58:31+01:00","experiment_id":"2026-03-20-reject-inline-clause-bump-analyze","hypothesis":"Because `analyze()` still calls `bump_clause_activity()` on every learnt conflict clause it traverses, inlining that helper and its rare rescale path directly into `analyze()` may shave overhead without changing the search path.","change_summary":"Refreshed cProfile on the hard cases, then measured an out-of-tree `InlineClauseBumpSolver` that inlined learnt-clause activity bumping into `analyze()` and discarded it after forward/reverse hotspot A/B regressed while preserving identical conflicts on every case.","files_changed":["agent_log.md","experiments.jsonl","benchmark_summary.md","next_steps.md"],"datasets":["large/test_6.cnf","special/hard.cnf","medium/test_4.cnf","large/test_10.cnf","large/test_8.cnf","small/test_1.cnf","special/tseitin.cnf"],"commands":["python - <<'PY' ... cProfile on large/test_6.cnf, special/hard.cnf, and large/test_8.cnf ... PY","PYTHONPATH=. python scratch/exp_inline_clause_bump.py","python -m unittest discover -s tests -v","python satsolver.py small/test_1.cnf /tmp/inline_clause_bump_sat.txt","python tools/checker.py small/test_1.cnf /tmp/inline_clause_bump_sat.txt","python satsolver.py special/tseitin.cnf /tmp/inline_clause_bump_unsat.txt","python tools/checker.py special/tseitin.cnf /tmp/inline_clause_bump_unsat.txt --bruteforce-var-limit 0"],"metrics_before":{"serial_hotspot_forward_total_s":28.2310,"serial_hotspot_reverse_total_s":28.2351,"serial_hotspot_avg_total_s":28.2330,"serial_hotspot_forward_large_test_6_s":12.9157,"serial_hotspot_forward_special_hard_s":8.5442,"serial_hotspot_forward_medium_test_4_s":1.7601,"serial_hotspot_forward_large_test_10_s":1.6653,"serial_hotspot_forward_large_test_8_s":3.3456,"serial_hotspot_reverse_large_test_8_s":3.4573,"serial_hotspot_reverse_large_test_10_s":1.7100,"serial_hotspot_reverse_medium_test_4_s":1.7672,"serial_hotspot_reverse_special_hard_s":8.3218,"serial_hotspot_reverse_large_test_6_s":12.9788,"large_test_6_conflicts":59201,"special_hard_conflicts":44619,"medium_test_4_conflicts":10995,"large_test_10_conflicts":9650,"large_test_8_conflicts":16430,"cprofile_large_test_6_bump_clause_activity_tottime_s":0.049,"cprofile_special_hard_bump_clause_activity_tottime_s":0.043,"cprofile_large_test_8_bump_clause_activity_tottime_s":0.013,"unit_test_count":27},"metrics_after":{"serial_hotspot_forward_total_s":28.8182,"serial_hotspot_reverse_total_s":29.9110,"serial_hotspot_avg_total_s":29.3646,"serial_hotspot_forward_large_test_6_s":13.0055,"serial_hotspot_forward_special_hard_s":8.6852,"serial_hotspot_forward_medium_test_4_s":1.9207,"serial_hotspot_forward_large_test_10_s":1.6857,"serial_hotspot_forward_large_test_8_s":3.5212,"serial_hotspot_reverse_large_test_8_s":3.6646,"serial_hotspot_reverse_large_test_10_s":1.9089,"serial_hotspot_reverse_medium_test_4_s":1.9370,"serial_hotspot_reverse_special_hard_s":9.3546,"serial_hotspot_reverse_large_test_6_s":13.0458,"large_test_6_conflicts":59201,"special_hard_conflicts":44619,"medium_test_4_conflicts":10995,"large_test_10_conflicts":9650,"large_test_8_conflicts":16430,"unit_test_count":27},"correctness_status":"the scratch variant preserved SAT/UNSAT outcomes and identical conflict counts on the hotspot slice, and the retained production solver still passed all 27 regression tests plus SAT/UNSAT checker spot checks after the scratch experiment was removed","decision":"discard","notes":"This was a pure-overhead loser. It preserved the exact same conflict counts on every hotspot case and still regressed, which makes inlined learnt-clause bumping another measured dead end rather than a search improvement."}
{"timestamp":"2026-03-20T14:13:22+01:00","experiment_id":"2026-03-20-reject-dense-unsat-worker-sweep","hypothesis":"Because the current stdlib portfolio only helps the lower-density SAT-like pure-3-SAT family, a second worker with slightly different restart or decay settings may beat the default search on the denser pure-3-SAT UNSAT-heavy family strongly enough to justify a future density-based portfolio gate.","change_summary":"Measured an out-of-tree worker sweep over the five hotspot cases using the retained solver with alternate `restart_base`, `var_decay`, and fixed-phase settings, then discarded the whole dense-UNSAT alternate-worker idea after the default worker still won clearly on that family. No production solver code was changed.","files_changed":["agent_log.md","experiments.jsonl","benchmark_summary.md","next_steps.md"],"datasets":["large/test_6.cnf","special/hard.cnf","medium/test_4.cnf","large/test_10.cnf","large/test_8.cnf","small/test_1.cnf","special/tseitin.cnf"],"commands":["python tools/profile_solver.py large/test_6.cnf special/hard.cnf medium/test_4.cnf large/test_8.cnf","python -m cProfile -s tottime satsolver.py large/test_6.cnf /tmp/profile_large6.out","python -m cProfile -s tottime satsolver.py special/hard.cnf /tmp/profile_hard.out","python - <<'PY' ... formula-density and phase-bias scan on the five hotspot cases ... PY","python - <<'PY' ... serial worker sweep for default, restart_base=32, restart_base=128, var_decay=0.94, var_decay=0.96, and all_true over the five hotspot cases ... PY","python -m unittest discover -s tests -v","python satsolver.py small/test_1.cnf /tmp/cycle_sat.txt","python tools/checker.py small/test_1.cnf /tmp/cycle_sat.txt","python satsolver.py special/tseitin.cnf /tmp/cycle_unsat.txt","python tools/checker.py special/tseitin.cnf /tmp/cycle_unsat.txt --bruteforce-var-limit 0"],"metrics_before":{"default_total_s":28.9875,"default_large_test_6_s":12.8893,"default_special_hard_s":8.6136,"default_medium_test_4_s":1.8611,"default_large_test_10_s":1.8541,"default_large_test_8_s":3.7694,"large_test_6_density":5.1402,"special_hard_density":4.25,"medium_test_4_density":4.6387,"large_test_10_density":5.5895,"large_test_8_density":4.0604,"unit_test_count":27},"metrics_after":{"rb32_total_s":36.5529,"rb32_large_test_6_s":18.4452,"rb32_special_hard_s":9.3682,"rb32_large_test_8_s":4.4813,"rb128_total_s":46.3689,"rb128_large_test_6_s":16.7997,"rb128_special_hard_s":9.0507,"rb128_large_test_8_s":16.7788,"vd94_total_s":35.6389,"vd94_large_test_6_s":21.8289,"vd94_special_hard_s":9.3631,"vd94_large_test_8_s":0.3785,"vd96_total_s":31.1810,"vd96_large_test_6_s":13.1248,"vd96_special_hard_s":11.4953,"vd96_large_test_8_s":3.3006,"all_true_total_s":31.5186,"all_true_large_test_6_s":15.6184,"all_true_special_hard_s":11.5602,"all_true_large_test_8_s":0.2104,"unit_test_count":27},"correctness_status":"the production solver stayed unchanged and still passed all 27 regression tests plus SAT/UNSAT checker spot checks after the measurement sweep","decision":"discard","notes":"The density split is real, but there is still no simple dense-UNSAT specialist worker. The variants that crush `large/test_8.cnf` continued to lose badly on `large/test_6.cnf` and `special/hard.cnf`, so this branch did not earn any exact-CLI portfolio follow-up."}
