{"timestamp":"2026-03-21T12:26:53+01:00","experiment_id":"2026-03-21-reject-lazy-phase-bias-recompute","hypothesis":"Because the current mainline almost never uses the phase-biased worker, stopping per-literal `phase_bias` maintenance during clause ingest and recomputing phase bias only when `seed_phase_bias=True` may improve startup-heavy exact-CLI slices without changing mainline search behavior.","change_summary":"Collected a fresh `large/test_6.cnf` profile, temporarily patched `satsolver_core.py`, `satsolver.py`, and `satsolver_fast.py` so `observe_clause()` seeds only initial activity while `seed_saved_phases_from_bias(...)` recomputes phase bias from clauses on demand, validated SAT and UNSAT smoke cases, benchmarked the candidate against the frozen `HEAD` baseline on the 12-case SAT-heavy exact-CLI root-hit slice via `tools/hotspot_compare.py --repeat 2`, then reverted the patch after the first gate regressed.","files_changed":["agent_log.md","benchmark_summary.md","experiments.jsonl","next_steps.md"],"datasets":["large/test_6.cnf","small/test_1.cnf","special/tseitin.cnf","small/test_5.cnf","small/test_6.cnf","small/test_9.cnf","medium/test_8.cnf","medium/test_9.cnf","large/test_1.cnf","large/test_2.cnf","large/test_5.cnf","large/test_7.cnf","large/test_9.cnf","special/easy.cnf"],"commands":["python -m cProfile -s tottime satsolver.py large/test_6.cnf /tmp/current_cycle_large6_profile_3.txt | head -n 35","python -m py_compile satsolver.py satsolver_core.py satsolver_fast.py","python satsolver.py small/test_1.cnf /tmp/lazyphasebias_sat.txt","python tools/checker.py small/test_1.cnf /tmp/lazyphasebias_sat.txt","python satsolver.py special/tseitin.cnf /tmp/lazyphasebias_unsat.txt","python tools/checker.py special/tseitin.cnf /tmp/lazyphasebias_unsat.txt --bruteforce-var-limit 0","python tools/hotspot_compare.py --baseline-cli-script /tmp/satsolver_nosavedphaseprop_baseline/satsolver.py --candidate-cli-script satsolver.py --repeat 2 small/test_1.cnf small/test_5.cnf small/test_6.cnf small/test_9.cnf medium/test_8.cnf medium/test_9.cnf large/test_1.cnf large/test_2.cnf large/test_5.cnf large/test_7.cnf large/test_9.cnf special/easy.cnf"],"metrics_before":{"large_test_6_profile_propagate_tottime_s":16.060,"large_test_6_profile_analyze_tottime_s":2.737,"large_test_6_profile_pick_branch_literal_tottime_s":1.580,"large_test_6_profile_observe_clause_tottime_s":0.002,"root_hit_two_order_avg_baseline_s":0.4780,"root_hit_forward_baseline_s":0.4725,"root_hit_reverse_baseline_s":0.4835},"metrics_after":{"root_hit_two_order_avg_candidate_s":0.4922,"root_hit_forward_candidate_s":0.4931,"root_hit_reverse_candidate_s":0.4914,"large_test_5_forward_candidate_s":0.0577,"large_test_7_forward_candidate_s":0.0603,"medium_test_9_reverse_candidate_s":0.0415},"correctness_status":"the temporary patch compiled cleanly and stayed checker-valid on SAT and UNSAT smoke cases, but it was reverted after the first startup-heavy exact-CLI gate regressed overall","decision":"discard","notes":"This is a startup/ingest reject. Eager `phase_bias` maintenance appears too small or too entangled to recover cleanly by itself."}
{"timestamp":"2026-03-21T12:36:08+01:00","experiment_id":"2026-03-21-reject-literal-var-abs-rewrite","hypothesis":"Because fresh exact-CLI `cProfile` runs still show `abs` as a visible cost inside conflict analysis, replacing hot `abs(...)` calls with the solver's existing `literal_var[...]` lookup in `analyze()`, `minimize_learnt()`, and `prepare_learnt_clause()` may trim conflict-analysis overhead without changing search behavior.","change_summary":"Collected fresh `large/test_6.cnf` and `special/hard.cnf` profiles, created a frozen `HEAD` baseline in `/tmp/satsolver_absvar_baseline/`, temporarily patched `satsolver_core.py` so conflict analysis uses `literal_var[...]` instead of `abs(...)`, validated SAT and UNSAT smoke cases, benchmarked the candidate against the frozen baseline on the mixed nine-case exact-CLI hotspot slice, then reverted the patch after the mixed gate regressed.","files_changed":["agent_log.md","benchmark_summary.md","experiments.jsonl","next_steps.md"],"datasets":["large/test_6.cnf","special/hard.cnf","small/test_1.cnf","special/tseitin.cnf","medium/test_3.cnf","medium/test_4.cnf","large/test_8.cnf","large/test_10.cnf","special/easy.cnf"],"commands":["python -m cProfile -s tottime satsolver.py large/test_6.cnf /tmp/cycle_profile_large6.txt | head -n 35","python -m cProfile -s tottime satsolver.py special/hard.cnf /tmp/cycle_profile_hard.txt | head -n 35","mkdir -p /tmp/satsolver_absvar_baseline && git show HEAD:satsolver.py > /tmp/satsolver_absvar_baseline/satsolver.py && git show HEAD:satsolver_core.py > /tmp/satsolver_absvar_baseline/satsolver_core.py && git show HEAD:satsolver_fast.py > /tmp/satsolver_absvar_baseline/satsolver_fast.py","python -m py_compile satsolver.py satsolver_core.py satsolver_fast.py","python satsolver.py small/test_1.cnf /tmp/absvar_sat.txt","python tools/checker.py small/test_1.cnf /tmp/absvar_sat.txt","python satsolver.py special/tseitin.cnf /tmp/absvar_unsat.txt","python tools/checker.py special/tseitin.cnf /tmp/absvar_unsat.txt --bruteforce-var-limit 0","python tools/hotspot_compare.py --baseline-cli-script /tmp/satsolver_absvar_baseline/satsolver.py --candidate-cli-script satsolver.py small/test_1.cnf special/tseitin.cnf medium/test_3.cnf medium/test_4.cnf large/test_6.cnf large/test_8.cnf large/test_10.cnf special/hard.cnf special/easy.cnf"],"metrics_before":{"large_test_6_profile_propagate_tottime_s":15.983,"large_test_6_profile_analyze_tottime_s":2.755,"large_test_6_profile_abs_tottime_s":1.115,"special_hard_profile_propagate_tottime_s":11.001,"special_hard_profile_analyze_tottime_s":1.943,"special_hard_profile_abs_tottime_s":0.800,"mixed_slice_two_order_avg_baseline_s":30.3393,"mixed_slice_forward_baseline_s":31.0800,"mixed_slice_reverse_baseline_s":29.5986},"metrics_after":{"mixed_slice_two_order_avg_candidate_s":30.9773,"mixed_slice_forward_candidate_s":31.3153,"mixed_slice_reverse_candidate_s":30.6392,"large_test_6_forward_candidate_s":15.6328,"large_test_6_reverse_candidate_s":15.4005,"special_hard_forward_candidate_s":10.2898,"special_hard_reverse_candidate_s":9.8490,"large_test_10_forward_candidate_s":1.9903,"large_test_10_reverse_candidate_s":1.9295},"correctness_status":"the temporary patch compiled cleanly and stayed checker-valid on SAT and UNSAT smoke cases, but it was reverted after the mixed exact-CLI hotspot gate regressed overall","decision":"discard","notes":"This looks like another pure-overhead conflict-analysis rewrite: the candidate improved a few slice members, but the stable `large/test_6.cnf` regression in both orders was enough to reject it immediately."}
{"timestamp":"2026-03-21T12:43:32+01:00","experiment_id":"2026-03-21-reject-keep-ternary-lbd3","hypothesis":"Because the workload is heavily ternary, broadening learnt retention to keep ternary clauses with `LBD <= 3` in `reduce_database()` may improve dense pure-3-SAT UNSAT search enough to outweigh the extra learnt-clause load.","change_summary":"Created a frozen `HEAD` baseline in `/tmp/satsolver_keepternlbd3_baseline/`, temporarily patched `satsolver_core.py` so `reduce_database()` keeps ternary learnt clauses when `clause.lbd <= 3`, validated SAT and UNSAT smoke cases, benchmarked the candidate against the frozen baseline on the mixed nine-case exact-CLI hotspot slice, then reverted the patch after the mixed gate failed catastrophically on the SAT-like family.","files_changed":["agent_log.md","benchmark_summary.md","experiments.jsonl","next_steps.md"],"datasets":["small/test_1.cnf","special/tseitin.cnf","medium/test_3.cnf","medium/test_4.cnf","large/test_6.cnf","large/test_8.cnf","large/test_10.cnf","special/hard.cnf","special/easy.cnf"],"commands":["mkdir -p /tmp/satsolver_keepternlbd3_baseline && git show HEAD:satsolver.py > /tmp/satsolver_keepternlbd3_baseline/satsolver.py && git show HEAD:satsolver_core.py > /tmp/satsolver_keepternlbd3_baseline/satsolver_core.py && git show HEAD:satsolver_fast.py > /tmp/satsolver_keepternlbd3_baseline/satsolver_fast.py","python -m py_compile satsolver.py satsolver_core.py satsolver_fast.py","python satsolver.py small/test_1.cnf /tmp/keepternlbd3_sat.txt","python tools/checker.py small/test_1.cnf /tmp/keepternlbd3_sat.txt","python satsolver.py special/tseitin.cnf /tmp/keepternlbd3_unsat.txt","python tools/checker.py special/tseitin.cnf /tmp/keepternlbd3_unsat.txt --bruteforce-var-limit 0","python tools/hotspot_compare.py --baseline-cli-script /tmp/satsolver_keepternlbd3_baseline/satsolver.py --candidate-cli-script satsolver.py small/test_1.cnf special/tseitin.cnf medium/test_3.cnf medium/test_4.cnf large/test_6.cnf large/test_8.cnf large/test_10.cnf special/hard.cnf special/easy.cnf"],"metrics_before":{"mixed_slice_two_order_avg_baseline_s":31.1445,"mixed_slice_forward_baseline_s":31.3888,"mixed_slice_reverse_baseline_s":30.9002,"large_test_8_forward_baseline_s":0.3193,"large_test_8_reverse_baseline_s":0.3519,"special_hard_forward_baseline_s":10.1341,"special_hard_reverse_baseline_s":9.7290},"metrics_after":{"mixed_slice_two_order_avg_candidate_s":54.9538,"mixed_slice_forward_candidate_s":55.7422,"mixed_slice_reverse_candidate_s":54.1655,"large_test_8_forward_candidate_s":25.6356,"large_test_8_reverse_candidate_s":24.9397,"special_hard_forward_candidate_s":7.6952,"special_hard_reverse_candidate_s":7.4674,"large_test_10_forward_candidate_s":1.6446,"large_test_10_reverse_candidate_s":1.7073},"correctness_status":"the temporary patch compiled cleanly and stayed checker-valid on SAT and UNSAT smoke cases, but it was reverted immediately after the mixed exact-CLI hotspot gate showed a catastrophic SAT-family regression","decision":"discard","notes":"This is a strong learnt-database reject. Extra retention of small ternary learnt clauses helps some dense UNSAT cases, but it destabilizes the SAT-like `large/test_8.cnf` family so badly that the branch is not viable."}
{"timestamp":"2026-03-21T12:49:31+01:00","experiment_id":"2026-03-21-reject-skip-kept-clause-bumps","hypothesis":"Because clause activity only matters for ranking deletable learnt clauses in `reduce_database()`, skipping `bump_clause_activity()` for learnt clauses that are already effectively always kept (binaries and `LBD <= 2`) may trim conflict-analysis overhead without materially changing database decisions.","change_summary":"Created a frozen `HEAD` baseline in `/tmp/satsolver_skipkeptclausebump_baseline/`, temporarily patched `satsolver_core.py` so `analyze()` only bumps learnt clauses when `clause.lbd > 2` and length is greater than `2`, validated SAT and UNSAT smoke cases, benchmarked the candidate against the frozen baseline on the mixed nine-case exact-CLI hotspot slice, then reverted the patch after the mixed gate came back slightly negative overall.","files_changed":["agent_log.md","benchmark_summary.md","experiments.jsonl","next_steps.md"],"datasets":["small/test_1.cnf","special/tseitin.cnf","medium/test_3.cnf","medium/test_4.cnf","large/test_6.cnf","large/test_8.cnf","large/test_10.cnf","special/hard.cnf","special/easy.cnf"],"commands":["mkdir -p /tmp/satsolver_skipkeptclausebump_baseline && git show HEAD:satsolver.py > /tmp/satsolver_skipkeptclausebump_baseline/satsolver.py && git show HEAD:satsolver_core.py > /tmp/satsolver_skipkeptclausebump_baseline/satsolver_core.py && git show HEAD:satsolver_fast.py > /tmp/satsolver_skipkeptclausebump_baseline/satsolver_fast.py","python -m py_compile satsolver.py satsolver_core.py satsolver_fast.py","python satsolver.py small/test_1.cnf /tmp/skipkeptclausebump_sat.txt","python tools/checker.py small/test_1.cnf /tmp/skipkeptclausebump_sat.txt","python satsolver.py special/tseitin.cnf /tmp/skipkeptclausebump_unsat.txt","python tools/checker.py special/tseitin.cnf /tmp/skipkeptclausebump_unsat.txt --bruteforce-var-limit 0","python tools/hotspot_compare.py --baseline-cli-script /tmp/satsolver_skipkeptclausebump_baseline/satsolver.py --candidate-cli-script satsolver.py small/test_1.cnf special/tseitin.cnf medium/test_3.cnf medium/test_4.cnf large/test_6.cnf large/test_8.cnf large/test_10.cnf special/hard.cnf special/easy.cnf"],"metrics_before":{"mixed_slice_two_order_avg_baseline_s":32.6181,"mixed_slice_forward_baseline_s":32.3114,"mixed_slice_reverse_baseline_s":32.9248,"special_hard_forward_baseline_s":10.7750,"special_hard_reverse_baseline_s":11.2034,"large_test_6_forward_baseline_s":15.5857,"large_test_6_reverse_baseline_s":16.0836},"metrics_after":{"mixed_slice_two_order_avg_candidate_s":32.8545,"mixed_slice_forward_candidate_s":32.1107,"mixed_slice_reverse_candidate_s":33.5983,"special_hard_forward_candidate_s":10.4010,"special_hard_reverse_candidate_s":10.5056,"large_test_6_forward_candidate_s":15.9471,"large_test_6_reverse_candidate_s":17.4529,"large_test_8_forward_candidate_s":0.3602,"large_test_8_reverse_candidate_s":0.3540},"correctness_status":"the temporary patch compiled cleanly and stayed checker-valid on SAT and UNSAT smoke cases, but it was reverted after the mixed exact-CLI hotspot gate stayed slightly negative overall","decision":"discard","notes":"This looks like another learnt-database interaction reject: trimming clause bumps on always-kept learnt clauses helps `special/hard.cnf`, but it still hurts `large/test_6.cnf` enough to lose the mixed slice overall."}
{"timestamp":"2026-03-21T12:58:38+01:00","experiment_id":"2026-03-21-reject-deferred-watcher-shrink","hypothesis":"Because watcher-list pops dominate explicit pop traffic in the profiler, keeping the current swap-remove semantics but deferring actual watcher-list shrink to one tail deletion per list may reduce propagation overhead without changing search behavior.","change_summary":"Created a frozen `HEAD` baseline in `/tmp/satsolver_watchcompact_baseline/`, temporarily patched `satsolver_core.py` so the non-binary watcher loop uses a logical end pointer and one final tail delete per watcher list, added and validated a focused conflict-return cleanup regression, benchmarked the candidate against the frozen baseline on the mixed nine-case exact-CLI hotspot slice, then reverted both the propagation patch and the temporary regression after the mixed gate regressed cleanly.","files_changed":["agent_log.md","benchmark_summary.md","experiments.jsonl","next_steps.md"],"datasets":["small/test_1.cnf","special/tseitin.cnf","medium/test_3.cnf","medium/test_4.cnf","large/test_6.cnf","large/test_8.cnf","large/test_10.cnf","special/hard.cnf","special/easy.cnf"],"commands":["mkdir -p /tmp/satsolver_watchcompact_baseline && git show HEAD:satsolver.py > /tmp/satsolver_watchcompact_baseline/satsolver.py && git show HEAD:satsolver_core.py > /tmp/satsolver_watchcompact_baseline/satsolver_core.py && git show HEAD:satsolver_fast.py > /tmp/satsolver_watchcompact_baseline/satsolver_fast.py","python -m py_compile satsolver.py satsolver_core.py satsolver_fast.py tests/test_solver_regressions.py","python -m unittest tests.test_solver_regressions.SolverRegressionTests.test_propagate_conflict_cleans_compacted_watcher_tail -v","python satsolver.py small/test_1.cnf /tmp/watchcompact_sat.txt","python tools/checker.py small/test_1.cnf /tmp/watchcompact_sat.txt","python satsolver.py special/tseitin.cnf /tmp/watchcompact_unsat.txt","python tools/checker.py special/tseitin.cnf /tmp/watchcompact_unsat.txt --bruteforce-var-limit 0","python tools/hotspot_compare.py --baseline-cli-script /tmp/satsolver_watchcompact_baseline/satsolver.py --candidate-cli-script satsolver.py small/test_1.cnf special/tseitin.cnf medium/test_3.cnf medium/test_4.cnf large/test_6.cnf large/test_8.cnf large/test_10.cnf special/hard.cnf special/easy.cnf"],"metrics_before":{"mixed_slice_two_order_avg_baseline_s":30.6616,"mixed_slice_forward_baseline_s":30.3996,"mixed_slice_reverse_baseline_s":30.9236,"special_hard_forward_baseline_s":9.9840,"special_hard_reverse_baseline_s":9.7723,"large_test_6_forward_baseline_s":14.9381,"large_test_6_reverse_baseline_s":15.6433},"metrics_after":{"mixed_slice_two_order_avg_candidate_s":31.6370,"mixed_slice_forward_candidate_s":31.4947,"mixed_slice_reverse_candidate_s":31.7792,"special_hard_forward_candidate_s":10.5435,"special_hard_reverse_candidate_s":10.1833,"large_test_6_forward_candidate_s":15.2874,"large_test_6_reverse_candidate_s":16.0219,"large_test_8_forward_candidate_s":0.3571,"large_test_8_reverse_candidate_s":0.3672},"correctness_status":"the temporary patch compiled cleanly, passed the focused conflict-return cleanup regression plus SAT/UNSAT smoke checks, but it was reverted after the mixed exact-CLI hotspot gate regressed overall","decision":"discard","notes":"This looks like another pure-overhead propagation rewrite: removing per-removal watcher `pop()` calls was not enough to pay for the changed shrink bookkeeping."}
{"timestamp":"2026-03-21T13:10:18+01:00","experiment_id":"2026-03-21-keep-pick-branch-local-aliases","hypothesis":"Because fresh profiling still shows `pick_branch_literal()` as a real cost center, hoisting the current read-only branch scan state into locals may reduce branch-selection overhead enough to survive the mixed exact-CLI hotspot gate and the repeat-aware full exact-CLI suite without changing branching policy.","change_summary":"Collected a fresh `large/test_6.cnf` profile, froze a `HEAD` baseline in `/tmp/satsolver_pickbranchlocals_baseline/`, patched only `pick_branch_literal()` in `satsolver_core.py` to use local aliases for `values`, `activity`, `saved_phase`, and `num_vars`, validated with `py_compile`, the full unit-test suite, CLI SAT/UNSAT smoke checks plus checker validation, benchmarked baseline vs candidate on a mixed nine-case exact-CLI hotspot slice and then on the repeat-aware exact-CLI full suite, collected a fresh post-keep profile, and refreshed `out_cli_extended.txt` from the retained candidate run.","files_changed":["agent_log.md","benchmark_summary.md","experiments.jsonl","next_steps.md","out_cli_extended.txt","satsolver_core.py"],"datasets":["large/test_6.cnf","small/test_1.cnf","special/tseitin.cnf","medium/test_3.cnf","medium/test_4.cnf","medium/test_9.cnf","large/test_8.cnf","large/test_10.cnf","special/hard.cnf","small","medium","large","special"],"commands":["python -m cProfile -s tottime satsolver.py large/test_6.cnf /tmp/current_cycle_large6_profile.txt | head -n 35","python -m py_compile satsolver.py satsolver_core.py satsolver_fast.py","python -m unittest discover -s tests -v","mkdir -p /tmp/satsolver_pickbranchlocals_baseline","cp satsolver.py /tmp/satsolver_pickbranchlocals_baseline/satsolver.py","git show HEAD:satsolver_core.py > /tmp/satsolver_pickbranchlocals_baseline/satsolver_core.py","cp satsolver_fast.py /tmp/satsolver_pickbranchlocals_baseline/satsolver_fast.py","python tools/hotspot_compare.py --baseline-cli-script /tmp/satsolver_pickbranchlocals_baseline/satsolver.py --candidate-cli-script satsolver.py small/test_1.cnf special/tseitin.cnf medium/test_3.cnf medium/test_4.cnf medium/test_9.cnf large/test_6.cnf large/test_8.cnf large/test_10.cnf special/hard.cnf","python benchmark_suite.py satsolver /tmp/cycle_pickbranchlocals_baseline_cli_repeat2.txt small medium large special --cli-script /tmp/satsolver_pickbranchlocals_baseline/satsolver.py --repeat 2","python benchmark_suite.py satsolver /tmp/cycle_pickbranchlocals_candidate_cli_repeat2.txt small medium large special --cli-script satsolver.py --repeat 2","python satsolver.py small/test_1.cnf /tmp/pickbranchlocals_sat.txt","python tools/checker.py small/test_1.cnf /tmp/pickbranchlocals_sat.txt","python satsolver.py special/tseitin.cnf /tmp/pickbranchlocals_unsat.txt","python tools/checker.py special/tseitin.cnf /tmp/pickbranchlocals_unsat.txt --bruteforce-var-limit 0","python -m cProfile -s tottime satsolver.py large/test_6.cnf /tmp/pickbranchlocals_profile_after.txt | head -n 20"],"metrics_before":{"large_test_6_profile_total_s":31.067,"large_test_6_profile_propagate_tottime_s":17.053,"large_test_6_profile_analyze_tottime_s":2.878,"large_test_6_profile_pick_branch_literal_tottime_s":1.626,"mixed_slice_two_order_avg_baseline_s":31.0625,"mixed_slice_forward_baseline_s":31.3587,"mixed_slice_reverse_baseline_s":30.7663,"full_suite_repeat2_total_baseline_s":32.7030,"full_suite_repeat2_measured_total_baseline_s":65.4059,"full_suite_repeat2_large_test_6_baseline_s":15.4449,"full_suite_repeat2_special_hard_baseline_s":10.0763},"metrics_after":{"large_test_6_profile_total_s":29.932,"large_test_6_profile_propagate_tottime_s":16.370,"large_test_6_profile_analyze_tottime_s":2.803,"large_test_6_profile_pick_branch_literal_tottime_s":1.388,"mixed_slice_two_order_avg_candidate_s":30.9412,"mixed_slice_forward_candidate_s":31.2829,"mixed_slice_reverse_candidate_s":30.5995,"full_suite_repeat2_total_candidate_s":31.6015,"full_suite_repeat2_measured_total_candidate_s":63.2029,"full_suite_repeat2_large_test_6_candidate_s":14.7695,"full_suite_repeat2_special_hard_candidate_s":9.7189},"correctness_status":"compiled cleanly, passed all 51 unit tests, produced checker-valid SAT and UNSAT CLI smoke outputs, and stayed 35/35 correct on the repeat-aware exact-CLI full suite","decision":"keep","notes":"This is a narrow kept branching cleanup. It improves the current read-only scan without reviving any of the already-rejected mutable frontier or heap-based branching ideas."}
