{"timestamp":"2026-03-21T13:02:11+01:00","experiment_id":"2026-03-21-keep-remove-fast-path-root-pure-from-main-wrapper","hypothesis":"Because current `satsolver_fast.py` again beats retained `satsolver.py` on same-day exact-CLI slices and on the same-day repeat-aware full suite, removing fast-path root-pure presolve from the promoted main wrapper may recover that win while preserving the richer import-time compatibility surface in `satsolver.py`.","change_summary":"Benchmarked retained `satsolver.py` against current `satsolver_fast.py` on the root-hit exact-CLI slice, the mixed nine-case exact-CLI hotspot slice, and the repeat-aware exact-CLI 59-case suite; created `scratch_satsolver_noroot.py`; removed only the fast-path root-pure block from `solve_cnf_fast_serial()`; validated SAT and UNSAT smoke cases; benchmarked the scratch candidate against retained `satsolver.py` on both exact-CLI slices and the repeat-aware full suite; then merged the change into tracked `satsolver.py`, updated the fast-path regression in `tests/test_solver_regressions.py`, refreshed `out_cli_extended.txt`, and deleted the scratch file.","files_changed":["satsolver.py","tests/test_solver_regressions.py","out_cli_extended.txt","agent_log.md","benchmark_summary.md","experiments.jsonl","next_steps.md"],"datasets":["small/test_1.cnf","special/tseitin.cnf","small/test_5.cnf","small/test_6.cnf","small/test_9.cnf","medium/test_8.cnf","medium/test_9.cnf","large/test_1.cnf","large/test_2.cnf","large/test_5.cnf","large/test_7.cnf","large/test_9.cnf","special/easy.cnf","small/test_10.cnf","medium/test_3.cnf","medium/test_4.cnf","large/test_6.cnf","large/test_8.cnf","large/test_10.cnf","special/hard.cnf","small","medium","large","special","satlib_subset","satlib_more"],"commands":["python tools/hotspot_compare.py --baseline-cli-script satsolver.py --candidate-cli-script satsolver_fast.py --repeat 2 small/test_1.cnf small/test_5.cnf small/test_6.cnf small/test_9.cnf medium/test_8.cnf medium/test_9.cnf large/test_1.cnf large/test_2.cnf large/test_5.cnf large/test_7.cnf large/test_9.cnf special/easy.cnf","python tools/hotspot_compare.py --baseline-cli-script satsolver.py --candidate-cli-script satsolver_fast.py small/test_1.cnf small/test_10.cnf medium/test_3.cnf medium/test_4.cnf large/test_6.cnf large/test_8.cnf large/test_10.cnf special/hard.cnf special/tseitin.cnf","python benchmark_suite.py satsolver /tmp/cycle_baseline_cli_repeat2.txt small medium large special satlib_subset satlib_more --bruteforce-var-limit 16 --cli-script satsolver.py --repeat 2","python benchmark_suite.py satsolver_fast /tmp/cycle_fast_cli_repeat2.txt small medium large special satlib_subset satlib_more --bruteforce-var-limit 16 --cli-script satsolver_fast.py --repeat 2","cp satsolver.py scratch_satsolver_noroot.py","python -m py_compile scratch_satsolver_noroot.py","python scratch_satsolver_noroot.py small/test_1.cnf /tmp/noroot_sat.txt","python tools/checker.py small/test_1.cnf /tmp/noroot_sat.txt","python scratch_satsolver_noroot.py special/tseitin.cnf /tmp/noroot_unsat.txt","python tools/checker.py special/tseitin.cnf /tmp/noroot_unsat.txt --bruteforce-var-limit 0","python tools/hotspot_compare.py --baseline-cli-script satsolver.py --candidate-cli-script scratch_satsolver_noroot.py --repeat 2 small/test_1.cnf small/test_5.cnf small/test_6.cnf small/test_9.cnf medium/test_8.cnf medium/test_9.cnf large/test_1.cnf large/test_2.cnf large/test_5.cnf large/test_7.cnf large/test_9.cnf special/easy.cnf","python tools/hotspot_compare.py --baseline-cli-script satsolver.py --candidate-cli-script scratch_satsolver_noroot.py small/test_1.cnf small/test_10.cnf medium/test_3.cnf medium/test_4.cnf large/test_6.cnf large/test_8.cnf large/test_10.cnf special/hard.cnf special/tseitin.cnf","python benchmark_suite.py scratch_satsolver_noroot /tmp/cycle_noroot_cli_repeat2.txt small medium large special satlib_subset satlib_more --bruteforce-var-limit 16 --cli-script scratch_satsolver_noroot.py --repeat 2","python -m py_compile satsolver.py satsolver_core.py satsolver_fast.py tests/test_solver_regressions.py","python -m unittest discover -s tests -v","python satsolver.py small/test_1.cnf /tmp/kept_noroot_sat.txt","python tools/checker.py small/test_1.cnf /tmp/kept_noroot_sat.txt","python satsolver.py special/tseitin.cnf /tmp/kept_noroot_unsat.txt","python tools/checker.py special/tseitin.cnf /tmp/kept_noroot_unsat.txt --bruteforce-var-limit 0","python benchmark_suite.py satsolver out_cli_extended.txt small medium large special satlib_subset satlib_more --bruteforce-var-limit 16 --cli-script satsolver.py --repeat 2"],"metrics_before":{"fast_root_hit_two_order_avg_baseline_s":0.5025,"fast_root_hit_two_order_avg_alternate_s":0.4947,"fast_mixed_slice_two_order_avg_baseline_s":32.7270,"fast_mixed_slice_two_order_avg_alternate_s":32.5444,"full_exact_cli_repeat2_baseline_s":39.8399,"full_exact_cli_repeat2_alternate_s":39.1591,"root_hit_two_order_avg_baseline_s":0.4790,"mixed_slice_two_order_avg_baseline_s":31.9046,"best_repeat_aware_exact_cli_s":25.7027},"metrics_after":{"root_hit_two_order_avg_candidate_s":0.4603,"mixed_slice_two_order_avg_candidate_s":31.4055,"full_exact_cli_repeat2_candidate_s":36.6465,"full_exact_cli_repeat2_refreshed_retained_s":38.0602,"full_exact_cli_repeat2_refreshed_retained_measured_s":76.1203,"large_test_6_candidate_repeat2_s":17.3420,"special_hard_candidate_repeat2_s":10.1976,"large_test_10_candidate_repeat2_s":2.0082,"large_test_8_candidate_repeat2_s":0.3689},"correctness_status":"the scratch candidate compiled cleanly, stayed checker-valid on SAT and UNSAT smoke cases, passed all 50 regression tests after merge, and all exact-CLI suite comparisons stayed 59/59 correct","decision":"keep","notes":"This keep is justified by the same-day baseline-vs-candidate comparisons, not by the refreshed retained artifact alone. Machine conditions were much slower than the historical `25.7027s` snapshot, but the no-root-pure main wrapper still beat both the retained baseline and the same-day `satsolver_fast.py` rerun decisively on the repeat-aware exact-CLI suite."}
{"timestamp":"2026-03-21T11:13:12+01:00","experiment_id":"2026-03-21-reject-problem-ternary-family-flag","hypothesis":"Because original problem ternary traffic still dominates watcher churn on the hard cases, adding immutable `Clause.problem_ternary` metadata and hoisting that family into its own `propagate()` fast branch may extend the earlier `Clause.ternary` keep without changing solver semantics.","change_summary":"Created a frozen `HEAD` baseline in `/tmp/satsolver_familyflag_baseline/`, temporarily patched `satsolver_core.py` to add immutable `Clause.problem_ternary` metadata and a dedicated original-ternary fast branch inside `propagate()`, validated SAT and UNSAT smoke cases, benchmarked the candidate against the frozen baseline on the 12-case SAT-heavy exact-CLI root-hit slice and the mixed nine-case exact-CLI hotspot slice, then reverted the core patch after the mixed gate regressed.","files_changed":["agent_log.md","benchmark_summary.md","experiments.jsonl","next_steps.md"],"datasets":["small/test_1.cnf","special/tseitin.cnf","small/test_5.cnf","small/test_6.cnf","small/test_9.cnf","medium/test_8.cnf","medium/test_9.cnf","large/test_1.cnf","large/test_2.cnf","large/test_5.cnf","large/test_7.cnf","large/test_9.cnf","special/easy.cnf","small/test_10.cnf","medium/test_3.cnf","medium/test_4.cnf","large/test_6.cnf","large/test_8.cnf","large/test_10.cnf","special/hard.cnf"],"commands":["mkdir -p /tmp/satsolver_familyflag_baseline && git show HEAD:satsolver.py > /tmp/satsolver_familyflag_baseline/satsolver.py && git show HEAD:satsolver_core.py > /tmp/satsolver_familyflag_baseline/satsolver_core.py && git show HEAD:satsolver_fast.py > /tmp/satsolver_familyflag_baseline/satsolver_fast.py","python -m py_compile satsolver.py satsolver_core.py satsolver_fast.py","python satsolver.py small/test_1.cnf /tmp/familyflag_sat.txt","python tools/checker.py small/test_1.cnf /tmp/familyflag_sat.txt","python satsolver.py special/tseitin.cnf /tmp/familyflag_unsat.txt","python tools/checker.py special/tseitin.cnf /tmp/familyflag_unsat.txt --bruteforce-var-limit 0","python tools/hotspot_compare.py --baseline-cli-script /tmp/satsolver_familyflag_baseline/satsolver.py --candidate-cli-script satsolver.py --repeat 2 small/test_1.cnf small/test_5.cnf small/test_6.cnf small/test_9.cnf medium/test_8.cnf medium/test_9.cnf large/test_1.cnf large/test_2.cnf large/test_5.cnf large/test_7.cnf large/test_9.cnf special/easy.cnf","python tools/hotspot_compare.py --baseline-cli-script /tmp/satsolver_familyflag_baseline/satsolver.py --candidate-cli-script satsolver.py small/test_1.cnf small/test_10.cnf medium/test_3.cnf medium/test_4.cnf large/test_6.cnf large/test_8.cnf large/test_10.cnf special/hard.cnf special/tseitin.cnf"],"metrics_before":{"root_hit_two_order_avg_baseline_s":0.5028,"mixed_slice_two_order_avg_baseline_s":32.7926,"mixed_slice_forward_baseline_s":32.0837,"mixed_slice_reverse_baseline_s":33.5015,"large_test_6_forward_baseline_s":15.5899,"large_test_6_reverse_baseline_s":17.4372,"special_hard_forward_baseline_s":10.4294,"special_hard_reverse_baseline_s":10.3249},"metrics_after":{"root_hit_two_order_avg_candidate_s":0.4952,"mixed_slice_two_order_avg_candidate_s":34.1993,"mixed_slice_forward_candidate_s":33.1709,"mixed_slice_reverse_candidate_s":35.2277,"large_test_6_forward_candidate_s":16.3647,"large_test_6_reverse_candidate_s":18.3817,"special_hard_forward_candidate_s":10.8470,"special_hard_reverse_candidate_s":11.1183},"correctness_status":"the temporary branch compiled cleanly and stayed checker-valid on SAT and UNSAT smoke cases, but it was reverted after the mixed exact-CLI hotspot gate regressed; the retained repository returned to the committed solver baseline before final validation","decision":"discard","notes":"This is a propagation-family reject. A small root-hit win was not enough: hoisting the dominant original-ternary family into its own branch still made the dense mixed gate materially worse, especially on `large/test_6.cnf` and `special/hard.cnf`."}
{"timestamp":"2026-03-21T11:21:39+01:00","experiment_id":"2026-03-21-reject-heap-branch-frontier","hypothesis":"Because `pick_branch_literal()` still consumes noticeable time in the current hard-case profile, replacing the full variable scan with a lazy `heapq` frontier of branch candidates may reduce branching overhead enough to help the mixed exact-CLI hotspot slice.","change_summary":"Created a frozen `HEAD` baseline in `/tmp/satsolver_heapbranch_baseline/`, temporarily patched `satsolver_core.py` to add a lazy branch heap populated after root propagation, push refreshed activity entries during `analyze()`, and reinsert variables on `backtrack()`, validated SAT and UNSAT smoke cases, benchmarked the candidate against the frozen baseline on the mixed nine-case exact-CLI hotspot slice, then reverted the heap branch after the slice regressed catastrophically.","files_changed":["agent_log.md","benchmark_summary.md","experiments.jsonl","next_steps.md"],"datasets":["small/test_1.cnf","special/tseitin.cnf","small/test_10.cnf","medium/test_3.cnf","medium/test_4.cnf","large/test_6.cnf","large/test_8.cnf","large/test_10.cnf","special/hard.cnf"],"commands":["python -m cProfile -s tottime satsolver.py large/test_6.cnf /tmp/current_cycle_large6_profile.txt","mkdir -p /tmp/satsolver_heapbranch_baseline && git show HEAD:satsolver.py > /tmp/satsolver_heapbranch_baseline/satsolver.py && git show HEAD:satsolver_core.py > /tmp/satsolver_heapbranch_baseline/satsolver_core.py && git show HEAD:satsolver_fast.py > /tmp/satsolver_heapbranch_baseline/satsolver_fast.py","python -m py_compile satsolver.py satsolver_core.py satsolver_fast.py","python satsolver.py small/test_1.cnf /tmp/heapbranch_sat.txt","python tools/checker.py small/test_1.cnf /tmp/heapbranch_sat.txt","python satsolver.py special/tseitin.cnf /tmp/heapbranch_unsat.txt","python tools/checker.py special/tseitin.cnf /tmp/heapbranch_unsat.txt --bruteforce-var-limit 0","python tools/hotspot_compare.py --baseline-cli-script /tmp/satsolver_heapbranch_baseline/satsolver.py --candidate-cli-script satsolver.py small/test_1.cnf small/test_10.cnf medium/test_3.cnf medium/test_4.cnf large/test_6.cnf large/test_8.cnf large/test_10.cnf special/hard.cnf special/tseitin.cnf"],"metrics_before":{"mixed_slice_two_order_avg_baseline_s":38.5681,"mixed_slice_forward_baseline_s":36.2510,"mixed_slice_reverse_baseline_s":40.8852,"large_test_6_forward_baseline_s":16.3472,"large_test_6_reverse_baseline_s":20.8493,"special_hard_forward_baseline_s":13.3576,"special_hard_reverse_baseline_s":13.0566},"metrics_after":{"mixed_slice_two_order_avg_candidate_s":55.0274,"mixed_slice_forward_candidate_s":54.8019,"mixed_slice_reverse_candidate_s":55.2530,"large_test_6_forward_candidate_s":26.6500,"large_test_6_reverse_candidate_s":26.6526,"special_hard_forward_candidate_s":19.0475,"special_hard_reverse_candidate_s":18.9846,"large_test_8_forward_candidate_s":0.7321,"large_test_8_reverse_candidate_s":0.6466},"correctness_status":"the temporary branch compiled cleanly and stayed checker-valid on SAT and UNSAT smoke cases, but it was reverted after the mixed exact-CLI hotspot gate regressed by a wide margin; the retained repository returned to the committed solver baseline before final validation","decision":"discard","notes":"This is a branching-data-structure reject. The lazy heap did not act like a cheap drop-in replacement for the current scan; the extra push/reinsert churn, and possibly search perturbation, made every important hotspot family worse."}
{"timestamp":"2026-03-21T11:27:31+01:00","experiment_id":"2026-03-21-reject-satsolver-fast-revival","hypothesis":"Because `satsolver_fast.py` is still structurally leaner than the promoted main wrapper, it may have regained an edge on the current same-day exact-CLI slices and be a better alternate-file focus than `satsolver.py`.","change_summary":"Reread the current wrapper files and local speed note, collected a fresh `cProfile` pass on `satsolver.py large/test_6.cnf`, then benchmarked current `satsolver.py` against current `satsolver_fast.py` on the 12-case SAT-heavy exact-CLI root-hit slice and the mixed nine-case exact-CLI hotspot slice. The alternate file failed to beat the promoted main wrapper on the decisive mixed slice, so the cycle ended as a measurement-only reject with no code changes.","files_changed":["agent_log.md","benchmark_summary.md","experiments.jsonl","next_steps.md"],"datasets":["large/test_6.cnf","small/test_1.cnf","small/test_5.cnf","small/test_6.cnf","small/test_9.cnf","medium/test_8.cnf","medium/test_9.cnf","large/test_1.cnf","large/test_2.cnf","large/test_5.cnf","large/test_7.cnf","large/test_9.cnf","special/easy.cnf","small/test_10.cnf","medium/test_3.cnf","medium/test_4.cnf","large/test_8.cnf","large/test_10.cnf","special/hard.cnf","special/tseitin.cnf"],"commands":["python -m cProfile -s tottime satsolver.py large/test_6.cnf /tmp/current_cycle_large6_profile.txt | head -n 40","python tools/hotspot_compare.py --baseline-cli-script satsolver.py --candidate-cli-script satsolver_fast.py --repeat 2 small/test_1.cnf small/test_5.cnf small/test_6.cnf small/test_9.cnf medium/test_8.cnf medium/test_9.cnf large/test_1.cnf large/test_2.cnf large/test_5.cnf large/test_7.cnf large/test_9.cnf special/easy.cnf","python tools/hotspot_compare.py --baseline-cli-script satsolver.py --candidate-cli-script satsolver_fast.py small/test_1.cnf small/test_10.cnf medium/test_3.cnf medium/test_4.cnf large/test_6.cnf large/test_8.cnf large/test_10.cnf special/hard.cnf special/tseitin.cnf"],"metrics_before":{"root_hit_two_order_avg_baseline_s":0.5198,"mixed_slice_two_order_avg_baseline_s":36.5697,"mixed_slice_forward_baseline_s":36.7266,"mixed_slice_reverse_baseline_s":36.4127,"large_test_6_forward_baseline_s":18.4633,"large_test_6_reverse_baseline_s":18.2376,"special_hard_forward_baseline_s":11.6244,"special_hard_reverse_baseline_s":11.7144},"metrics_after":{"root_hit_two_order_avg_candidate_s":0.5205,"mixed_slice_two_order_avg_candidate_s":36.9565,"mixed_slice_forward_candidate_s":36.6320,"mixed_slice_reverse_candidate_s":37.2809,"large_test_6_forward_candidate_s":18.4107,"large_test_6_reverse_candidate_s":18.9720,"special_hard_forward_candidate_s":11.7868,"special_hard_reverse_candidate_s":12.2073},"correctness_status":"both existing solver files stayed checker-valid throughout the slice comparisons, and no repository code changed during this measurement cycle","decision":"discard","notes":"This is an alternate-file recheck reject. `satsolver_fast.py` is still viable, but it no longer beats the promoted main wrapper where it matters, so future alternate-file work should start from current `satsolver.py` unless a materially different wrapper emerges."}
{"timestamp":"2026-03-21T11:35:55+01:00","experiment_id":"2026-03-21-reject-disable-main-portfolio","hypothesis":"Because only `large/test_8.cnf` still triggers the current portfolio gate, removing the portfolio handoff from the main exact-CLI wrapper may save enough process-launch overhead to improve the broad exact-CLI slices overall.","change_summary":"Scanned the benchmark corpus to confirm that only `large/test_8.cnf` still satisfies `should_use_parallel_portfolio(...)`, created `scratch_satsolver_noportfolio.py`, removed only the portfolio handoff from `solve_cnf()`, validated SAT and UNSAT smoke cases, benchmarked the scratch candidate against retained `satsolver.py` on the 12-case SAT-heavy exact-CLI root-hit slice and the mixed nine-case exact-CLI hotspot slice, then deleted the scratch file after the mixed gate failed decisively.","files_changed":["agent_log.md","benchmark_summary.md","experiments.jsonl","next_steps.md"],"datasets":["large/test_8.cnf","small/test_1.cnf","special/tseitin.cnf","small/test_5.cnf","small/test_6.cnf","small/test_9.cnf","medium/test_8.cnf","medium/test_9.cnf","large/test_1.cnf","large/test_2.cnf","large/test_5.cnf","large/test_7.cnf","large/test_9.cnf","special/easy.cnf","small/test_10.cnf","medium/test_3.cnf","medium/test_4.cnf","large/test_6.cnf","large/test_10.cnf","special/hard.cnf"],"commands":["python - <<'PY' ... corpus scan for should_use_parallel_portfolio(...) hits ... PY","python -m py_compile scratch_satsolver_noportfolio.py","python scratch_satsolver_noportfolio.py small/test_1.cnf /tmp/noportfolio_sat.txt","python tools/checker.py small/test_1.cnf /tmp/noportfolio_sat.txt","python scratch_satsolver_noportfolio.py special/tseitin.cnf /tmp/noportfolio_unsat.txt","python tools/checker.py special/tseitin.cnf /tmp/noportfolio_unsat.txt --bruteforce-var-limit 0","python tools/hotspot_compare.py --baseline-cli-script satsolver.py --candidate-cli-script scratch_satsolver_noportfolio.py --repeat 2 small/test_1.cnf small/test_5.cnf small/test_6.cnf small/test_9.cnf medium/test_8.cnf medium/test_9.cnf large/test_1.cnf large/test_2.cnf large/test_5.cnf large/test_7.cnf large/test_9.cnf special/easy.cnf","python tools/hotspot_compare.py --baseline-cli-script satsolver.py --candidate-cli-script scratch_satsolver_noportfolio.py small/test_1.cnf small/test_10.cnf medium/test_3.cnf medium/test_4.cnf large/test_6.cnf large/test_8.cnf large/test_10.cnf special/hard.cnf special/tseitin.cnf"],"metrics_before":{"root_hit_two_order_avg_baseline_s":0.4724,"mixed_slice_two_order_avg_baseline_s":30.3681,"mixed_slice_forward_baseline_s":30.2344,"mixed_slice_reverse_baseline_s":30.5018,"large_test_8_forward_baseline_s":0.3372,"large_test_8_reverse_baseline_s":0.3526},"metrics_after":{"root_hit_two_order_avg_candidate_s":0.4478,"mixed_slice_two_order_avg_candidate_s":34.0072,"mixed_slice_forward_candidate_s":33.3600,"mixed_slice_reverse_candidate_s":34.6544,"large_test_8_forward_candidate_s":3.8820,"large_test_8_reverse_candidate_s":4.1060,"large_test_6_forward_candidate_s":14.7751,"large_test_6_reverse_candidate_s":15.8286,"special_hard_forward_candidate_s":9.9152,"special_hard_reverse_candidate_s":9.7547},"correctness_status":"the scratch no-portfolio wrapper compiled cleanly, stayed checker-valid on SAT and UNSAT smoke cases, and was deleted after the mixed exact-CLI hotspot gate regressed sharply overall","decision":"discard","notes":"This is a narrow-portfolio reject. Even though only one current benchmark case still triggers the gate, that one case still depends heavily on the forked portfolio path: `large/test_8.cnf` exploded by roughly an order of magnitude without it, overwhelming the small startup-heavy slice win."}
