{"timestamp":"2026-05-31T22:26:11+02:00","experiment_id":"2026-05-31-keep-mycielski-graph-coloring-detector","hypothesis":"A conservative structural detector for exact graph-coloring CNFs over Mycielski towers can prove the hard iter4/color5 case UNSAT immediately without using filenames or external dependencies, while preserving SAT guard cases by falling through when enough colors are available.","change_summary":"Added parse_graph_coloring_encoding(), mycielski_chromatic_lower_bound(), and graph_coloring_mycielski_unsat() in satsolver_core.py, wired the detector after pigeonhole and XOR fast exits in satsolver_core.py, satsolver.py, and satsolver_fast.py, and added regression tests for the hard UNSAT target, smaller UNSAT family members, sufficient-color SAT guards, and incomplete graph-coloring constraint rejection.","files_changed":["satsolver_core.py","satsolver.py","satsolver_fast.py","tests/test_solver_regressions.py","PLANS.md","benchmark_summary.md","experiments.jsonl"],"datasets":["course_cnf_tests/cnf_training_complex__complex_cnf_hard__mycielski_iter4_color5_unsat.cnf","course_cnf_tests/*mycielski*.cnf","formulae/large/test_8.cnf","formulae/large/test_6.cnf","formulae/special/hard.cnf","formulae/small","formulae/medium","formulae/large","formulae/special","small","medium","large","special","satlib_subset","satlib_more","course_cnf_tests scratch 279 including mycielski_iter4_color5_unsat"],"commands":["python -m py_compile satsolver.py satsolver_core.py satsolver_io.py satsolver_fast.py","python -m pytest tests/test_solver_regressions.py -q","python satsolver.py course_cnf_tests/cnf_training_complex__complex_cnf_hard__mycielski_iter4_color5_unsat.cnf /tmp/mycielski_iter4_color5.out","python tools/checker.py course_cnf_tests/cnf_training_complex__complex_cnf_hard__mycielski_iter4_color5_unsat.cnf /tmp/mycielski_iter4_color5.out --bruteforce-var-limit 16","python satsolver.py formulae/large/test_8.cnf /tmp/formulae_large_test8.out && python tools/checker.py formulae/large/test_8.cnf /tmp/formulae_large_test8.out --bruteforce-var-limit 16","python satsolver.py formulae/large/test_6.cnf /tmp/formulae_large_test6.out && python tools/checker.py formulae/large/test_6.cnf /tmp/formulae_large_test6.out --bruteforce-var-limit 16","python satsolver.py formulae/special/hard.cnf /tmp/formulae_special_hard.out && python tools/checker.py formulae/special/hard.cnf /tmp/formulae_special_hard.out --bruteforce-var-limit 16","python tools/codex_verify.py","python ../benchmark_suite.py satsolver /tmp/mycielski_formulae_repeat2.txt small medium large special --bruteforce-var-limit 16 --repeat 2 --cli-script ../satsolver.py","python /home/doomguy/Desktop/sat/satsolver/benchmark_suite.py satsolver /tmp/mycielski_course_all_repeat2.txt . --bruteforce-var-limit 16 --repeat 2 --cli-script /home/doomguy/Desktop/sat/satsolver/satsolver.py","python tools/codex_verify.py --benchmark-mode cli --repeat 2"],"metrics_before":{"hard_mycielski_pre_detector_manual_run":"no output after more than 12.5 minutes before manual kill","previous_course_scratch_excluding_hard_repeat2_total_s":27.8704},"metrics_after":{"hard_mycielski_direct_s":0.0336,"hard_mycielski_course_repeat2_avg_s":0.0441,"mycielski_iter2_color3_unsat_s":0.0249,"mycielski_iter2_color4_sat_s":0.0304,"mycielski_iter3_color4_unsat_s":0.0303,"mycielski_iter3_color5_sat_s":0.0311,"formulae_repeat2_total_s":10.5654,"formulae_repeat2_correct":35,"course279_repeat2_total_s":27.5045,"course279_repeat2_correct":279,"suite59_repeat2_total_s":11.5872,"suite59_repeat2_correct":59},"correctness_status":"compiled cleanly, targeted regression tests passed, all Mycielski family smoke cases were checker-valid with sufficient-color SAT instances still SAT, formulae finished 35/35 correct, the full course scratch suite including the formerly excluded hard case finished 279/279 correct, and codex_verify plus exact-CLI repeat-2 verification passed","decision":"keep","notes":"The detector is intentionally narrow. It rejects malformed graph-coloring encodings, incomplete at-most-one or edge-color constraint sets, non-Mycielski graphs, and Mycielski graphs with enough colors, so uncertain cases continue through the existing CDCL/portfolio solver."}
