{"timestamp":"2026-03-20T03:14:32+01:00","experiment_id":"2026-03-20-narrow-parallel-portfolio","hypothesis":"A very narrow standard-library process portfolio, combining the current default search with a phase-bias-seeded alternate worker on large pure 3-SAT formulas, should cut wall time by turning a standalone-regressing phase heuristic into a secondary portfolio strategy.","change_summary":"Added a gated two-process portfolio path for large pure 3-SAT instances on multi-core POSIX systems, added an environment-variable off switch for serial A/B testing, and added a regression test that keeps the portfolio gate narrow and disableable.","files_changed":["satsolver.py","tests/test_solver_regressions.py","out_extended.txt","out_cli_extended.txt","agent_log.md","experiments.jsonl","benchmark_summary.md","next_steps.md"],"datasets":["large/test_6.cnf","special/hard.cnf","large/test_8.cnf","large/test_10.cnf","medium/test_4.cnf","small","medium","large","special","satlib_subset","satlib_more","small/test_1.cnf","/tmp/tiny_unsat.cnf"],"commands":["python -m unittest discover -s tests -v","python satsolver.py small/test_1.cnf /tmp/portfolio_sat.txt","python tools/checker.py small/test_1.cnf /tmp/portfolio_sat.txt","python satsolver.py /tmp/tiny_unsat.cnf /tmp/portfolio_unsat.txt","python tools/checker.py /tmp/tiny_unsat.cnf /tmp/portfolio_unsat.txt","SATSOLVER_DISABLE_PORTFOLIO=1 python -u - <<'PY' ... focused timing script over large/test_6.cnf, special/hard.cnf, large/test_8.cnf, large/test_10.cnf, medium/test_4.cnf ... PY","python -u - <<'PY' ... same focused timing script with portfolio enabled ... PY","python satsolver.py large/test_8.cnf /tmp/portfolio_large_sat.txt","python tools/checker.py large/test_8.cnf /tmp/portfolio_large_sat.txt","python benchmark_suite.py satsolver out_extended.txt small medium large special satlib_subset satlib_more --bruteforce-var-limit 16","python benchmark_suite.py satsolver out_cli_extended.txt small medium large special satlib_subset satlib_more --bruteforce-var-limit 16 --cli-script satsolver.py"],"metrics_before":{"focused_cases_total_runtime_s":29.9933,"best_in_process_validated_total_runtime_s":33.1525,"exact_cli_validated_total_runtime_s":36.6379,"large_test_6_runtime_s":13.9059,"special_hard_runtime_s":9.2406,"large_test_8_runtime_s":3.7718,"large_test_10_runtime_s":1.9317,"medium_test_4_runtime_s":1.9209},"metrics_after":{"focused_cases_total_runtime_s":27.8797,"best_in_process_validated_total_runtime_s":30.3556,"exact_cli_validated_total_runtime_s":34.0246,"large_test_6_runtime_s":14.2811,"special_hard_runtime_s":9.4462,"large_test_8_runtime_s":0.2557,"large_test_10_runtime_s":1.8357,"medium_test_4_runtime_s":2.0377,"solved_correctly":59,"sat":28,"unsat":31,"errors":0},"correctness_status":"passed 13 regression tests, SAT/UNSAT checker spot checks, a serial-vs-portfolio focused A/B run, and both validated 59/59 benchmark harnesses","decision":"keep","notes":"The alternate phase-bias worker is still a bad standalone global policy, but as a secondary portfolio worker it slashes hard SAT wall time enough to outweigh the mild UNSAT regressions. The environment variable SATSOLVER_DISABLE_PORTFOLIO provides a clean serial fallback for future A/B measurements."}
{"timestamp":"2026-03-20T03:24:27+01:00","experiment_id":"2026-03-20-density-limited-portfolio-gate","hypothesis":"A density-limited portfolio gate should keep the huge SAT-like portfolio payoff while avoiding alternate-worker overhead on dense UNSAT-heavy formulas that do not benefit.","change_summary":"Refined the parallel portfolio gate to require larger formulas, more clauses, and a SAT-like clause density; updated the regression test so the gate remains narrow and disableable; and measured the refined gate against both the broad-gate portfolio and a clean serial baseline.","files_changed":["satsolver.py","tests/test_solver_regressions.py","out_extended.txt","out_cli_extended.txt","agent_log.md","experiments.jsonl","benchmark_summary.md","next_steps.md"],"datasets":["large/test_8.cnf","large/test_6.cnf","special/hard.cnf","medium/test_4.cnf","large/test_10.cnf","large/test_3.cnf","large/test_4.cnf","large/test_7.cnf","large/test_9.cnf","special/dense.cnf","small","medium","large","special","satlib_subset","satlib_more"],"commands":["python -m unittest discover -s tests -v","python - <<'PY' ... gate-inspection script over benchmark directories ... PY","python satsolver.py large/test_8.cnf /tmp/refined_gate_sat.txt","python tools/checker.py large/test_8.cnf /tmp/refined_gate_sat.txt","SATSOLVER_DISABLE_PORTFOLIO=1 python benchmark_suite.py satsolver /tmp/out_serial_compare.txt small medium large special satlib_subset satlib_more --bruteforce-var-limit 16","python - <<'PY' ... compare gated-case serial vs portfolio timings from /tmp/out_serial_compare.txt and out_extended.txt ... PY","python benchmark_suite.py satsolver out_extended.txt small medium large special satlib_subset satlib_more --bruteforce-var-limit 16","python benchmark_suite.py satsolver out_cli_extended.txt small medium large special satlib_subset satlib_more --bruteforce-var-limit 16 --cli-script satsolver.py"],"metrics_before":{"serial_in_process_validated_total_runtime_s":33.4337,"broad_gate_in_process_validated_total_runtime_s":30.3556,"broad_gate_exact_cli_validated_total_runtime_s":34.0246,"large_test_8_serial_runtime_s":3.8974,"large_test_8_broad_gate_runtime_s":0.2557},"metrics_after":{"refined_gate_in_process_validated_total_runtime_s":30.3215,"refined_gate_exact_cli_validated_total_runtime_s":33.6033,"large_test_8_runtime_s":0.2512,"large_test_6_runtime_s":14.0189,"special_hard_runtime_s":9.7447,"medium_test_4_runtime_s":1.9252,"large_test_10_runtime_s":1.8264,"solved_correctly":59,"sat":28,"unsat":31,"errors":0},"correctness_status":"passed 13 regression tests, SAT checker validation on the gated big SAT case, and both validated 59/59 benchmark harnesses","decision":"keep","notes":"In the local benchmark suite the refined gate now only triggers on large/test_8.cnf, effectively turning the portfolio into a targeted fix for that hard SAT case. The in-process gain was small (-0.0341s vs the broad gate), but the exact-CLI gain was larger (-0.4213s), which made the refinement worth keeping."}
{"timestamp":"2026-03-20T03:31:26+01:00","experiment_id":"2026-03-20-profile-repair-and-rejected-literal-var-cleanup","hypothesis":"Repairing the profiling helper to mirror explicit decision-level bookkeeping should restore trustworthy measurements, and a small literal-variable lookup cleanup outside propagate() might trim some Python overhead on the remaining UNSAT-heavy hotspots.","change_summary":"Fixed ProfiledSolver.solve() to increment decision_level before enqueuing branch literals, reran profiling and cProfile on the main UNSAT-heavy cases, then tested and reverted a small non-propagation literal-var substitution experiment after it regressed the focused serial set.","files_changed":["tools/profile_solver.py","satsolver.py","agent_log.md","experiments.jsonl","benchmark_summary.md","next_steps.md"],"datasets":["large/test_6.cnf","special/hard.cnf","medium/test_4.cnf","large/test_10.cnf"],"commands":["python -m unittest discover -s tests -v","python tools/profile_solver.py large/test_6.cnf special/hard.cnf medium/test_4.cnf large/test_10.cnf","SATSOLVER_DISABLE_PORTFOLIO=1 python -m cProfile -s cumulative - <<'PY' ... solve_cnf on large/test_6.cnf ... PY","SATSOLVER_DISABLE_PORTFOLIO=1 python -u - <<'PY' ... focused timing script over large/test_6.cnf, special/hard.cnf, medium/test_4.cnf, large/test_10.cnf ... PY"],"metrics_before":{"bogus_profile_large_test_6_runtime_s":0.0007,"bogus_profile_large_test_6_conflicts":1,"focused_serial_hotspot_total_runtime_s":27.1270},"metrics_after":{"profile_large_test_6_runtime_s":18.3434,"profile_large_test_6_decisions":72886,"profile_large_test_6_conflicts":59201,"profile_large_test_6_processed_literals":2431409,"profile_special_hard_runtime_s":11.9661,"profile_medium_test_4_runtime_s":2.4574,"profile_large_test_10_runtime_s":2.4363,"rejected_literal_var_cleanup_hotspot_total_runtime_s":27.3295},"correctness_status":"passed 13 regression tests, restored believable profile counters, and reverted the regressing solver experiment","decision":"keep","notes":"The kept change is the profiler repair in tools/profile_solver.py. Serial cProfile again ranked propagate() first, then analyze() and backtrack() on large/test_6.cnf. The tested literal-var substitutions outside propagate() were discarded after a +0.2025s (+0.75%) hotspot regression, so the best-known solver benchmark snapshots remain 30.3215s in-process and 33.6033s exact CLI."}
{"timestamp":"2026-03-20T03:40:42+01:00","experiment_id":"2026-03-20-rejected-stale-watcher-detach","hypothesis":"If reduce_database() detaches deleted learnt clauses from their watch lists immediately instead of relying on propagate() to lazily skip stale watcher entries later, the dense UNSAT-heavy cases may spend less time in the propagation hot path.","change_summary":"Implemented immediate watcher detachment for deleted learnt clauses during database reduction, validated correctness, then reverted it after focused serial regressions on the main dense UNSAT-heavy cases.","files_changed":["satsolver.py","agent_log.md","experiments.jsonl","benchmark_summary.md","next_steps.md"],"datasets":["large/test_6.cnf","special/hard.cnf","medium/test_4.cnf","large/test_10.cnf","small/test_1.cnf","special/tseitin.cnf"],"commands":["python -m unittest discover -s tests -v","SATSOLVER_DISABLE_PORTFOLIO=1 python -u - <<'PY' ... focused timing script over large/test_6.cnf, special/hard.cnf, medium/test_4.cnf, large/test_10.cnf ... PY","python satsolver.py small/test_1.cnf /tmp/cycle_sat.txt","python tools/checker.py small/test_1.cnf /tmp/cycle_sat.txt","python satsolver.py special/tseitin.cnf /tmp/cycle_unsat.txt","python tools/checker.py special/tseitin.cnf /tmp/cycle_unsat.txt --bruteforce-var-limit 0"],"metrics_before":{"focused_serial_hotspot_total_runtime_s":26.1434,"large_test_6_runtime_s":13.4447,"special_hard_runtime_s":8.9782,"medium_test_4_runtime_s":1.9299,"large_test_10_runtime_s":1.7906},"metrics_after":{"experimental_focused_serial_hotspot_total_runtime_s":28.2716,"large_test_6_runtime_s":15.0836,"special_hard_runtime_s":8.6151,"medium_test_4_runtime_s":2.1292,"large_test_10_runtime_s":2.4436},"correctness_status":"passed 13 regression tests and SAT/UNSAT checker spot checks, but benchmarked worse overall and was reverted","decision":"discard","notes":"The extra list-removal work during clause database reduction cost more than the reduced stale-watcher traversal saved on the measured hotspot set, so the solver was restored to the previous retained state."}
{"timestamp":"2026-03-20T03:40:42+01:00","experiment_id":"2026-03-20-rejected-analyze-touched-shortcut","hypothesis":"Because analyze() already uses a tokenized seen[] array, removing the per-conflict touched-list bookkeeping and end-of-analysis cleanup loop might reduce list churn without changing the search path.","change_summary":"Removed touched-list append/cleanup in analyze(), validated correctness, then reverted the change after it regressed the focused dense UNSAT-heavy timing slice.","files_changed":["satsolver.py","agent_log.md","experiments.jsonl","benchmark_summary.md","next_steps.md"],"datasets":["large/test_6.cnf","special/hard.cnf","medium/test_4.cnf","large/test_10.cnf"],"commands":["python -m unittest discover -s tests -v","SATSOLVER_DISABLE_PORTFOLIO=1 python -u - <<'PY' ... focused timing script over large/test_6.cnf, special/hard.cnf, medium/test_4.cnf, large/test_10.cnf ... PY"],"metrics_before":{"focused_serial_hotspot_total_runtime_s":26.1434,"large_test_6_runtime_s":13.4447,"special_hard_runtime_s":8.9782,"medium_test_4_runtime_s":1.9299,"large_test_10_runtime_s":1.7906},"metrics_after":{"experimental_focused_serial_hotspot_total_runtime_s":27.4386,"large_test_6_runtime_s":14.2073,"special_hard_runtime_s":9.3743,"medium_test_4_runtime_s":1.9196,"large_test_10_runtime_s":1.9374},"correctness_status":"passed 13 regression tests, but benchmarked worse overall and was reverted","decision":"discard","notes":"The tokenized seen[] logic was not enough to make the shortcut pay off in Python; the removed touched-list bookkeeping appears to have been offset by worse downstream behavior, so the solver was restored to the previous retained state."}
{"timestamp":"2026-03-20T03:51:04+01:00","experiment_id":"2026-03-20-rejected-ternary-watcher-split","hypothesis":"If ternary clauses use dedicated watcher lists instead of flowing through the generic watched-literal list, the 3-SAT-heavy hotspot cases may spend less time in propagate().","change_summary":"Split ternary clauses into dedicated watcher arrays and a specialized propagation loop, validated correctness, then reverted the change after a large regression on the focused dense UNSAT-heavy slice.","files_changed":["satsolver.py","agent_log.md","experiments.jsonl","benchmark_summary.md","next_steps.md"],"datasets":["large/test_6.cnf","special/hard.cnf","medium/test_4.cnf","large/test_10.cnf"],"commands":["python tools/profile_solver.py large/test_6.cnf special/hard.cnf medium/test_4.cnf large/test_10.cnf","SATSOLVER_DISABLE_PORTFOLIO=1 python -u - <<'PY' ... focused timing script over large/test_6.cnf, special/hard.cnf, medium/test_4.cnf, large/test_10.cnf ... PY","python -m unittest discover -s tests -v"],"metrics_before":{"focused_serial_hotspot_total_runtime_s":27.2253,"large_test_6_runtime_s":13.8526,"special_hard_runtime_s":9.3800,"medium_test_4_runtime_s":2.0303,"large_test_10_runtime_s":1.9625},"metrics_after":{"experimental_focused_serial_hotspot_total_runtime_s":35.5294,"large_test_6_runtime_s":21.7405,"special_hard_runtime_s":9.4970,"medium_test_4_runtime_s":2.0481,"large_test_10_runtime_s":2.2438},"correctness_status":"passed 13 regression tests, but benchmarked much worse overall and was reverted","decision":"discard","notes":"The extra watcher-structure and loop-management overhead outweighed the saved ternary branch on the measured hotspot cases, so the retained solver configuration is unchanged."}
{"timestamp":"2026-03-20T03:51:04+01:00","experiment_id":"2026-03-20-rejected-reason-size-minimization-cutoff","hypothesis":"Because reason clauses of size 2..9 account for almost all successful learnt-literal removals on the main UNSAT bottlenecks, skipping redundancy checks for larger reason clauses might preserve most minimization benefit while reducing analyze()-time Python work.","change_summary":"Instrumented minimize_learnt() on the main hard UNSAT cases, observed that reason sizes 2..9 account for about 97.22% and 98.30% of removals on large/test_6.cnf and special/hard.cnf respectively, then implemented and reverted a hard reason-size cutoff after it regressed the focused hotspot slice.","files_changed":["satsolver.py","agent_log.md","experiments.jsonl","benchmark_summary.md","next_steps.md"],"datasets":["large/test_6.cnf","special/hard.cnf","medium/test_4.cnf","large/test_10.cnf","small/test_1.cnf","special/tseitin.cnf"],"commands":["python -m unittest discover -s tests -v","SATSOLVER_DISABLE_PORTFOLIO=1 python -u - <<'PY' ... focused timing script over large/test_6.cnf, special/hard.cnf, medium/test_4.cnf, large/test_10.cnf ... PY","python satsolver.py small/test_1.cnf /tmp/cycle2_sat.txt","python tools/checker.py small/test_1.cnf /tmp/cycle2_sat.txt","python satsolver.py special/tseitin.cnf /tmp/cycle2_unsat.txt","python tools/checker.py special/tseitin.cnf /tmp/cycle2_unsat.txt --bruteforce-var-limit 0"],"metrics_before":{"focused_serial_hotspot_total_runtime_s":27.2253,"large_test_6_runtime_s":13.8526,"special_hard_runtime_s":9.3800,"medium_test_4_runtime_s":2.0303,"large_test_10_runtime_s":1.9625,"large_test_6_removed_by_reason_size_2_to_9_pct":97.22,"special_hard_removed_by_reason_size_2_to_9_pct":98.30},"metrics_after":{"experimental_focused_serial_hotspot_total_runtime_s":38.2439,"large_test_6_runtime_s":20.5925,"special_hard_runtime_s":13.5514,"medium_test_4_runtime_s":1.6244,"large_test_10_runtime_s":2.4756},"correctness_status":"passed 13 regression tests and SAT/UNSAT checker spot checks, but benchmarked much worse overall and was reverted","decision":"discard","notes":"The instrumentation insight was real, but the hard global cutoff hurt search quality far more than its saved redundancy checks were worth. Any future minimize_learnt() change needs a more selective rule than a blunt reason-size cap."}
{"timestamp":"2026-03-20T03:56:53+01:00","experiment_id":"2026-03-20-rejected-backtrack-local-caching","hypothesis":"Because backtrack() still shows up as a meaningful cost in the hard UNSAT profile, caching local references, trail length, and decision level inside that loop might reduce Python bookkeeping overhead without changing solver behavior.","change_summary":"Rewrote backtrack() to use cached locals and an explicit trail-length counter, validated correctness, then reverted the change after a small focused serial regression.","files_changed":["satsolver.py","agent_log.md","experiments.jsonl","benchmark_summary.md","next_steps.md"],"datasets":["large/test_6.cnf","special/hard.cnf","medium/test_4.cnf","large/test_10.cnf","small/test_1.cnf","special/tseitin.cnf"],"commands":["python tools/profile_solver.py large/test_6.cnf special/hard.cnf medium/test_4.cnf large/test_10.cnf","SATSOLVER_DISABLE_PORTFOLIO=1 python - <<'PY' ... cProfile solve_cnf on large/test_6.cnf ... PY","SATSOLVER_DISABLE_PORTFOLIO=1 python -u - <<'PY' ... focused timing script over large/test_6.cnf, special/hard.cnf, medium/test_4.cnf, large/test_10.cnf ... PY","python -m unittest discover -s tests -v","python satsolver.py small/test_1.cnf /tmp/cycle3_sat.txt","python tools/checker.py small/test_1.cnf /tmp/cycle3_sat.txt","python satsolver.py special/tseitin.cnf /tmp/cycle3_unsat.txt","python tools/checker.py special/tseitin.cnf /tmp/cycle3_unsat.txt --bruteforce-var-limit 0"],"metrics_before":{"focused_serial_hotspot_total_runtime_s":28.8067,"large_test_6_runtime_s":14.9555,"special_hard_runtime_s":9.7826,"medium_test_4_runtime_s":2.0892,"large_test_10_runtime_s":1.9794,"large_test_6_backtrack_cprofile_cumtime_s":3.163},"metrics_after":{"experimental_focused_serial_hotspot_total_runtime_s":29.1004,"large_test_6_runtime_s":15.0354,"special_hard_runtime_s":10.0787,"medium_test_4_runtime_s":1.9878,"large_test_10_runtime_s":1.9985,"post_revert_focused_serial_hotspot_total_runtime_s":28.8374},"correctness_status":"passed 13 regression tests and SAT/UNSAT checker spot checks, but benchmarked slightly worse overall and was reverted","decision":"discard","notes":"Even a very narrow backtrack() bookkeeping cleanup was not a net win on the measured hotspot slice, which further supports the idea that the next useful gain needs to come from a more structural propagation/data-layout or heuristic change rather than helper-loop micro-optimizations."}
