{"timestamp":"2026-03-21T03:44:06+01:00","experiment_id":"2026-03-21-reject-direct-sat-byte-writer","hypothesis":"Because the alternate exact-CLI wrapper already localizes DIMACS parsing and byte output, replacing `format_model(...).encode(\"ascii\")` with direct SAT byte emission might remove one more small submission-path cost without touching the solver core.","change_summary":"Copied `satsolver_fast.py` to `scratch_satsolver_writefast.py`, patched only `write_result()` so SAT models were emitted through a `bytearray` instead of `format_model(...).encode(\"ascii\")`, validated SAT and UNSAT smoke cases with the checker, benchmarked the scratch wrapper against retained `satsolver_fast.py` on the 12-case SAT-heavy exact-CLI root-hit slice via `tools/hotspot_compare.py --repeat 2`, and deleted the scratch file after it lost the first gate.","files_changed":["agent_log.md","benchmark_summary.md","experiments.jsonl","next_steps.md"],"datasets":["small/test_1.cnf","special/tseitin.cnf","small/test_5.cnf","small/test_6.cnf","small/test_9.cnf","medium/test_8.cnf","medium/test_9.cnf","large/test_1.cnf","large/test_2.cnf","large/test_5.cnf","large/test_7.cnf","large/test_9.cnf","special/easy.cnf"],"commands":["python -m cProfile -s tottime satsolver_fast.py large/test_8.cnf /tmp/profile_fast_large8_out.txt","cp satsolver_fast.py scratch_satsolver_writefast.py","python -m py_compile scratch_satsolver_writefast.py","python scratch_satsolver_writefast.py small/test_1.cnf /tmp/writefast_sat.txt","python tools/checker.py small/test_1.cnf /tmp/writefast_sat.txt","python scratch_satsolver_writefast.py special/tseitin.cnf /tmp/writefast_unsat.txt","python tools/checker.py special/tseitin.cnf /tmp/writefast_unsat.txt --bruteforce-var-limit 0","python tools/hotspot_compare.py --baseline-cli-script satsolver_fast.py --candidate-cli-script scratch_satsolver_writefast.py --repeat 2 small/test_1.cnf small/test_5.cnf small/test_6.cnf small/test_9.cnf medium/test_8.cnf medium/test_9.cnf large/test_1.cnf large/test_2.cnf large/test_5.cnf large/test_7.cnf large/test_9.cnf special/easy.cnf"],"metrics_before":{"unit_test_count":48,"root_hit_two_order_avg_baseline_s":0.3717,"root_hit_forward_baseline_s":0.3913,"root_hit_reverse_baseline_s":0.3522},"metrics_after":{"unit_test_count":48,"root_hit_two_order_avg_candidate_s":0.3843,"root_hit_forward_candidate_s":0.3969,"root_hit_reverse_candidate_s":0.3717,"large_test_8_profile_total_s":0.447,"large_test_8_profile_posix_read_s":0.400,"large_test_8_profile_portfolio_cumtime_s":0.428},"correctness_status":"the scratch wrapper compiled cleanly, stayed checker-valid on SAT and UNSAT smoke cases, and was deleted after the first exact-CLI gate regressed; the retained solver files remained unchanged","decision":"discard","notes":"The direct A/B matches the earlier `large/test_8.cnf` profile: isolated SAT-output formatting is too small a cost to overcome the extra Python work of a manual `bytearray` emitter."}
{"timestamp":"2026-03-21T03:56:43+01:00","experiment_id":"2026-03-21-keep-cached-ternary-clause-flag","hypothesis":"Because `propagate()` is still the main retained hotspot and `len()` is still a visible Python-side cost there, caching immutable ternary-vs-non-ternary clause shape on each `Clause` may remove enough repeated hot-loop work to improve the exact-CLI solver path without changing traversal order or search semantics.","change_summary":"Created scratch candidates `scratch_satsolver_core_ternaryflag.py` and `scratch_satsolver_ternaryflag.py`, added `Clause.ternary`, switched the ternary fast path in `propagate()` from `len(lits) == 3` to `clause.ternary`, validated SAT and UNSAT smoke cases, benchmarked the scratch candidate against retained `satsolver.py` on the mixed nine-case exact-CLI hotspot slice, the 12-case SAT-heavy root-hit slice, and a same-day repeat-aware exact-CLI 59-case baseline-vs-candidate comparison, then merged the change into `satsolver_core.py`, added a regression in `tests/test_solver_regressions.py`, refreshed `out_cli_extended.txt`, and deleted the scratch files.","files_changed":["satsolver_core.py","tests/test_solver_regressions.py","out_cli_extended.txt","agent_log.md","benchmark_summary.md","experiments.jsonl","next_steps.md"],"datasets":["small/test_1.cnf","special/tseitin.cnf","small/test_5.cnf","small/test_6.cnf","small/test_9.cnf","medium/test_8.cnf","medium/test_9.cnf","large/test_1.cnf","large/test_2.cnf","large/test_5.cnf","large/test_7.cnf","large/test_9.cnf","special/easy.cnf","small/test_10.cnf","medium/test_3.cnf","medium/test_4.cnf","large/test_6.cnf","large/test_8.cnf","large/test_10.cnf","special/hard.cnf","small","medium","large","special","satlib_subset","satlib_more"],"commands":["python -m cProfile -s tottime satsolver.py large/test_6.cnf /tmp/current_main_profile_out.txt","python tools/hotspot_compare.py --baseline-cli-script satsolver.py --candidate-cli-script satsolver_fast.py --repeat 2 small/test_1.cnf small/test_5.cnf small/test_6.cnf small/test_9.cnf medium/test_8.cnf medium/test_9.cnf large/test_1.cnf large/test_2.cnf large/test_5.cnf large/test_7.cnf large/test_9.cnf special/easy.cnf","python tools/hotspot_compare.py --baseline-cli-script satsolver.py --candidate-cli-script satsolver_fast.py small/test_1.cnf small/test_10.cnf medium/test_3.cnf medium/test_4.cnf large/test_6.cnf large/test_8.cnf large/test_10.cnf special/hard.cnf special/tseitin.cnf","cp satsolver_core.py scratch_satsolver_core_ternaryflag.py","cp satsolver.py scratch_satsolver_ternaryflag.py","python -m py_compile scratch_satsolver_ternaryflag.py scratch_satsolver_core_ternaryflag.py","python scratch_satsolver_ternaryflag.py small/test_1.cnf /tmp/ternaryflag_sat.txt","python tools/checker.py small/test_1.cnf /tmp/ternaryflag_sat.txt","python scratch_satsolver_ternaryflag.py special/tseitin.cnf /tmp/ternaryflag_unsat.txt","python tools/checker.py special/tseitin.cnf /tmp/ternaryflag_unsat.txt --bruteforce-var-limit 0","python tools/hotspot_compare.py --baseline-cli-script satsolver.py --candidate-cli-script scratch_satsolver_ternaryflag.py small/test_1.cnf small/test_10.cnf medium/test_3.cnf medium/test_4.cnf large/test_6.cnf large/test_8.cnf large/test_10.cnf special/hard.cnf special/tseitin.cnf","python tools/hotspot_compare.py --baseline-cli-script satsolver.py --candidate-cli-script scratch_satsolver_ternaryflag.py --repeat 2 small/test_1.cnf small/test_5.cnf small/test_6.cnf small/test_9.cnf medium/test_8.cnf medium/test_9.cnf large/test_1.cnf large/test_2.cnf large/test_5.cnf large/test_7.cnf large/test_9.cnf special/easy.cnf","python benchmark_suite.py satsolver /tmp/ternaryflag_baseline_cli_repeat2.txt small medium large special satlib_subset satlib_more --bruteforce-var-limit 16 --cli-script satsolver.py --repeat 2","python benchmark_suite.py scratch_satsolver_ternaryflag /tmp/ternaryflag_candidate_cli_repeat2.txt small medium large special satlib_subset satlib_more --bruteforce-var-limit 16 --cli-script scratch_satsolver_ternaryflag.py --repeat 2","python -m py_compile satsolver.py satsolver_core.py satsolver_fast.py tests/test_solver_regressions.py","python -m unittest discover -s tests -v","python satsolver.py small/test_1.cnf /tmp/corekeep_sat.txt","python tools/checker.py small/test_1.cnf /tmp/corekeep_sat.txt","python satsolver.py special/tseitin.cnf /tmp/corekeep_unsat.txt","python tools/checker.py special/tseitin.cnf /tmp/corekeep_unsat.txt --bruteforce-var-limit 0","python benchmark_suite.py satsolver out_cli_extended.txt small medium large special satlib_subset satlib_more --bruteforce-var-limit 16 --cli-script satsolver.py --repeat 2"],"metrics_before":{"unit_test_count":48,"mixed_slice_two_order_avg_baseline_s":25.9133,"mixed_slice_forward_baseline_s":25.5562,"mixed_slice_reverse_baseline_s":26.2705,"root_hit_two_order_avg_baseline_s":0.3694,"full_exact_cli_repeat2_baseline_s":29.1167,"full_exact_cli_repeat2_measured_baseline_s":58.2334},"metrics_after":{"unit_test_count":49,"mixed_slice_two_order_avg_candidate_s":25.0078,"mixed_slice_forward_candidate_s":25.4490,"mixed_slice_reverse_candidate_s":24.5666,"root_hit_two_order_avg_candidate_s":0.3722,"full_exact_cli_repeat2_candidate_s":28.3019,"full_exact_cli_repeat2_measured_candidate_s":56.6037,"retained_artifact_exact_cli_repeat2_s":27.8701,"retained_artifact_exact_cli_repeat2_measured_s":55.7401},"correctness_status":"the scratch candidate and the merged retained solver both stayed checker-valid on SAT and UNSAT smoke cases, passed the full regression suite after merge, and solved 59/59 correctly on the repeat-aware exact-CLI full-suite comparisons","decision":"keep","notes":"This is a core-side keep, not a startup-path keep. The SAT-heavy root-hit slice was slightly worse, but the mixed hotspot slice and same-day repeat-aware exact-CLI full-suite A/B were strong enough to justify merging the change. The result reopens only a narrow metadata-cache lane: immutable clause-family flags can help, while earlier `Clause.size` and broader mutable side-state still remain dead ends."}
{"timestamp":"2026-03-21T04:08:44+01:00","experiment_id":"2026-03-21-reject-minimize-learnt-ternary-flag","hypothesis":"Because ternary reasons still dominate conflict analysis on the hard UNSAT cases and the new cached `Clause.ternary` flag already paid off in `propagate()`, reusing that immutable shape flag inside `minimize_learnt()` may remove enough repeated `len(reason_lits)` work to improve the exact-CLI solver path without changing semantics.","change_summary":"Created scratch candidates `scratch_satsolver_core_minreasonternary.py` and `scratch_satsolver_minreasonternary.py`, changed `minimize_learnt()` to read `reason_clause.ternary` instead of computing ternary shape from `len(reason_lits)`, validated SAT and UNSAT smoke cases, benchmarked the scratch candidate against retained `satsolver.py` on the mixed nine-case exact-CLI hotspot slice, the 12-case SAT-heavy root-hit slice, and a same-day repeat-aware exact-CLI 59-case baseline-vs-candidate comparison, then deleted the scratch files after the full-suite gate regressed.","files_changed":["agent_log.md","benchmark_summary.md","experiments.jsonl","next_steps.md"],"datasets":["small/test_1.cnf","special/tseitin.cnf","small/test_5.cnf","small/test_6.cnf","small/test_9.cnf","medium/test_8.cnf","medium/test_9.cnf","large/test_1.cnf","large/test_2.cnf","large/test_5.cnf","large/test_7.cnf","large/test_9.cnf","special/easy.cnf","small/test_10.cnf","medium/test_3.cnf","medium/test_4.cnf","large/test_6.cnf","large/test_8.cnf","large/test_10.cnf","special/hard.cnf","small","medium","large","special","satlib_subset","satlib_more"],"commands":["python -m cProfile -s tottime satsolver.py large/test_6.cnf /tmp/current_main_profile_after_ternaryflag.txt","python tools/hotspot_compare.py --baseline-cli-script satsolver.py --candidate-cli-script satsolver_fast.py --repeat 2 small/test_1.cnf small/test_5.cnf small/test_6.cnf small/test_9.cnf medium/test_8.cnf medium/test_9.cnf large/test_1.cnf large/test_2.cnf large/test_5.cnf large/test_7.cnf large/test_9.cnf special/easy.cnf","python tools/hotspot_compare.py --baseline-cli-script satsolver.py --candidate-cli-script satsolver_fast.py small/test_1.cnf small/test_10.cnf medium/test_3.cnf medium/test_4.cnf large/test_6.cnf large/test_8.cnf large/test_10.cnf special/hard.cnf special/tseitin.cnf","cp satsolver_core.py scratch_satsolver_core_minreasonternary.py","cp satsolver.py scratch_satsolver_minreasonternary.py","python -m py_compile scratch_satsolver_minreasonternary.py scratch_satsolver_core_minreasonternary.py","python scratch_satsolver_minreasonternary.py small/test_1.cnf /tmp/minreasonternary_sat.txt","python tools/checker.py small/test_1.cnf /tmp/minreasonternary_sat.txt","python scratch_satsolver_minreasonternary.py special/tseitin.cnf /tmp/minreasonternary_unsat.txt","python tools/checker.py special/tseitin.cnf /tmp/minreasonternary_unsat.txt --bruteforce-var-limit 0","python tools/hotspot_compare.py --baseline-cli-script satsolver.py --candidate-cli-script scratch_satsolver_minreasonternary.py small/test_1.cnf small/test_10.cnf medium/test_3.cnf medium/test_4.cnf large/test_6.cnf large/test_8.cnf large/test_10.cnf special/hard.cnf special/tseitin.cnf","python tools/hotspot_compare.py --baseline-cli-script satsolver.py --candidate-cli-script scratch_satsolver_minreasonternary.py --repeat 2 small/test_1.cnf small/test_5.cnf small/test_6.cnf small/test_9.cnf medium/test_8.cnf medium/test_9.cnf large/test_1.cnf large/test_2.cnf large/test_5.cnf large/test_7.cnf large/test_9.cnf special/easy.cnf","python benchmark_suite.py satsolver /tmp/minreasonternary_baseline_cli_repeat2.txt small medium large special satlib_subset satlib_more --bruteforce-var-limit 16 --cli-script satsolver.py --repeat 2","python benchmark_suite.py scratch_satsolver_minreasonternary /tmp/minreasonternary_candidate_cli_repeat2.txt small medium large special satlib_subset satlib_more --bruteforce-var-limit 16 --cli-script scratch_satsolver_minreasonternary.py --repeat 2"],"metrics_before":{"mixed_slice_two_order_avg_baseline_s":24.7815,"mixed_slice_forward_baseline_s":26.1039,"mixed_slice_reverse_baseline_s":23.4591,"root_hit_two_order_avg_baseline_s":0.3652,"full_exact_cli_repeat2_baseline_s":26.5996,"full_exact_cli_repeat2_measured_baseline_s":53.1992},"metrics_after":{"mixed_slice_two_order_avg_candidate_s":23.3213,"mixed_slice_forward_candidate_s":23.5085,"mixed_slice_reverse_candidate_s":23.1341,"root_hit_two_order_avg_candidate_s":0.3889,"full_exact_cli_repeat2_candidate_s":27.9836,"full_exact_cli_repeat2_measured_candidate_s":55.9673,"large_test_6_repeat2_baseline_s":11.5792,"large_test_6_repeat2_candidate_s":13.0787,"large_test_8_repeat2_baseline_s":0.2730,"large_test_8_repeat2_candidate_s":0.2651,"special_hard_repeat2_baseline_s":7.8688,"special_hard_repeat2_candidate_s":7.8196},"correctness_status":"the scratch candidate stayed checker-valid on SAT and UNSAT smoke cases and solved 59/59 correctly on the repeat-aware exact-CLI full-suite comparison, but it was deleted after the broader suite regressed","decision":"discard","notes":"This is a hotspot-overfit reject: the mixed nine-case exact-CLI slice looked strong, but the SAT-heavy root-hit slice and the repeat-aware exact-CLI 59-case suite both moved the wrong way, with most of the full-suite damage coming from `large/test_6.cnf`."}
{"timestamp":"2026-03-21T04:16:18+01:00","experiment_id":"2026-03-21-reject-minimize-learnt-reason4-fast-path","hypothesis":"Because `minimize_learnt()` already benefits from dedicated binary and ternary one-hop reason handling and `4..9` is the next nontrivial reason bucket, adding a fixed exact-4-literal fast path may cut conflict-analysis loop overhead without changing solver semantics.","change_summary":"Created scratch candidates `scratch_satsolver_core_reason4.py` and `scratch_satsolver_reason4.py`, added a dedicated exact 4-literal reason branch to `minimize_learnt()`, validated SAT and UNSAT smoke cases, benchmarked the scratch candidate against retained `satsolver.py` on the mixed nine-case exact-CLI hotspot slice, and deleted the scratch files after the candidate lost the first gate.","files_changed":["agent_log.md","benchmark_summary.md","experiments.jsonl","next_steps.md"],"datasets":["small/test_1.cnf","special/tseitin.cnf","small/test_10.cnf","medium/test_3.cnf","medium/test_4.cnf","large/test_6.cnf","large/test_8.cnf","large/test_10.cnf","special/hard.cnf"],"commands":["python -m cProfile -s tottime satsolver.py large/test_6.cnf /tmp/current_cycle_profile_large6.txt","cp satsolver_core.py scratch_satsolver_core_reason4.py","cp satsolver.py scratch_satsolver_reason4.py","python -m py_compile scratch_satsolver_reason4.py scratch_satsolver_core_reason4.py","python scratch_satsolver_reason4.py small/test_1.cnf /tmp/reason4_sat.txt","python tools/checker.py small/test_1.cnf /tmp/reason4_sat.txt","python scratch_satsolver_reason4.py special/tseitin.cnf /tmp/reason4_unsat.txt","python tools/checker.py special/tseitin.cnf /tmp/reason4_unsat.txt --bruteforce-var-limit 0","python tools/hotspot_compare.py --baseline-cli-script satsolver.py --candidate-cli-script scratch_satsolver_reason4.py small/test_1.cnf small/test_10.cnf medium/test_3.cnf medium/test_4.cnf large/test_6.cnf large/test_8.cnf large/test_10.cnf special/hard.cnf special/tseitin.cnf"],"metrics_before":{"mixed_slice_two_order_avg_baseline_s":23.9068,"mixed_slice_forward_baseline_s":24.1870,"mixed_slice_reverse_baseline_s":23.6266},"metrics_after":{"mixed_slice_two_order_avg_candidate_s":24.9093,"mixed_slice_forward_candidate_s":26.1316,"mixed_slice_reverse_candidate_s":23.6870,"large_test_6_forward_baseline_s":11.7708,"large_test_6_forward_candidate_s":11.5467,"special_hard_forward_baseline_s":8.1569,"special_hard_forward_candidate_s":10.1933},"correctness_status":"the scratch candidate compiled cleanly, stayed checker-valid on SAT and UNSAT smoke cases, and was deleted after the mixed exact-CLI hotspot gate regressed","decision":"discard","notes":"This is a clean hotspot-gate reject. The exact 4-literal fast path helped `large/test_6.cnf` a little, but `special/hard.cnf` regressed too much and the overall two-order mixed exact-CLI slice moved the wrong way."}
{"timestamp":"2026-03-21T04:24:41+01:00","experiment_id":"2026-03-21-reject-later-reduce-database-schedule","hypothesis":"Because `reduce_database()` itself is not a large direct hotspot and the earlier-schedule experiment already showed that aggressive reduction hurts search quality, raising the post-reduction `next_reduce` growth factor from `1.5` to `1.75` may preserve more useful learnt clauses on the dense UNSAT-heavy exact-CLI cases without changing the rest of the solver.","change_summary":"Created scratch candidates `scratch_satsolver_core_laterreduce.py` and `scratch_satsolver_laterreduce.py`, changed only the post-reduction `next_reduce` multiplier from `1.5` to `1.75`, validated SAT and UNSAT smoke cases, benchmarked the scratch candidate against retained `satsolver.py` on the mixed nine-case exact-CLI hotspot slice, and deleted the scratch files after the candidate failed the first gate.","files_changed":["agent_log.md","benchmark_summary.md","experiments.jsonl","next_steps.md"],"datasets":["small/test_1.cnf","special/tseitin.cnf","small/test_10.cnf","medium/test_3.cnf","medium/test_4.cnf","large/test_6.cnf","large/test_8.cnf","large/test_10.cnf","special/hard.cnf"],"commands":["python -m cProfile -s tottime satsolver.py special/hard.cnf /tmp/current_cycle_profile_hard.txt","cp satsolver_core.py scratch_satsolver_core_laterreduce.py","cp satsolver.py scratch_satsolver_laterreduce.py","python -m py_compile scratch_satsolver_laterreduce.py scratch_satsolver_core_laterreduce.py","python scratch_satsolver_laterreduce.py small/test_1.cnf /tmp/laterreduce_sat.txt","python tools/checker.py small/test_1.cnf /tmp/laterreduce_sat.txt","python scratch_satsolver_laterreduce.py special/tseitin.cnf /tmp/laterreduce_unsat.txt","python tools/checker.py special/tseitin.cnf /tmp/laterreduce_unsat.txt --bruteforce-var-limit 0","python tools/hotspot_compare.py --baseline-cli-script satsolver.py --candidate-cli-script scratch_satsolver_laterreduce.py small/test_1.cnf small/test_10.cnf medium/test_3.cnf medium/test_4.cnf large/test_6.cnf large/test_8.cnf large/test_10.cnf special/hard.cnf special/tseitin.cnf"],"metrics_before":{"mixed_slice_two_order_avg_baseline_s":23.5526,"mixed_slice_forward_baseline_s":23.7552,"mixed_slice_reverse_baseline_s":23.3501},"metrics_after":{"mixed_slice_two_order_avg_candidate_s":33.5169,"mixed_slice_forward_candidate_s":35.0503,"mixed_slice_reverse_candidate_s":31.9834,"large_test_8_forward_baseline_s":0.2912,"large_test_8_forward_candidate_s":6.6520,"large_test_8_reverse_baseline_s":0.2766,"large_test_8_reverse_candidate_s":6.4384,"large_test_6_forward_baseline_s":11.5209,"large_test_6_forward_candidate_s":15.2828,"large_test_6_reverse_baseline_s":11.3521,"large_test_6_reverse_candidate_s":15.4253,"special_hard_forward_baseline_s":7.9597,"special_hard_forward_candidate_s":8.9276,"special_hard_reverse_baseline_s":7.8335,"special_hard_reverse_candidate_s":6.0730},"correctness_status":"the scratch candidate compiled cleanly, stayed checker-valid on SAT and UNSAT smoke cases, and was deleted after the mixed exact-CLI hotspot gate regressed badly","decision":"discard","notes":"This is a strong hotspot-gate reject. The schedule-only branch made `large/test_8.cnf` catastrophically slower in both orders and also worsened `large/test_6.cnf` heavily, so “reduce later” joins “reduce earlier” as another unsafe learnt-database schedule tweak without a better classifier."}
