{"timestamp":"2026-03-21T14:55:03+01:00","experiment_id":"2026-03-21-reject-ternary-true-candidate-hold","hypothesis":"Because only about 13.5%..17.2% of ternary relocations go to already-`TRUE` candidate literals, leaving those clauses satisfied in place instead of relocating the false watch might cut watcher churn on a minority path without disturbing the dominant `candidate=UNASSIGNED` ternary behavior.","change_summary":"Froze a `HEAD` baseline in `/tmp/satsolver_ternarytruehold_baseline/`, temporarily patched the ternary branch in `propagate()` so `candidate_value == TRUE` kept the clause satisfied in place instead of relocating the watch, validated with `py_compile`, the full unit suite, and checker-backed SAT/UNSAT smoke checks, benchmarked baseline vs candidate on the mixed nine-case exact-CLI hotspot slice, then reverted the patch immediately after the mixed gate failed catastrophically and reran full validation on the retained baseline.","files_changed":["agent_log.md","benchmark_summary.md","experiments.jsonl","next_steps.md"],"datasets":["small/test_1.cnf","special/tseitin.cnf","medium/test_3.cnf","medium/test_4.cnf","medium/test_9.cnf","large/test_6.cnf","large/test_8.cnf","large/test_10.cnf","special/hard.cnf"],"commands":["mkdir -p /tmp/satsolver_ternarytruehold_baseline && git show HEAD:satsolver.py > /tmp/satsolver_ternarytruehold_baseline/satsolver.py && git show HEAD:satsolver_core.py > /tmp/satsolver_ternarytruehold_baseline/satsolver_core.py && git show HEAD:satsolver_fast.py > /tmp/satsolver_ternarytruehold_baseline/satsolver_fast.py","python -m py_compile satsolver.py satsolver_core.py satsolver_fast.py","python -m unittest discover -s tests -v","python satsolver.py small/test_1.cnf /tmp/ternary_true_hold_sat.txt","python tools/checker.py small/test_1.cnf /tmp/ternary_true_hold_sat.txt","python satsolver.py special/tseitin.cnf /tmp/ternary_true_hold_unsat.txt","python tools/checker.py special/tseitin.cnf /tmp/ternary_true_hold_unsat.txt --bruteforce-var-limit 0","python tools/hotspot_compare.py --baseline-cli-script /tmp/satsolver_ternarytruehold_baseline/satsolver.py --candidate-cli-script satsolver.py small/test_1.cnf special/tseitin.cnf medium/test_3.cnf medium/test_4.cnf medium/test_9.cnf large/test_6.cnf large/test_8.cnf large/test_10.cnf special/hard.cnf","python -m py_compile satsolver.py satsolver_core.py satsolver_fast.py","python -m unittest discover -s tests -v","python satsolver.py small/test_1.cnf /tmp/current_cycle_sat.txt","python tools/checker.py small/test_1.cnf /tmp/current_cycle_sat.txt","python satsolver.py special/tseitin.cnf /tmp/current_cycle_unsat.txt","python tools/checker.py special/tseitin.cnf /tmp/current_cycle_unsat.txt --bruteforce-var-limit 0"],"metrics_before":{"unit_test_count":55,"mixed_slice_two_order_avg_baseline_s":34.2608,"mixed_slice_forward_baseline_s":35.1672,"mixed_slice_reverse_baseline_s":33.3543,"large_test_6_forward_baseline_s":16.8833,"large_test_6_reverse_baseline_s":16.9439,"large_test_8_forward_baseline_s":0.3514,"large_test_8_reverse_baseline_s":0.3674,"special_hard_forward_baseline_s":11.8450,"special_hard_reverse_baseline_s":10.8565},"metrics_after":{"unit_test_count":55,"mixed_slice_two_order_avg_candidate_s":55.5632,"mixed_slice_forward_candidate_s":57.8010,"mixed_slice_reverse_candidate_s":53.3254,"large_test_6_forward_candidate_s":25.7924,"large_test_6_reverse_candidate_s":23.3024,"large_test_8_forward_candidate_s":12.0130,"large_test_8_reverse_candidate_s":11.9362,"special_hard_forward_candidate_s":14.0072,"special_hard_reverse_candidate_s":13.1154,"large_test_10_forward_candidate_s":1.8070,"large_test_10_reverse_candidate_s":1.6425},"correctness_status":"the temporary patch compiled cleanly, passed all 55 unit tests, stayed checker-valid on SAT and UNSAT smoke cases, and was reverted immediately after the mixed exact-CLI hotspot gate failed catastrophically overall","decision":"discard","notes":"This is a strong propagation reject. Even though `candidate=TRUE` ternary relocations are a minority path, leaving the false watch in place destroyed `large/test_8.cnf` and made the dense UNSAT cases much worse too."}
{"timestamp":"2026-03-21T18:05:00+01:00","experiment_id":"2026-03-21-reject-reason-sentinel-plus-else-tail","hypothesis":"Because `reason` is touched across `enqueue()`, `backtrack()`, `minimize_learnt()`, `analyze()`, and `reduce_database()`, and because the no-replacement ternary tails in `propagate()` still branch on an already-impossible `other_value == TRUE` case, combining integer-only `reason` sentinel storage with a tiny no-replacement-tail cleanup might produce a broader same-search win than recent primitive-binding rejects.","change_summary":"Collected a fresh retained-baseline `large/test_6.cnf` profile, froze a baseline in `/tmp/satsolver_reasonsentinel_baseline.nViK3a/`, patched a bundled candidate that both replaced `None` decision reasons with `NO_REASON = -1` and simplified the two no-replacement tails in `propagate()` from `if other_value == FALSE ... elif other_value == UNASSIGNED ...` to `if other_value == FALSE ... else ...`, mirrored the sentinel path in `tools/profile_solver.py`, updated the backtrack regressions temporarily, validated with `py_compile`, the full unit suite, and checker-backed SAT/UNSAT smoke checks, benchmarked baseline vs candidate on the mixed nine-case exact-CLI hotspot slice, then ran same-day repeat-aware exact-CLI 35-case suites for both before reverting the bundled branch and restoring the retained solver/artifact files after the broader suite regressed.","files_changed":["agent_log.md","benchmark_summary.md","experiments.jsonl","next_steps.md","out_cli_extended.txt","satsolver.py","satsolver_core.py","satsolver_fast.py","tests/test_solver_regressions.py","tools/profile_solver.py"],"datasets":["large/test_6.cnf","small/test_1.cnf","special/tseitin.cnf","medium/test_4.cnf","medium/test_8.cnf","small/test_5.cnf","large/test_8.cnf","large/test_10.cnf","special/hard.cnf","small","medium","large","special"],"commands":["python -m cProfile -s tottime satsolver.py large/test_6.cnf /tmp/codex_cycle_profile.txt | head -n 35","baseline_dir=$(mktemp -d /tmp/satsolver_reasonsentinel_baseline.XXXXXX) && cp satsolver.py satsolver_core.py satsolver_fast.py \"$baseline_dir\" && printf '%s\\n' \"$baseline_dir\"","python -m py_compile satsolver.py satsolver_core.py satsolver_fast.py tools/profile_solver.py tests/test_solver_regressions.py tests/test_profile_solver.py","python -m unittest discover -s tests -v","python satsolver.py small/test_1.cnf /tmp/reasonsentinel_sat.txt && python tools/checker.py small/test_1.cnf /tmp/reasonsentinel_sat.txt","python satsolver.py special/tseitin.cnf /tmp/reasonsentinel_unsat.txt && python tools/checker.py special/tseitin.cnf /tmp/reasonsentinel_unsat.txt --bruteforce-var-limit 0","python tools/hotspot_compare.py --baseline-cli-script /tmp/satsolver_reasonsentinel_baseline.nViK3a/satsolver.py --candidate-cli-script satsolver.py large/test_6.cnf special/hard.cnf medium/test_4.cnf large/test_10.cnf large/test_8.cnf small/test_1.cnf small/test_5.cnf medium/test_8.cnf special/tseitin.cnf","python benchmark_suite.py satsolver /tmp/elseunit_baseline_cli_repeat2.txt small medium large special --bruteforce-var-limit 16 --cli-script /tmp/satsolver_reasonsentinel_baseline.nViK3a/satsolver.py --repeat 2","python benchmark_suite.py satsolver /tmp/elseunit_candidate_cli_repeat2.txt small medium large special --bruteforce-var-limit 16 --cli-script satsolver.py --repeat 2","python -m py_compile satsolver.py satsolver_core.py satsolver_fast.py tools/profile_solver.py tests/test_solver_regressions.py tests/test_profile_solver.py","python -m unittest discover -s tests -v","python satsolver.py small/test_1.cnf /tmp/revert_cycle_sat.txt && python tools/checker.py small/test_1.cnf /tmp/revert_cycle_sat.txt","python satsolver.py special/tseitin.cnf /tmp/revert_cycle_unsat.txt && python tools/checker.py special/tseitin.cnf /tmp/revert_cycle_unsat.txt --bruteforce-var-limit 0"],"metrics_before":{"unit_test_count":55,"large_test_6_profile_total_s":29.479,"large_test_6_profile_propagate_tottime_s":16.097,"large_test_6_profile_analyze_tottime_s":2.804,"large_test_6_profile_pick_branch_literal_tottime_s":1.373,"large_test_6_profile_minimize_learnt_tottime_s":0.864,"large_test_6_profile_backtrack_tottime_s":0.826,"mixed_slice_two_order_avg_baseline_s":38.0602,"mixed_slice_forward_baseline_s":39.6473,"mixed_slice_reverse_baseline_s":36.4732,"suite35_repeat2_baseline_s":40.3613,"suite35_large_test_6_baseline_s":18.3887,"suite35_special_hard_baseline_s":13.6687,"suite35_large_test_10_baseline_s":2.1764,"suite35_large_test_8_baseline_s":0.4560},"metrics_after":{"unit_test_count":55,"mixed_slice_two_order_avg_candidate_s":37.6673,"mixed_slice_forward_candidate_s":39.4773,"mixed_slice_reverse_candidate_s":35.8573,"suite35_repeat2_candidate_s":43.3099,"suite35_large_test_6_candidate_s":19.5514,"suite35_special_hard_candidate_s":14.4636,"suite35_large_test_10_candidate_s":2.7222,"suite35_large_test_8_candidate_s":0.5581},"correctness_status":"the temporary bundled patch compiled cleanly, passed all 55 unit tests, stayed checker-valid on SAT and UNSAT smoke cases, and still solved the repeat-aware exact-CLI 35-case suite correctly at 35/35, but the broader suite regressed strongly enough that the branch was reverted and the retained solver/artifact files were restored unchanged","decision":"discard","notes":"This is a bundled-branch reject, not evidence against either subchange on its own. The mixed exact-CLI hotspot slice was mildly positive, but the repeat-aware exact-CLI 35-case suite regressed badly, so future cross-cutting cleanup work should isolate these lanes one at a time and still require broad-suite confirmation."}
{"timestamp":"2026-03-21T15:27:08+01:00","experiment_id":"2026-03-21-reject-isolated-else-tail-cleanup","hypothesis":"Because the no-replacement watched-clause tails in `propagate()` already know `other_value != TRUE`, deleting the redundant `other_value == UNASSIGNED` check there might shave a small amount of hot-path overhead without changing solver behavior.","change_summary":"Collected a fresh retained-baseline `large/test_6.cnf` profile, froze a `HEAD` baseline in `/tmp/satsolver_else_tail_baseline/`, patched only the two no-replacement tails in `satsolver_core.py` so they use `if other_value == FALSE: conflict else: unit`, validated with `py_compile`, the full unit suite, and checker-backed SAT/UNSAT smoke checks, benchmarked baseline vs candidate on the mixed nine-case exact-CLI hotspot slice, then ran same-day repeat-aware exact-CLI 35-case suites for both before reverting the solver patch after the broader suite regressed and cleaning the stale scratch reason-sentinel helper files.","files_changed":["agent_log.md","benchmark_summary.md","experiments.jsonl","next_steps.md"],"datasets":["large/test_6.cnf","small/test_1.cnf","special/tseitin.cnf","medium/test_4.cnf","medium/test_8.cnf","small/test_5.cnf","large/test_8.cnf","large/test_10.cnf","special/hard.cnf","small","medium","large","special"],"commands":["python -m cProfile -s tottime satsolver.py large/test_6.cnf /tmp/cycle_profile.txt | head -n 35","mkdir -p /tmp/satsolver_else_tail_baseline && git show HEAD:satsolver.py > /tmp/satsolver_else_tail_baseline/satsolver.py && git show HEAD:satsolver_core.py > /tmp/satsolver_else_tail_baseline/satsolver_core.py && git show HEAD:satsolver_fast.py > /tmp/satsolver_else_tail_baseline/satsolver_fast.py","python -m py_compile satsolver.py satsolver_core.py satsolver_fast.py","python -m unittest discover -s tests -v","python satsolver.py small/test_1.cnf /tmp/else_tail_sat.txt && python tools/checker.py small/test_1.cnf /tmp/else_tail_sat.txt","python satsolver.py special/tseitin.cnf /tmp/else_tail_unsat.txt && python tools/checker.py special/tseitin.cnf /tmp/else_tail_unsat.txt --bruteforce-var-limit 0","python tools/hotspot_compare.py --baseline-cli-script /tmp/satsolver_else_tail_baseline/satsolver.py --candidate-cli-script satsolver.py large/test_6.cnf special/hard.cnf medium/test_4.cnf large/test_10.cnf large/test_8.cnf small/test_1.cnf small/test_5.cnf medium/test_8.cnf special/tseitin.cnf","python benchmark_suite.py satsolver /tmp/else_tail_baseline_cli_repeat2.txt small medium large special --bruteforce-var-limit 16 --cli-script /tmp/satsolver_else_tail_baseline/satsolver.py --repeat 2","python benchmark_suite.py satsolver /tmp/else_tail_candidate_cli_repeat2.txt small medium large special --bruteforce-var-limit 16 --cli-script satsolver.py --repeat 2","python -m py_compile satsolver.py satsolver_core.py satsolver_fast.py","python -m unittest discover -s tests -v","python satsolver.py small/test_1.cnf /tmp/revert_cycle_sat.txt && python tools/checker.py small/test_1.cnf /tmp/revert_cycle_sat.txt","python satsolver.py special/tseitin.cnf /tmp/revert_cycle_unsat.txt && python tools/checker.py special/tseitin.cnf /tmp/revert_cycle_unsat.txt --bruteforce-var-limit 0"],"metrics_before":{"unit_test_count":55,"large_test_6_profile_total_s":36.29,"large_test_6_profile_propagate_tottime_s":20.209,"large_test_6_profile_analyze_tottime_s":3.341,"large_test_6_profile_pick_branch_literal_tottime_s":1.66,"large_test_6_profile_minimize_learnt_tottime_s":1.044,"large_test_6_profile_backtrack_tottime_s":0.979,"mixed_slice_two_order_avg_baseline_s":32.5969,"mixed_slice_forward_baseline_s":32.5612,"mixed_slice_reverse_baseline_s":32.6325,"suite35_repeat2_baseline_s":33.6532,"suite35_large_test_6_baseline_s":15.2192,"suite35_special_hard_baseline_s":11.2203,"suite35_medium_test_4_baseline_s":2.1749,"suite35_large_test_10_baseline_s":1.9581,"suite35_large_test_8_baseline_s":0.3826},"metrics_after":{"unit_test_count":55,"mixed_slice_two_order_avg_candidate_s":31.1921,"mixed_slice_forward_candidate_s":31.6352,"mixed_slice_reverse_candidate_s":30.7490,"suite35_repeat2_candidate_s":38.5035,"suite35_large_test_6_candidate_s":17.5894,"suite35_special_hard_candidate_s":12.6692,"suite35_medium_test_4_candidate_s":2.4914,"suite35_large_test_10_candidate_s":2.3852,"suite35_large_test_8_candidate_s":0.3731},"correctness_status":"the temporary patch compiled cleanly, passed all 55 unit tests, stayed checker-valid on SAT and UNSAT smoke cases, and still solved the repeat-aware exact-CLI 35-case suite correctly at 35/35, but the broader suite regressed badly enough that the solver patch was reverted and the retained baseline was restored unchanged","decision":"discard","notes":"This is a clean isolated reject. The mixed exact-CLI hotspot slice looked genuinely strong, but the repeat-aware exact-CLI 35-case suite regressed hard enough that the branch still does not clear the bar."}
{"timestamp":"2026-03-21T15:32:37+01:00","experiment_id":"2026-03-21-reject-rerun-isolated-else-tail-cleanup","hypothesis":"Because the two no-replacement tails in `propagate()` already know `other_value != TRUE`, rerunning the isolated `if other_value == FALSE ... else ...` simplification on the current retained baseline would tell us whether the earlier strong hotspot win was a transient measurement fluke or a repeatable but still broad-suite-negative lane.","change_summary":"Collected a fresh retained-baseline `large/test_6.cnf` profile, reread the current backlog and metadata warnings, temporarily re-applied only the two no-replacement-tail `else` simplifications in `satsolver_core.py`, validated with `py_compile`, the full unit suite, and checker-backed SAT/UNSAT smoke checks, benchmarked the frozen `HEAD` baseline vs candidate on the mixed nine-case exact-CLI hotspot slice, ran repeat-aware exact-CLI 35-case suites for both, then reverted the solver patch and cleaned the stale untracked scratch reason-sentinel helper files after the broader suite regressed again.","files_changed":["agent_log.md","benchmark_summary.md","experiments.jsonl","next_steps.md"],"datasets":["large/test_6.cnf","small/test_1.cnf","special/tseitin.cnf","medium/test_4.cnf","medium/test_8.cnf","small/test_5.cnf","large/test_8.cnf","large/test_10.cnf","special/hard.cnf","small","medium","large","special"],"commands":["python -m cProfile -s tottime satsolver.py large/test_6.cnf /tmp/current_cycle_profile2.txt | head -n 35","python -m py_compile satsolver.py satsolver_core.py satsolver_fast.py","python -m unittest discover -s tests -v","python satsolver.py small/test_1.cnf /tmp/else_tail_sat.txt && python tools/checker.py small/test_1.cnf /tmp/else_tail_sat.txt","python satsolver.py special/tseitin.cnf /tmp/else_tail_unsat.txt && python tools/checker.py special/tseitin.cnf /tmp/else_tail_unsat.txt --bruteforce-var-limit 0","python tools/hotspot_compare.py --baseline-cli-script /tmp/satsolver_else_tail_baseline/satsolver.py --candidate-cli-script satsolver.py large/test_6.cnf special/hard.cnf medium/test_4.cnf large/test_10.cnf large/test_8.cnf small/test_1.cnf small/test_5.cnf medium/test_8.cnf special/tseitin.cnf","python benchmark_suite.py satsolver /tmp/else_tail_baseline_cli_repeat2.txt small medium large special --bruteforce-var-limit 16 --cli-script /tmp/satsolver_else_tail_baseline/satsolver.py --repeat 2","python benchmark_suite.py satsolver /tmp/else_tail_candidate_cli_repeat2.txt small medium large special --bruteforce-var-limit 16 --cli-script satsolver.py --repeat 2","python -m py_compile satsolver.py satsolver_core.py satsolver_fast.py","python -m unittest discover -s tests -v","python satsolver.py small/test_1.cnf /tmp/revert_cycle_sat2.txt && python tools/checker.py small/test_1.cnf /tmp/revert_cycle_sat2.txt","python satsolver.py special/tseitin.cnf /tmp/revert_cycle_unsat2.txt && python tools/checker.py special/tseitin.cnf /tmp/revert_cycle_unsat2.txt --bruteforce-var-limit 0"],"metrics_before":{"unit_test_count":55,"large_test_6_profile_total_s":36.424,"large_test_6_profile_propagate_tottime_s":20.33,"large_test_6_profile_analyze_tottime_s":3.348,"large_test_6_profile_pick_branch_literal_tottime_s":1.658,"large_test_6_profile_minimize_learnt_tottime_s":1.034,"large_test_6_profile_backtrack_tottime_s":0.988,"mixed_slice_two_order_avg_baseline_s":32.5969,"mixed_slice_forward_baseline_s":32.5612,"mixed_slice_reverse_baseline_s":32.6325,"suite35_repeat2_baseline_s":33.6532,"suite35_large_test_6_baseline_s":15.2192,"suite35_special_hard_baseline_s":11.2203,"suite35_medium_test_4_baseline_s":2.1749,"suite35_large_test_10_baseline_s":1.9581,"suite35_large_test_8_baseline_s":0.3826},"metrics_after":{"unit_test_count":55,"mixed_slice_two_order_avg_candidate_s":31.1921,"mixed_slice_forward_candidate_s":31.6352,"mixed_slice_reverse_candidate_s":30.7490,"suite35_repeat2_candidate_s":38.5035,"suite35_large_test_6_candidate_s":17.5894,"suite35_special_hard_candidate_s":12.6692,"suite35_medium_test_4_candidate_s":2.4914,"suite35_large_test_10_candidate_s":2.3852,"suite35_large_test_8_candidate_s":0.3731},"correctness_status":"the rerun patch compiled cleanly, passed all 55 unit tests, stayed checker-valid on SAT and UNSAT smoke cases, and still solved the repeat-aware exact-CLI 35-case suite correctly at 35/35, but the broader suite regressed again, so the solver patch was reverted and the retained baseline restored unchanged","decision":"discard","notes":"This rerun reproduced the earlier shape almost exactly: a convincing mixed exact-CLI hotspot win that still fails the repeat-aware exact-CLI 35-case suite badly. So the lane is now best treated as actively misleading rather than merely inconclusive."}
