{"timestamp":"2026-03-21T00:36:06+01:00","experiment_id":"2026-03-21-reject-satsolver-fast-lazy-structural-wrapper","hypothesis":"Because the retained `satsolver_fast.py` imports the full main solver immediately, a smaller alternate file that duplicates only parsing/output/structural presolvers and lazy-imports `satsolver` only for non-structural cases might cut exact-CLI startup enough to beat the current alternate baseline.","change_summary":"Created scratch candidate `scratch_satsolver_fast_lazy.py` with local `parse_dimacs`, `parse_dimacs_file`, `has_pigeonhole_core`, `xor_system_unsat`, `model_satisfies`, `format_model`, and `write_result`, then lazy-imported `satsolver` only when the structural presolvers did not solve the instance. Validated SAT and UNSAT smoke cases, measured structural-hit, SAT-heavy root-hit, and mixed exact-CLI hotspot slices, ran same-day exact-CLI full-suite single runs for the retained alternate and the scratch candidate, then ran a repeat-aware exact-CLI 59-case suite for the scratch candidate and deleted the scratch file after it regressed on the real gate.","files_changed":["agent_log.md","experiments.jsonl","benchmark_summary.md","next_steps.md"],"datasets":["small/test_1.cnf","special/tseitin.cnf","special/pigeonhole.cnf","satlib_subset/dubois20.cnf","satlib_subset/dubois21.cnf","satlib_subset/hole8.cnf","satlib_subset/hole10.cnf","small/test_5.cnf","small/test_6.cnf","small/test_9.cnf","medium/test_8.cnf","medium/test_9.cnf","large/test_1.cnf","large/test_2.cnf","large/test_5.cnf","large/test_7.cnf","large/test_9.cnf","special/easy.cnf","small/test_10.cnf","medium/test_3.cnf","medium/test_4.cnf","large/test_6.cnf","large/test_8.cnf","large/test_10.cnf","special/hard.cnf","small","medium","large","special","satlib_subset","satlib_more"],"commands":["python -m py_compile scratch_satsolver_fast_lazy.py","python scratch_satsolver_fast_lazy.py small/test_1.cnf /tmp/scratch_fast_lazy_sat.txt","python tools/checker.py small/test_1.cnf /tmp/scratch_fast_lazy_sat.txt","python scratch_satsolver_fast_lazy.py special/tseitin.cnf /tmp/scratch_fast_lazy_unsat.txt","python tools/checker.py special/tseitin.cnf /tmp/scratch_fast_lazy_unsat.txt --bruteforce-var-limit 0","python tools/hotspot_compare.py --baseline-cli-script satsolver_fast.py --candidate-cli-script scratch_satsolver_fast_lazy.py special/pigeonhole.cnf special/tseitin.cnf satlib_subset/dubois20.cnf satlib_subset/dubois21.cnf satlib_subset/hole8.cnf satlib_subset/hole10.cnf","python tools/hotspot_compare.py --baseline-cli-script satsolver_fast.py --candidate-cli-script scratch_satsolver_fast_lazy.py small/test_1.cnf small/test_5.cnf small/test_6.cnf small/test_9.cnf medium/test_8.cnf medium/test_9.cnf large/test_1.cnf large/test_2.cnf large/test_5.cnf large/test_7.cnf large/test_9.cnf special/easy.cnf","python tools/hotspot_compare.py --baseline-cli-script satsolver_fast.py --candidate-cli-script scratch_satsolver_fast_lazy.py small/test_1.cnf small/test_10.cnf medium/test_3.cnf medium/test_4.cnf large/test_6.cnf large/test_8.cnf large/test_10.cnf special/hard.cnf special/tseitin.cnf","python benchmark_suite.py satsolver_fast /tmp/fast_cli_single_20260321_baseline.txt small medium large special satlib_subset satlib_more --bruteforce-var-limit 16 --cli-script satsolver_fast.py","python benchmark_suite.py scratch_satsolver_fast_lazy /tmp/fast_cli_single_20260321_lazy.txt small medium large special satlib_subset satlib_more --bruteforce-var-limit 16 --cli-script scratch_satsolver_fast_lazy.py","python benchmark_suite.py scratch_satsolver_fast_lazy /tmp/fast_cli_repeat2_20260321_lazy.txt small medium large special satlib_subset satlib_more --bruteforce-var-limit 16 --cli-script scratch_satsolver_fast_lazy.py --repeat 2","python -m unittest discover -s tests -v"],"metrics_before":{"retained_fast_cli_repeat2_s":27.3829,"unit_test_count":43,"structural_hit_slice_two_order_avg_baseline_s":0.1811,"root_hit_slice_two_order_avg_baseline_s":0.4499,"mixed_slice_two_order_avg_baseline_s":24.7933,"same_day_full_exact_cli_single_baseline_s":27.1851},"metrics_after":{"unit_test_count":43,"structural_hit_slice_two_order_avg_candidate_s":0.1780,"root_hit_slice_two_order_avg_candidate_s":0.4677,"mixed_slice_two_order_avg_candidate_s":24.7768,"same_day_full_exact_cli_single_candidate_s":26.9872,"candidate_full_exact_cli_repeat2_s":27.5546,"candidate_full_exact_cli_repeat2_measured_s":55.1091,"candidate_full_exact_cli_repeat2_wall_clock_s":55.3400,"candidate_full_exact_cli_repeat2_solved_correctly":59},"correctness_status":"the temporary lazy-import alternate produced checker-valid SAT and UNSAT smoke outputs, solved the repeat-aware exact-CLI 59-case suite 59/59 correctly, and after deleting the scratch file the retained baseline still passed all 43 regression tests","decision":"discard","notes":"This branch is a good warning about measurement methodology. The lazy-import alternate improved the structural-hit slice and even beat the retained alternate on a same-day exact-CLI single-run full suite, but it still lost the repeat-aware exact-CLI gate (`27.3829s -> 27.5546s`). So future alternate-file work needs a stronger broad exact-CLI signal than startup-sensitive slice wins or a one-off full-suite win."}
{"timestamp":"2026-03-21T00:42:33+01:00","experiment_id":"2026-03-21-reject-satsolver-fast-lazy-core-without-structural-presolvers","hypothesis":"Because the retained `satsolver_fast.py` still imports the full main solver eagerly, a minimal alternate file that only localizes parse/output work and lazy-imports the solver core might beat it even without duplicating the structural pigeonhole/XOR presolvers.","change_summary":"Created scratch candidate `scratch_satsolver_fast_lazycore.py` with local `parse_dimacs`, `parse_dimacs_file`, `model_satisfies`, `format_model`, and `write_result`, but no local structural presolvers. It lazy-imported `satsolver` only inside `solve_cnf_serial()` / `should_use_parallel_portfolio()`. Validated SAT and UNSAT smoke cases, measured the SAT-heavy root-hit slice and the mixed nine-case exact-CLI hotspot slice, then deleted the scratch file after the hotspot gate failed catastrophically because `special/tseitin.cnf` lost the XOR fast exit.","files_changed":["agent_log.md","experiments.jsonl","benchmark_summary.md","next_steps.md"],"datasets":["small/test_1.cnf","special/tseitin.cnf","small/test_5.cnf","small/test_6.cnf","small/test_9.cnf","medium/test_8.cnf","medium/test_9.cnf","large/test_1.cnf","large/test_2.cnf","large/test_5.cnf","large/test_7.cnf","large/test_9.cnf","special/easy.cnf","small/test_10.cnf","medium/test_3.cnf","medium/test_4.cnf","large/test_6.cnf","large/test_8.cnf","large/test_10.cnf","special/hard.cnf"],"commands":["python -m py_compile scratch_satsolver_fast_lazycore.py","python scratch_satsolver_fast_lazycore.py small/test_1.cnf /tmp/scratch_fast_lazycore_sat.txt","python tools/checker.py small/test_1.cnf /tmp/scratch_fast_lazycore_sat.txt","python scratch_satsolver_fast_lazycore.py special/tseitin.cnf /tmp/scratch_fast_lazycore_unsat.txt","python tools/checker.py special/tseitin.cnf /tmp/scratch_fast_lazycore_unsat.txt --bruteforce-var-limit 0","python tools/hotspot_compare.py --baseline-cli-script satsolver_fast.py --candidate-cli-script scratch_satsolver_fast_lazycore.py small/test_1.cnf small/test_5.cnf small/test_6.cnf small/test_9.cnf medium/test_8.cnf medium/test_9.cnf large/test_1.cnf large/test_2.cnf large/test_5.cnf large/test_7.cnf large/test_9.cnf special/easy.cnf","python tools/hotspot_compare.py --baseline-cli-script satsolver_fast.py --candidate-cli-script scratch_satsolver_fast_lazycore.py small/test_1.cnf small/test_10.cnf medium/test_3.cnf medium/test_4.cnf large/test_6.cnf large/test_8.cnf large/test_10.cnf special/hard.cnf special/tseitin.cnf","python -m unittest discover -s tests -v"],"metrics_before":{"unit_test_count":43,"root_hit_slice_two_order_avg_baseline_s":0.4081,"mixed_slice_two_order_avg_baseline_s":24.3616},"metrics_after":{"unit_test_count":43,"root_hit_slice_two_order_avg_candidate_s":0.4182,"mixed_slice_two_order_avg_candidate_s":32.2099,"mixed_slice_forward_baseline_s":24.2172,"mixed_slice_forward_candidate_s":32.5370,"mixed_slice_reverse_baseline_s":24.5059,"mixed_slice_reverse_candidate_s":31.8828,"special_tseitin_forward_baseline_s":0.0298,"special_tseitin_forward_candidate_s":7.4602,"special_tseitin_reverse_baseline_s":0.0341,"special_tseitin_reverse_candidate_s":7.4312},"correctness_status":"the temporary lazy-core alternate still produced checker-valid SAT and UNSAT smoke outputs, and after deleting the scratch file the retained baseline still passed all 43 regression tests unchanged","decision":"discard","notes":"This branch failed much more strongly than the earlier lazy-import alternate because it removed the structural XOR/pigeonhole shortcuts. Even though those presolvers are cheap in aggregate, they are essential to certain exact-CLI instances; `special/tseitin.cnf` alone was enough to kill this design."}
{"timestamp":"2026-03-21T00:58:40+01:00","experiment_id":"2026-03-21-keep-satsolver-fast-bytes-parse","hypothesis":"Because exact-CLI timing still pays DIMACS parse/read overhead on every case, replacing the inherited text parser and writer inside `satsolver_fast.py` with a byte-oriented local path might produce a real same-day submission-path win without changing the underlying CDCL behavior or structural presolvers.","change_summary":"Created scratch candidate `scratch_satsolver_fast_bytesparse.py` with a byte-level `parse_dimacs[_file]()` and local byte-output writer, validated SAT and UNSAT smoke cases, compared it against the retained `satsolver_fast.py` on the exact-CLI root-hit and mixed hotspot slices plus same-day repeat-aware full exact-CLI suites, then merged the byte parser/writer into `satsolver_fast.py`, added parser regressions to `tests/test_solver_fast.py`, refreshed `out_fast_cli_extended.txt`, and deleted the scratch file.","files_changed":["satsolver_fast.py","tests/test_solver_fast.py","out_fast_cli_extended.txt","agent_log.md","experiments.jsonl","benchmark_summary.md","next_steps.md"],"datasets":["small/test_1.cnf","special/tseitin.cnf","small/test_5.cnf","small/test_6.cnf","small/test_9.cnf","medium/test_8.cnf","medium/test_9.cnf","large/test_1.cnf","large/test_2.cnf","large/test_5.cnf","large/test_7.cnf","large/test_9.cnf","special/easy.cnf","small/test_10.cnf","medium/test_3.cnf","medium/test_4.cnf","large/test_6.cnf","large/test_8.cnf","large/test_10.cnf","special/hard.cnf","small","medium","large","special","satlib_subset","satlib_more"],"commands":["python -m py_compile scratch_satsolver_fast_bytesparse.py","python scratch_satsolver_fast_bytesparse.py small/test_1.cnf /tmp/scratch_fast_bytesparse_sat.txt","python tools/checker.py small/test_1.cnf /tmp/scratch_fast_bytesparse_sat.txt","python scratch_satsolver_fast_bytesparse.py special/tseitin.cnf /tmp/scratch_fast_bytesparse_unsat.txt","python tools/checker.py special/tseitin.cnf /tmp/scratch_fast_bytesparse_unsat.txt --bruteforce-var-limit 0","python tools/hotspot_compare.py --baseline-cli-script satsolver_fast.py --candidate-cli-script scratch_satsolver_fast_bytesparse.py --repeat 2 small/test_1.cnf small/test_5.cnf small/test_6.cnf small/test_9.cnf medium/test_8.cnf medium/test_9.cnf large/test_1.cnf large/test_2.cnf large/test_5.cnf large/test_7.cnf large/test_9.cnf special/easy.cnf","python tools/hotspot_compare.py --baseline-cli-script satsolver_fast.py --candidate-cli-script scratch_satsolver_fast_bytesparse.py small/test_1.cnf small/test_10.cnf medium/test_3.cnf medium/test_4.cnf large/test_6.cnf large/test_8.cnf large/test_10.cnf special/hard.cnf special/tseitin.cnf","python benchmark_suite.py satsolver_fast /tmp/fast_cli_suite_repeat2_20260321_bytesparse_baseline.txt small medium large special satlib_subset satlib_more --bruteforce-var-limit 16 --cli-script satsolver_fast.py --repeat 2","python benchmark_suite.py scratch_satsolver_fast_bytesparse /tmp/fast_cli_suite_repeat2_20260321_bytesparse_candidate.txt small medium large special satlib_subset satlib_more --bruteforce-var-limit 16 --cli-script scratch_satsolver_fast_bytesparse.py --repeat 2","python -m py_compile satsolver_fast.py tests/test_solver_fast.py","python satsolver_fast.py small/test_1.cnf /tmp/satsolver_fast_sat.txt","python tools/checker.py small/test_1.cnf /tmp/satsolver_fast_sat.txt","python satsolver_fast.py special/tseitin.cnf /tmp/satsolver_fast_unsat.txt","python tools/checker.py special/tseitin.cnf /tmp/satsolver_fast_unsat.txt --bruteforce-var-limit 0","python -m unittest discover -s tests -v","python benchmark_suite.py satsolver_fast out_fast_cli_extended.txt small medium large special satlib_subset satlib_more --bruteforce-var-limit 16 --cli-script satsolver_fast.py --repeat 2"],"metrics_before":{"unit_test_count":43,"root_hit_slice_two_order_avg_baseline_s":0.4431,"mixed_slice_two_order_avg_baseline_s":24.6944,"same_day_fast_cli_repeat2_baseline_s":27.6459,"same_day_fast_cli_repeat2_baseline_measured_s":55.2917,"historical_fast_cli_repeat2_best_s":27.3829},"metrics_after":{"unit_test_count":47,"root_hit_slice_two_order_avg_candidate_s":0.4319,"mixed_slice_two_order_avg_candidate_s":24.6945,"same_day_fast_cli_repeat2_candidate_s":27.4523,"same_day_fast_cli_repeat2_candidate_measured_s":54.9045,"merged_artifact_fast_cli_repeat2_s":27.5074,"merged_artifact_fast_cli_repeat2_measured_s":55.0148,"merged_artifact_fast_cli_repeat2_wall_clock_s":55.2459,"merged_artifact_fast_cli_repeat2_solved_correctly":59},"correctness_status":"the scratch candidate and the merged `satsolver_fast.py` both produced checker-valid SAT and UNSAT smoke outputs, the merged file passed all 47 regression tests, and the refreshed repeat-aware exact-CLI artifact still solved 59/59 correctly","decision":"keep","notes":"This is a real same-day exact-CLI improvement to the retained alternate file, but not a new all-time record. The bytes parser/writer beat the same-day retained wrapper on the repeat-aware exact-CLI 59-case suite (`27.6459s -> 27.4523s`), yet the refreshed merged artifact landed at `27.5074s`, still above the historical best retained `satsolver_fast.py` snapshot `27.3829s`. So parser/read overhead is a real but small alternate-path lever, and future exact-CLI file work should benchmark it with same-day repeat-aware baseline-vs-candidate runs rather than assuming tiny slice wins are enough."}
{"timestamp":"2026-03-21T01:08:55+01:00","experiment_id":"2026-03-21-reject-main-satsolver-bytes-parse","hypothesis":"Because the main submission file `satsolver.py` still uses the older text parse/write path, porting the same byte-level DIMACS parser and byte-output writer that helped `satsolver_fast.py` might improve the exact-CLI runtime of the real required command without affecting solver behavior.","change_summary":"Temporarily patched `satsolver.py` to use a byte-level `parse_dimacs_file()` and byte-output `write_result()`, added a parser regression to `tests/test_validation_tools.py`, materialized the pre-change committed `satsolver.py` into `/tmp/satsolver_main_baseline_before_bytesparse.py` for exact-CLI A/B, benchmarked root-hit and mixed slices plus same-day repeat-aware full exact-CLI suites, then reverted the main-solver parse/write change after the full-suite gate regressed. The new parser regression test was kept.","files_changed":["tests/test_validation_tools.py","agent_log.md","experiments.jsonl","benchmark_summary.md","next_steps.md"],"datasets":["small/test_1.cnf","special/tseitin.cnf","small/test_5.cnf","small/test_6.cnf","small/test_9.cnf","medium/test_8.cnf","medium/test_9.cnf","large/test_1.cnf","large/test_2.cnf","large/test_5.cnf","large/test_7.cnf","large/test_9.cnf","special/easy.cnf","small/test_10.cnf","medium/test_3.cnf","medium/test_4.cnf","large/test_6.cnf","large/test_8.cnf","large/test_10.cnf","special/hard.cnf","small","medium","large","special","satlib_subset","satlib_more"],"commands":["git show HEAD:satsolver.py > /tmp/satsolver_main_baseline_before_bytesparse.py","python -m py_compile satsolver.py tests/test_validation_tools.py /tmp/satsolver_main_baseline_before_bytesparse.py","python -m unittest discover -s tests -v","python tools/hotspot_compare.py --baseline-cli-script /tmp/satsolver_main_baseline_before_bytesparse.py --candidate-cli-script satsolver.py --repeat 2 small/test_1.cnf small/test_5.cnf small/test_6.cnf small/test_9.cnf medium/test_8.cnf medium/test_9.cnf large/test_1.cnf large/test_2.cnf large/test_5.cnf large/test_7.cnf large/test_9.cnf special/easy.cnf","python tools/hotspot_compare.py --baseline-cli-script /tmp/satsolver_main_baseline_before_bytesparse.py --candidate-cli-script satsolver.py small/test_1.cnf small/test_10.cnf medium/test_3.cnf medium/test_4.cnf large/test_6.cnf large/test_8.cnf large/test_10.cnf special/hard.cnf special/tseitin.cnf","python benchmark_suite.py satsolver /tmp/satsolver_main_baseline_bytesparse_repeat2.txt small medium large special satlib_subset satlib_more --bruteforce-var-limit 16 --cli-script /tmp/satsolver_main_baseline_before_bytesparse.py --repeat 2","python benchmark_suite.py satsolver /tmp/satsolver_main_candidate_bytesparse_repeat2.txt small medium large special satlib_subset satlib_more --bruteforce-var-limit 16 --cli-script satsolver.py --repeat 2","python -m py_compile satsolver.py tests/test_validation_tools.py","python satsolver.py small/test_1.cnf /tmp/revert_cycle_sat.txt","python tools/checker.py small/test_1.cnf /tmp/revert_cycle_sat.txt","python satsolver.py special/tseitin.cnf /tmp/revert_cycle_unsat.txt","python tools/checker.py special/tseitin.cnf /tmp/revert_cycle_unsat.txt --bruteforce-var-limit 0","python -m unittest discover -s tests -v"],"metrics_before":{"unit_test_count":47,"root_hit_slice_two_order_avg_baseline_s":0.4960,"mixed_slice_two_order_avg_baseline_s":24.6647,"same_day_main_cli_repeat2_baseline_s":27.6153,"same_day_main_cli_repeat2_baseline_measured_s":55.2306},"metrics_after":{"unit_test_count":48,"root_hit_slice_two_order_avg_candidate_s":0.4718,"mixed_slice_two_order_avg_candidate_s":24.6994,"same_day_main_cli_repeat2_candidate_s":29.3807,"same_day_main_cli_repeat2_candidate_measured_s":58.7613,"same_day_main_cli_repeat2_solved_correctly":59},"correctness_status":"the temporary branch and the reverted retained main solver both produced checker-valid SAT and UNSAT smoke outputs; after the revert the repository passed all 48 regression tests","decision":"discard","notes":"This looked plausible on exact-CLI slices but failed the real gate badly. The root-hit slice improved and the mixed slice was nearly flat, yet the same-day repeat-aware exact-CLI 59-case suite regressed from `27.6153s` to `29.3807s`. So parser/read/write experimentation should stay on alternate exact-CLI files unless a future main-solver branch can clear the same-day full-suite baseline."}
