{"timestamp":"2026-03-21T05:14:03+01:00","experiment_id":"2026-03-21-keep-cli-local-wrapper-aliases","hypothesis":"Because the current main wrapper now beats `satsolver_fast.py` on the startup-heavy exact-CLI root-hit slice but still trails slightly on the mixed exact-CLI hotspot slice, binding a very small set of hot `satsolver_core` symbols to CLI-local names inside `satsolver.py` may cut enough `base.*` lookup overhead on the real solve path to improve the broad exact-CLI suite without reintroducing the old broad alias surface.","change_summary":"Compared the retained main wrapper against `satsolver_fast.py` on the root-hit and mixed exact-CLI slices, profiled the retained solver on `large/test_6.cnf`, created `scratch_satsolver_clialias.py`, added a tiny CLI-only alias set for `Solver`, `model_satisfies`, `has_pigeonhole_core`, `xor_system_unsat`, `format_model`, and `should_use_parallel_portfolio`, validated SAT and UNSAT smoke cases, benchmarked the scratch candidate against retained `satsolver.py` on the root-hit slice, mixed hotspot slice, and a same-day repeat-aware exact-CLI full-suite baseline-vs-candidate comparison, then merged the change into tracked `satsolver.py`, refreshed `out_cli_extended.txt`, and deleted the scratch file.","files_changed":["satsolver.py","out_cli_extended.txt","agent_log.md","benchmark_summary.md","experiments.jsonl","next_steps.md"],"datasets":["large/test_6.cnf","small/test_1.cnf","special/tseitin.cnf","small/test_5.cnf","small/test_6.cnf","small/test_9.cnf","medium/test_8.cnf","medium/test_9.cnf","large/test_1.cnf","large/test_2.cnf","large/test_5.cnf","large/test_7.cnf","large/test_9.cnf","special/easy.cnf","small/test_10.cnf","medium/test_3.cnf","medium/test_4.cnf","large/test_8.cnf","large/test_10.cnf","special/hard.cnf","small","medium","large","special","satlib_subset","satlib_more"],"commands":["python -m cProfile -s tottime satsolver.py large/test_6.cnf /tmp/current_cycle_large6_profile.txt","python tools/hotspot_compare.py --baseline-cli-script satsolver.py --candidate-cli-script satsolver_fast.py --repeat 2 small/test_1.cnf small/test_5.cnf small/test_6.cnf small/test_9.cnf medium/test_8.cnf medium/test_9.cnf large/test_1.cnf large/test_2.cnf large/test_5.cnf large/test_7.cnf large/test_9.cnf special/easy.cnf","python tools/hotspot_compare.py --baseline-cli-script satsolver.py --candidate-cli-script satsolver_fast.py small/test_1.cnf small/test_10.cnf medium/test_3.cnf medium/test_4.cnf large/test_6.cnf large/test_8.cnf large/test_10.cnf special/hard.cnf special/tseitin.cnf","cp satsolver.py scratch_satsolver_clialias.py","python -m py_compile scratch_satsolver_clialias.py","python scratch_satsolver_clialias.py small/test_1.cnf /tmp/clialias_sat.txt","python tools/checker.py small/test_1.cnf /tmp/clialias_sat.txt","python scratch_satsolver_clialias.py special/tseitin.cnf /tmp/clialias_unsat.txt","python tools/checker.py special/tseitin.cnf /tmp/clialias_unsat.txt --bruteforce-var-limit 0","python tools/hotspot_compare.py --baseline-cli-script satsolver.py --candidate-cli-script scratch_satsolver_clialias.py --repeat 2 small/test_1.cnf small/test_5.cnf small/test_6.cnf small/test_9.cnf medium/test_8.cnf medium/test_9.cnf large/test_1.cnf large/test_2.cnf large/test_5.cnf large/test_7.cnf large/test_9.cnf special/easy.cnf","python tools/hotspot_compare.py --baseline-cli-script satsolver.py --candidate-cli-script scratch_satsolver_clialias.py small/test_1.cnf small/test_10.cnf medium/test_3.cnf medium/test_4.cnf large/test_6.cnf large/test_8.cnf large/test_10.cnf special/hard.cnf special/tseitin.cnf","python benchmark_suite.py satsolver /tmp/clialias_baseline_cli_repeat2.txt small medium large special satlib_subset satlib_more --bruteforce-var-limit 16 --cli-script satsolver.py --repeat 2","python benchmark_suite.py scratch_satsolver_clialias /tmp/clialias_candidate_cli_repeat2.txt small medium large special satlib_subset satlib_more --bruteforce-var-limit 16 --cli-script scratch_satsolver_clialias.py --repeat 2","python -m py_compile satsolver.py satsolver_core.py satsolver_fast.py","python -m unittest discover -s tests -v","python satsolver.py small/test_1.cnf /tmp/kept_clialias_sat.txt","python tools/checker.py small/test_1.cnf /tmp/kept_clialias_sat.txt","python satsolver.py special/tseitin.cnf /tmp/kept_clialias_unsat.txt","python tools/checker.py special/tseitin.cnf /tmp/kept_clialias_unsat.txt --bruteforce-var-limit 0","python benchmark_suite.py satsolver out_cli_extended.txt small medium large special satlib_subset satlib_more --bruteforce-var-limit 16 --cli-script satsolver.py --repeat 2"],"metrics_before":{"root_hit_two_order_avg_baseline_s":0.3878,"mixed_slice_two_order_avg_baseline_s":23.4102,"full_exact_cli_repeat2_baseline_s":27.2824,"refreshed_retained_exact_cli_repeat2_previous_s":26.4762},"metrics_after":{"root_hit_two_order_avg_candidate_s":0.3997,"mixed_slice_two_order_avg_candidate_s":23.2025,"full_exact_cli_repeat2_candidate_s":27.0228,"refreshed_retained_exact_cli_repeat2_s":25.7027,"refreshed_retained_exact_cli_repeat2_measured_s":51.4054},"correctness_status":"the scratch candidate stayed checker-valid on SAT and UNSAT smoke cases, the retained repo passed all 49 tests after merge, and both the temp full-suite comparison and the refreshed retained artifact stayed 59/59 correct","decision":"keep","notes":"This is a wrapper-path keep with split slice behavior. The startup-heavy SAT slice regressed, but the mixed hotspot slice and the same-day repeat-aware exact-CLI full suite improved, and the refreshed retained artifact dropped sharply to `25.7027s`. Future wrapper work should therefore trust the broad suite over SAT-heavy startup slices when those signals disagree."}
{"timestamp":"2026-03-21T05:30:38+01:00","experiment_id":"2026-03-21-keep-density-gated-fast-root-pure","hypothesis":"Because the current benchmark corpus only shows iterative root-pure wins on low-density all-3-SAT formulas, reintroducing root-pure presolve only when all clauses are length `3` and clause density is at most `3.2` may recover the easy-case gains without reintroducing the dense pure-3-SAT overhead that broke earlier root-pure gates.","change_summary":"Scanned the current benchmark corpus for root-pure hits and density patterns, created `scratch_satsolver_densityroot.py`, added a low-density all-3-SAT gate around iterative root-pure presolve on the fast exact-CLI solve path, validated SAT and UNSAT smoke cases, benchmarked the scratch candidate against retained `satsolver.py` on the 12-case root-hit slice, the mixed nine-case exact-CLI hotspot slice, and a same-day repeat-aware exact-CLI full-suite baseline-vs-candidate comparison, then merged the gate into tracked `satsolver.py`, added a regression covering the gate, refreshed `out_cli_extended.txt`, and deleted the scratch file.","files_changed":["satsolver.py","tests/test_solver_regressions.py","out_cli_extended.txt","agent_log.md","benchmark_summary.md","experiments.jsonl","next_steps.md"],"datasets":["small/test_1.cnf","special/tseitin.cnf","small/test_5.cnf","small/test_6.cnf","small/test_9.cnf","medium/test_8.cnf","medium/test_9.cnf","large/test_1.cnf","large/test_2.cnf","large/test_5.cnf","large/test_7.cnf","large/test_9.cnf","special/easy.cnf","small/test_10.cnf","medium/test_3.cnf","medium/test_4.cnf","large/test_6.cnf","large/test_8.cnf","large/test_10.cnf","special/hard.cnf","small","medium","large","special","satlib_subset","satlib_more"],"commands":["python - <<'PY' ... corpus root-pure density scan ... PY","python -m py_compile scratch_satsolver_densityroot.py","python scratch_satsolver_densityroot.py small/test_1.cnf /tmp/densityroot_sat.txt","python tools/checker.py small/test_1.cnf /tmp/densityroot_sat.txt","python scratch_satsolver_densityroot.py special/tseitin.cnf /tmp/densityroot_unsat.txt","python tools/checker.py special/tseitin.cnf /tmp/densityroot_unsat.txt --bruteforce-var-limit 0","python tools/hotspot_compare.py --baseline-cli-script satsolver.py --candidate-cli-script scratch_satsolver_densityroot.py --repeat 2 small/test_1.cnf small/test_5.cnf small/test_6.cnf small/test_9.cnf medium/test_8.cnf medium/test_9.cnf large/test_1.cnf large/test_2.cnf large/test_5.cnf large/test_7.cnf large/test_9.cnf special/easy.cnf","python tools/hotspot_compare.py --baseline-cli-script satsolver.py --candidate-cli-script scratch_satsolver_densityroot.py small/test_1.cnf small/test_10.cnf medium/test_3.cnf medium/test_4.cnf large/test_6.cnf large/test_8.cnf large/test_10.cnf special/hard.cnf special/tseitin.cnf","python benchmark_suite.py satsolver /tmp/densityroot_baseline_cli_repeat2.txt small medium large special satlib_subset satlib_more --bruteforce-var-limit 16 --cli-script satsolver.py --repeat 2","python benchmark_suite.py satsolver /tmp/densityroot_candidate_cli_repeat2.txt small medium large special satlib_subset satlib_more --bruteforce-var-limit 16 --cli-script scratch_satsolver_densityroot.py --repeat 2","python -m py_compile satsolver.py satsolver_core.py satsolver_fast.py tests/test_solver_regressions.py scratch_satsolver_densityroot.py","python -m unittest discover -s tests -v","python satsolver.py small/test_1.cnf /tmp/kept_densityroot_sat.txt","python tools/checker.py small/test_1.cnf /tmp/kept_densityroot_sat.txt","python satsolver.py special/tseitin.cnf /tmp/kept_densityroot_unsat.txt","python tools/checker.py special/tseitin.cnf /tmp/kept_densityroot_unsat.txt --bruteforce-var-limit 0","python benchmark_suite.py satsolver out_cli_extended.txt small medium large special satlib_subset satlib_more --bruteforce-var-limit 16 --cli-script satsolver.py --repeat 2"],"metrics_before":{"root_hit_two_order_avg_baseline_s":0.3794,"mixed_slice_two_order_avg_baseline_s":23.5744,"full_exact_cli_repeat2_baseline_s":26.1422,"best_repeat_aware_exact_cli_s":25.7027},"metrics_after":{"root_hit_two_order_avg_candidate_s":0.3674,"mixed_slice_two_order_avg_candidate_s":23.0621,"full_exact_cli_repeat2_candidate_s":25.9837,"refreshed_retained_exact_cli_repeat2_s":26.1805,"refreshed_retained_exact_cli_repeat2_measured_s":52.3610},"correctness_status":"the scratch candidate stayed checker-valid on SAT and UNSAT smoke cases, the retained repo passed all 50 tests after merge, and both the temp full-suite comparison and the refreshed retained artifact stayed 59/59 correct","decision":"keep","notes":"This is a cautious exact-CLI keep. The cheap density/shape prefilter made root-pure live again on the same-day A/B gates, but the refreshed retained artifact did not beat the historical best exact-CLI snapshot. Future root-pure work should therefore trust broad same-day baseline-vs-candidate comparisons more than a single refreshed artifact when the margin is sub-percent."}
{"timestamp":"2026-03-21T10:40:18+01:00","experiment_id":"2026-03-21-reject-parse-time-all-ternary-carry-forward","hypothesis":"Because `satsolver.py` already learns whether every clause is length `3` while parsing DIMACS bytes, carrying an `all_ternary` flag forward into the low-density root-pure gate and portfolio gate may shave wrapper-side clause-shape rescans without changing solver semantics.","change_summary":"Created `scratch_satsolver_parsestats.py`, added an internal byte parser that returns `(num_vars, clauses, all_ternary)`, threaded `all_ternary` through the fast serial solve path and a scratch portfolio gate, validated SAT and UNSAT smoke cases, benchmarked the scratch candidate against retained `satsolver.py` on the 12-case SAT-heavy root-hit slice and the mixed nine-case exact-CLI hotspot slice, then deleted the scratch file after the mixed gate regressed.","files_changed":["agent_log.md","benchmark_summary.md","experiments.jsonl","next_steps.md"],"datasets":["small/test_1.cnf","special/tseitin.cnf","small/test_5.cnf","small/test_6.cnf","small/test_9.cnf","medium/test_8.cnf","medium/test_9.cnf","large/test_1.cnf","large/test_2.cnf","large/test_5.cnf","large/test_7.cnf","large/test_9.cnf","special/easy.cnf","small/test_10.cnf","medium/test_3.cnf","medium/test_4.cnf","large/test_6.cnf","large/test_8.cnf","large/test_10.cnf","special/hard.cnf"],"commands":["cp satsolver.py scratch_satsolver_parsestats.py","python -m py_compile scratch_satsolver_parsestats.py","python scratch_satsolver_parsestats.py small/test_1.cnf /tmp/parsestats_sat.txt","python tools/checker.py small/test_1.cnf /tmp/parsestats_sat.txt","python scratch_satsolver_parsestats.py special/tseitin.cnf /tmp/parsestats_unsat.txt","python tools/checker.py special/tseitin.cnf /tmp/parsestats_unsat.txt --bruteforce-var-limit 0","python tools/hotspot_compare.py --baseline-cli-script satsolver.py --candidate-cli-script scratch_satsolver_parsestats.py --repeat 2 small/test_1.cnf small/test_5.cnf small/test_6.cnf small/test_9.cnf medium/test_8.cnf medium/test_9.cnf large/test_1.cnf large/test_2.cnf large/test_5.cnf large/test_7.cnf large/test_9.cnf special/easy.cnf","python tools/hotspot_compare.py --baseline-cli-script satsolver.py --candidate-cli-script scratch_satsolver_parsestats.py small/test_1.cnf small/test_10.cnf medium/test_3.cnf medium/test_4.cnf large/test_6.cnf large/test_8.cnf large/test_10.cnf special/hard.cnf special/tseitin.cnf"],"metrics_before":{"root_hit_two_order_avg_baseline_s":0.4696,"root_hit_forward_baseline_s":0.4627,"root_hit_reverse_baseline_s":0.4765,"mixed_slice_two_order_avg_baseline_s":28.1142,"mixed_slice_forward_baseline_s":28.6650,"mixed_slice_reverse_baseline_s":27.5635},"metrics_after":{"root_hit_two_order_avg_candidate_s":0.4536,"root_hit_forward_candidate_s":0.4664,"root_hit_reverse_candidate_s":0.4409,"mixed_slice_two_order_avg_candidate_s":28.6419,"mixed_slice_forward_candidate_s":28.3190,"mixed_slice_reverse_candidate_s":28.9649,"large_test_6_forward_baseline_s":13.6206,"large_test_6_forward_candidate_s":14.0899,"large_test_6_reverse_baseline_s":13.2467,"large_test_6_reverse_candidate_s":14.9543,"large_test_8_forward_baseline_s":0.3548,"large_test_8_forward_candidate_s":0.3946,"large_test_8_reverse_baseline_s":0.3168,"large_test_8_reverse_candidate_s":0.3218},"correctness_status":"the scratch candidate compiled cleanly, stayed checker-valid on SAT and UNSAT smoke cases, and was deleted after the startup-heavy root-hit slice improved but the mixed exact-CLI hotspot gate regressed on the two-order average","decision":"discard","notes":"This is a wrapper-metadata reject. Reusing parse-time clause-shape information was not enough to generalize beyond the startup-heavy slice; the dense mixed gate still lost, mainly through stable regressions on `large/test_6.cnf`."}
{"timestamp":"2026-03-21T10:48:18+01:00","experiment_id":"2026-03-21-reject-tighten-fast-root-pure-density-gate-27","hypothesis":"Because the current kept low-density all-3-SAT root-pure gate may still admit a few marginal cases, lowering `FAST_ROOT_PURE_DENSITY_GATE` from `3.2` to `2.7` may preserve the easy root-pure wins while trimming enough front-loaded work to improve exact-CLI runtime.","change_summary":"Scanned the benchmark corpus for all-3-SAT root-pure hit densities, created `scratch_satsolver_density27.py`, changed only `FAST_ROOT_PURE_DENSITY_GATE` from `3.2` to `2.7`, validated SAT and UNSAT smoke cases, benchmarked the scratch candidate against retained `satsolver.py` on the 12-case SAT-heavy root-hit slice and the mixed nine-case exact-CLI hotspot slice, then deleted the scratch file after both gates regressed overall.","files_changed":["agent_log.md","benchmark_summary.md","experiments.jsonl","next_steps.md"],"datasets":["small/test_1.cnf","special/tseitin.cnf","small/test_5.cnf","small/test_6.cnf","small/test_9.cnf","medium/test_8.cnf","medium/test_9.cnf","large/test_1.cnf","large/test_2.cnf","large/test_5.cnf","large/test_7.cnf","large/test_9.cnf","special/easy.cnf","small/test_10.cnf","medium/test_3.cnf","medium/test_4.cnf","large/test_6.cnf","large/test_8.cnf","large/test_10.cnf","special/hard.cnf"],"commands":["python - <<'PY' ... root-pure density scan ... PY","cp satsolver.py scratch_satsolver_density27.py","python -m py_compile scratch_satsolver_density27.py","python scratch_satsolver_density27.py small/test_1.cnf /tmp/density27_sat.txt","python tools/checker.py small/test_1.cnf /tmp/density27_sat.txt","python scratch_satsolver_density27.py special/tseitin.cnf /tmp/density27_unsat.txt","python tools/checker.py special/tseitin.cnf /tmp/density27_unsat.txt --bruteforce-var-limit 0","python tools/hotspot_compare.py --baseline-cli-script satsolver.py --candidate-cli-script scratch_satsolver_density27.py --repeat 2 small/test_1.cnf small/test_5.cnf small/test_6.cnf small/test_9.cnf medium/test_8.cnf medium/test_9.cnf large/test_1.cnf large/test_2.cnf large/test_5.cnf large/test_7.cnf large/test_9.cnf special/easy.cnf","python tools/hotspot_compare.py --baseline-cli-script satsolver.py --candidate-cli-script scratch_satsolver_density27.py small/test_1.cnf small/test_10.cnf medium/test_3.cnf medium/test_4.cnf large/test_6.cnf large/test_8.cnf large/test_10.cnf special/hard.cnf special/tseitin.cnf"],"metrics_before":{"root_hit_two_order_avg_baseline_s":0.5057,"mixed_slice_two_order_avg_baseline_s":33.6012,"mixed_slice_forward_baseline_s":33.1953,"mixed_slice_reverse_baseline_s":34.0070},"metrics_after":{"root_hit_two_order_avg_candidate_s":0.5126,"mixed_slice_two_order_avg_candidate_s":34.4853,"mixed_slice_forward_candidate_s":32.3214,"mixed_slice_reverse_candidate_s":36.6491,"large_test_6_forward_baseline_s":17.0557,"large_test_6_forward_candidate_s":16.6018,"large_test_6_reverse_baseline_s":17.6161,"large_test_6_reverse_candidate_s":19.0170,"special_hard_forward_baseline_s":10.2257,"special_hard_forward_candidate_s":9.8360,"special_hard_reverse_baseline_s":10.4885,"special_hard_reverse_candidate_s":11.6226,"large_test_8_forward_baseline_s":0.3347,"large_test_8_forward_candidate_s":0.3489,"large_test_8_reverse_baseline_s":0.3696,"large_test_8_reverse_candidate_s":0.3810},"correctness_status":"the scratch candidate compiled cleanly, stayed checker-valid on SAT and UNSAT smoke cases, and was deleted after both the root-hit slice and the mixed exact-CLI two-order average regressed overall","decision":"discard","notes":"This is a root-pure-threshold reject. Tightening the density cutoff alone was too aggressive: it lost the startup-heavy root-hit slice and destabilized the mixed exact-CLI gate, especially on reverse-order `large/test_6.cnf` and `special/hard.cnf`."}
