{"timestamp":"2026-03-21T11:50:12+01:00","experiment_id":"2026-03-21-reject-phase-bias-portfolio-gate-replacement","hypothesis":"Because the current portfolio gate only fires on `large/test_8.cnf`, and the direct same-day serial `seed_phase_bias=True` solve is faster there than the forked portfolio, replacing the portfolio handoff with the phase-bias serial path may improve exact-CLI runtime overall.","change_summary":"Timed direct same-process default-serial, phase-bias-serial, and portfolio solves on `large/test_8.cnf`; created `scratch_satsolver_phasebias_gate.py`; changed only the portfolio branch in `solve_cnf()` to call `solve_cnf_fast_serial(..., seed_phase_bias=True)`; validated SAT and UNSAT smoke cases; benchmarked the scratch candidate against retained `satsolver.py` on the mixed nine-case exact-CLI hotspot slice; then ran same-day repeat-aware exact-CLI 59-case baseline-vs-candidate comparisons and deleted the scratch file after the broad suite came back slightly worse overall.","files_changed":["agent_log.md","benchmark_summary.md","experiments.jsonl","next_steps.md"],"datasets":["large/test_8.cnf","small/test_1.cnf","special/tseitin.cnf","small/test_10.cnf","medium/test_3.cnf","medium/test_4.cnf","large/test_6.cnf","large/test_10.cnf","special/hard.cnf","small","medium","large","special","satlib_subset","satlib_more"],"commands":["python - <<'PY' ... direct large/test_8 serial vs phase-bias vs portfolio timings ... PY","python -m py_compile scratch_satsolver_phasebias_gate.py","python scratch_satsolver_phasebias_gate.py small/test_1.cnf /tmp/phasegate_sat.txt","python tools/checker.py small/test_1.cnf /tmp/phasegate_sat.txt","python scratch_satsolver_phasebias_gate.py special/tseitin.cnf /tmp/phasegate_unsat.txt","python tools/checker.py special/tseitin.cnf /tmp/phasegate_unsat.txt --bruteforce-var-limit 0","python tools/hotspot_compare.py --baseline-cli-script satsolver.py --candidate-cli-script scratch_satsolver_phasebias_gate.py small/test_1.cnf small/test_10.cnf medium/test_3.cnf medium/test_4.cnf large/test_6.cnf large/test_8.cnf large/test_10.cnf special/hard.cnf special/tseitin.cnf","python benchmark_suite.py satsolver /tmp/cycle_baseline_phasebias_gate_cli_repeat2.txt small medium large special satlib_subset satlib_more --bruteforce-var-limit 16 --cli-script satsolver.py --repeat 2","python benchmark_suite.py scratch_satsolver_phasebias_gate /tmp/cycle_candidate_phasebias_gate_cli_repeat2.txt small medium large special satlib_subset satlib_more --bruteforce-var-limit 16 --cli-script scratch_satsolver_phasebias_gate.py --repeat 2"],"metrics_before":{"large_test_8_default_serial_samples_s":[4.2218,4.1424,4.0848],"large_test_8_portfolio_samples_s":[0.2800,0.2808,0.2704],"mixed_slice_two_order_avg_baseline_s":30.7417,"mixed_slice_forward_baseline_s":31.4071,"mixed_slice_reverse_baseline_s":30.0763,"full_exact_cli_repeat2_baseline_s":35.2571,"full_exact_cli_repeat2_large_test_8_s":0.3611},"metrics_after":{"large_test_8_phase_bias_serial_samples_s":[0.2122,0.2084,0.2412],"mixed_slice_two_order_avg_candidate_s":30.3299,"mixed_slice_forward_candidate_s":30.2937,"mixed_slice_reverse_candidate_s":30.3661,"large_test_8_forward_candidate_s":0.2796,"large_test_8_reverse_candidate_s":0.2967,"full_exact_cli_repeat2_candidate_s":35.2674,"full_exact_cli_repeat2_large_test_8_s":0.3217,"full_exact_cli_repeat2_large_test_6_s":15.9060,"full_exact_cli_repeat2_special_hard_s":10.2287},"correctness_status":"the scratch wrapper compiled cleanly, stayed checker-valid on SAT and UNSAT smoke cases, improved the mixed exact-CLI slice, but was deleted after the same-day repeat-aware 59-case exact-CLI suite came back slightly worse overall","decision":"discard","notes":"This is a one-case shortcut reject. The targeted replacement really did help `large/test_8.cnf`, but the win was too small to survive the broad same-day suite once the rest of the corpus and machine noise were included."}
{"timestamp":"2026-03-21T11:53:41+01:00","experiment_id":"2026-03-21-reject-skip-ternary-learnt-minimization","hypothesis":"Because `minimize_learnt()` still costs real time in the current hard-case profile and ternary learnt clauses have very little room left to shrink, skipping minimization when `len(learnt) == 3` may cut conflict-analysis overhead enough to help the mixed exact-CLI hotspot slice.","change_summary":"Created a frozen `HEAD` baseline in `/tmp/satsolver_skipternmin_baseline/`, temporarily patched `satsolver_core.py` so `minimize_learnt()` returns immediately for learnt clauses of length `3`, validated SAT and UNSAT smoke cases, benchmarked the candidate against the frozen baseline on the mixed nine-case exact-CLI hotspot slice, then reverted the patch after the mixed gate regressed.","files_changed":["agent_log.md","benchmark_summary.md","experiments.jsonl","next_steps.md"],"datasets":["small/test_1.cnf","special/tseitin.cnf","small/test_10.cnf","medium/test_3.cnf","medium/test_4.cnf","large/test_6.cnf","large/test_8.cnf","large/test_10.cnf","special/hard.cnf"],"commands":["mkdir -p /tmp/satsolver_skipternmin_baseline && git show HEAD:satsolver.py > /tmp/satsolver_skipternmin_baseline/satsolver.py && git show HEAD:satsolver_core.py > /tmp/satsolver_skipternmin_baseline/satsolver_core.py && git show HEAD:satsolver_fast.py > /tmp/satsolver_skipternmin_baseline/satsolver_fast.py","python -m py_compile satsolver.py satsolver_core.py satsolver_fast.py","python satsolver.py small/test_1.cnf /tmp/skipternmin_sat.txt","python tools/checker.py small/test_1.cnf /tmp/skipternmin_sat.txt","python satsolver.py special/tseitin.cnf /tmp/skipternmin_unsat.txt","python tools/checker.py special/tseitin.cnf /tmp/skipternmin_unsat.txt --bruteforce-var-limit 0","python tools/hotspot_compare.py --baseline-cli-script /tmp/satsolver_skipternmin_baseline/satsolver.py --candidate-cli-script satsolver.py small/test_1.cnf small/test_10.cnf medium/test_3.cnf medium/test_4.cnf large/test_6.cnf large/test_8.cnf large/test_10.cnf special/hard.cnf special/tseitin.cnf"],"metrics_before":{"mixed_slice_two_order_avg_baseline_s":30.4068,"mixed_slice_forward_baseline_s":30.3753,"mixed_slice_reverse_baseline_s":30.4383,"large_test_6_forward_baseline_s":15.1699,"large_test_6_reverse_baseline_s":15.3032,"special_hard_forward_baseline_s":9.7911,"special_hard_reverse_baseline_s":9.9774},"metrics_after":{"mixed_slice_two_order_avg_candidate_s":30.5538,"mixed_slice_forward_candidate_s":30.4375,"mixed_slice_reverse_candidate_s":30.6701,"large_test_6_forward_candidate_s":15.7710,"large_test_6_reverse_candidate_s":15.4892,"special_hard_forward_candidate_s":9.2958,"special_hard_reverse_candidate_s":9.7349,"large_test_10_forward_candidate_s":2.0165,"large_test_10_reverse_candidate_s":2.0572,"large_test_8_forward_candidate_s":0.3474,"large_test_8_reverse_candidate_s":0.3278},"correctness_status":"the temporary patch compiled cleanly, stayed checker-valid on SAT and UNSAT smoke cases, but it was reverted after the mixed exact-CLI hotspot gate regressed overall","decision":"discard","notes":"This is a conflict-analysis shortcut reject. The branch did make `special/hard.cnf` and `large/test_8.cnf` slightly better, but the dense UNSAT cases that matter most, especially `large/test_6.cnf`, moved the wrong way in both orders."}
{"timestamp":"2026-03-21T12:00:06+01:00","experiment_id":"2026-03-21-reject-watch-indexed-literal-truth-cache","hypothesis":"Because literal truth is read or written on nearly every hot-path step in `enqueue()`, `backtrack()`, and `propagate()`, storing `literal_values` in positive watch-index space instead of using signed list indexing with negative Python indices may reduce enough indexing overhead to help the mixed exact-CLI hotspot slice.","change_summary":"Created a frozen `HEAD` baseline in `/tmp/satsolver_watchvalue_baseline/`, temporarily patched `satsolver_core.py` so `literal_values` lives in watch-index space and all truth reads/writes in `literal_value()`, `enqueue()`, `backtrack()`, and `propagate()` use that mapping, validated SAT and UNSAT smoke cases, benchmarked the candidate against the frozen baseline on the mixed nine-case exact-CLI hotspot slice, then reverted the patch after the slice regressed decisively.","files_changed":["agent_log.md","benchmark_summary.md","experiments.jsonl","next_steps.md"],"datasets":["small/test_1.cnf","special/tseitin.cnf","small/test_10.cnf","medium/test_3.cnf","medium/test_4.cnf","large/test_6.cnf","large/test_8.cnf","large/test_10.cnf","special/hard.cnf"],"commands":["mkdir -p /tmp/satsolver_watchvalue_baseline && git show HEAD:satsolver.py > /tmp/satsolver_watchvalue_baseline/satsolver.py && git show HEAD:satsolver_core.py > /tmp/satsolver_watchvalue_baseline/satsolver_core.py && git show HEAD:satsolver_fast.py > /tmp/satsolver_watchvalue_baseline/satsolver_fast.py","python -m py_compile satsolver.py satsolver_core.py satsolver_fast.py","python satsolver.py small/test_1.cnf /tmp/watchvalue_sat.txt","python tools/checker.py small/test_1.cnf /tmp/watchvalue_sat.txt","python satsolver.py special/tseitin.cnf /tmp/watchvalue_unsat.txt","python tools/checker.py special/tseitin.cnf /tmp/watchvalue_unsat.txt --bruteforce-var-limit 0","python tools/hotspot_compare.py --baseline-cli-script /tmp/satsolver_watchvalue_baseline/satsolver.py --candidate-cli-script satsolver.py small/test_1.cnf small/test_10.cnf medium/test_3.cnf medium/test_4.cnf large/test_6.cnf large/test_8.cnf large/test_10.cnf special/hard.cnf special/tseitin.cnf"],"metrics_before":{"mixed_slice_two_order_avg_baseline_s":31.0231,"mixed_slice_forward_baseline_s":31.0070,"mixed_slice_reverse_baseline_s":31.0393,"large_test_6_forward_baseline_s":15.3921,"large_test_6_reverse_baseline_s":15.1555,"special_hard_forward_baseline_s":10.0445,"special_hard_reverse_baseline_s":10.2325,"large_test_10_forward_baseline_s":2.0104,"large_test_10_reverse_baseline_s":2.0675},"metrics_after":{"mixed_slice_two_order_avg_candidate_s":32.7078,"mixed_slice_forward_candidate_s":32.3361,"mixed_slice_reverse_candidate_s":33.0795,"large_test_6_forward_candidate_s":16.0680,"large_test_6_reverse_candidate_s":16.8912,"special_hard_forward_candidate_s":10.6671,"special_hard_reverse_candidate_s":10.2890,"large_test_10_forward_candidate_s":2.1026,"large_test_10_reverse_candidate_s":2.1534,"large_test_8_forward_candidate_s":0.3592,"large_test_8_reverse_candidate_s":0.3375},"correctness_status":"the temporary patch compiled cleanly, stayed checker-valid on SAT and UNSAT smoke cases, but it was reverted after the mixed exact-CLI hotspot gate regressed heavily overall","decision":"discard","notes":"This is a propagation-indexing reject. Re-encoding the literal-truth cache through positive watch indices made the same logical work slower, so the next real `propagate()` win still needs to remove more watcher traversal work rather than only change how truth values are looked up."}
{"timestamp":"2026-03-21T12:11:12+01:00","experiment_id":"2026-03-21-keep-remove-zero-activity-phase-fallback","hypothesis":"Because earlier branch-frontier profiling showed zero-activity branch choices were absent on the main hotspot cases, the zero-activity `phase_bias` fallback in `pick_branch_literal()` is likely dead or low-value overhead on the current exact-CLI path, and always using `saved_phase` may produce a small broad-suite win.","change_summary":"Reread the current prompt, speed notes, and backlog; collected a fresh `large/test_6.cnf` `cProfile` pass; rechecked direct default-vs-phase-bias-vs-portfolio timings on `large/test_8.cnf`; froze a `HEAD` baseline in `/tmp/satsolver_nozerophase_baseline/`; patched `satsolver_core.py` so `pick_branch_literal()` always uses `saved_phase[best_variable]` instead of falling back to `phase_bias` when activity is zero; validated SAT and UNSAT smoke cases; benchmarked baseline vs candidate on the mixed nine-case exact-CLI hotspot slice and on the repeat-aware exact-CLI 59-case suite; then kept the change and added a regression that locks zero-activity branch polarity to `saved_phase`.","files_changed":["agent_log.md","benchmark_summary.md","experiments.jsonl","next_steps.md","out_cli_extended.txt","satsolver_core.py","tests/test_solver_regressions.py"],"datasets":["large/test_6.cnf","large/test_8.cnf","small/test_1.cnf","small/test_5.cnf","small/test_6.cnf","small/test_9.cnf","medium/test_8.cnf","medium/test_9.cnf","large/test_1.cnf","large/test_2.cnf","large/test_5.cnf","large/test_7.cnf","large/test_9.cnf","special/easy.cnf","special/tseitin.cnf","small/test_10.cnf","medium/test_3.cnf","medium/test_4.cnf","large/test_10.cnf","special/hard.cnf","small","medium","large","special","satlib_subset","satlib_more"],"commands":["python -m cProfile -s tottime satsolver.py large/test_6.cnf /tmp/current_cycle_large6_profile.txt | head -n 35","python - <<'PY' ... direct same-process default vs phase-bias vs portfolio timings on large/test_8.cnf plus conflict counts ... PY","mkdir -p /tmp/satsolver_nozerophase_baseline && git show HEAD:satsolver.py > /tmp/satsolver_nozerophase_baseline/satsolver.py && git show HEAD:satsolver_core.py > /tmp/satsolver_nozerophase_baseline/satsolver_core.py && git show HEAD:satsolver_fast.py > /tmp/satsolver_nozerophase_baseline/satsolver_fast.py","python -m py_compile satsolver.py satsolver_core.py satsolver_fast.py","python satsolver.py small/test_1.cnf /tmp/nozerophase_sat.txt","python tools/checker.py small/test_1.cnf /tmp/nozerophase_sat.txt","python satsolver.py special/tseitin.cnf /tmp/nozerophase_unsat.txt","python tools/checker.py special/tseitin.cnf /tmp/nozerophase_unsat.txt --bruteforce-var-limit 0","python tools/hotspot_compare.py --baseline-cli-script /tmp/satsolver_nozerophase_baseline/satsolver.py --candidate-cli-script satsolver.py small/test_1.cnf small/test_10.cnf medium/test_3.cnf medium/test_4.cnf large/test_6.cnf large/test_8.cnf large/test_10.cnf special/hard.cnf special/tseitin.cnf","PYTHONPATH=/tmp/satsolver_nozerophase_baseline python benchmark_suite.py satsolver /tmp/cycle_baseline_nozerophase_cli_repeat2.txt small medium large special satlib_subset satlib_more --bruteforce-var-limit 16 --cli-script /tmp/satsolver_nozerophase_baseline/satsolver.py --repeat 2","python benchmark_suite.py satsolver /tmp/cycle_candidate_nozerophase_cli_repeat2.txt small medium large special satlib_subset satlib_more --bruteforce-var-limit 16 --cli-script satsolver.py --repeat 2","python -m unittest discover -s tests -v"],"metrics_before":{"mixed_slice_two_order_avg_baseline_s":32.6520,"mixed_slice_forward_baseline_s":33.2466,"mixed_slice_reverse_baseline_s":32.0575,"full_exact_cli_repeat2_baseline_s":38.1276,"full_exact_cli_repeat2_measured_baseline_s":76.2552,"full_exact_cli_repeat2_large_test_6_s":17.4301,"full_exact_cli_repeat2_special_hard_s":11.4124,"full_exact_cli_repeat2_large_test_8_s":0.3861},"metrics_after":{"mixed_slice_two_order_avg_candidate_s":32.5010,"mixed_slice_forward_candidate_s":33.0447,"mixed_slice_reverse_candidate_s":31.9573,"full_exact_cli_repeat2_candidate_s":37.8494,"full_exact_cli_repeat2_measured_candidate_s":75.6988,"full_exact_cli_repeat2_large_test_6_s":16.8850,"full_exact_cli_repeat2_special_hard_s":11.3692,"full_exact_cli_repeat2_large_test_8_s":0.4012},"correctness_status":"the kept core change compiled cleanly, passed SAT and UNSAT checker smoke checks, solved the repeat-aware exact-CLI 59-case suite `59/59` correctly, and the regression suite passed after adding explicit zero-activity branch-polarity coverage","decision":"keep","notes":"This is a narrow branching-policy keep, not a reopening of the broader branching-design lane. The earlier profiler result that zero-activity branch choices were absent appears to transfer cleanly into a real exact-CLI win when the fallback branch is removed."}
{"timestamp":"2026-03-21T12:19:55+01:00","experiment_id":"2026-03-21-reject-no-propagated-saved-phase","hypothesis":"Because `propagate()` still dominates runtime and every implied assignment currently writes `saved_phase[variable]`, removing those propagated phase-saving writes may trim enough hot-path overhead to help the mixed exact-CLI hotspot slice without materially hurting search quality.","change_summary":"Collected a fresh `large/test_6.cnf` profile, created a frozen `HEAD` baseline in `/tmp/satsolver_nosavedphaseprop_baseline/`, temporarily patched `satsolver_core.py` so the three inlined propagated-unit assignment sites no longer update `saved_phase`, validated SAT and UNSAT smoke cases, benchmarked the candidate against the frozen baseline on the mixed nine-case exact-CLI hotspot slice, then reverted the patch after the mixed gate failed catastrophically.","files_changed":["agent_log.md","benchmark_summary.md","experiments.jsonl","next_steps.md"],"datasets":["large/test_6.cnf","small/test_1.cnf","special/tseitin.cnf","small/test_10.cnf","medium/test_3.cnf","medium/test_4.cnf","large/test_8.cnf","large/test_10.cnf","special/hard.cnf"],"commands":["python -m cProfile -s tottime satsolver.py large/test_6.cnf /tmp/current_cycle_large6_profile_2.txt | head -n 40","mkdir -p /tmp/satsolver_nosavedphaseprop_baseline && git show HEAD:satsolver.py > /tmp/satsolver_nosavedphaseprop_baseline/satsolver.py && git show HEAD:satsolver_core.py > /tmp/satsolver_nosavedphaseprop_baseline/satsolver_core.py && git show HEAD:satsolver_fast.py > /tmp/satsolver_nosavedphaseprop_baseline/satsolver_fast.py","python -m py_compile satsolver.py satsolver_core.py satsolver_fast.py","python satsolver.py small/test_1.cnf /tmp/nosavedphaseprop_sat.txt","python tools/checker.py small/test_1.cnf /tmp/nosavedphaseprop_sat.txt","python satsolver.py special/tseitin.cnf /tmp/nosavedphaseprop_unsat.txt","python tools/checker.py special/tseitin.cnf /tmp/nosavedphaseprop_unsat.txt --bruteforce-var-limit 0","python tools/hotspot_compare.py --baseline-cli-script /tmp/satsolver_nosavedphaseprop_baseline/satsolver.py --candidate-cli-script satsolver.py small/test_1.cnf small/test_10.cnf medium/test_3.cnf medium/test_4.cnf large/test_6.cnf large/test_8.cnf large/test_10.cnf special/hard.cnf special/tseitin.cnf"],"metrics_before":{"large_test_6_profile_propagate_tottime_s":18.179,"large_test_6_profile_analyze_tottime_s":3.014,"large_test_6_profile_pick_branch_literal_tottime_s":1.748,"mixed_slice_two_order_avg_baseline_s":30.5205,"mixed_slice_forward_baseline_s":30.6543,"mixed_slice_reverse_baseline_s":30.3866,"large_test_8_forward_baseline_s":0.3345,"large_test_8_reverse_baseline_s":0.3393},"metrics_after":{"mixed_slice_two_order_avg_candidate_s":56.9678,"mixed_slice_forward_candidate_s":56.4923,"mixed_slice_reverse_candidate_s":57.4433,"large_test_8_forward_candidate_s":24.7775,"large_test_8_reverse_candidate_s":25.8776,"large_test_6_forward_candidate_s":17.0311,"large_test_6_reverse_candidate_s":16.7994,"special_hard_forward_candidate_s":9.2372,"special_hard_reverse_candidate_s":9.2636},"correctness_status":"the temporary patch compiled cleanly, stayed checker-valid on SAT and UNSAT smoke cases, but it was reverted immediately after the mixed exact-CLI hotspot gate showed a catastrophic SAT-family regression","decision":"discard","notes":"This is a strong search-quality reject. Propagated phase saving is still essential for the current solver, especially on the SAT-like `large/test_8.cnf` family."}
