{"timestamp":"2026-03-21T22:29:55+01:00","experiment_id":"2026-03-21-keep-pysat-external-wrapper","hypothesis":"If external SAT libraries are allowed, a thin PySAT-backed wrapper that reuses the repo DIMACS/output path should solve the dense UNSAT search-heavy cases much faster than the retained pure-Python solver, even though the repo's bespoke structural presolvers may still win on special handcrafted families.","change_summary":"Created `.venv-external-sat`, installed `python-sat`, benchmarked several available PySAT backends on representative hard cases, selected `minisat22` as the default backend, added `satsolver_pysat.py` as an optional external-library solver wrapper, added lightweight regression coverage in `tests/test_solver_pysat.py`, validated with `py_compile`, the full unit suite, checker-backed SAT/UNSAT smoke checks, a mixed exact-CLI nine-case A/B versus the retained main wrapper, and single-run exact-CLI 35-case suites for both the retained main wrapper and the PySAT wrapper.","files_changed":["satsolver_pysat.py","tests/test_solver_pysat.py","agent_log.md","benchmark_summary.md","experiments.jsonl","next_steps.md"],"datasets":["small/test_1.cnf","special/tseitin.cnf","large/test_6.cnf","special/hard.cnf","large/test_8.cnf","large/test_10.cnf","medium/test_4.cnf","medium/test_3.cnf","small/test_5.cnf","small","medium","large","special"],"commands":["python - <<'PY'\nimport importlib.util\nfor name in ['pysat', 'pycosat', 'z3', 'z3solver', 'pycryptosat']:\n    print(name, bool(importlib.util.find_spec(name)))\nPY","python -m venv .venv-external-sat"," .venv-external-sat/bin/python -m pip install python-sat","python - <<'PY'\nfrom pysat.solvers import SolverNames\nprint(sorted(name for name in dir(SolverNames) if not name.startswith('_')))\nPY","python -m py_compile satsolver_pysat.py tests/test_solver_pysat.py","python -m unittest discover -s tests -v",".venv-external-sat/bin/python satsolver_pysat.py small/test_1.cnf /tmp/pysat_small_sat.txt && python tools/checker.py small/test_1.cnf /tmp/pysat_small_sat.txt",".venv-external-sat/bin/python satsolver_pysat.py special/tseitin.cnf /tmp/pysat_small_unsat.txt && python tools/checker.py special/tseitin.cnf /tmp/pysat_small_unsat.txt --bruteforce-var-limit 0","python tools/hotspot_compare.py --baseline-cli-script satsolver.py --candidate-cli-script satsolver_pysat.py --candidate-python-executable .venv-external-sat/bin/python large/test_6.cnf special/hard.cnf medium/test_4.cnf large/test_10.cnf medium/test_3.cnf large/test_8.cnf small/test_5.cnf special/tseitin.cnf small/test_1.cnf","python benchmark_suite.py satsolver out_main_cli_35_compare.txt small medium large special --bruteforce-var-limit 16 --cli-script satsolver.py","python benchmark_suite.py satsolver out_pysat_cli_35.txt small medium large special --bruteforce-var-limit 16 --cli-script satsolver_pysat.py --python-executable .venv-external-sat/bin/python"],"metrics_before":{"unit_test_count":55,"mixed_slice_two_order_avg_baseline_s":32.8031,"mixed_slice_forward_baseline_s":37.3345,"mixed_slice_reverse_baseline_s":28.2716,"large_test_6_forward_baseline_s":19.2892,"large_test_6_reverse_baseline_s":13.1029,"special_hard_forward_baseline_s":12.1562,"special_hard_reverse_baseline_s":9.7769,"medium_test_4_forward_baseline_s":2.3995,"medium_test_4_reverse_baseline_s":2.0634,"large_test_10_forward_baseline_s":2.1882,"large_test_10_reverse_baseline_s":2.0423,"suite35_baseline_total_s":37.4322},"metrics_after":{"unit_test_count":57,"mixed_slice_two_order_avg_candidate_s":2.4796,"mixed_slice_forward_candidate_s":2.6325,"mixed_slice_reverse_candidate_s":2.3267,"large_test_6_forward_candidate_s":0.4214,"large_test_6_reverse_candidate_s":0.3302,"special_hard_forward_candidate_s":0.3707,"special_hard_reverse_candidate_s":0.2945,"medium_test_4_forward_candidate_s":0.1694,"medium_test_4_reverse_candidate_s":0.1166,"large_test_10_forward_candidate_s":0.1172,"large_test_10_reverse_candidate_s":0.1086,"suite35_candidate_total_s":8.6607,"suite35_candidate_max_case_s":3.8135,"suite35_candidate_max_case":"special/pigeonhole.cnf","suite35_candidate_second_slowest_s":0.9697,"suite35_candidate_second_slowest_case":"special/tseitin.cnf"},"correctness_status":"the wrapper compiled cleanly, the full unit suite passed, checker-backed SAT and UNSAT smoke cases passed, the mixed exact-CLI hotspot slice stayed fully correct, and the 35-case exact-CLI suite finished 35/35 correct for both the retained main wrapper and the PySAT wrapper","decision":"keep_as_optional_comparison_solver","notes":"This is intentionally not a submission-path keep. It is a comparison ceiling that shows how far the retained pure-Python core still trails a mature SAT backend on dense search-heavy families, while also showing that the repo's handcrafted structural presolvers still beat the external library on special pigeonhole and Tseitin inputs."}
{"timestamp":"2026-03-22T16:42:43+01:00","experiment_id":"2026-03-22-keep-post-minimization-learnt-metadata","hypothesis":"If the solver computes best backtrack level and LBD metadata during the post-minimization learnt-clause compaction itself, it can delete a full analyze-to-finalization pass and reduce conflict-analysis overhead without changing the search path.","change_summary":"Patched `satsolver_core.py` so `analyze()` uses a new post-minimization helper that compacts the learnt clause and finalizes best-level/LBD metadata in the same pass, mirrored that boundary in `tools/profile_solver.py`, validated with `python tools/codex_verify.py`, benchmarked the frozen `HEAD` baseline vs candidate on the refreshed seven-case exact-CLI hotspot slice and the structural fast-exit guardrail, ran `python tools/codex_verify.py --benchmark-mode cli --repeat 2`, and confirmed with `tools/profile_solver.py` that the dense hard-case search counters stayed unchanged.","files_changed":["satsolver_core.py","tools/profile_solver.py","PLANS.md","benchmark_summary.md","experiments.jsonl",".agent/STATE.yaml",".agent/TASK_QUEUE.yaml",".agent/HANDOFF.md",".agent/DECISIONS.md",".agent/WORKLOG.md"],"datasets":["large/test_6.cnf","special/hard.cnf","large/test_10.cnf","medium/test_4.cnf","medium/test_3.cnf","satlib_more/uuf150-01.cnf","large/test_8.cnf","special/pigeonhole.cnf","special/tseitin.cnf","small","medium","large","special","satlib_subset","satlib_more"],"commands":["python -m cProfile -s tottime satsolver.py large/test_6.cnf /tmp/perf012_profile_large6.txt | head -n 50","python tools/codex_verify.py","python tools/hotspot_compare.py --baseline-cli-script /tmp/perf012_metadata_baseline/satsolver.py --candidate-cli-script satsolver.py large/test_6.cnf special/hard.cnf large/test_10.cnf medium/test_4.cnf medium/test_3.cnf satlib_more/uuf150-01.cnf large/test_8.cnf","python tools/hotspot_compare.py --baseline-cli-script /tmp/perf012_metadata_baseline/satsolver.py --candidate-cli-script satsolver.py special/pigeonhole.cnf special/tseitin.cnf","python tools/codex_verify.py --benchmark-mode cli --repeat 2","python tools/profile_solver.py large/test_6.cnf special/hard.cnf"],"metrics_before":{"large_test_6_profile_analyze_tottime_s":2.206,"large_test_6_profile_minimize_learnt_tottime_s":0.674,"large_test_6_profile_prepare_learnt_clause_tottime_s":0.246,"hotspot_two_order_avg_baseline_s":30.2756,"structural_two_order_avg_baseline_s":0.0748,"suite59_repeat2_representative_total_s":32.2896,"suite59_repeat2_measured_total_s":64.5793,"large_test_6_decisions":72886,"large_test_6_conflicts":59201,"special_hard_decisions":54245,"special_hard_conflicts":44619},"metrics_after":{"hotspot_two_order_avg_candidate_s":29.8805,"structural_two_order_avg_candidate_s":0.0725,"suite59_repeat2_representative_total_s":31.9532,"suite59_repeat2_measured_total_s":63.9064,"suite59_repeat2_large_test_6_s":14.4150,"suite59_repeat2_special_hard_s":8.9831,"suite59_repeat2_medium_test_4_s":2.0668,"suite59_repeat2_large_test_10_s":2.0307,"suite59_repeat2_large_test_8_s":0.3056,"large_test_6_decisions":72886,"large_test_6_conflicts":59201,"special_hard_decisions":54245,"special_hard_conflicts":44619},"correctness_status":"the candidate compiled cleanly, passed all 73 tests, stayed checker-valid on the main and alternate-wrapper smoke paths, stayed valid on the hotspot and structural exact-CLI comparisons, and improved the repeat-aware exact-CLI 59-case suite to 59/59 correct with a lower representative total","decision":"keep","notes":"This is a same-search conflict-analysis keep rather than a heuristic change: the dense hard-case decision and conflict counters stayed unchanged while the exact-CLI totals improved. The strong boundary lesson is that deleting a whole post-minimization metadata pass can pay off where smaller `prepare_learnt_clause()` loop-shape and primitive-substitution rewrites did not."}
{"timestamp":"2026-03-22T17:06:04+01:00","experiment_id":"2026-03-22-keep-problem-ternary-unit-first-tail","hypothesis":"If the ternary `candidate=FALSE` tail in `propagate()` takes the overwhelmingly common unit path directly and leaves the rare conflict return as the final fallthrough, the solver can shave original problem-ternary propagation overhead without changing the search path.","change_summary":"Patched `satsolver_core.py` so the ternary `candidate_value == FALSE` tail goes straight to the unit handoff when the other watched literal is not `FALSE`, mirrored that branch order in `tools/profile_solver.py`, validated with `python tools/codex_verify.py`, benchmarked the frozen `HEAD` baseline vs candidate on the refreshed seven-case exact-CLI hotspot slice and the structural fast-exit guardrail, ran the candidate through `python tools/codex_verify.py --benchmark-mode cli --repeat 2`, ran the frozen baseline through the same repeat-aware exact-CLI suite, and confirmed with `tools/profile_solver.py` that the dense hard-case search counters stayed unchanged.","files_changed":["satsolver_core.py","tools/profile_solver.py","PLANS.md","benchmark_summary.md","experiments.jsonl",".agent/STATE.yaml",".agent/TASK_QUEUE.yaml",".agent/HANDOFF.md",".agent/WORKLOG.md"],"datasets":["large/test_6.cnf","special/hard.cnf","large/test_10.cnf","medium/test_4.cnf","medium/test_3.cnf","satlib_more/uuf150-01.cnf","large/test_8.cnf","special/pigeonhole.cnf","special/tseitin.cnf","small","medium","large","special","satlib_subset","satlib_more"],"commands":["python tools/codex_verify.py","python tools/hotspot_compare.py --baseline-cli-script /tmp/perf014_unitfirst_baseline/satsolver.py --candidate-cli-script satsolver.py large/test_6.cnf special/hard.cnf large/test_10.cnf medium/test_4.cnf medium/test_3.cnf satlib_more/uuf150-01.cnf large/test_8.cnf","python tools/hotspot_compare.py --baseline-cli-script /tmp/perf014_unitfirst_baseline/satsolver.py --candidate-cli-script satsolver.py special/pigeonhole.cnf special/tseitin.cnf","python tools/codex_verify.py --benchmark-mode cli --repeat 2","python benchmark_suite.py satsolver /tmp/perf014_baseline_cli_repeat2.txt small medium large special satlib_subset satlib_more --bruteforce-var-limit 16 --cli-script /tmp/perf014_unitfirst_baseline/satsolver.py --python-executable /usr/bin/python --repeat 2","python tools/profile_solver.py large/test_6.cnf special/hard.cnf"],"metrics_before":{"hotspot_two_order_avg_baseline_s":29.5292,"structural_two_order_avg_baseline_s":0.0671,"suite59_repeat2_representative_total_s":32.5124,"suite59_repeat2_measured_total_s":65.0247,"large_test_6_decisions":72886,"large_test_6_conflicts":59201,"special_hard_decisions":54245,"special_hard_conflicts":44619},"metrics_after":{"hotspot_two_order_avg_candidate_s":28.8116,"structural_two_order_avg_candidate_s":0.0658,"suite59_repeat2_representative_total_s":31.8378,"suite59_repeat2_measured_total_s":63.6755,"suite59_repeat2_large_test_6_s":14.4118,"suite59_repeat2_special_hard_s":9.2416,"suite59_repeat2_medium_test_4_s":1.9995,"suite59_repeat2_large_test_10_s":1.8467,"suite59_repeat2_large_test_8_s":0.3193,"large_test_6_decisions":72886,"large_test_6_conflicts":59201,"special_hard_decisions":54245,"special_hard_conflicts":44619},"correctness_status":"the candidate compiled cleanly, passed all 73 tests, stayed checker-valid on the main and alternate-wrapper smoke paths, stayed valid on the hotspot and structural exact-CLI comparisons, and improved the repeat-aware exact-CLI 59-case suite to 59/59 correct with a lower representative total than the frozen same-day baseline","decision":"keep","notes":"This is a same-search propagation keep rather than a heuristic change: the dense hard-case decision and conflict counters stayed unchanged while the exact-CLI totals improved. The durable lesson is that a tiny original-ternary tail cleanup can pay off when it directly favors the dominant unit path and still clears the broad exact-CLI suite."}
{"timestamp":"2026-03-22T17:37:39+01:00","experiment_id":"2026-03-22-keep-problem-ternary-relocation-bookkeeping","hypothesis":"If ternary relocation uses the already-known `candidate_literal` directly when updating the watched slot and choosing the destination watch list, the solver can delete a small amount of dominant original problem-ternary relocation bookkeeping without changing the search path.","change_summary":"Patched `satsolver_core.py` so ternary relocation writes the false watched literal back explicitly and appends through `candidate_literal` directly instead of re-reading the swapped watch slot, mirrored that bookkeeping in `tools/profile_solver.py`, validated with `python tools/codex_verify.py`, benchmarked the frozen `HEAD` baseline vs candidate on the refreshed seven-case exact-CLI hotspot slice and the structural fast-exit guardrail, ran the frozen baseline through the repeat-aware exact-CLI 59-case suite, ran the candidate through `python tools/codex_verify.py --benchmark-mode cli --repeat 2`, and confirmed with `tools/profile_solver.py` that the dense hard-case search counters stayed unchanged.","files_changed":["satsolver_core.py","tools/profile_solver.py","PLANS.md","benchmark_summary.md","experiments.jsonl",".agent/STATE.yaml",".agent/TASK_QUEUE.yaml",".agent/HANDOFF.md",".agent/WORKLOG.md"],"datasets":["large/test_6.cnf","special/hard.cnf","large/test_10.cnf","medium/test_4.cnf","medium/test_3.cnf","satlib_more/uuf150-01.cnf","large/test_8.cnf","special/pigeonhole.cnf","special/tseitin.cnf","small","medium","large","special","satlib_subset","satlib_more"],"commands":["python -m cProfile -s tottime satsolver.py large/test_6.cnf /tmp/perf017_profile_large6.txt | head -n 45","python tools/codex_verify.py","python tools/hotspot_compare.py --baseline-cli-script /tmp/perf017_relocbook_baseline.gYxgu4/satsolver.py --candidate-cli-script satsolver.py large/test_6.cnf special/hard.cnf large/test_10.cnf medium/test_4.cnf medium/test_3.cnf satlib_more/uuf150-01.cnf large/test_8.cnf","python tools/hotspot_compare.py --baseline-cli-script /tmp/perf017_relocbook_baseline.gYxgu4/satsolver.py --candidate-cli-script satsolver.py special/pigeonhole.cnf special/tseitin.cnf","python benchmark_suite.py satsolver /tmp/perf017_baseline_cli_repeat2.txt small medium large special satlib_subset satlib_more --bruteforce-var-limit 16 --cli-script /tmp/perf017_relocbook_baseline.gYxgu4/satsolver.py --python-executable /usr/bin/python --repeat 2","python tools/codex_verify.py --benchmark-mode cli --repeat 2","python tools/profile_solver.py large/test_6.cnf special/hard.cnf"],"metrics_before":{"large_test_6_profile_total_s":25.216,"large_test_6_profile_propagate_tottime_s":13.621,"large_test_6_profile_analyze_tottime_s":2.375,"hotspot_two_order_avg_baseline_s":28.4207,"structural_two_order_avg_baseline_s":0.0810,"suite59_repeat2_representative_total_s":31.5160,"suite59_repeat2_measured_total_s":63.0320,"large_test_6_decisions":72886,"large_test_6_conflicts":59201,"special_hard_decisions":54245,"special_hard_conflicts":44619},"metrics_after":{"hotspot_two_order_avg_candidate_s":27.8720,"structural_two_order_avg_candidate_s":0.0639,"suite59_repeat2_representative_total_s":29.7607,"suite59_repeat2_measured_total_s":59.5215,"suite59_repeat2_large_test_6_s":12.9621,"suite59_repeat2_special_hard_s":8.6436,"suite59_repeat2_medium_test_4_s":1.9653,"suite59_repeat2_large_test_10_s":1.8854,"suite59_repeat2_large_test_8_s":0.2903,"large_test_6_decisions":72886,"large_test_6_conflicts":59201,"special_hard_decisions":54245,"special_hard_conflicts":44619},"correctness_status":"the candidate compiled cleanly, passed all 73 tests, stayed checker-valid on the main and alternate-wrapper smoke paths, stayed valid on the hotspot and structural exact-CLI comparisons, and improved the repeat-aware exact-CLI 59-case suite to 59/59 correct with a lower representative total than the frozen same-day baseline","decision":"keep","notes":"This is a same-search propagation keep rather than a heuristic change: the dense hard-case decision and conflict counters stayed unchanged while the exact-CLI totals improved. The durable lesson is that original-ternary relocation is still a live lane when the branch deletes concrete watched-slot bookkeeping instead of just reshaping candidate-state branches."}
{"timestamp":"2026-05-31T19:36:00+02:00","experiment_id":"2026-05-31-keep-phase-diversified-portfolio","hypothesis":"Adding a deterministic third phase-diverse portfolio worker can recover large SAT phase-sensitivity losses such as formulae/large/test_8.cnf while preserving the existing narrow portfolio gate and native-only submission path.","change_summary":"Added shared phase mode constants and Solver.seed_saved_phases_mode(), kept seed_saved_phases_from_bias() as a compatibility wrapper, replaced boolean portfolio worker selection in satsolver_core.py, satsolver.py, and satsolver_fast.py with deterministic phase modes, and ordered the retained worker modes as default, bias_positive, lcg1, bias_negative capped at three workers after a default/lcg1/bias_negative trial regressed planted SAT gate cases.","files_changed":["satsolver_core.py","satsolver.py","satsolver_fast.py","tests/test_solver_regressions.py","PLANS.md","benchmark_summary.md","experiments.jsonl"],"datasets":["formulae/large/test_8.cnf","formulae/large/test_6.cnf","formulae/special/hard.cnf","formulae/large/test_10.cnf","formulae/small","formulae/medium","formulae/large","formulae/special","course_cnf_tests scratch 278 excluding mycielski_iter4_color5_unsat"],"commands":["python -m py_compile satsolver.py satsolver_core.py satsolver_io.py satsolver_fast.py","python -m pytest tests/test_solver_regressions.py -q","python tools/hotspot_compare.py --baseline-cli-script /tmp/phase_portfolio_baseline.yPZFfp/satsolver.py --candidate-cli-script satsolver.py --repeat 2 formulae/large/test_8.cnf","python tools/hotspot_compare.py --baseline-cli-script /tmp/phase_portfolio_baseline.yPZFfp/satsolver.py --candidate-cli-script satsolver.py --repeat 2 formulae/large/test_8.cnf formulae/large/test_6.cnf formulae/special/hard.cnf formulae/large/test_10.cnf","python tools/hotspot_compare.py --baseline-cli-script /tmp/phase_portfolio_baseline.yPZFfp/satsolver.py --candidate-cli-script satsolver.py --repeat 2 <six portfolio-gated course cases>","python ../benchmark_suite.py satsolver /tmp/phase_formulae_candidate_final.txt small medium large special --bruteforce-var-limit 16 --repeat 2 --cli-script ../satsolver.py","python ../benchmark_suite.py satsolver /tmp/phase_formulae_baseline.txt small medium large special --bruteforce-var-limit 16 --repeat 2 --cli-script /tmp/phase_portfolio_baseline.yPZFfp/satsolver.py","python benchmark_suite.py satsolver /tmp/phase_course_candidate_final.txt . --bruteforce-var-limit 16 --repeat 2 --cli-script /home/doomguy/Desktop/sat/satsolver/satsolver.py","python benchmark_suite.py satsolver /tmp/phase_course_baseline.txt . --bruteforce-var-limit 16 --repeat 2 --cli-script /tmp/phase_portfolio_baseline.yPZFfp/satsolver.py"],"metrics_before":{"formulae_repeat2_total_s":12.0224,"formulae_large_test_8_s":1.8271,"portfolio_gated_six_case_two_order_avg_s":5.5063,"course278_repeat2_total_s":30.3867},"metrics_after":{"formulae_repeat2_total_s":10.0431,"formulae_large_test_8_s":0.1340,"portfolio_gated_six_case_two_order_avg_s":3.9310,"course278_repeat2_total_s":27.8704},"correctness_status":"compiled cleanly, regression tests passed, checker-backed focused cases stayed valid, formulae finished 35/35 correct, and the broad 278-case scratch suite finished 278/278 correct with no errors","decision":"keep","notes":"The first mode order default/lcg1/bias_negative was rejected during the run because it removed the old bias_positive worker and regressed several planted SAT gate cases. The kept order preserves the old two-worker behavior on two-core systems and adds lcg1 only when a third worker is available."}
