{"timestamp":"2026-03-21T13:19:22+01:00","experiment_id":"2026-03-21-reject-inline-decay-updates","hypothesis":"Because `solve()` still executes two tiny activity-decay helper calls on every learnt conflict, replacing `decay_var_activity()` and `decay_clause_activity()` with direct assignments may trim enough helper-boundary overhead to help the exact-CLI path without changing search behavior.","change_summary":"Collected a fresh post-keep `large/test_6.cnf` profile, froze a `HEAD` baseline in `/tmp/satsolver_inline_decay_baseline/`, temporarily patched `satsolver_core.py` so `solve()` updates `var_inc` and `clause_inc` inline after learning, validated with `py_compile`, the full unit suite, and checker-backed SAT/UNSAT smoke checks, benchmarked baseline vs candidate on the mixed nine-case exact-CLI hotspot slice and then on the repeat-aware exact-CLI 35-case suite, then reverted the patch after the broad suite came back slightly worse overall.","files_changed":["agent_log.md","benchmark_summary.md","experiments.jsonl","next_steps.md"],"datasets":["large/test_6.cnf","small/test_1.cnf","special/tseitin.cnf","medium/test_3.cnf","medium/test_4.cnf","medium/test_9.cnf","large/test_8.cnf","large/test_10.cnf","special/hard.cnf","small","medium","large","special"],"commands":["python -m cProfile -s tottime satsolver.py large/test_6.cnf /tmp/cycle_profile_large6_after_pickbranch.txt | head -n 35","mkdir -p /tmp/satsolver_inline_decay_baseline && git show HEAD:satsolver.py > /tmp/satsolver_inline_decay_baseline/satsolver.py && git show HEAD:satsolver_core.py > /tmp/satsolver_inline_decay_baseline/satsolver_core.py && git show HEAD:satsolver_fast.py > /tmp/satsolver_inline_decay_baseline/satsolver_fast.py","python -m py_compile satsolver.py satsolver_core.py satsolver_fast.py","python -m unittest discover -s tests -v","python tools/hotspot_compare.py --baseline-cli-script /tmp/satsolver_inline_decay_baseline/satsolver.py --candidate-cli-script satsolver.py small/test_1.cnf special/tseitin.cnf medium/test_3.cnf medium/test_4.cnf medium/test_9.cnf large/test_6.cnf large/test_8.cnf large/test_10.cnf special/hard.cnf","python benchmark_suite.py satsolver /tmp/cycle_inline_decay_baseline_cli_repeat2.txt small medium large special --cli-script /tmp/satsolver_inline_decay_baseline/satsolver.py --repeat 2","python benchmark_suite.py satsolver /tmp/cycle_inline_decay_candidate_cli_repeat2.txt small medium large special --cli-script satsolver.py --repeat 2","python satsolver.py small/test_1.cnf /tmp/inline_decay_revert_sat.txt","python tools/checker.py small/test_1.cnf /tmp/inline_decay_revert_sat.txt","python satsolver.py special/tseitin.cnf /tmp/inline_decay_revert_unsat.txt","python tools/checker.py special/tseitin.cnf /tmp/inline_decay_revert_unsat.txt --bruteforce-var-limit 0"],"metrics_before":{"large_test_6_profile_total_s":35.278,"large_test_6_profile_propagate_tottime_s":19.426,"large_test_6_profile_analyze_tottime_s":3.257,"large_test_6_profile_pick_branch_literal_tottime_s":1.636,"mixed_slice_two_order_avg_baseline_s":30.7973,"mixed_slice_forward_baseline_s":30.4765,"mixed_slice_reverse_baseline_s":31.1182,"full_suite_repeat2_total_baseline_s":33.4842,"full_suite_repeat2_measured_total_baseline_s":66.9684,"full_suite_repeat2_large_test_6_baseline_s":15.4237,"full_suite_repeat2_special_hard_baseline_s":10.9702},"metrics_after":{"mixed_slice_two_order_avg_candidate_s":30.4203,"mixed_slice_forward_candidate_s":29.8930,"mixed_slice_reverse_candidate_s":30.9477,"full_suite_repeat2_total_candidate_s":33.6295,"full_suite_repeat2_measured_total_candidate_s":67.2590,"full_suite_repeat2_large_test_6_candidate_s":15.8732,"full_suite_repeat2_special_hard_candidate_s":10.4972,"mixed_slice_large_test_6_forward_candidate_s":14.4010,"mixed_slice_large_test_6_reverse_candidate_s":15.1773},"correctness_status":"the temporary patch compiled cleanly, passed all 51 unit tests, stayed checker-valid on SAT and UNSAT smoke cases, but it was reverted after the repeat-aware exact-CLI full suite regressed slightly overall despite a positive hotspot slice","decision":"discard","notes":"This is a helper-boundary false positive: the mixed hotspot slice looked clearly positive, but the broad repeat-aware exact-CLI suite came back slightly worse overall."}
{"timestamp":"2026-03-21T13:24:57+01:00","experiment_id":"2026-03-21-reject-solve-local-method-binding","hypothesis":"Because `solve()` repeatedly dispatches the same hot helper methods on every conflict and decision, binding those methods into locals once per call may reduce helper-lookup overhead enough to help the exact-CLI path without changing solver behavior.","change_summary":"Collected a fresh `large/test_6.cnf` profile after the prior reject, froze a `HEAD` baseline in `/tmp/satsolver_solve_alias_baseline/`, temporarily patched `satsolver_core.py` so `solve()` binds its hot helper methods and `trail_limits` into locals once before entering the CDCL loop, validated with `py_compile`, the full unit suite, and checker-backed SAT/UNSAT smoke checks, benchmarked baseline vs candidate on the mixed nine-case exact-CLI hotspot slice, then reverted the patch immediately after the mixed gate regressed decisively.","files_changed":["agent_log.md","benchmark_summary.md","experiments.jsonl","next_steps.md"],"datasets":["large/test_6.cnf","small/test_1.cnf","special/tseitin.cnf","medium/test_3.cnf","medium/test_4.cnf","medium/test_9.cnf","large/test_8.cnf","large/test_10.cnf","special/hard.cnf"],"commands":["python -m cProfile -s tottime satsolver.py large/test_6.cnf /tmp/cycle_profile_large6_after_fb7b41e.txt | head -n 35","mkdir -p /tmp/satsolver_solve_alias_baseline && git show HEAD:satsolver.py > /tmp/satsolver_solve_alias_baseline/satsolver.py && git show HEAD:satsolver_core.py > /tmp/satsolver_solve_alias_baseline/satsolver_core.py && git show HEAD:satsolver_fast.py > /tmp/satsolver_solve_alias_baseline/satsolver_fast.py","python -m py_compile satsolver.py satsolver_core.py satsolver_fast.py","python -m unittest discover -s tests -v","python tools/hotspot_compare.py --baseline-cli-script /tmp/satsolver_solve_alias_baseline/satsolver.py --candidate-cli-script satsolver.py small/test_1.cnf special/tseitin.cnf medium/test_3.cnf medium/test_4.cnf medium/test_9.cnf large/test_6.cnf large/test_8.cnf large/test_10.cnf special/hard.cnf","python satsolver.py small/test_1.cnf /tmp/solve_alias_revert_sat.txt","python tools/checker.py small/test_1.cnf /tmp/solve_alias_revert_sat.txt","python satsolver.py special/tseitin.cnf /tmp/solve_alias_revert_unsat.txt","python tools/checker.py special/tseitin.cnf /tmp/solve_alias_revert_unsat.txt --bruteforce-var-limit 0"],"metrics_before":{"large_test_6_profile_total_s":32.074,"large_test_6_profile_propagate_tottime_s":17.725,"large_test_6_profile_analyze_tottime_s":2.941,"large_test_6_profile_pick_branch_literal_tottime_s":1.470,"large_test_6_profile_add_learnt_clause_tottime_s":0.328,"large_test_6_profile_solve_tottime_s":0.596,"mixed_slice_two_order_avg_baseline_s":29.4850,"mixed_slice_forward_baseline_s":29.1647,"mixed_slice_reverse_baseline_s":29.8053},"metrics_after":{"mixed_slice_two_order_avg_candidate_s":31.0535,"mixed_slice_forward_candidate_s":29.8406,"mixed_slice_reverse_candidate_s":32.2663,"large_test_6_forward_candidate_s":14.7106,"large_test_6_reverse_candidate_s":16.9758,"special_hard_forward_candidate_s":9.9555,"special_hard_reverse_candidate_s":10.0131,"large_test_8_forward_candidate_s":0.3055,"large_test_8_reverse_candidate_s":0.3284},"correctness_status":"the temporary patch compiled cleanly, passed all 51 unit tests, and stayed checker-valid on SAT and UNSAT smoke cases, but it was reverted immediately after the mixed exact-CLI hotspot gate regressed strongly overall","decision":"discard","notes":"This is a broad local-binding reject. Unlike the kept `pick_branch_literal()` scan cleanup, binding most of the `solve()` helpers into locals made the dense UNSAT cases materially worse, especially reverse-order `large/test_6.cnf`."}
{"timestamp":"2026-03-21T13:33:47+01:00","experiment_id":"2026-03-21-reject-conflict-abs-local-binding","hypothesis":"Because fresh exact-CLI profiling still shows `abs` as a visible cost center inside conflict analysis, binding `abs` into locals inside `analyze()`, `minimize_learnt()`, and `prepare_learnt_clause()` may trim builtin-lookup overhead enough to help the exact-CLI path without changing solver behavior.","change_summary":"Collected fresh `large/test_6.cnf` and `special/hard.cnf` profiles, froze a baseline copy in `/tmp/satsolver_abslocal_baseline.QdUJFU/`, temporarily patched `satsolver_core.py` so `analyze()`, `minimize_learnt()`, and `prepare_learnt_clause()` bind `abs` into locals, validated with `py_compile`, the full unit suite, and checker-backed SAT/UNSAT smoke checks, benchmarked baseline vs candidate on the mixed nine-case exact-CLI hotspot slice, then reverted the patch after the mixed gate regressed clearly overall.","files_changed":["agent_log.md","benchmark_summary.md","experiments.jsonl","next_steps.md"],"datasets":["large/test_6.cnf","special/hard.cnf","small/test_1.cnf","special/tseitin.cnf","medium/test_3.cnf","medium/test_4.cnf","medium/test_9.cnf","large/test_8.cnf","large/test_10.cnf"],"commands":["python -m cProfile -s tottime satsolver.py large/test_6.cnf /tmp/cycle_profile_large6_current.txt | head -n 40","python -m cProfile -s tottime satsolver.py special/hard.cnf /tmp/cycle_profile_hard_current.txt | head -n 40","baseline_dir=$(mktemp -d /tmp/satsolver_abslocal_baseline.XXXXXX) && cp satsolver.py satsolver_core.py satsolver_fast.py \"$baseline_dir\" && printf '%s' \"$baseline_dir\"","python -m py_compile satsolver.py satsolver_core.py satsolver_fast.py","python -m unittest discover -s tests -v","python tools/hotspot_compare.py --baseline-cli-script /tmp/satsolver_abslocal_baseline.QdUJFU/satsolver.py --candidate-cli-script satsolver.py small/test_1.cnf special/tseitin.cnf medium/test_3.cnf medium/test_4.cnf medium/test_9.cnf large/test_6.cnf large/test_8.cnf large/test_10.cnf special/hard.cnf","python satsolver.py small/test_1.cnf /tmp/abslocal_revert_sat.txt","python tools/checker.py small/test_1.cnf /tmp/abslocal_revert_sat.txt","python satsolver.py special/tseitin.cnf /tmp/abslocal_revert_unsat.txt","python tools/checker.py special/tseitin.cnf /tmp/abslocal_revert_unsat.txt --bruteforce-var-limit 0"],"metrics_before":{"large_test_6_profile_total_s":33.356,"large_test_6_profile_propagate_tottime_s":18.56,"large_test_6_profile_analyze_tottime_s":3.079,"large_test_6_profile_pick_branch_literal_tottime_s":1.544,"large_test_6_profile_abs_tottime_s":1.194,"special_hard_profile_total_s":19.99,"special_hard_profile_propagate_tottime_s":10.929,"special_hard_profile_analyze_tottime_s":1.958,"special_hard_profile_pick_branch_literal_tottime_s":0.748,"special_hard_profile_abs_tottime_s":0.788,"mixed_slice_two_order_avg_baseline_s":31.4277,"mixed_slice_forward_baseline_s":32.3663,"mixed_slice_reverse_baseline_s":30.4891},"metrics_after":{"mixed_slice_two_order_avg_candidate_s":32.1594,"mixed_slice_forward_candidate_s":33.0372,"mixed_slice_reverse_candidate_s":31.2816,"large_test_6_forward_candidate_s":16.5961,"large_test_6_reverse_candidate_s":15.4358,"special_hard_forward_candidate_s":10.8689,"special_hard_reverse_candidate_s":10.3215,"large_test_10_forward_candidate_s":2.039,"large_test_10_reverse_candidate_s":1.9988,"large_test_8_forward_candidate_s":0.3377,"large_test_8_reverse_candidate_s":0.3162},"correctness_status":"the temporary patch compiled cleanly, passed all 51 unit tests, and stayed checker-valid on SAT and UNSAT smoke cases, but it was reverted immediately after the mixed exact-CLI hotspot gate regressed clearly overall","decision":"discard","notes":"This is another pure-overhead conflict-analysis reject: the visible `abs` cost did not turn into an end-to-end gain when the builtin was simply bound into locals."}
{"timestamp":"2026-03-21T13:42:17+01:00","experiment_id":"2026-03-21-reject-prepare-learnt-fixed-size-fast-path","hypothesis":"Because the solver learns many short clauses and `prepare_learnt_clause()` still does generic LBD-token bookkeeping and a best-level scan for every learnt clause, special-casing binary and ternary learnt clauses may trim conflict-analysis overhead enough to help the exact-CLI path without changing solver policy.","change_summary":"Froze a `HEAD` baseline in `/tmp/satsolver_preparelearnt_baseline.Es2D5k/`, temporarily patched `prepare_learnt_clause()` in `satsolver_core.py` with dedicated binary and ternary fast paths while leaving the generic path unchanged for larger learnt clauses, validated with `py_compile`, the full unit suite, and checker-backed SAT/UNSAT smoke checks, benchmarked baseline vs candidate on the mixed nine-case exact-CLI hotspot slice, then reverted the patch immediately after the mixed gate regressed clearly overall.","files_changed":["agent_log.md","benchmark_summary.md","experiments.jsonl","next_steps.md"],"datasets":["small/test_1.cnf","special/tseitin.cnf","medium/test_3.cnf","medium/test_4.cnf","medium/test_9.cnf","large/test_6.cnf","large/test_8.cnf","large/test_10.cnf","special/hard.cnf"],"commands":["baseline_dir=$(mktemp -d /tmp/satsolver_preparelearnt_baseline.XXXXXX) && git show HEAD:satsolver.py > \"$baseline_dir/satsolver.py\" && git show HEAD:satsolver_core.py > \"$baseline_dir/satsolver_core.py\" && git show HEAD:satsolver_fast.py > \"$baseline_dir/satsolver_fast.py\" && printf '%s' \"$baseline_dir\"","python -m py_compile satsolver.py satsolver_core.py satsolver_fast.py","python -m unittest discover -s tests -v","python tools/hotspot_compare.py --baseline-cli-script /tmp/satsolver_preparelearnt_baseline.Es2D5k/satsolver.py --candidate-cli-script satsolver.py small/test_1.cnf special/tseitin.cnf medium/test_3.cnf medium/test_4.cnf medium/test_9.cnf large/test_6.cnf large/test_8.cnf large/test_10.cnf special/hard.cnf","python satsolver.py small/test_1.cnf /tmp/preparelearnt_revert_sat.txt","python tools/checker.py small/test_1.cnf /tmp/preparelearnt_revert_sat.txt","python satsolver.py special/tseitin.cnf /tmp/preparelearnt_revert_unsat.txt","python tools/checker.py special/tseitin.cnf /tmp/preparelearnt_revert_unsat.txt --bruteforce-var-limit 0"],"metrics_before":{"mixed_slice_two_order_avg_baseline_s":32.1394,"mixed_slice_forward_baseline_s":32.1665,"mixed_slice_reverse_baseline_s":32.1123,"large_test_6_forward_baseline_s":15.9523,"large_test_6_reverse_baseline_s":14.9877,"special_hard_forward_baseline_s":10.8156,"special_hard_reverse_baseline_s":11.0351},"metrics_after":{"mixed_slice_two_order_avg_candidate_s":34.0749,"mixed_slice_forward_candidate_s":34.5739,"mixed_slice_reverse_candidate_s":33.5760,"large_test_6_forward_candidate_s":18.1880,"large_test_6_reverse_candidate_s":16.9680,"special_hard_forward_candidate_s":11.0575,"special_hard_reverse_candidate_s":10.6748,"large_test_8_forward_candidate_s":0.3344,"large_test_8_reverse_candidate_s":0.3131},"correctness_status":"the temporary patch compiled cleanly, passed all 51 unit tests, and stayed checker-valid on SAT and UNSAT smoke cases, but it was reverted immediately after the mixed exact-CLI hotspot gate regressed strongly overall","decision":"discard","notes":"This looked like a harmless fixed-size conflict-analysis specialization, but it materially worsened `large/test_6.cnf` in both orders and failed the mixed exact-CLI gate decisively."}
{"timestamp":"2026-03-21T13:48:28+01:00","experiment_id":"2026-03-21-reject-flat-binary-implications","hypothesis":"Because `propagate()` still dominates runtime and the binary implication loop still unpacks Python tuples, storing `binary_implications` as flat integer pairs may reduce same-search propagation overhead without changing solver behavior.","change_summary":"Froze a `HEAD` baseline in `/tmp/satsolver_binaryflat_baseline.TPfZD0/`, temporarily patched `satsolver_core.py` so `binary_implications` stores alternating `implied_literal, clause_id` integers and `propagate()` iterates them by step `2`, updated `tools/profile_solver.py` to mirror the temporary layout so tests and profiler tooling stayed valid during measurement, validated with `py_compile`, the full unit suite, and checker-backed SAT/UNSAT smoke checks, benchmarked baseline vs candidate on the mixed nine-case exact-CLI hotspot slice, then reverted both the core patch and the profiler mirror after the mixed gate regressed overall.","files_changed":["agent_log.md","benchmark_summary.md","experiments.jsonl","next_steps.md"],"datasets":["small/test_1.cnf","special/tseitin.cnf","medium/test_3.cnf","medium/test_4.cnf","medium/test_9.cnf","large/test_6.cnf","large/test_8.cnf","large/test_10.cnf","special/hard.cnf"],"commands":["baseline_dir=$(mktemp -d /tmp/satsolver_binaryflat_baseline.XXXXXX) && git show HEAD:satsolver.py > \"$baseline_dir/satsolver.py\" && git show HEAD:satsolver_core.py > \"$baseline_dir/satsolver_core.py\" && git show HEAD:satsolver_fast.py > \"$baseline_dir/satsolver_fast.py\" && printf '%s' \"$baseline_dir\"","python -m py_compile satsolver.py satsolver_core.py satsolver_fast.py tools/profile_solver.py","python -m unittest discover -s tests -v","python tools/hotspot_compare.py --baseline-cli-script /tmp/satsolver_binaryflat_baseline.TPfZD0/satsolver.py --candidate-cli-script satsolver.py small/test_1.cnf special/tseitin.cnf medium/test_3.cnf medium/test_4.cnf medium/test_9.cnf large/test_6.cnf large/test_8.cnf large/test_10.cnf special/hard.cnf","python satsolver.py small/test_1.cnf /tmp/binaryflat_revert_sat.txt","python tools/checker.py small/test_1.cnf /tmp/binaryflat_revert_sat.txt","python satsolver.py special/tseitin.cnf /tmp/binaryflat_revert_unsat.txt","python tools/checker.py special/tseitin.cnf /tmp/binaryflat_revert_unsat.txt --bruteforce-var-limit 0"],"metrics_before":{"mixed_slice_two_order_avg_baseline_s":35.0798,"mixed_slice_forward_baseline_s":35.8088,"mixed_slice_reverse_baseline_s":34.3507,"large_test_6_forward_baseline_s":18.5623,"large_test_6_reverse_baseline_s":16.9915,"special_hard_forward_baseline_s":11.1569,"special_hard_reverse_baseline_s":11.2627,"large_test_10_forward_baseline_s":2.3252,"large_test_10_reverse_baseline_s":2.2495},"metrics_after":{"mixed_slice_two_order_avg_candidate_s":36.0096,"mixed_slice_forward_candidate_s":35.5085,"mixed_slice_reverse_candidate_s":36.5107,"large_test_6_forward_candidate_s":17.4797,"large_test_6_reverse_candidate_s":18.9111,"special_hard_forward_candidate_s":12.0093,"special_hard_reverse_candidate_s":11.3503,"large_test_10_forward_candidate_s":2.2217,"large_test_10_reverse_candidate_s":2.4885,"large_test_8_forward_candidate_s":0.3684,"large_test_8_reverse_candidate_s":0.3722},"correctness_status":"the temporary core patch plus mirrored profiler-layout patch compiled cleanly, passed all 51 unit tests, and stayed checker-valid on SAT and UNSAT smoke cases, but both were reverted immediately after the mixed exact-CLI hotspot gate regressed overall","decision":"discard","notes":"This looked like a plausible propagation data-layout cleanup, but the reverse-order dense UNSAT losses outweighed the forward-order gains and it did not survive the mixed exact-CLI gate."}
