{"timestamp":"2026-03-20T07:34:25+01:00","experiment_id":"2026-03-20-rejected-recursive-learnt-minimization","hypothesis":"Because the current minimizer still removes many literals on the dense UNSAT bottlenecks, recursive reason traversal might shrink learnt clauses enough to reduce future watched-clause work and beat its added conflict-analysis cost.","change_summary":"Measured a temporary RecursiveMinSolver subclass with recursive redundancy checking in minimize_learnt() against the retained baseline on the focused five-case serial slice, then discarded it after a clear regression. No production solver code was changed.","files_changed":["agent_log.md","experiments.jsonl","benchmark_summary.md","next_steps.md"],"datasets":["large/test_6.cnf","special/hard.cnf","medium/test_4.cnf","large/test_10.cnf","large/test_8.cnf"],"commands":["python - <<'PY' ... baseline vs RecursiveMinSolver over large/test_6.cnf, special/hard.cnf, medium/test_4.cnf, large/test_10.cnf, large/test_8.cnf ... PY"],"metrics_before":{"focused_five_case_total_s":30.0874,"large_test_6_s":13.3046,"special_hard_s":8.9443,"medium_test_4_s":1.8355,"large_test_10_s":1.6580,"large_test_8_s":4.3450},"metrics_after":{"recursive_total_s":35.9624,"large_test_6_s":14.8008,"special_hard_s":11.7288,"medium_test_4_s":2.3683,"large_test_10_s":1.5048,"large_test_8_s":5.5598},"correctness_status":"measurement-only experiment on a temporary solver subclass; all five cases still solved with the expected SAT/UNSAT status","decision":"discard","notes":"The idea aligned with the profiler evidence that minimization matters, but the naive Python recursive redundancy traversal cost more than its extra clause shrinking was worth. Future minimization work needs a cheaper or more selective design."}
{"timestamp":"2026-03-20T07:41:04+01:00","experiment_id":"2026-03-20-watch-outcome-probe-profiler-upgrade","hypothesis":"If the profiler separates ternary-vs-large watch outcomes and measures large-clause probe depth, it will show whether the next propagation change should hit the ternary fast path or the large-clause replacement scan.","change_summary":"Extended tools/profile_solver.py with ternary/large relocation-unit-conflict counters and large-clause probe-depth totals, added a new regression test for large-clause probe statistics, and profiled the main dense UNSAT cases plus SAT-like large/test_8.cnf.","files_changed":["tools/profile_solver.py","tests/test_profile_solver.py","agent_log.md","experiments.jsonl","benchmark_summary.md","next_steps.md"],"datasets":["large/test_6.cnf","special/hard.cnf","medium/test_4.cnf","large/test_8.cnf"],"commands":["python -m unittest discover -s tests -v","python tools/profile_solver.py large/test_6.cnf special/hard.cnf medium/test_4.cnf large/test_8.cnf"],"metrics_before":{"reported_profile_metrics":["watch_visits","ternary_visits","large_visits","watch_relocations","watch_units","watch_conflicts","avg_learnt_before","avg_learnt_after","avg_lbd"],"unit_test_count":19},"metrics_after":{"unit_test_count":20,"large_test_6_ternary_relocations":4813494,"large_test_6_ternary_units":3037579,"large_test_6_ternary_conflicts":53776,"large_test_6_large_relocations":1743065,"large_test_6_large_units":191005,"large_test_6_large_conflicts":5421,"large_test_6_avg_large_probe":2.36,"large_test_6_avg_large_probe_success":2.22,"large_test_6_avg_large_probe_failure":3.61,"special_hard_avg_large_probe":2.32,"special_hard_avg_large_probe_failure":3.37,"medium_test_4_avg_large_probe":2.56,"medium_test_4_avg_large_probe_failure":3.72,"large_test_8_ternary_visits":2045418,"large_test_8_large_visits":336168,"large_test_8_avg_large_probe":3.39,"large_test_8_avg_large_probe_failure":4.85,"large_test_8_max_large_probe":38,"large_test_8_avg_learnt_before":18.51,"large_test_8_avg_learnt_after":16.34,"large_test_8_avg_lbd":11.08},"correctness_status":"passed 20 regression tests and the upgraded profiler produced valid output on the three dense UNSAT bottlenecks plus SAT-like large/test_8.cnf","decision":"keep","notes":"The new breakdown points away from another blind large-clause scan rewrite: the hard UNSAT cases are still dominated by ternary relocations and units, while average large-clause scan depth stays fairly short. Any future large-clause optimization should be selective enough to help large/test_8.cnf without adding duplicated mutable watch state."}
{"timestamp":"2026-03-20T07:47:53+01:00","experiment_id":"2026-03-20-rejected-eager-satisfied-ternary-relocation","hypothesis":"Because ternary watch traffic dominates the hard cases and checking the third literal is cheap, eagerly relocating ternary watches away from a false watched literal even when the other watch is already true might reduce future satisfied re-visits enough to win overall.","change_summary":"Temporarily changed the ternary propagation path so already-satisfied ternary clauses still tried to relocate the false watch to the third literal, benchmarked the serial five-case hotspot slice, and then reverted the change after a clear regression.","files_changed":["satsolver.py","agent_log.md","experiments.jsonl","benchmark_summary.md","next_steps.md"],"datasets":["large/test_6.cnf","special/hard.cnf","medium/test_4.cnf","large/test_10.cnf","large/test_8.cnf"],"commands":["python - <<'PY' ... baseline serial five-case timing with SATSOLVER_DISABLE_PORTFOLIO=1 ... PY","python - <<'PY' ... experimental serial five-case timing with SATSOLVER_DISABLE_PORTFOLIO=1 ... PY","python -m unittest discover -s tests -v","python - <<'PY' ... post-revert serial five-case timing with SATSOLVER_DISABLE_PORTFOLIO=1 ... PY"],"metrics_before":{"focused_five_case_total_s":28.4768,"large_test_6_s":12.6142,"special_hard_s":8.7291,"medium_test_4_s":1.7953,"large_test_10_s":1.7525,"large_test_8_s":3.5857},"metrics_after":{"experimental_total_s":36.4731,"experimental_large_test_6_s":17.9193,"experimental_special_hard_s":8.1042,"experimental_medium_test_4_s":2.1350,"experimental_large_test_10_s":1.8333,"experimental_large_test_8_s":6.4813,"post_revert_total_s":28.7496,"post_revert_large_test_6_s":12.9485,"post_revert_special_hard_s":8.5619,"post_revert_medium_test_4_s":1.8272,"post_revert_large_test_10_s":1.7770,"post_revert_large_test_8_s":3.6350},"correctness_status":"passed 20 regression tests after revert and all five hotspot cases continued to solve with the expected SAT/UNSAT status throughout the experiment","decision":"discard","notes":"The added eager relocation churn hurt badly, especially on SAT-like large/test_8.cnf and also on large/test_6.cnf. If satisfied-skip work is revisited, it needs a much stronger selector than moving watches whenever the other watched literal is already true."}
{"timestamp":"2026-03-20T07:58:50+01:00","experiment_id":"2026-03-20-inline-propagation-unit-assignment","hypothesis":"If propagate() updates already-known-unassigned unit assignments directly instead of calling enqueue() millions of times, the solver should keep the same search path but spend less time in the watched-clause and binary implication hot loops.","change_summary":"Inlined the assignment updates for already-known-unassigned binary and watched-clause unit propagations in satsolver.py, mirrored the same fast path in tools/profile_solver.py, added a regression test covering reason/level/cache updates for binary and ternary units, and refreshed validated in-process and exact-CLI benchmarks.","files_changed":["satsolver.py","tools/profile_solver.py","tests/test_solver_regressions.py","out_extended.txt","out_cli_extended.txt","agent_log.md","experiments.jsonl","benchmark_summary.md","next_steps.md"],"datasets":["large/test_6.cnf","special/hard.cnf","medium/test_4.cnf","large/test_10.cnf","large/test_8.cnf","small/test_1.cnf","special/tseitin.cnf","small","medium","large","special","satlib_subset","satlib_more"],"commands":["python - <<'PY' ... serial five-case timing with SATSOLVER_DISABLE_PORTFOLIO=1 ... PY","python satsolver.py small/test_1.cnf /tmp/cycle_sat.txt","python tools/checker.py small/test_1.cnf /tmp/cycle_sat.txt","python satsolver.py special/tseitin.cnf /tmp/cycle_unsat.txt","python tools/checker.py special/tseitin.cnf /tmp/cycle_unsat.txt --bruteforce-var-limit 0","python satsolver.py large/test_8.cnf /tmp/cycle_large8.txt","python tools/checker.py large/test_8.cnf /tmp/cycle_large8.txt","python -m unittest discover -s tests -v","python tools/profile_solver.py large/test_6.cnf special/hard.cnf medium/test_4.cnf large/test_8.cnf","python benchmark_suite.py satsolver out_extended.txt small medium large special satlib_subset satlib_more --bruteforce-var-limit 16","python benchmark_suite.py satsolver out_extended.txt small medium large special satlib_subset satlib_more --bruteforce-var-limit 16 --repeat 2","python benchmark_suite.py satsolver out_cli_extended.txt small medium large special satlib_subset satlib_more --bruteforce-var-limit 16 --cli-script satsolver.py","python benchmark_suite.py satsolver out_cli_extended.txt small medium large special satlib_subset satlib_more --bruteforce-var-limit 16 --cli-script satsolver.py --repeat 2","python benchmark_suite.py satsolver out_cli_extended.txt small medium large special satlib_subset satlib_more --bruteforce-var-limit 16 --cli-script satsolver.py"],"metrics_before":{"focused_five_case_total_s":28.7496,"large_test_6_s":12.9485,"special_hard_s":8.5619,"medium_test_4_s":1.8272,"large_test_10_s":1.7770,"large_test_8_s":3.6350,"large_test_6_profile_time_s":20.8801,"special_hard_profile_time_s":13.9615,"medium_test_4_profile_time_s":2.8093,"large_test_8_profile_time_s":5.3621,"repeat2_inprocess_total_s":28.9770,"repeat2_inprocess_measured_total_s":57.9540,"best_single_run_inprocess_total_s":27.3023,"repeat2_exact_cli_total_s":31.5848,"repeat2_exact_cli_measured_total_s":63.1696,"best_single_run_exact_cli_total_s":30.1080},"metrics_after":{"focused_five_case_total_s":27.1753,"large_test_6_s":12.1792,"special_hard_s":8.1314,"medium_test_4_s":1.7000,"large_test_10_s":1.6590,"large_test_8_s":3.5058,"large_test_6_profile_time_s":18.8837,"special_hard_profile_time_s":12.2556,"medium_test_4_profile_time_s":2.5129,"large_test_8_profile_time_s":4.8326,"large_test_6_decisions":72886,"large_test_6_conflicts":59201,"large_test_6_processed_literals":2431409,"repeat2_inprocess_total_s":26.4508,"repeat2_inprocess_measured_total_s":52.9016,"best_single_run_inprocess_total_s":26.4178,"repeat2_exact_cli_total_s":28.7122,"repeat2_exact_cli_measured_total_s":57.4245,"best_single_run_exact_cli_total_s":28.4550,"unit_test_count":21},"correctness_status":"passed 21 regression tests, SAT/UNSAT checker spot checks, hotspot profiling with unchanged search counts, and validated 59/59 benchmark runs in both in-process and exact-CLI modes","decision":"keep","notes":"The first exact-CLI single run landed at 30.4187s and looked noisy, but repeat-aware exact-CLI validation and a clean rerun both confirmed the production win. This appears to be pure propagation overhead reduction rather than heuristic drift."}
{"timestamp":"2026-03-20T08:05:57+01:00","experiment_id":"2026-03-20-rejected-encoded-watch-slot-payloads","hypothesis":"If watcher-list entries encode which watched slot fired, propagation can avoid rediscovering and normalizing the false watched position on every visit and reduce hot-path overhead enough to beat the extra payload decoding.","change_summary":"Measured a temporary SideWatchSolver subclass that stored encoded watch-slot payloads in watcher lists and updated propagation to use them directly, then discarded it after a same-run regression on the serial five-case hotspot slice. No production solver code was changed.","files_changed":["agent_log.md","experiments.jsonl","benchmark_summary.md","next_steps.md"],"datasets":["large/test_6.cnf","special/hard.cnf","medium/test_4.cnf","large/test_10.cnf","large/test_8.cnf"],"commands":["python - <<'PY' ... same-run baseline vs SideWatchSolver over large/test_6.cnf, special/hard.cnf, medium/test_4.cnf, large/test_10.cnf, large/test_8.cnf ... PY","python -m unittest discover -s tests -v","python satsolver.py large/test_8.cnf /tmp/cycle_large8_verify.txt","python tools/checker.py large/test_8.cnf /tmp/cycle_large8_verify.txt"],"metrics_before":{"focused_five_case_total_s":27.2088,"large_test_6_s":12.3262,"special_hard_s":8.1615,"medium_test_4_s":1.6892,"large_test_10_s":1.6469,"large_test_8_s":3.3849},"metrics_after":{"sidewatch_total_s":27.7040,"sidewatch_large_test_6_s":12.3438,"sidewatch_special_hard_s":8.3617,"sidewatch_medium_test_4_s":1.7474,"sidewatch_large_test_10_s":1.7169,"sidewatch_large_test_8_s":3.5342,"unit_test_count":21},"correctness_status":"measurement-only experiment on a temporary solver subclass; production regression tests still passed and the retained solver still validated on large/test_8.cnf","decision":"discard","notes":"Changing watch-list payloads just to encode the watched slot was not enough to beat the current baseline. The saved watched-slot normalization work was outweighed by Python-side payload decoding and bookkeeping."}
{"timestamp":"2026-03-20T08:12:07+01:00","experiment_id":"2026-03-20-phase-policy-portfolio-resweep","hypothesis":"After the recent propagation hot-loop wins, the best alternate phase policy might have shifted enough that a broader standard-library portfolio could now justify itself beyond the current narrow large/test_8-like gate.","change_summary":"Reran the main serial five-case slice with temporary seeded solvers using default phases, phase-bias seeding, all-true seeding, and all-false seeding, then discarded any portfolio broadening because no alternate worker provided a strong enough cross-family win.","files_changed":["agent_log.md","experiments.jsonl","benchmark_summary.md","next_steps.md"],"datasets":["large/test_6.cnf","special/hard.cnf","medium/test_4.cnf","large/test_10.cnf","large/test_8.cnf"],"commands":["python - <<'PY' ... same-run phase-policy sweep over default, phase_bias, all_true, all_false on the serial five-case slice ... PY","python -m unittest discover -s tests -v","python satsolver.py large/test_8.cnf /tmp/cycle_phase_large8.txt","python tools/checker.py large/test_8.cnf /tmp/cycle_phase_large8.txt","python satsolver.py special/tseitin.cnf /tmp/cycle_phase_unsat.txt","python tools/checker.py special/tseitin.cnf /tmp/cycle_phase_unsat.txt --bruteforce-var-limit 0"],"metrics_before":{"default_total_s":27.3625,"default_large_test_6_s":12.3475,"default_special_hard_s":8.2076,"default_medium_test_4_s":1.7316,"default_large_test_10_s":1.6326,"default_large_test_8_s":3.4432},"metrics_after":{"phase_bias_total_s":29.5747,"phase_bias_large_test_6_s":14.6544,"phase_bias_special_hard_s":10.7338,"phase_bias_medium_test_4_s":2.3100,"phase_bias_large_test_10_s":1.6802,"phase_bias_large_test_8_s":0.1963,"all_true_total_s":27.3121,"all_true_large_test_6_s":12.3747,"all_true_special_hard_s":8.0577,"all_true_medium_test_4_s":1.7642,"all_true_large_test_10_s":1.7081,"all_true_large_test_8_s":3.4074,"all_false_total_s":41.0540,"all_false_large_test_6_s":15.2192,"all_false_special_hard_s":8.4159,"all_false_medium_test_4_s":1.5156,"all_false_large_test_10_s":1.6274,"all_false_large_test_8_s":14.2759,"unit_test_count":21},"correctness_status":"measurement-only experiment on temporary seeded solver subclasses; production regression tests still passed and the retained solver continued to validate on SAT and UNSAT spot checks","decision":"discard","notes":"The current shape is still the same: phase_bias is fantastic for large/test_8 but too expensive on the hard UNSAT cases, all_true is effectively tied with default, and all_false is still unstable. That confirms the existing narrow portfolio gate rather than suggesting a broader one."}
{"timestamp":"2026-03-20T08:18:14+01:00","experiment_id":"2026-03-20-conflict-reason-bucket-profiler-upgrade","hypothesis":"If the profiler records reason-clause size buckets for conflict-analysis traversals and minimization kept/removed literals, it will show whether future analyze/minimize work should focus on tiny reasons, medium reasons, or avoid spending effort on large reasons that rarely help.","change_summary":"Extended tools/profile_solver.py with reason-size bucket counters for analyze() traversals and minimize_learnt() kept/removed literals, added regression coverage for the new bucket invariants, and profiled the main dense UNSAT cases plus SAT-like large/test_8.cnf.","files_changed":["tools/profile_solver.py","tests/test_profile_solver.py","agent_log.md","experiments.jsonl","benchmark_summary.md","next_steps.md"],"datasets":["large/test_6.cnf","special/hard.cnf","medium/test_4.cnf","large/test_8.cnf"],"commands":["python -m unittest discover -s tests -v","python tools/profile_solver.py large/test_6.cnf special/hard.cnf medium/test_4.cnf large/test_8.cnf"],"metrics_before":{"reported_profile_metrics":["watch_visits","ternary_visits","large_visits","watch_relocations","watch_units","watch_conflicts","avg_learnt_before","avg_learnt_after","avg_lbd"],"unit_test_count":21},"metrics_after":{"unit_test_count":21,"large_test_6_analyze_reason_traversals":1057846,"large_test_6_analyze_reason_2_3":931316,"large_test_6_analyze_reason_4_9":78664,"large_test_6_analyze_reason_10_plus":47866,"large_test_6_min_drop_2_3":112785,"large_test_6_min_drop_4_9":27850,"large_test_6_min_drop_10_plus":4012,"special_hard_analyze_reason_2_3":658449,"special_hard_analyze_reason_4_9":78795,"special_hard_analyze_reason_10_plus":32795,"special_hard_min_drop_2_3":86242,"special_hard_min_drop_4_9":22901,"special_hard_min_drop_10_plus":1885,"medium_test_4_analyze_reason_2_3":160254,"medium_test_4_analyze_reason_4_9":14702,"medium_test_4_analyze_reason_10_plus":6828,"medium_test_4_min_drop_2_3":19271,"medium_test_4_min_drop_4_9":4808,"medium_test_4_min_drop_10_plus":272,"large_test_8_min_keep_10_plus":19467,"large_test_8_min_drop_10_plus":2856},"correctness_status":"passed 21 regression tests including the new bucket-invariant checks, and the upgraded profiler produced valid output on the three dense UNSAT bottlenecks plus SAT-like large/test_8.cnf","decision":"keep","notes":"The new data says future conflict-analysis work should bias toward tiny reasons and possibly medium reasons. Large reasons are a weak target for extra minimization effort, especially on large/test_8.cnf where they are often kept and rarely removed."}
{"timestamp":"2026-03-20T08:38:24+01:00","experiment_id":"2026-03-20-rejected-tiny-reason-analyze-unroll","hypothesis":"Because the new profiler shows that `2..3`-literal reasons dominate conflict-analysis traversal and successful minimization, manually unrolling both `analyze()` and `minimize_learnt()` for tiny reasons might cut Python loop overhead on the dense UNSAT hotspots.","change_summary":"Measured a temporary TinyReasonFastSolver subclass that manually unrolled binary and ternary reason handling in both analyze() and minimize_learnt(), then discarded it after it regressed the same-run serial five-case hotspot slice.","files_changed":["agent_log.md","experiments.jsonl","benchmark_summary.md","next_steps.md"],"datasets":["large/test_6.cnf","special/hard.cnf","medium/test_4.cnf","large/test_10.cnf","large/test_8.cnf"],"commands":["python - <<'PY' ... same-run baseline vs TinyReasonFastSolver over the serial five-case slice ... PY"],"metrics_before":{"focused_five_case_total_s":26.6506,"large_test_6_s":12.1251,"special_hard_s":7.8535,"medium_test_4_s":1.6927,"large_test_10_s":1.6059,"large_test_8_s":3.3735},"metrics_after":{"tiny_reason_fast_total_s":27.4136,"tiny_reason_fast_large_test_6_s":12.3049,"tiny_reason_fast_special_hard_s":8.1160,"tiny_reason_fast_medium_test_4_s":1.7961,"tiny_reason_fast_large_test_10_s":1.7133,"tiny_reason_fast_large_test_8_s":3.4832},"correctness_status":"temporary subclass preserved SAT/UNSAT outcomes on the five hotspot cases but regressed wall time enough to reject the approach before patching production code","decision":"discard","notes":"The broad analyze-path unroll was too heavy in pure Python. Future tiny-reason work should stay narrower than this."}
