{"timestamp":"2026-03-21T01:51:02+01:00","experiment_id":"2026-03-21-reject-main-reduce-database-shorter-first-ranking","hypothesis":"Because learnt-large relocation is still a major secondary watcher-churn bucket on the profiled hotspots, preferring shorter learnt clauses ahead of equally-good active long clauses inside the current reduction ranking might improve the retained learnt set without the search damage seen from keeping fewer clauses or reducing sooner.","change_summary":"Materialized the retained `satsolver.py` into `_tmp_satsolver_baseline_reduce_key.py`, temporarily patched `reduce_database()` so candidates were sorted by `(lbd, len(lits), -activity)` instead of `(lbd, -activity, len(lits))`, validated SAT and UNSAT smoke cases, benchmarked exact-CLI A/B on the mixed nine-case hotspot slice, then reverted the change and deleted the temporary baseline after the candidate regressed broadly.","files_changed":["agent_log.md","experiments.jsonl","benchmark_summary.md","next_steps.md"],"datasets":["small/test_1.cnf","special/tseitin.cnf","small/test_10.cnf","medium/test_3.cnf","medium/test_4.cnf","large/test_6.cnf","large/test_8.cnf","large/test_10.cnf","special/hard.cnf"],"commands":["git show HEAD:satsolver.py > /home/doomguy/Desktop/sat/satsolver/_tmp_satsolver_baseline_reduce_key.py","python -m py_compile satsolver.py","python satsolver.py small/test_1.cnf /tmp/reduce_key_sat.txt","python tools/checker.py small/test_1.cnf /tmp/reduce_key_sat.txt","python satsolver.py special/tseitin.cnf /tmp/reduce_key_unsat.txt","python tools/checker.py special/tseitin.cnf /tmp/reduce_key_unsat.txt --bruteforce-var-limit 0","python tools/hotspot_compare.py --baseline-cli-script /home/doomguy/Desktop/sat/satsolver/_tmp_satsolver_baseline_reduce_key.py --candidate-cli-script satsolver.py --bruteforce-var-limit 0 small/test_1.cnf small/test_10.cnf medium/test_3.cnf medium/test_4.cnf large/test_6.cnf large/test_8.cnf large/test_10.cnf special/hard.cnf special/tseitin.cnf","python -m unittest discover -s tests -v"],"metrics_before":{"unit_test_count":48,"mixed_slice_two_order_avg_baseline_s":24.9575,"mixed_slice_forward_baseline_s":25.4716,"mixed_slice_reverse_baseline_s":24.4434,"large_test_6_forward_baseline_s":12.9431,"large_test_6_reverse_baseline_s":12.0496,"large_test_8_forward_baseline_s":0.2815,"large_test_8_reverse_baseline_s":0.2814},"metrics_after":{"unit_test_count":48,"mixed_slice_two_order_avg_candidate_s":30.6752,"mixed_slice_forward_candidate_s":30.3040,"mixed_slice_reverse_candidate_s":31.0463,"large_test_6_forward_candidate_s":16.5156,"large_test_6_reverse_candidate_s":17.2031,"large_test_8_forward_candidate_s":0.9161,"large_test_8_reverse_candidate_s":0.9101},"correctness_status":"the temporary branch produced checker-valid SAT and UNSAT smoke outputs, the repository was reverted to the retained `satsolver.py` baseline after the hotspot gate failed, and the reverted repository still passed all 48 regression tests","decision":"discard","notes":"This was a ranking-only classifier change with the same retention fraction and schedule, and it still lost badly. Preferring shorter clauses earlier within the same LBD bucket regressed both dense UNSAT and SAT-like families, so future learnt-database work needs a better classifier than swapping length and activity in the sort key."}
{"timestamp":"2026-03-21T02:06:22+01:00","experiment_id":"2026-03-21-reject-fast-main-hybrid-dense-3sat-selector","hypothesis":"Because the retained exact-CLI artifacts plus same-day slice checks suggested `satsolver_fast.py` wins broadly on startup-sensitive cases while `satsolver.py` can still be stronger on some dense UNSAT-heavy pure-3-SAT cases, a narrow hybrid wrapper might capture the best of both by routing only one dense all-3-SAT band back to the main solver.","change_summary":"Profiled the retained baseline, compared `satsolver_fast.py` and `satsolver.py` on targeted exact-CLI and module slices, then created scratch candidate `scratch_satsolver_hybrid.py` from `satsolver_fast.py` with a narrow selector that routed formulas with `num_vars >= 250`, density `> 5.0`, and all clauses length `3` to `base.solve_cnf_serial(...)` while keeping the retained fast path otherwise unchanged. Validated SAT, structural-UNSAT, and routed dense-UNSAT smoke cases, benchmarked the scratch hybrid against retained `satsolver_fast.py` on the mixed nine-case exact-CLI hotspot slice, then deleted the scratch files after the candidate regressed overall.","files_changed":["agent_log.md","experiments.jsonl","benchmark_summary.md","next_steps.md"],"datasets":["large/test_6.cnf","special/hard.cnf","medium/test_4.cnf","large/test_10.cnf","large/test_8.cnf","satlib_more/uuf125-01.cnf","special/dense.cnf","small/test_1.cnf","special/tseitin.cnf","small/test_10.cnf","medium/test_3.cnf"],"commands":["python tools/profile_solver.py large/test_6.cnf special/hard.cnf medium/test_4.cnf large/test_10.cnf large/test_8.cnf","python - <<'PY' ... cProfile satsolver.solve_cnf on large/test_6.cnf ... PY","python tools/hotspot_compare.py --baseline-cli-script satsolver_fast.py --candidate-cli-script satsolver.py --repeat 2 special/hard.cnf large/test_10.cnf satlib_more/uuf125-01.cnf large/test_6.cnf large/test_8.cnf medium/test_4.cnf special/dense.cnf","python tools/hotspot_compare.py --baseline-module satsolver_fast --candidate-module satsolver --repeat 2 large/test_6.cnf large/test_8.cnf special/hard.cnf medium/test_4.cnf","git show HEAD:satsolver_fast.py > /home/doomguy/Desktop/sat/satsolver/_tmp_satsolver_fast_baseline_hybrid.py","python -m py_compile scratch_satsolver_hybrid.py","python scratch_satsolver_hybrid.py small/test_1.cnf /tmp/hybrid_sat.txt","python tools/checker.py small/test_1.cnf /tmp/hybrid_sat.txt","python scratch_satsolver_hybrid.py special/tseitin.cnf /tmp/hybrid_unsat.txt","python tools/checker.py special/tseitin.cnf /tmp/hybrid_unsat.txt --bruteforce-var-limit 0","python scratch_satsolver_hybrid.py large/test_6.cnf /tmp/hybrid_large_unsat.txt","python tools/checker.py large/test_6.cnf /tmp/hybrid_large_unsat.txt --bruteforce-var-limit 0","python tools/hotspot_compare.py --baseline-cli-script /home/doomguy/Desktop/sat/satsolver/satsolver_fast.py --candidate-cli-script scratch_satsolver_hybrid.py --bruteforce-var-limit 0 small/test_1.cnf small/test_10.cnf medium/test_3.cnf medium/test_4.cnf large/test_6.cnf large/test_8.cnf large/test_10.cnf special/hard.cnf special/tseitin.cnf","python -m unittest discover -s tests -v"],"metrics_before":{"unit_test_count":48,"mixed_slice_two_order_avg_baseline_s":24.6659,"mixed_slice_forward_baseline_s":24.4419,"mixed_slice_reverse_baseline_s":24.8899,"large_test_6_forward_baseline_s":11.9609,"large_test_6_reverse_baseline_s":12.2016},"metrics_after":{"unit_test_count":48,"mixed_slice_two_order_avg_candidate_s":25.0305,"mixed_slice_forward_candidate_s":24.6735,"mixed_slice_reverse_candidate_s":25.3875,"large_test_6_forward_candidate_s":12.1944,"large_test_6_reverse_candidate_s":11.8936},"correctness_status":"the scratch hybrid produced checker-valid SAT and UNSAT smoke outputs, the repository was reverted to the retained solver files after the mixed exact-CLI hotspot gate failed, and the reverted repository still passed all 48 regression tests","decision":"discard","notes":"The selector was too narrow and too unstable. It only rescued `large/test_6.cnf` in one order, while `special/hard.cnf`, `large/test_10.cnf`, and some startup-sensitive small cases gave the gain back. Future hybrid exact-CLI work needs a much stronger classifier than dense all-3-SAT shape plus size/density thresholds."}
{"timestamp":"2026-03-21T02:14:10+01:00","experiment_id":"2026-03-21-reject-main-no-learnt-clause-bump","hypothesis":"Because `bump_clause_activity()` is not a major direct hot-path cost by itself, removing learnt-clause activity bumping entirely during conflict analysis might simplify learnt-database ranking and either save enough work to matter or reveal that the ranking signal is unnecessary.","change_summary":"Materialized the retained `satsolver.py` into `_tmp_satsolver_baseline_no_clause_bump.py`, temporarily patched `analyze()` to stop calling `self.bump_clause_activity(current_clause_id)` for learnt clauses, validated SAT and UNSAT smoke cases, benchmarked exact-CLI A/B on the mixed nine-case hotspot slice, then reverted the change and deleted the temporary baseline after the candidate regressed badly.","files_changed":["agent_log.md","experiments.jsonl","benchmark_summary.md","next_steps.md"],"datasets":["small/test_1.cnf","special/tseitin.cnf","small/test_10.cnf","medium/test_3.cnf","medium/test_4.cnf","large/test_6.cnf","large/test_8.cnf","large/test_10.cnf","special/hard.cnf"],"commands":["git show HEAD:satsolver.py > /home/doomguy/Desktop/sat/satsolver/_tmp_satsolver_baseline_no_clause_bump.py","python -m py_compile satsolver.py","python satsolver.py small/test_1.cnf /tmp/no_clause_bump_sat.txt","python tools/checker.py small/test_1.cnf /tmp/no_clause_bump_sat.txt","python satsolver.py special/tseitin.cnf /tmp/no_clause_bump_unsat.txt","python tools/checker.py special/tseitin.cnf /tmp/no_clause_bump_unsat.txt --bruteforce-var-limit 0","python tools/hotspot_compare.py --baseline-cli-script /home/doomguy/Desktop/sat/satsolver/_tmp_satsolver_baseline_no_clause_bump.py --candidate-cli-script satsolver.py --bruteforce-var-limit 0 small/test_1.cnf small/test_10.cnf medium/test_3.cnf medium/test_4.cnf large/test_6.cnf large/test_8.cnf large/test_10.cnf special/hard.cnf special/tseitin.cnf","python -m unittest discover -s tests -v"],"metrics_before":{"unit_test_count":48,"mixed_slice_two_order_avg_baseline_s":25.5245,"mixed_slice_forward_baseline_s":26.8840,"mixed_slice_reverse_baseline_s":24.1650,"large_test_6_forward_baseline_s":13.3551,"large_test_6_reverse_baseline_s":11.7847,"large_test_8_forward_baseline_s":0.2955,"large_test_8_reverse_baseline_s":0.2910},"metrics_after":{"unit_test_count":48,"mixed_slice_two_order_avg_candidate_s":34.0354,"mixed_slice_forward_candidate_s":35.3150,"mixed_slice_reverse_candidate_s":32.7558,"large_test_6_forward_candidate_s":18.5140,"large_test_6_reverse_candidate_s":17.0076,"large_test_8_forward_candidate_s":2.0991,"large_test_8_reverse_candidate_s":1.7697},"correctness_status":"the temporary branch produced checker-valid SAT and UNSAT smoke outputs, the repository was reverted to the retained `satsolver.py` baseline after the hotspot gate failed, and the reverted repository still passed all 48 regression tests","decision":"discard","notes":"This was not a small quality regression. Removing learnt-clause activity bumping badly hurt both dense UNSAT and SAT-like families, so future learnt-database work should treat clause activity as an essential signal unless it is replaced by something materially better."}
{"timestamp":"2026-03-21T02:22:29+01:00","experiment_id":"2026-03-21-reject-main-reduce-database-activity-per-literal","hypothesis":"Because learnt-clause activity is clearly essential but large learnt clauses still drive much of the secondary watcher churn, ranking reduction candidates by activity per literal within each LBD bucket might preserve impactful short clauses while pushing less efficient long clauses out of the kept half more often.","change_summary":"Copied `satsolver.py` into `scratch_satsolver_reduce_act_per_len.py`, materialized the retained baseline into `_tmp_satsolver_baseline_reduce_act_per_len.py`, patched the scratch solver so `reduce_database()` sorted candidates by `(lbd, -(activity / len(lits)), len(lits), -activity)` instead of `(lbd, -activity, len(lits))`, validated SAT and UNSAT smoke cases, benchmarked exact-CLI A/B on the mixed nine-case hotspot slice, then deleted the scratch files after the candidate regressed clearly.","files_changed":["agent_log.md","experiments.jsonl","benchmark_summary.md","next_steps.md"],"datasets":["small/test_1.cnf","special/tseitin.cnf","small/test_10.cnf","medium/test_3.cnf","medium/test_4.cnf","large/test_6.cnf","large/test_8.cnf","large/test_10.cnf","special/hard.cnf"],"commands":["cp satsolver.py /home/doomguy/Desktop/sat/satsolver/scratch_satsolver_reduce_act_per_len.py","git show HEAD:satsolver.py > /home/doomguy/Desktop/sat/satsolver/_tmp_satsolver_baseline_reduce_act_per_len.py","python -m py_compile scratch_satsolver_reduce_act_per_len.py","python scratch_satsolver_reduce_act_per_len.py small/test_1.cnf /tmp/reduce_act_per_len_sat.txt","python tools/checker.py small/test_1.cnf /tmp/reduce_act_per_len_sat.txt","python scratch_satsolver_reduce_act_per_len.py special/tseitin.cnf /tmp/reduce_act_per_len_unsat.txt","python tools/checker.py special/tseitin.cnf /tmp/reduce_act_per_len_unsat.txt --bruteforce-var-limit 0","python tools/hotspot_compare.py --baseline-cli-script /home/doomguy/Desktop/sat/satsolver/_tmp_satsolver_baseline_reduce_act_per_len.py --candidate-cli-script /home/doomguy/Desktop/sat/satsolver/scratch_satsolver_reduce_act_per_len.py small/test_1.cnf small/test_10.cnf medium/test_3.cnf medium/test_4.cnf large/test_6.cnf large/test_8.cnf large/test_10.cnf special/hard.cnf special/tseitin.cnf","python -m unittest discover -s tests -v"],"metrics_before":{"unit_test_count":48,"mixed_slice_two_order_avg_baseline_s":25.3946,"mixed_slice_forward_baseline_s":24.9354,"mixed_slice_reverse_baseline_s":25.8538,"large_test_6_forward_baseline_s":12.1182,"large_test_6_reverse_baseline_s":13.3722,"large_test_8_forward_baseline_s":0.2813,"large_test_8_reverse_baseline_s":0.2895},"metrics_after":{"unit_test_count":48,"mixed_slice_two_order_avg_candidate_s":30.0746,"mixed_slice_forward_candidate_s":29.9795,"mixed_slice_reverse_candidate_s":30.1696,"large_test_6_forward_candidate_s":16.5862,"large_test_6_reverse_candidate_s":16.8649,"large_test_8_forward_candidate_s":1.3741,"large_test_8_reverse_candidate_s":1.3303},"correctness_status":"the scratch candidate produced checker-valid SAT and UNSAT smoke outputs, the temporary files were deleted after the hotspot gate failed, and the retained repository stayed on the committed `satsolver.py` baseline","decision":"discard","notes":"This looked like a gentler classifier than shorter-first tie-breaking, but it still destabilized both dense UNSAT and SAT-like search. The modest wins on `special/hard.cnf`, `medium/test_3.cnf`, and `medium/test_4.cnf` were nowhere near enough to offset the losses on `large/test_6.cnf` and `large/test_8.cnf`."}
{"timestamp":"2026-03-21T02:44:19+01:00","experiment_id":"2026-03-21-keep-promote-fast-wrapper-into-main","hypothesis":"Because the retained exact-CLI alternate already beat the current `satsolver.py` on the same-day root-hit slice, mixed hotspot slice, and repeat-aware exact-CLI full suite, splitting the old full solver into `satsolver_core.py` and making `satsolver.py` use the faster byte-parser/no-root-pure wrapper path should speed up the required submission command while preserving the internal API that tests and tooling still use.","change_summary":"Benchmarked retained `satsolver.py` against retained `satsolver_fast.py` on the exact-CLI root-hit slice, the mixed nine-case hotspot slice, and repeat-aware full-suite exact-CLI runs; promoted the faster wrapper architecture by copying the old full solver to `satsolver_core.py`, rewriting `satsolver.py` as the wrapper path while preserving `solve_cnf_serial()` and the core symbols for tests/tools, and pointing `satsolver_fast.py` directly at `satsolver_core.py`; validated regression tests and checker smoke cases; benchmarked the promoted `satsolver.py` against `HEAD:satsolver.py` on the root-hit and mixed exact-CLI slices; refreshed repeat-aware in-process and exact-CLI full-suite artifacts.","files_changed":["agent_log.md","benchmark_summary.md","experiments.jsonl","next_steps.md","out_extended.txt","out_cli_extended.txt","satsolver.py","satsolver_core.py","satsolver_fast.py"],"datasets":["small/test_1.cnf","special/tseitin.cnf","small/test_10.cnf","medium/test_3.cnf","medium/test_4.cnf","large/test_6.cnf","large/test_8.cnf","large/test_10.cnf","special/hard.cnf","small/test_5.cnf","small/test_6.cnf","small/test_9.cnf","medium/test_8.cnf","medium/test_9.cnf","large/test_1.cnf","large/test_2.cnf","large/test_5.cnf","large/test_7.cnf","large/test_9.cnf","special/easy.cnf","small","medium","large","special","satlib_subset","satlib_more"],"commands":["python tools/hotspot_compare.py --baseline-cli-script satsolver.py --candidate-cli-script satsolver_fast.py small/test_1.cnf small/test_10.cnf medium/test_3.cnf medium/test_4.cnf large/test_6.cnf large/test_8.cnf large/test_10.cnf special/hard.cnf special/tseitin.cnf","python tools/hotspot_compare.py --baseline-cli-script satsolver.py --candidate-cli-script satsolver_fast.py --repeat 2 small/test_1.cnf small/test_5.cnf small/test_6.cnf small/test_9.cnf medium/test_8.cnf medium/test_9.cnf large/test_1.cnf large/test_2.cnf large/test_5.cnf large/test_7.cnf large/test_9.cnf special/easy.cnf","python benchmark_suite.py satsolver /tmp/main_cli_repeat2_20260321.txt small medium large special satlib_subset satlib_more --bruteforce-var-limit 16 --cli-script satsolver.py --repeat 2","python benchmark_suite.py satsolver_fast /tmp/fast_cli_repeat2_20260321.txt small medium large special satlib_subset satlib_more --bruteforce-var-limit 16 --cli-script satsolver_fast.py --repeat 2","cp satsolver.py satsolver_core.py","python -m py_compile satsolver.py satsolver_core.py satsolver_fast.py","python -m unittest discover -s tests -v","python satsolver.py small/test_1.cnf /tmp/main_wrapper_sat.txt","python tools/checker.py small/test_1.cnf /tmp/main_wrapper_sat.txt","python satsolver.py special/tseitin.cnf /tmp/main_wrapper_unsat.txt","python tools/checker.py special/tseitin.cnf /tmp/main_wrapper_unsat.txt --bruteforce-var-limit 0","git show HEAD:satsolver.py > /tmp/satsolver_head_baseline_20260321.py","python tools/hotspot_compare.py --baseline-cli-script /tmp/satsolver_head_baseline_20260321.py --candidate-cli-script satsolver.py small/test_1.cnf small/test_10.cnf medium/test_3.cnf medium/test_4.cnf large/test_6.cnf large/test_8.cnf large/test_10.cnf special/hard.cnf special/tseitin.cnf","python tools/hotspot_compare.py --baseline-cli-script /tmp/satsolver_head_baseline_20260321.py --candidate-cli-script satsolver.py --repeat 2 small/test_1.cnf small/test_5.cnf small/test_6.cnf small/test_9.cnf medium/test_8.cnf medium/test_9.cnf large/test_1.cnf large/test_2.cnf large/test_5.cnf large/test_7.cnf large/test_9.cnf special/easy.cnf","python tools/hotspot_compare.py --baseline-cli-script satsolver_fast.py --candidate-cli-script satsolver.py small/test_1.cnf small/test_10.cnf medium/test_3.cnf medium/test_4.cnf large/test_6.cnf large/test_8.cnf large/test_10.cnf special/hard.cnf special/tseitin.cnf","python tools/hotspot_compare.py --baseline-cli-script satsolver_fast.py --candidate-cli-script satsolver.py --repeat 2 small/test_1.cnf small/test_5.cnf small/test_6.cnf small/test_9.cnf medium/test_8.cnf medium/test_9.cnf large/test_1.cnf large/test_2.cnf large/test_5.cnf large/test_7.cnf large/test_9.cnf special/easy.cnf","python benchmark_suite.py satsolver out_extended.txt small medium large special satlib_subset satlib_more --bruteforce-var-limit 16 --repeat 2","python benchmark_suite.py satsolver out_cli_extended.txt small medium large special satlib_subset satlib_more --bruteforce-var-limit 16 --cli-script satsolver.py --repeat 2"],"metrics_before":{"unit_test_count":48,"root_hit_slice_two_order_avg_old_main_s":0.5026,"mixed_slice_two_order_avg_old_main_s":24.5923,"repeat2_exact_cli_old_main_s":30.3078,"repeat2_exact_cli_fast_alt_s":29.1527},"metrics_after":{"unit_test_count":48,"root_hit_slice_two_order_avg_promoted_main_s":0.4044,"mixed_slice_two_order_avg_promoted_main_s":24.1644,"repeat2_in_process_promoted_main_s":27.6294,"repeat2_exact_cli_promoted_main_s":29.5746,"root_hit_slice_two_order_avg_fast_vs_promoted_main_s":0.4391,"mixed_slice_two_order_avg_fast_vs_promoted_main_s":24.5747},"correctness_status":"the promoted wrapper path passed all 48 regression tests, produced checker-valid SAT and UNSAT smoke outputs, refreshed both benchmark artifacts with 59/59 correct, and preserved the internal core API through `satsolver_core.py` plus exported wrapper symbols","decision":"keep","notes":"This is a real submission-path keep against the immediately previous mainline, not a new all-time exact-CLI record. The helper split makes the required `python satsolver.py input.cnf output.txt` command materially faster on the same-day exact-CLI baseline while keeping the repo tooling alive, but future exact-CLI work should still compare against both the promoted main wrapper and the sibling `satsolver_fast.py` because broad-suite variance is still real."}
