{"timestamp":"2026-03-20T09:44:53+01:00","experiment_id":"2026-03-20-keep-slice-delete-backtrack","hypothesis":"Because cProfile still shows backtrack() plus list pop() as a real cost on the dense UNSAT cases, clearing each decision-level segment by reverse index scan plus one tail delete should be cheaper than repeated trail.pop() cleanup without changing the search path.","change_summary":"Rewrote Solver.backtrack() to scan the active trail segment by index and delete the tail once per decision level, added a regression test for trail/reason/qhead cleanup, and refreshed the repeat-aware benchmark artifacts.","files_changed":["satsolver.py","tests/test_solver_regressions.py","out_extended.txt","out_cli_extended.txt","agent_log.md","experiments.jsonl","benchmark_summary.md","next_steps.md"],"datasets":["large/test_6.cnf","special/hard.cnf","medium/test_4.cnf","large/test_10.cnf","large/test_8.cnf","small/test_1.cnf","special/tseitin.cnf","small","medium","large","special","satlib_subset","satlib_more"],"commands":["python - <<'PY' ... same-run five-case timing baseline then SliceBacktrackSolver ... PY","python - <<'PY' ... reversed-order same-run five-case timing SliceBacktrackSolver then baseline ... PY","python - <<'PY' ... cProfile baseline vs SliceBacktrackSolver on large/test_6.cnf ... PY","python -m unittest discover -s tests -v","python satsolver.py small/test_1.cnf /tmp/cycle_sat_check4.txt","python tools/checker.py small/test_1.cnf /tmp/cycle_sat_check4.txt","python satsolver.py special/tseitin.cnf /tmp/cycle_unsat_check4.txt","python tools/checker.py special/tseitin.cnf /tmp/cycle_unsat_check4.txt --bruteforce-var-limit 0","python benchmark_suite.py satsolver out_extended.txt small medium large special satlib_subset satlib_more --bruteforce-var-limit 16 --repeat 2","python benchmark_suite.py satsolver out_cli_extended.txt small medium large special satlib_subset satlib_more --bruteforce-var-limit 16 --cli-script satsolver.py --repeat 2","python benchmark_suite.py satsolver /tmp/hotspot_repeat.txt large special medium --bruteforce-var-limit 16 --repeat 2"],"metrics_before":{"focused_forward_baseline_total_s":27.9713,"focused_forward_large_test_6_s":12.6535,"focused_forward_special_hard_s":8.1331,"focused_forward_medium_test_4_s":1.8396,"focused_forward_large_test_10_s":1.7260,"focused_forward_large_test_8_s":3.6191,"focused_reverse_baseline_total_s":28.5337,"focused_reverse_large_test_6_s":12.6444,"focused_reverse_special_hard_s":8.6289,"focused_reverse_medium_test_4_s":1.9661,"focused_reverse_large_test_10_s":1.7508,"focused_reverse_large_test_8_s":3.5435,"focused_average_baseline_total_s":28.2525,"cprofile_large_test_6_total_s":30.397,"cprofile_large_test_6_backtrack_tottime_s":2.189,"cprofile_large_test_6_pop_calls":10107994,"cprofile_large_test_6_conflicts":59201,"repeat2_inprocess_total_s":26.2118,"repeat2_inprocess_measured_total_s":52.4236,"repeat2_exact_cli_total_s":28.9681,"repeat2_exact_cli_measured_total_s":57.9363,"historical_best_repeat2_exact_cli_total_s":28.7122,"unit_test_count":24},"metrics_after":{"focused_forward_experimental_total_s":27.0617,"focused_forward_large_test_6_s":12.7217,"focused_forward_special_hard_s":7.8644,"focused_forward_medium_test_4_s":1.6281,"focused_forward_large_test_10_s":1.5465,"focused_forward_large_test_8_s":3.3010,"focused_reverse_experimental_total_s":26.9753,"focused_reverse_large_test_6_s":12.3935,"focused_reverse_special_hard_s":7.8904,"focused_reverse_medium_test_4_s":1.6940,"focused_reverse_large_test_10_s":1.6720,"focused_reverse_large_test_8_s":3.3254,"focused_average_experimental_total_s":27.0185,"cprofile_large_test_6_total_s":25.975,"cprofile_large_test_6_backtrack_tottime_s":0.558,"cprofile_large_test_6_pop_calls":6745603,"cprofile_large_test_6_conflicts":59201,"repeat2_inprocess_total_s":26.8404,"repeat2_inprocess_measured_total_s":53.6809,"repeat2_inprocess_wall_clock_s":53.8498,"repeat2_exact_cli_total_s":28.6838,"repeat2_exact_cli_measured_total_s":57.3677,"repeat2_exact_cli_wall_clock_s":57.6092,"hotspot_repeat2_total_s":24.8900,"hotspot_repeat2_large_test_6_s":12.1898,"hotspot_repeat2_special_hard_s":7.8706,"hotspot_repeat2_medium_test_4_s":1.7183,"hotspot_repeat2_large_test_8_s":0.2163,"unit_test_count":24},"correctness_status":"passed 24 regression tests, SAT/UNSAT checker spot checks on small/test_1.cnf and special/tseitin.cnf, and validated 59/59 repeat-aware full-suite runs in both module and exact-CLI modes","decision":"keep","notes":"The keep is driven by same-search hotspot wins and a new best repeat-aware exact-CLI 59-case result, even though the module-mode repeat-aware 59-case rerun did not beat its historical best. This change should be treated as a real submission-path improvement with an explicit cross-harness caution flag."}
{"timestamp":"2026-03-20T09:54:21+01:00","experiment_id":"2026-03-20-keep-clause-family-profiler-split","hypothesis":"If the profiler splits active watch traffic and reason traversals into original-clause versus learnt-clause families, it will tell us whether the next solver win should target raw ternary propagation speed or learnt-database policy/layout.","change_summary":"Extended tools/profile_solver.py to split active ternary/large watch visits plus analyze/minimize reason traversals into problem-clause versus learnt-clause families, added regression invariants in tests/test_profile_solver.py, and reran the profiler on the main hotspots.","files_changed":["tools/profile_solver.py","tests/test_profile_solver.py","agent_log.md","experiments.jsonl","benchmark_summary.md","next_steps.md"],"datasets":["large/test_6.cnf","special/hard.cnf","medium/test_4.cnf","large/test_8.cnf"],"commands":["python -m unittest discover -s tests -v","python tools/profile_solver.py large/test_6.cnf special/hard.cnf medium/test_4.cnf large/test_8.cnf"],"metrics_before":{"reported_family_split_metrics":[],"unit_test_count":24},"metrics_after":{"reported_family_split_metrics":["problem_ternary_visits","learnt_ternary_visits","problem_large_visits","learnt_large_visits","analyze_problem_reasons","analyze_learnt_reasons","minimize_problem_reasons","minimize_learnt_reasons"],"unit_test_count":24,"large_test_6_problem_ternary_visits":7596700,"large_test_6_learnt_ternary_visits":308149,"large_test_6_problem_large_visits":0,"large_test_6_learnt_large_visits":1939491,"large_test_6_analyze_problem_reasons":887029,"large_test_6_analyze_learnt_reasons":170817,"large_test_6_minimize_problem_reasons":296373,"large_test_6_minimize_learnt_reasons":169478,"special_hard_problem_ternary_visits":4194393,"special_hard_learnt_ternary_visits":232728,"special_hard_problem_large_visits":0,"special_hard_learnt_large_visits":1725097,"special_hard_analyze_problem_reasons":618633,"special_hard_analyze_learnt_reasons":151406,"special_hard_minimize_problem_reasons":215799,"special_hard_minimize_learnt_reasons":133502,"medium_test_4_problem_ternary_visits":1062253,"medium_test_4_learnt_ternary_visits":50847,"medium_test_4_problem_large_visits":0,"medium_test_4_learnt_large_visits":229521,"medium_test_4_analyze_problem_reasons":150818,"medium_test_4_analyze_learnt_reasons":30966,"medium_test_4_minimize_problem_reasons":47961,"medium_test_4_minimize_learnt_reasons":28101,"large_test_8_problem_ternary_visits":1976129,"large_test_8_learnt_ternary_visits":69289,"large_test_8_problem_large_visits":0,"large_test_8_learnt_large_visits":336168,"large_test_8_analyze_problem_reasons":292270,"large_test_8_analyze_learnt_reasons":45266,"large_test_8_minimize_problem_reasons":113081,"large_test_8_minimize_learnt_reasons":38257},"correctness_status":"passed 24 regression tests including the new family-split invariants, and the upgraded profiler produced valid output on the main hotspot cases","decision":"keep","notes":"The main ternary hot path is overwhelmingly original-clause work on the dense bottlenecks, while active large-clause watch work is entirely learnt-clause traffic on these pure-3-SAT cases. Conflict-analysis traversals also lean strongly toward original clauses, so broad learnt-retention ideas look lower priority than raw ternary propagation / reason-traversal speedups."}
{"timestamp":"2026-03-20T10:18:20+01:00","experiment_id":"2026-03-20-keep-watcher-learnt-deleted-guard","hypothesis":"Because only learnt clauses can be deleted, changing the watched-clause hot path from `if clause.deleted` to `if clause.learnt and clause.deleted` may cut a little propagation overhead on the overwhelmingly problem-clause ternary workload without changing the search.","change_summary":"Changed the watched-clause deleted check in `satsolver.py` and `tools/profile_solver.py` to guard only deleted learnt clauses, added a regression asserting that `reduce_database()` never deletes problem clauses, and validated the branch with same-day module and exact-CLI hotspot A/B runs plus repeat-aware full-suite reruns.","files_changed":["satsolver.py","tools/profile_solver.py","tests/test_solver_regressions.py","agent_log.md","experiments.jsonl","benchmark_summary.md","next_steps.md","out_extended.txt","out_cli_extended.txt"],"datasets":["large/test_6.cnf","special/hard.cnf","medium/test_4.cnf","large/test_10.cnf","large/test_8.cnf","small/test_1.cnf","special/tseitin.cnf","small","medium","large","special","satlib_subset","satlib_more"],"commands":["python - <<'PY' ... temporary baseline-vs-experiment serial five-case A/B in forward and reverse order ... PY","python - <<'PY' ... temporary baseline-vs-experiment ProfiledSolver A/B on large/test_6.cnf, special/hard.cnf, and large/test_8.cnf ... PY","python -m unittest discover -s tests -v","python satsolver.py small/test_1.cnf /tmp/cycle_sat.txt","python tools/checker.py small/test_1.cnf /tmp/cycle_sat.txt","python satsolver.py special/tseitin.cnf /tmp/cycle_unsat.txt","python tools/checker.py special/tseitin.cnf /tmp/cycle_unsat.txt --bruteforce-var-limit 0","python benchmark_suite.py satsolver out_extended.txt small medium large special satlib_subset satlib_more --bruteforce-var-limit 16 --repeat 2","python benchmark_suite.py satsolver out_cli_extended.txt small medium large special satlib_subset satlib_more --bruteforce-var-limit 16 --cli-script satsolver.py --repeat 2","python - <<'PY' ... temporary reverted-baseline exact-CLI five-case A/B in forward and reverse order ... PY"],"metrics_before":{"serial_hotspot_forward_total_s":30.9099,"serial_hotspot_reverse_total_s":31.1534,"exact_cli_hotspot_forward_total_s":25.7390,"exact_cli_hotspot_reverse_total_s":26.1964,"profiled_large_test_6_time_s":20.7688,"profiled_special_hard_time_s":13.7854,"profiled_large_test_8_time_s":5.9403,"profiled_large_test_6_decisions":72886,"profiled_large_test_6_conflicts":59201,"profiled_large_test_6_processed_literals":2431409,"profiled_special_hard_decisions":54245,"profiled_special_hard_conflicts":44619,"profiled_special_hard_processed_literals":1737825,"profiled_large_test_8_decisions":21526,"profiled_large_test_8_conflicts":16430,"profiled_large_test_8_processed_literals":838303,"baseline_guard_repeat2_inprocess_s":29.8019,"baseline_guard_repeat2_exact_cli_s":31.8364,"unit_test_count":24},"metrics_after":{"serial_hotspot_forward_total_s":30.4341,"serial_hotspot_reverse_total_s":29.4951,"serial_hotspot_avg_total_s":29.9646,"exact_cli_hotspot_forward_total_s":25.4543,"exact_cli_hotspot_reverse_total_s":26.1397,"exact_cli_hotspot_avg_total_s":25.7970,"profiled_large_test_6_time_s":21.4601,"profiled_special_hard_time_s":14.9141,"profiled_large_test_8_time_s":6.5875,"profiled_large_test_6_decisions":72886,"profiled_large_test_6_conflicts":59201,"profiled_large_test_6_processed_literals":2431409,"profiled_special_hard_decisions":54245,"profiled_special_hard_conflicts":44619,"profiled_special_hard_processed_literals":1737825,"profiled_large_test_8_decisions":21526,"profiled_large_test_8_conflicts":16430,"profiled_large_test_8_processed_literals":838303,"repeat2_inprocess_run_a_s":29.1333,"repeat2_exact_cli_run_a_s":31.5217,"repeat2_inprocess_retained_artifact_s":30.3709,"repeat2_exact_cli_retained_artifact_s":32.8080,"unit_test_count":25},"correctness_status":"passed 25 regression tests including the new problem-clause deletion invariant, SAT/UNSAT checker spot checks, and multiple validated repeat-aware benchmark runs; search counts on the profiled hotspot cases remained identical","decision":"keep","notes":"This is a cautious keep. The same-day serial and exact-CLI hotspot A/B comparisons were positive in both orders, but repeat-aware 59-case runs were noisy enough that they should not be compared directly against older archived snapshots. The profiled variant got slower under instrumentation even though its search counts were identical, so future decisions for changes of this size should rely on direct baseline-vs-experiment A/B rather than profiler wall time alone."}
{"timestamp":"2026-03-20T10:31:53+01:00","experiment_id":"2026-03-20-rejected-problem-ternary-analyze-unroll","hypothesis":"Because `analyze()` reason traffic on the dense bottlenecks is overwhelmingly original-clause ternary work, manually handling only non-learnt length-3 reason clauses inside `analyze()` may trim Python loop overhead without changing the search path.","change_summary":"Measured an out-of-tree `ProblemTernaryAnalyzeSolver` that manually unrolled only problem-clause ternary handling inside `analyze()`, then discarded it after focused timing and profiled comparisons failed to show a stable win. No production solver code was changed.","files_changed":["agent_log.md","experiments.jsonl","benchmark_summary.md","next_steps.md"],"datasets":["large/test_6.cnf","special/hard.cnf","medium/test_4.cnf","large/test_10.cnf","large/test_8.cnf","small/test_1.cnf","special/tseitin.cnf"],"commands":["python - <<'PY' ... temporary baseline vs ProblemTernaryAnalyzeSolver over the five hotspot cases in forward and reverse order ... PY","python - <<'PY' ... temporary ProfiledSolver vs ProblemTernaryAnalyzeProfiledSolver on large/test_6.cnf, special/hard.cnf, and large/test_8.cnf ... PY","python -m unittest discover -s tests -v","python satsolver.py small/test_1.cnf /tmp/cycle_sat_reject.txt","python tools/checker.py small/test_1.cnf /tmp/cycle_sat_reject.txt","python satsolver.py special/tseitin.cnf /tmp/cycle_unsat_reject.txt","python tools/checker.py special/tseitin.cnf /tmp/cycle_unsat_reject.txt --bruteforce-var-limit 0"],"metrics_before":{"focused_forward_total_s":27.7240,"focused_reverse_total_s":27.0589,"focused_average_total_s":27.3915,"focused_forward_large_test_6_s":12.2981,"focused_forward_special_hard_s":8.3453,"focused_forward_medium_test_4_s":1.7601,"focused_forward_large_test_10_s":1.7037,"focused_forward_large_test_8_s":3.6169,"profiled_large_test_6_time_s":21.3100,"profiled_large_test_6_decisions":72886,"profiled_large_test_6_conflicts":59201,"profiled_large_test_6_processed_literals":2431409,"profiled_special_hard_time_s":14.0452,"profiled_special_hard_decisions":54245,"profiled_special_hard_conflicts":44619,"profiled_special_hard_processed_literals":1737825,"profiled_large_test_8_time_s":5.2510,"profiled_large_test_8_decisions":21526,"profiled_large_test_8_conflicts":16430,"profiled_large_test_8_processed_literals":838303,"unit_test_count":25},"metrics_after":{"focused_forward_total_s":28.0297,"focused_reverse_total_s":27.0489,"focused_average_total_s":27.5393,"focused_forward_large_test_6_s":13.0645,"focused_forward_special_hard_s":8.2357,"focused_forward_medium_test_4_s":1.6947,"focused_forward_large_test_10_s":1.6690,"focused_forward_large_test_8_s":3.3658,"profiled_large_test_6_time_s":20.7846,"profiled_large_test_6_decisions":72886,"profiled_large_test_6_conflicts":59201,"profiled_large_test_6_processed_literals":2431409,"profiled_special_hard_time_s":14.6237,"profiled_special_hard_decisions":54245,"profiled_special_hard_conflicts":44619,"profiled_special_hard_processed_literals":1737825,"profiled_large_test_8_time_s":5.3102,"profiled_large_test_8_decisions":21526,"profiled_large_test_8_conflicts":16430,"profiled_large_test_8_processed_literals":838303,"unit_test_count":25},"correctness_status":"the temporary solver preserved SAT/UNSAT outcomes on the measured cases, the retained production solver still passed 25 regression tests plus SAT/UNSAT checker spot checks, and the profiled hotspot cases kept identical decisions/conflicts/processed-literal counts","decision":"discard","notes":"This was another narrow `analyze()` unroll that mainly added Python overhead. It helped some per-case timings, but the forward/reverse five-case average still regressed slightly, so the production solver stays unchanged."}
{"timestamp":"2026-03-20T10:47:47+01:00","experiment_id":"2026-03-20-keep-analyze-inline-var-activity","hypothesis":"Because `bump_var_activity()` is still called millions of times inside `analyze()` on the dense hotspots, inlining the variable-activity increment and rare rescale there may cut conflict-analysis overhead while preserving the exact same search path.","change_summary":"Inlined the variable-activity bump logic directly into `analyze()` in both `satsolver.py` and `tools/profile_solver.py`, added a regression covering the rescale path, then validated and benchmarked the change against a temporary reverted baseline.","files_changed":["satsolver.py","tools/profile_solver.py","tests/test_solver_regressions.py","agent_log.md","experiments.jsonl","benchmark_summary.md","next_steps.md","out_extended.txt","out_cli_extended.txt"],"datasets":["large/test_6.cnf","special/hard.cnf","medium/test_4.cnf","large/test_10.cnf","large/test_8.cnf","small/test_1.cnf","special/tseitin.cnf","small","medium","large","special","satlib_subset","satlib_more"],"commands":["python - <<'PY' ... cProfile retained solver on large/test_6.cnf, special/hard.cnf, and large/test_8.cnf ... PY","python - <<'PY' ... temporary AnalyzeActivityInlineSolver vs reverted baseline on the five hotspot cases in forward and reverse order ... PY","python - <<'PY' ... temporary AnalyzeActivityInlineProfiledSolver vs ProfiledSolver on large/test_6.cnf, special/hard.cnf, and large/test_8.cnf ... PY","python - <<'PY' ... exact-CLI hotspot A/B against /tmp/satsolver_baseline_cycle.py in forward and reverse order ... PY","python -m unittest discover -s tests -v","python satsolver.py small/test_1.cnf /tmp/cycle_sat.txt","python tools/checker.py small/test_1.cnf /tmp/cycle_sat.txt","python satsolver.py special/tseitin.cnf /tmp/cycle_unsat.txt","python tools/checker.py special/tseitin.cnf /tmp/cycle_unsat.txt --bruteforce-var-limit 0","python benchmark_suite.py satsolver out_extended.txt small medium large special satlib_subset satlib_more --bruteforce-var-limit 16 --repeat 2","python benchmark_suite.py satsolver out_cli_extended.txt small medium large special satlib_subset satlib_more --bruteforce-var-limit 16 --cli-script satsolver.py --repeat 2"],"metrics_before":{"cprofile_large_test_6_bump_var_activity_tottime_s":0.394,"cprofile_special_hard_bump_var_activity_tottime_s":0.286,"cprofile_large_test_8_bump_var_activity_tottime_s":0.117,"serial_hotspot_forward_total_s":27.3880,"serial_hotspot_reverse_total_s":27.0001,"serial_hotspot_avg_total_s":27.1941,"exact_cli_hotspot_forward_total_s":23.9932,"exact_cli_hotspot_reverse_total_s":24.4198,"exact_cli_hotspot_avg_total_s":24.2065,"profiled_large_test_6_time_s":20.6977,"profiled_large_test_6_decisions":72886,"profiled_large_test_6_conflicts":59201,"profiled_large_test_6_processed_literals":2431409,"profiled_special_hard_time_s":14.3639,"profiled_special_hard_decisions":54245,"profiled_special_hard_conflicts":44619,"profiled_special_hard_processed_literals":1737825,"profiled_large_test_8_time_s":5.2845,"profiled_large_test_8_decisions":21526,"profiled_large_test_8_conflicts":16430,"profiled_large_test_8_processed_literals":838303,"repeat2_inprocess_total_s":30.3709,"repeat2_exact_cli_total_s":32.8080,"unit_test_count":25},"metrics_after":{"serial_hotspot_forward_total_s":27.1947,"serial_hotspot_reverse_total_s":27.0957,"serial_hotspot_avg_total_s":27.1452,"exact_cli_hotspot_forward_total_s":23.9416,"exact_cli_hotspot_reverse_total_s":23.8409,"exact_cli_hotspot_avg_total_s":23.8913,"profiled_large_test_6_time_s":20.4848,"profiled_large_test_6_decisions":72886,"profiled_large_test_6_conflicts":59201,"profiled_large_test_6_processed_literals":2431409,"profiled_special_hard_time_s":14.1469,"profiled_special_hard_decisions":54245,"profiled_special_hard_conflicts":44619,"profiled_special_hard_processed_literals":1737825,"profiled_large_test_8_time_s":5.3028,"profiled_large_test_8_decisions":21526,"profiled_large_test_8_conflicts":16430,"profiled_large_test_8_processed_literals":838303,"repeat2_inprocess_total_s":26.4982,"repeat2_inprocess_measured_total_s":52.9964,"repeat2_exact_cli_total_s":28.7536,"repeat2_exact_cli_measured_total_s":57.5073,"unit_test_count":26},"correctness_status":"passed 26 regression tests including a new analyze-rescale invariant, SAT/UNSAT checker spot checks, and validated 59/59 repeat-aware full-suite runs in both module and exact-CLI modes; the profiled hotspot cases kept identical decisions/conflicts/processed-literal counts","decision":"keep","notes":"This keep is driven by same-search direct A/B, especially on the exact required CLI hotspot slice, plus a much healthier repeat-aware full-suite refresh. The serial hotspot gain was small and one order regressed slightly, so future changes of similar size should still demand direct baseline-vs-experiment A/B rather than relying only on refreshed full-suite numbers."}
