{"timestamp":"2026-03-21T14:01:47+01:00","experiment_id":"2026-03-21-reject-one-pass-backtrack-tail","hypothesis":"Because fresh profiling still shows `backtrack()` as a visible cost center after the earlier kept cleanup, computing the cut point once and clearing the whole trail tail in one pass may reduce same-search backtrack overhead enough to survive the mixed exact-CLI slice and the repeat-aware exact-CLI suite without changing solver behavior.","change_summary":"Collected a fresh retained-baseline `large/test_6.cnf` profile, froze a `HEAD` baseline in `/tmp/satsolver_backtrackslice_baseline.KCqpxd/`, temporarily patched `satsolver_core.py` so `backtrack()` computes one start index, clears the trail tail in one pass, and slices `trail_limits` once, added a regression in `tests/test_solver_regressions.py` for backtrack-to-nonzero-level behavior, validated with `py_compile` and the full unit suite, benchmarked baseline vs candidate on the mixed nine-case exact-CLI hotspot slice and then on the repeat-aware exact-CLI 35-case suite, then reverted the core patch after the broad suite regressed while keeping the new regression test.","files_changed":["agent_log.md","benchmark_summary.md","experiments.jsonl","next_steps.md","tests/test_solver_regressions.py"],"datasets":["large/test_6.cnf","small/test_1.cnf","special/tseitin.cnf","medium/test_3.cnf","medium/test_4.cnf","medium/test_9.cnf","large/test_8.cnf","large/test_10.cnf","special/hard.cnf","small","medium","large","special"],"commands":["python -m cProfile -s tottime satsolver.py large/test_6.cnf /tmp/cycle_backtrack_baseline_out.txt | head -n 35","baseline_dir=$(mktemp -d /tmp/satsolver_backtrackslice_baseline.XXXXXX) && git show HEAD:satsolver.py > \"$baseline_dir/satsolver.py\" && git show HEAD:satsolver_core.py > \"$baseline_dir/satsolver_core.py\" && git show HEAD:satsolver_fast.py > \"$baseline_dir/satsolver_fast.py\" && printf '%s' \"$baseline_dir\"","python -m py_compile satsolver.py satsolver_core.py satsolver_fast.py tests/test_solver_regressions.py","python -m unittest discover -s tests -v","python tools/hotspot_compare.py --baseline-cli-script /tmp/satsolver_backtrackslice_baseline.KCqpxd/satsolver.py --candidate-cli-script satsolver.py small/test_1.cnf special/tseitin.cnf medium/test_3.cnf medium/test_4.cnf medium/test_9.cnf large/test_6.cnf large/test_8.cnf large/test_10.cnf special/hard.cnf","python benchmark_suite.py satsolver /tmp/cycle_backtrack_baseline_cli_repeat2.txt small medium large special --cli-script /tmp/satsolver_backtrackslice_baseline.KCqpxd/satsolver.py --repeat 2","python benchmark_suite.py satsolver /tmp/cycle_backtrack_candidate_cli_repeat2.txt small medium large special --cli-script satsolver.py --repeat 2"],"metrics_before":{"unit_test_count":51,"large_test_6_profile_total_s":36.264,"large_test_6_profile_propagate_tottime_s":20.287,"large_test_6_profile_analyze_tottime_s":3.328,"large_test_6_profile_pick_branch_literal_tottime_s":1.657,"large_test_6_profile_backtrack_tottime_s":0.971,"mixed_slice_two_order_avg_baseline_s":38.9067,"mixed_slice_forward_baseline_s":39.1605,"mixed_slice_reverse_baseline_s":38.6528,"full_suite_repeat2_total_baseline_s":39.2286,"full_suite_repeat2_measured_total_baseline_s":78.4572,"full_suite_repeat2_large_test_6_baseline_s":18.9120,"full_suite_repeat2_special_hard_baseline_s":11.8325},"metrics_after":{"unit_test_count":52,"mixed_slice_two_order_avg_candidate_s":38.1503,"mixed_slice_forward_candidate_s":38.8441,"mixed_slice_reverse_candidate_s":37.4565,"full_suite_repeat2_total_candidate_s":39.7958,"full_suite_repeat2_measured_total_candidate_s":79.5916,"full_suite_repeat2_large_test_6_candidate_s":18.4629,"full_suite_repeat2_special_hard_candidate_s":12.8074,"full_suite_repeat2_medium_test_4_candidate_s":2.6679,"full_suite_repeat2_large_test_10_candidate_s":2.3904},"correctness_status":"the temporary backtrack rewrite compiled cleanly, the repository passed all 52 unit tests with the new regression, mixed-slice outputs stayed checker-valid, and the retained repository returned to the committed solver logic after the broad repeat-aware exact-CLI suite regressed overall","decision":"discard","notes":"This is a hotspot-only mirage. The candidate clearly helped the mixed nine-case slice and `large/test_6.cnf`, but it still lost the repeat-aware 35-case suite because broader regressions on `special/hard.cnf` and `medium/test_4.cnf` outweighed the dense-case gain."}
{"timestamp":"2026-03-21T14:10:29+01:00","experiment_id":"2026-03-21-reject-portfolio-phase32-worker","hypothesis":"Because the exact-CLI portfolio gate is now extremely narrow and mainly protects the `large/test_8.cnf` family, replacing the current phase-biased worker with a more aggressive `seed_phase_bias=True, restart_base=32` worker might improve that one protected case enough to justify itself.","change_summary":"Created `scratch_satsolver_portfolio32.py` as a temporary wrapper over the retained mainline that kept the current default portfolio worker but changed the second worker to run with `seed_phase_bias=True` and `restart_base=32`, validated SAT output on `large/test_8.cnf`, benchmarked retained `satsolver.py` vs the scratch wrapper on exact-CLI `large/test_8.cnf` with `tools/hotspot_compare.py --repeat 2`, then deleted the scratch wrapper immediately after the one-case gate failed catastrophically.","files_changed":["agent_log.md","benchmark_summary.md","experiments.jsonl","next_steps.md"],"datasets":["large/test_8.cnf"],"commands":["python -m py_compile scratch_satsolver_portfolio32.py","python scratch_satsolver_portfolio32.py large/test_8.cnf /tmp/portfolio32_large8.txt","python tools/checker.py large/test_8.cnf /tmp/portfolio32_large8.txt","python tools/hotspot_compare.py --baseline-cli-script satsolver.py --candidate-cli-script scratch_satsolver_portfolio32.py --repeat 2 large/test_8.cnf","python -m py_compile satsolver.py satsolver_core.py satsolver_fast.py","python -m unittest discover -s tests -v"],"metrics_before":{"unit_test_count":52,"large_test_8_two_order_avg_baseline_s":0.4129,"large_test_8_forward_baseline_s":0.3952,"large_test_8_reverse_baseline_s":0.4307},"metrics_after":{"unit_test_count":52,"large_test_8_two_order_avg_candidate_s":5.5657,"large_test_8_forward_candidate_s":5.6692,"large_test_8_reverse_candidate_s":5.4622},"correctness_status":"the temporary wrapper compiled cleanly, produced checker-valid SAT output on large/test_8.cnf, and the retained repository returned to the unchanged committed solver after the one-case exact-CLI gate failed; the retained baseline still passes all 52 regression tests","decision":"discard","notes":"This was a hard early reject. The tuned second worker was not merely neutral; it made the one remaining portfolio-gated family about 13.5x slower, so more aggressive restart retuning for that worker is currently off the table."}
{"timestamp":"2026-03-21T14:22:22+01:00","experiment_id":"2026-03-21-reject-merge-root-propagate-solve","hypothesis":"Because `solve()` currently performs one root `propagate()` call before entering a loop that immediately calls `propagate()` again, removing that standalone pre-loop call may shave exact-CLI startup overhead without changing the real search on larger cases.","change_summary":"Collected a fresh retained-baseline `large/test_6.cnf` profile, froze a `HEAD` baseline in `/tmp/satsolver_rootprop_baseline/`, temporarily patched `satsolver_core.py` to remove the standalone root `propagate()` call from `solve()`, validated with `py_compile`, benchmarked baseline vs candidate on the 12-case SAT-heavy exact-CLI root-hit slice and the mixed nine-case exact-CLI hotspot slice, then reverted the patch immediately after the mixed gate regressed and reran the unit suite plus checker-backed SAT/UNSAT smoke checks.","files_changed":["agent_log.md","benchmark_summary.md","experiments.jsonl","next_steps.md"],"datasets":["large/test_6.cnf","small/test_1.cnf","small/test_5.cnf","small/test_6.cnf","small/test_9.cnf","medium/test_8.cnf","medium/test_9.cnf","large/test_1.cnf","large/test_2.cnf","large/test_5.cnf","large/test_7.cnf","large/test_9.cnf","special/easy.cnf","special/tseitin.cnf","medium/test_3.cnf","medium/test_4.cnf","large/test_8.cnf","large/test_10.cnf","special/hard.cnf"],"commands":["python -m cProfile -s tottime satsolver.py large/test_6.cnf /tmp/current_cycle_profile.txt | head -n 40","mkdir -p /tmp/satsolver_rootprop_baseline && git show HEAD:satsolver.py > /tmp/satsolver_rootprop_baseline/satsolver.py && git show HEAD:satsolver_core.py > /tmp/satsolver_rootprop_baseline/satsolver_core.py && git show HEAD:satsolver_fast.py > /tmp/satsolver_rootprop_baseline/satsolver_fast.py","python -m py_compile satsolver.py satsolver_core.py satsolver_fast.py","python tools/hotspot_compare.py --baseline-cli-script /tmp/satsolver_rootprop_baseline/satsolver.py --candidate-cli-script satsolver.py --repeat 2 small/test_1.cnf small/test_5.cnf small/test_6.cnf small/test_9.cnf medium/test_8.cnf medium/test_9.cnf large/test_1.cnf large/test_2.cnf large/test_5.cnf large/test_7.cnf large/test_9.cnf special/easy.cnf","python tools/hotspot_compare.py --baseline-cli-script /tmp/satsolver_rootprop_baseline/satsolver.py --candidate-cli-script satsolver.py small/test_1.cnf special/tseitin.cnf medium/test_3.cnf medium/test_4.cnf medium/test_9.cnf large/test_6.cnf large/test_8.cnf large/test_10.cnf special/hard.cnf","python -m py_compile satsolver.py satsolver_core.py satsolver_fast.py","python -m unittest discover -s tests -v","python satsolver.py small/test_1.cnf /tmp/current_cycle_sat.txt","python tools/checker.py small/test_1.cnf /tmp/current_cycle_sat.txt","python satsolver.py special/tseitin.cnf /tmp/current_cycle_unsat.txt","python tools/checker.py special/tseitin.cnf /tmp/current_cycle_unsat.txt --bruteforce-var-limit 0"],"metrics_before":{"large_test_6_profile_total_s":34.74,"large_test_6_profile_propagate_tottime_s":19.301,"large_test_6_profile_analyze_tottime_s":3.188,"large_test_6_profile_pick_branch_literal_tottime_s":1.578,"large_test_6_profile_backtrack_tottime_s":0.936,"root_hit_two_order_avg_baseline_s":0.5092,"root_hit_forward_baseline_s":0.5225,"root_hit_reverse_baseline_s":0.4959,"mixed_slice_two_order_avg_baseline_s":36.2592,"mixed_slice_forward_baseline_s":36.4923,"mixed_slice_reverse_baseline_s":36.0261,"mixed_slice_large_test_6_forward_baseline_s":18.39,"mixed_slice_large_test_6_reverse_baseline_s":18.1681},"metrics_after":{"root_hit_two_order_avg_candidate_s":0.5010,"root_hit_forward_candidate_s":0.5270,"root_hit_reverse_candidate_s":0.4750,"mixed_slice_two_order_avg_candidate_s":36.5577,"mixed_slice_forward_candidate_s":36.9874,"mixed_slice_reverse_candidate_s":36.1280,"mixed_slice_large_test_6_forward_candidate_s":18.8554,"mixed_slice_large_test_6_reverse_candidate_s":18.6613,"mixed_slice_large_test_8_forward_candidate_s":0.4054,"mixed_slice_large_test_8_reverse_candidate_s":0.3567,"mixed_slice_special_hard_forward_candidate_s":11.6014,"mixed_slice_special_hard_reverse_candidate_s":11.2535,"unit_test_count":52},"correctness_status":"the temporary patch compiled cleanly, the retained repository passed all 52 unit tests after rollback, and SAT/UNSAT checker smoke checks passed on `small/test_1.cnf` and `special/tseitin.cnf`","decision":"discard","notes":"This is another startup-only mirage. Removing the standalone root `propagate()` call helped the startup-heavy exact-CLI slice slightly, but it still regressed the real mixed exact-CLI gate because the dense UNSAT family, especially `large/test_6.cnf`, moved the wrong way."}
{"timestamp":"2026-03-21T14:36:37+01:00","experiment_id":"2026-03-21-keep-profile-restart-reduction-cadence","hypothesis":"If `tools/profile_solver.py` mirrors the retained zero-activity branching rule and records restart/reduction cadence directly, it can sharpen the backlog by showing whether more work should go into restart/reduction bookkeeping or whether those paths are already too small for another micro-optimization to matter.","change_summary":"Patched `tools/profile_solver.py` so zero-activity branch choices still count but always follow `saved_phase`, added explicit restart and reduction counters plus CLI reporting, mirrored the retained `reduce_database()` logic inside the profiler wrapper, added profile-tool regressions for zero-activity branch polarity, restart stats, and reduction stats in `tests/test_profile_solver.py`, validated with `py_compile` and the full unit suite, and reran the hotspot profiler on the main hard cases.","files_changed":["agent_log.md","benchmark_summary.md","experiments.jsonl","next_steps.md","tests/test_profile_solver.py","tools/profile_solver.py"],"datasets":["small/test_4.cnf","large/test_6.cnf","special/hard.cnf","medium/test_4.cnf","large/test_8.cnf"],"commands":["python -m py_compile tools/profile_solver.py tests/test_profile_solver.py","python -m unittest discover -s tests -v","python tools/profile_solver.py large/test_6.cnf special/hard.cnf medium/test_4.cnf large/test_8.cnf"],"metrics_before":{"unit_test_count":52},"metrics_after":{"unit_test_count":55,"large_test_6_restarts":253,"large_test_6_avg_conflicts_per_restart":226.4,"large_test_6_avg_restart_decision_level":10.16,"large_test_6_avg_restart_trail":33.5,"large_test_6_reductions":260,"large_test_6_avg_live_learnts_per_reduction":550.25,"large_test_6_avg_locked_clauses_per_reduction":23.94,"large_test_6_avg_candidate_clauses_per_reduction":447.42,"special_hard_restarts":218,"special_hard_avg_conflicts_per_restart":204.04,"special_hard_reductions":186,"special_hard_avg_locked_clauses_per_reduction":24.69,"special_hard_avg_candidate_clauses_per_reduction":469.92,"medium_test_4_restarts":61,"medium_test_4_avg_conflicts_per_restart":166.82,"medium_test_4_reductions":66,"medium_test_4_avg_locked_clauses_per_reduction":22.73,"medium_test_4_avg_candidate_clauses_per_reduction":320.55,"large_test_8_restarts":92,"large_test_8_avg_conflicts_per_restart":177.39,"large_test_8_avg_restart_decision_level":16.3,"large_test_8_avg_restart_trail":51.83,"large_test_8_reductions":102,"large_test_8_avg_locked_clauses_per_reduction":33.07,"large_test_8_avg_candidate_clauses_per_reduction":315.26},"correctness_status":"the profiler upgrade compiled cleanly, the repository passed all 55 unit tests after adding the new profile regressions, the hotspot profiler ran cleanly on the four main hard cases, and the production solver stayed unchanged","decision":"keep","notes":"This is a tooling keep, not a solver-core keep. The new counters show reductions are mostly operating on a few hundred deletable candidates while only a few dozen learnt clauses are locked, so future `reduce_database()` work should focus on classifier/search effects rather than more locked-set bookkeeping cleanup."}
{"timestamp":"2026-03-21T14:44:43+01:00","experiment_id":"2026-03-21-reject-pick-branch-while-scan","hypothesis":"Because the last kept branch-scan cleanup came from removing repeated attribute lookups, replacing the remaining `for range(...)` machinery in `pick_branch_literal()` with a manual `while` loop may trim enough branch-selection overhead to help the exact-CLI path without changing branch policy or tie behavior.","change_summary":"Collected a fresh retained-baseline `large/test_6.cnf` profile, froze a `HEAD` baseline in `/tmp/satsolver_pickbranchwhile_baseline/`, temporarily patched `pick_branch_literal()` in `satsolver_core.py` to use a manual `while variable <= num_vars` scan with the same `>` tie policy, validated with `py_compile` and the full unit suite, benchmarked baseline vs candidate on the mixed nine-case exact-CLI hotspot slice, then reverted the patch immediately after the mixed gate regressed and reran full validation plus checker-backed SAT/UNSAT smoke checks.","files_changed":["agent_log.md","benchmark_summary.md","experiments.jsonl","next_steps.md"],"datasets":["large/test_6.cnf","small/test_1.cnf","special/tseitin.cnf","medium/test_3.cnf","medium/test_4.cnf","medium/test_9.cnf","large/test_8.cnf","large/test_10.cnf","special/hard.cnf"],"commands":["python -m cProfile -s tottime satsolver.py large/test_6.cnf /tmp/current_cycle_profile.txt | head -n 30","mkdir -p /tmp/satsolver_pickbranchwhile_baseline && git show HEAD:satsolver.py > /tmp/satsolver_pickbranchwhile_baseline/satsolver.py && git show HEAD:satsolver_core.py > /tmp/satsolver_pickbranchwhile_baseline/satsolver_core.py && git show HEAD:satsolver_fast.py > /tmp/satsolver_pickbranchwhile_baseline/satsolver_fast.py","python -m py_compile satsolver.py satsolver_core.py satsolver_fast.py","python -m unittest discover -s tests -v","python tools/hotspot_compare.py --baseline-cli-script /tmp/satsolver_pickbranchwhile_baseline/satsolver.py --candidate-cli-script satsolver.py small/test_1.cnf special/tseitin.cnf medium/test_3.cnf medium/test_4.cnf medium/test_9.cnf large/test_6.cnf large/test_8.cnf large/test_10.cnf special/hard.cnf","python -m py_compile satsolver.py satsolver_core.py satsolver_fast.py","python -m unittest discover -s tests -v","python satsolver.py small/test_1.cnf /tmp/current_cycle_sat.txt","python tools/checker.py small/test_1.cnf /tmp/current_cycle_sat.txt","python satsolver.py special/tseitin.cnf /tmp/current_cycle_unsat.txt","python tools/checker.py special/tseitin.cnf /tmp/current_cycle_unsat.txt --bruteforce-var-limit 0"],"metrics_before":{"large_test_6_profile_total_s":27.938,"large_test_6_profile_propagate_tottime_s":15.213,"large_test_6_profile_analyze_tottime_s":2.652,"large_test_6_profile_pick_branch_literal_tottime_s":1.292,"mixed_slice_two_order_avg_baseline_s":28.0431,"mixed_slice_forward_baseline_s":28.0849,"mixed_slice_reverse_baseline_s":28.0013,"large_test_6_forward_baseline_s":13.9161,"large_test_6_reverse_baseline_s":13.9364,"special_hard_forward_baseline_s":9.2612,"special_hard_reverse_baseline_s":9.1085,"medium_test_4_forward_baseline_s":1.9543,"medium_test_4_reverse_baseline_s":1.8855},"metrics_after":{"unit_test_count":55,"mixed_slice_two_order_avg_candidate_s":29.6058,"mixed_slice_forward_candidate_s":29.5404,"mixed_slice_reverse_candidate_s":29.6711,"large_test_6_forward_candidate_s":14.4373,"large_test_6_reverse_candidate_s":14.5136,"special_hard_forward_candidate_s":9.8463,"special_hard_reverse_candidate_s":9.9682,"medium_test_4_forward_candidate_s":2.0481,"medium_test_4_reverse_candidate_s":2.1457,"large_test_8_forward_candidate_s":0.3560,"large_test_8_reverse_candidate_s":0.3091},"correctness_status":"the temporary patch compiled cleanly, passed all 55 unit tests, stayed checker-valid on SAT and UNSAT smoke cases, and was reverted immediately after the mixed exact-CLI hotspot gate regressed decisively overall","decision":"discard","notes":"This is a clean mixed-gate reject. The previous kept local-alias cleanup in `pick_branch_literal()` does not extend to swapping the scan loop from `for range(...)` to `while`; the dense UNSAT cases all moved the wrong way in both orders."}
