{"timestamp":"2026-03-20T05:03:19+01:00","experiment_id":"2026-03-20-lazy-multiprocessing-import","hypothesis":"Because the local portfolio gate matches only a tiny subset of formulas, moving the multiprocessing import behind solve_cnf_portfolio() should reduce exact-CLI startup overhead on most runs without affecting solver behavior.","change_summary":"Removed the top-level multiprocessing import, imported it lazily inside solve_cnf_portfolio(), and kept the portfolio path otherwise unchanged.","files_changed":["satsolver.py","out_extended.txt","out_cli_extended.txt","agent_log.md","experiments.jsonl","benchmark_summary.md","next_steps.md"],"datasets":["large/test_8.cnf","large","small","medium","special","satlib_subset","satlib_more"],"commands":["python -m unittest discover -s tests -v","python satsolver.py large/test_8.cnf /tmp/cycle9_portfolio_sat.txt","python tools/checker.py large/test_8.cnf /tmp/cycle9_portfolio_sat.txt","python - <<'PY' ... repeated import timing using python -c 'import satsolver' ... PY","python benchmark_suite.py satsolver /tmp/pre_cli_small.txt large --bruteforce-var-limit 0 --cli-script satsolver.py","python benchmark_suite.py satsolver /tmp/post_cli_large.txt large --bruteforce-var-limit 0 --cli-script satsolver.py","python benchmark_suite.py satsolver /tmp/post_cli_full.txt small medium large special satlib_subset satlib_more --bruteforce-var-limit 16 --cli-script satsolver.py","python benchmark_suite.py satsolver /tmp/post_inprocess_full.txt small medium large special satlib_subset satlib_more --bruteforce-var-limit 16"],"metrics_before":{"import_mean_s":0.03461,"import_median_s":0.03184,"large_cli_total_s":17.6655,"large_test_8_cli_s":0.3306,"exact_cli_full_suite_total_s":33.6033,"best_inprocess_validated_total_s":30.3215},"metrics_after":{"import_mean_s":0.02719,"import_median_s":0.02248,"large_cli_total_s":17.3190,"large_test_8_cli_s":0.3206,"exact_cli_full_suite_total_s":33.0018,"fresh_inprocess_validated_total_s":29.4438},"correctness_status":"passed 15 regression tests, large/test_8 CLI SAT checker validation, and validated 59/59 exact-CLI plus in-process benchmark runs","decision":"keep","notes":"The exact-CLI path is the main beneficiary because the solver now avoids paying multiprocessing import cost on cases that never touch the portfolio path. The local portfolio gate still matches only large/test_8.cnf."}
{"timestamp":"2026-03-20T05:06:24+01:00","experiment_id":"2026-03-20-manual-slotted-clause","hypothesis":"Replacing the slotted dataclass-based Clause object with a hand-written slotted class should reduce import/startup overhead and may also make clause allocation cheaper, improving exact-CLI time without changing solver behavior.","change_summary":"Removed the dataclasses import, replaced Clause with a manual __slots__ class with the same fields and constructor defaults, and revalidated both benchmark views.","files_changed":["satsolver.py","out_extended.txt","out_cli_extended.txt","agent_log.md","experiments.jsonl","benchmark_summary.md","next_steps.md"],"datasets":["small/test_1.cnf","large/test_8.cnf","large","small","medium","special","satlib_subset","satlib_more"],"commands":["python -m unittest discover -s tests -v","python satsolver.py small/test_1.cnf /tmp/cycle10_sat.txt","python tools/checker.py small/test_1.cnf /tmp/cycle10_sat.txt","python satsolver.py large/test_8.cnf /tmp/cycle10_large8.txt","python tools/checker.py large/test_8.cnf /tmp/cycle10_large8.txt","python - <<'PY' ... repeated import timing using python -c 'import satsolver' ... PY","python benchmark_suite.py satsolver /tmp/pre_cycle10_cli_large.txt large --bruteforce-var-limit 0 --cli-script satsolver.py","python benchmark_suite.py satsolver /tmp/pre_cycle10_inproc_large.txt large --bruteforce-var-limit 0","python benchmark_suite.py satsolver /tmp/post_cycle10_cli_large.txt large --bruteforce-var-limit 0 --cli-script satsolver.py","python benchmark_suite.py satsolver /tmp/post_cycle10_inproc_large.txt large --bruteforce-var-limit 0","python benchmark_suite.py satsolver /tmp/post_cycle10_cli_full.txt small medium large special satlib_subset satlib_more --bruteforce-var-limit 16 --cli-script satsolver.py","python benchmark_suite.py satsolver /tmp/post_cycle10_inproc_full.txt small medium large special satlib_subset satlib_more --bruteforce-var-limit 16","python benchmark_suite.py satsolver /tmp/post_cycle10_inproc_repeat.txt small medium large special satlib_subset satlib_more --bruteforce-var-limit 16"],"metrics_before":{"import_mean_s":0.01929,"import_median_s":0.01890,"large_cli_total_s":17.2038,"large_inprocess_total_s":16.3092,"exact_cli_full_suite_total_s":33.0018,"best_inprocess_validated_total_s":29.4438},"metrics_after":{"import_mean_s":0.00726,"import_median_s":0.00592,"large_cli_total_s":17.1859,"large_inprocess_total_s":16.8758,"exact_cli_full_suite_total_s":31.5073,"first_inprocess_full_suite_total_s":29.7688,"repeat_inprocess_full_suite_total_s":28.7549},"correctness_status":"passed 15 regression tests, SAT checker validation on small/test_1.cnf and large/test_8.cnf, and validated 59/59 exact-CLI plus in-process benchmark runs","decision":"keep","notes":"The largest visible benefit is startup/import cost, but the repeated in-process full-suite run also improved, so the change appears to be a low-risk net win rather than a pure CLI-only tweak."}
{"timestamp":"2026-03-20T05:14:57+01:00","experiment_id":"2026-03-20-literal-value-cache","hypothesis":"Maintaining a direct per-literal truth-value cache should remove repeated variable/sign lookups and multiplications from propagation and root simplification, improving dense UNSAT-heavy cases without changing the search path.","change_summary":"Added a per-literal truth-value cache updated in enqueue() and backtrack(), switched literal_value() and propagate() to read from that cache, added a regression test for cache coherence across enqueue/backtrack, and revalidated both benchmark views.","files_changed":["satsolver.py","tests/test_solver_regressions.py","out_extended.txt","out_cli_extended.txt","agent_log.md","experiments.jsonl","benchmark_summary.md","next_steps.md"],"datasets":["small/test_1.cnf","large/test_8.cnf","large/test_6.cnf","special/hard.cnf","medium/test_4.cnf","small","medium","large","special","satlib_subset","satlib_more"],"commands":["python -m unittest discover -s tests -v","python satsolver.py small/test_1.cnf /tmp/cycle11_sat.txt","python tools/checker.py small/test_1.cnf /tmp/cycle11_sat.txt","python satsolver.py large/test_8.cnf /tmp/cycle11_large8.txt","python tools/checker.py large/test_8.cnf /tmp/cycle11_large8.txt","python tools/profile_solver.py large/test_6.cnf special/hard.cnf medium/test_4.cnf","python benchmark_suite.py satsolver /tmp/post_cycle11_inproc_full_seq.txt small medium large special satlib_subset satlib_more --bruteforce-var-limit 16","python benchmark_suite.py satsolver /tmp/post_cycle11_cli_full_seq.txt small medium large special satlib_subset satlib_more --bruteforce-var-limit 16 --cli-script satsolver.py"],"metrics_before":{"profiled_hotspot_total_runtime_s":30.2643,"large_test_6_profile_time_s":16.8129,"special_hard_profile_time_s":11.2271,"medium_test_4_profile_time_s":2.2243,"large_test_6_decisions":72886,"large_test_6_conflicts":59201,"large_test_6_processed_literals":2431409,"special_hard_decisions":54245,"special_hard_conflicts":44619,"special_hard_processed_literals":1737825,"medium_test_4_decisions":13510,"medium_test_4_conflicts":10995,"medium_test_4_processed_literals":396463,"best_inprocess_validated_total_s":28.7549,"exact_cli_full_suite_total_s":31.5073},"metrics_after":{"profiled_hotspot_total_runtime_s":29.5402,"large_test_6_profile_time_s":16.4005,"special_hard_profile_time_s":10.9486,"medium_test_4_profile_time_s":2.1911,"large_test_6_decisions":72886,"large_test_6_conflicts":59201,"large_test_6_processed_literals":2431409,"special_hard_decisions":54245,"special_hard_conflicts":44619,"special_hard_processed_literals":1737825,"medium_test_4_decisions":13510,"medium_test_4_conflicts":10995,"medium_test_4_processed_literals":396463,"best_inprocess_validated_total_s":27.9763,"exact_cli_full_suite_total_s":30.5932},"correctness_status":"passed 16 regression tests, SAT checker validation on small/test_1.cnf and large/test_8.cnf, and validated 59/59 exact-CLI plus in-process benchmark runs","decision":"keep","notes":"The unchanged search counters on the profiled dense UNSAT slice make this a clean hot-path overhead reduction rather than a heuristic change. The added regression test protects the new cache against future assignment/backtrack coherence bugs."}
{"timestamp":"2026-03-20T05:23:14+01:00","experiment_id":"2026-03-20-inplace-learnt-minimization","hypothesis":"If analyze() stops allocating a fresh minimized learnt list and folds backtrack-level selection plus LBD computation into a single final pass, conflict-analysis overhead should drop on the dense UNSAT-heavy cases without changing the search path.","change_summary":"Reworked minimize_learnt() to compact the learnt clause in place, replaced the separate best-level scan and compute_lbd() pass with one prepare_learnt_clause() pass, and revalidated both benchmark views.","files_changed":["satsolver.py","out_extended.txt","out_cli_extended.txt","agent_log.md","experiments.jsonl","benchmark_summary.md","next_steps.md"],"datasets":["small/test_1.cnf","special/tseitin.cnf","large/test_8.cnf","large/test_6.cnf","special/hard.cnf","medium/test_4.cnf","small","medium","large","special","satlib_subset","satlib_more"],"commands":["python -m unittest discover -s tests -v","python satsolver.py small/test_1.cnf /tmp/cycle12_sat.txt","python tools/checker.py small/test_1.cnf /tmp/cycle12_sat.txt","python satsolver.py special/tseitin.cnf /tmp/cycle12_unsat.txt","python tools/checker.py special/tseitin.cnf /tmp/cycle12_unsat.txt --bruteforce-var-limit 0","python satsolver.py large/test_8.cnf /tmp/cycle12_large8.txt","python tools/checker.py large/test_8.cnf /tmp/cycle12_large8.txt","python tools/profile_solver.py large/test_6.cnf special/hard.cnf medium/test_4.cnf","python - <<'PY' ... cProfile solve_cnf_serial on large/test_6.cnf before and after ... PY","python benchmark_suite.py satsolver /tmp/post_cycle12_inproc_clean.txt small medium large special satlib_subset satlib_more --bruteforce-var-limit 16","python benchmark_suite.py satsolver /tmp/post_cycle12_cli_clean.txt small medium large special satlib_subset satlib_more --bruteforce-var-limit 16 --cli-script satsolver.py"],"metrics_before":{"profiled_hotspot_total_runtime_s":31.7,"large_test_6_profile_time_s":17.7136,"special_hard_profile_time_s":11.7149,"medium_test_4_profile_time_s":2.2715,"large_test_6_decisions":72886,"large_test_6_conflicts":59201,"large_test_6_processed_literals":2431409,"special_hard_decisions":54245,"special_hard_conflicts":44619,"special_hard_processed_literals":1737825,"medium_test_4_decisions":13510,"medium_test_4_conflicts":10995,"medium_test_4_processed_literals":396463,"large_test_6_cprofile_total_s":32.181,"large_test_6_cprofile_analyze_cum_s":5.987,"large_test_6_cprofile_minimize_cum_s":0.933,"best_inprocess_validated_total_s":27.9763,"exact_cli_full_suite_total_s":30.5932},"metrics_after":{"profiled_hotspot_total_runtime_s":29.605,"large_test_6_profile_time_s":16.5008,"special_hard_profile_time_s":10.9579,"medium_test_4_profile_time_s":2.1463,"large_test_6_decisions":72886,"large_test_6_conflicts":59201,"large_test_6_processed_literals":2431409,"special_hard_decisions":54245,"special_hard_conflicts":44619,"special_hard_processed_literals":1737825,"medium_test_4_decisions":13510,"medium_test_4_conflicts":10995,"medium_test_4_processed_literals":396463,"large_test_6_cprofile_total_s":29.649,"large_test_6_cprofile_analyze_cum_s":5.356,"large_test_6_cprofile_minimize_cum_s":0.708,"large_test_6_cprofile_prepare_learnt_clause_cum_s":0.308,"best_inprocess_validated_total_s":27.3023,"exact_cli_full_suite_total_s":30.108},"correctness_status":"passed 16 regression tests, SAT checker validation on small/test_1.cnf, special/tseitin.cnf, and large/test_8.cnf, and validated 59/59 exact-CLI plus in-process benchmark runs","decision":"keep","notes":"The unchanged search counters on the dense UNSAT slice make this a conflict-analysis overhead reduction rather than a heuristic change. The clean in-process rerun mattered here because one earlier parallel benchmark attempt came out noisier and slower."}
{"timestamp":"2026-03-20T05:32:44+01:00","experiment_id":"2026-03-20-rejected-keep-ternary-learnts","hypothesis":"Because the remaining hard cases are pure 3-SAT UNSAT families, preserving learnt clauses of length 3 during reduce_database() might keep more useful short deductions alive and improve overall runtime.","change_summary":"Temporarily changed reduce_database() to retain learnt clauses of size <= 3 instead of only <= 2, validated correctness, benchmarked a dense UNSAT slice plus a SAT-like counterexample case, then reverted after the rule catastrophically hurt large/test_8.cnf.","files_changed":["satsolver.py","agent_log.md","experiments.jsonl","benchmark_summary.md","next_steps.md"],"datasets":["large/test_6.cnf","special/hard.cnf","medium/test_4.cnf","large/test_10.cnf","large/test_8.cnf","small/test_1.cnf","special/tseitin.cnf"],"commands":["python -m unittest discover -s tests -v","python satsolver.py small/test_1.cnf /tmp/cycle13_sat.txt","python tools/checker.py small/test_1.cnf /tmp/cycle13_sat.txt","python satsolver.py special/tseitin.cnf /tmp/cycle13_unsat.txt","python tools/checker.py special/tseitin.cnf /tmp/cycle13_unsat.txt --bruteforce-var-limit 0","python - <<'PY' ... serial timing script over large/test_6.cnf, special/hard.cnf, medium/test_4.cnf, large/test_10.cnf, large/test_8.cnf ... PY","python -m unittest discover -s tests -v","python satsolver.py small/test_1.cnf /tmp/cycle13_revert_sat.txt","python tools/checker.py small/test_1.cnf /tmp/cycle13_revert_sat.txt","python satsolver.py special/tseitin.cnf /tmp/cycle13_revert_unsat.txt","python tools/checker.py special/tseitin.cnf /tmp/cycle13_revert_unsat.txt --bruteforce-var-limit 0","python satsolver.py large/test_8.cnf /tmp/cycle13_revert_large8.txt","python tools/checker.py large/test_8.cnf /tmp/cycle13_revert_large8.txt","python - <<'PY' ... post-revert serial sanity timing on large/test_6.cnf and large/test_8.cnf ... PY"],"metrics_before":{"dense_unsat_four_case_total_s":25.9122,"large_test_6_serial_s":13.3445,"special_hard_serial_s":8.8621,"medium_test_4_serial_s":1.9022,"large_test_10_serial_s":1.8034,"large_test_8_serial_s":3.7121,"mixed_five_case_total_s":29.6243},"metrics_after":{"experimental_dense_unsat_four_case_total_s":24.3444,"large_test_6_serial_s":14.2395,"special_hard_serial_s":6.5355,"medium_test_4_serial_s":2.1911,"large_test_10_serial_s":1.3783,"large_test_8_serial_s":29.3577,"experimental_mixed_five_case_total_s":53.7021,"post_revert_large_test_6_serial_s":13.2304,"post_revert_large_test_8_serial_s":3.5765},"correctness_status":"passed 16 regression tests and SAT/UNSAT checker spot checks before and after revert; experiment was discarded for performance, not correctness","decision":"discard","notes":"Learnt-clause size alone is too crude a retention heuristic. Keeping ternary learnts helped some dense UNSAT cases but was catastrophic on the SAT-like large/test_8.cnf family, so the solver was restored to the previous retained baseline."}
{"timestamp":"2026-03-20T05:41:11+01:00","experiment_id":"2026-03-20-rejected-watcher-compaction","hypothesis":"Replacing swap-and-pop watcher removal with a read/write compaction pass should reduce list-mutation overhead in propagate() while preserving watched-clause behavior.","change_summary":"Rewrote the watcher-removal path in propagate() to compact the current watcher list in place with read/write indices, validated correctness, then reverted after the changed traversal order perturbed the search path and regressed both dense UNSAT and mixed SAT/UNSAT slices.","files_changed":["satsolver.py","agent_log.md","experiments.jsonl","benchmark_summary.md","next_steps.md"],"datasets":["large/test_6.cnf","special/hard.cnf","medium/test_4.cnf","large/test_10.cnf","large/test_8.cnf","small/test_1.cnf","special/tseitin.cnf"],"commands":["python - <<'PY' ... baseline serial timing script over large/test_6.cnf, special/hard.cnf, medium/test_4.cnf, large/test_10.cnf, large/test_8.cnf ... PY","python -m unittest discover -s tests -v","python satsolver.py small/test_1.cnf /tmp/cycle14_sat.txt","python tools/checker.py small/test_1.cnf /tmp/cycle14_sat.txt","python satsolver.py special/tseitin.cnf /tmp/cycle14_unsat.txt","python tools/checker.py special/tseitin.cnf /tmp/cycle14_unsat.txt --bruteforce-var-limit 0","python satsolver.py large/test_8.cnf /tmp/cycle14_large8.txt","python tools/checker.py large/test_8.cnf /tmp/cycle14_large8.txt","python tools/profile_solver.py large/test_6.cnf special/hard.cnf medium/test_4.cnf","python - <<'PY' ... experimental serial timing script over large/test_6.cnf, special/hard.cnf, medium/test_4.cnf, large/test_10.cnf, large/test_8.cnf ... PY","python -m unittest discover -s tests -v","python satsolver.py small/test_1.cnf /tmp/cycle14_revert_sat.txt","python tools/checker.py small/test_1.cnf /tmp/cycle14_revert_sat.txt","python satsolver.py special/tseitin.cnf /tmp/cycle14_revert_unsat.txt","python tools/checker.py special/tseitin.cnf /tmp/cycle14_revert_unsat.txt --bruteforce-var-limit 0","python satsolver.py large/test_8.cnf /tmp/cycle14_revert_large8.txt","python tools/checker.py large/test_8.cnf /tmp/cycle14_revert_large8.txt","python - <<'PY' ... post-revert serial sanity timing on large/test_6.cnf and large/test_8.cnf ... PY","python tools/profile_solver.py large/test_6.cnf special/hard.cnf medium/test_4.cnf"],"metrics_before":{"dense_four_case_total_s":25.7604,"mixed_five_case_total_s":29.3953,"large_test_6_serial_s":13.4074,"special_hard_serial_s":8.6575,"medium_test_4_serial_s":1.9321,"large_test_10_serial_s":1.7634,"large_test_8_serial_s":3.6349,"baseline_large_test_6_decisions":72886,"baseline_large_test_6_conflicts":59201,"baseline_large_test_6_processed_literals":2431409,"baseline_special_hard_decisions":54245,"baseline_special_hard_conflicts":44619,"baseline_special_hard_processed_literals":1737825,"baseline_medium_test_4_decisions":13510,"baseline_medium_test_4_conflicts":10995,"baseline_medium_test_4_processed_literals":396463},"metrics_after":{"experimental_dense_four_case_total_s":28.8592,"experimental_mixed_five_case_total_s":37.3648,"large_test_6_serial_s":13.9106,"special_hard_serial_s":10.779,"medium_test_4_serial_s":1.9115,"large_test_10_serial_s":2.2581,"large_test_8_serial_s":8.5056,"experimental_large_test_6_decisions":72629,"experimental_large_test_6_conflicts":58977,"experimental_large_test_6_processed_literals":2404568,"experimental_special_hard_decisions":65618,"experimental_special_hard_conflicts":53590,"experimental_special_hard_processed_literals":2076568,"experimental_medium_test_4_decisions":11204,"experimental_medium_test_4_conflicts":9056,"experimental_medium_test_4_processed_literals":325604,"post_revert_large_test_6_serial_s":13.0119,"post_revert_large_test_8_serial_s":3.733,"post_revert_large_test_6_decisions":72886,"post_revert_large_test_6_conflicts":59201,"post_revert_large_test_6_processed_literals":2431409},"correctness_status":"passed 16 regression tests and SAT/UNSAT checker spot checks before and after revert; experiment was discarded because it perturbed search behavior and regressed performance","decision":"discard","notes":"The compaction logic preserved SAT correctness but did not preserve effective propagation order closely enough. Future watcher-loop work should avoid reordering clause handling unless that tradeoff is explicitly intended and benchmarked."}
