{"timestamp":"2026-03-20T01:59:31+01:00","experiment_id":"2026-03-20-xor-unsat-presolver","hypothesis":"Detecting XOR equations encoded in CNF will short-circuit Tseitin-style contradictions and lower total benchmark runtime without breaking satisfiable instances.","change_summary":"Ported an XOR contradiction detector into solve_cnf before the CDCL search and added brute-force regression tests for consistent and inconsistent XOR systems.","files_changed":["satsolver.py","tests/test_solver_regressions.py","out_extended.txt","agent_log.md","experiments.jsonl","benchmark_summary.md","next_steps.md"],"datasets":["special/tseitin.cnf","special/hard.cnf","large/test_6.cnf","large/test_8.cnf","medium/test_4.cnf","small","medium","large","special","satlib_subset","satlib_more"],"commands":["python -m unittest discover -s tests -v","python satsolver.py small/test_1.cnf /tmp/satsolver_cli_sat.txt","python satsolver.py special/tseitin.cnf /tmp/satsolver_cli_unsat.txt","python benchmark_suite.py satsolver out_extended.txt small medium large special satlib_subset satlib_more"],"metrics_before":{"focused_cases_total_runtime_s":43.3847,"full_suite_total_runtime_s":50.2815,"special_suite_total_runtime_s":21.5404,"special_tseitin_runtime_s":9.9430},"metrics_after":{"focused_cases_total_runtime_s":35.6815,"full_suite_total_runtime_s":40.8923,"special_suite_total_runtime_s":11.3451,"special_tseitin_runtime_s":0.0004},"correctness_status":"passed regression tests, CLI spot checks, and 59/59 benchmark semantic checks","decision":"keep","notes":"The detector only fires when a clause family cleanly implies XOR parity constraints of width 3..6, then uses GF(2) elimination to prove inconsistency."}
{"timestamp":"2026-03-20T02:15:24+01:00","experiment_id":"2026-03-20-propagation-hot-path","hypothesis":"If watched-literal propagation uses precomputed literal lookup tables instead of repeated abs()/lit_index() calls, the solver will keep the same search behavior but spend less time per propagated literal.","change_summary":"Added a profiling helper under tools/, profiled the hard cases, rejected restart_base and next_reduce tuning after measured sweeps, then rewrote the propagation hot path to use precomputed per-literal variable/sign/watch-index tables.","files_changed":["satsolver.py","tools/profile_solver.py","out_extended.txt","agent_log.md","experiments.jsonl","benchmark_summary.md","next_steps.md"],"datasets":["large/test_6.cnf","special/hard.cnf","large/test_8.cnf","medium/test_4.cnf","small","medium","large","special","satlib_subset","satlib_more"],"commands":["python tools/profile_solver.py large/test_6.cnf special/hard.cnf large/test_8.cnf medium/test_4.cnf","python -m unittest discover -s tests -v","python satsolver.py special/tseitin.cnf /tmp/satsolver_hot_unsat.txt","python benchmark_suite.py satsolver out_extended.txt small medium large special satlib_subset satlib_more"],"metrics_before":{"focused_cases_total_runtime_s":35.6815,"full_suite_total_runtime_s":40.8923,"medium_suite_total_runtime_s":3.2377,"large_suite_total_runtime_s":25.2193,"special_suite_total_runtime_s":11.3451,"large_test_6_runtime_s":17.0858,"special_hard_runtime_s":11.2043,"large_test_8_runtime_s":4.8993,"medium_test_4_runtime_s":2.3157},"metrics_after":{"focused_cases_total_runtime_s":32.7784,"full_suite_total_runtime_s":38.6404,"medium_suite_total_runtime_s":3.1531,"large_suite_total_runtime_s":23.6089,"special_suite_total_runtime_s":10.7629,"large_test_6_runtime_s":16.2129,"special_hard_runtime_s":10.6399,"large_test_8_runtime_s":4.4817,"medium_test_4_runtime_s":2.2794},"correctness_status":"passed regression tests, CLI UNSAT spot check, and 59/59 benchmark semantic checks","decision":"keep","notes":"Profile counters for conflicts, decisions, processed literals, propagations, restarts, and reductions stayed unchanged on the bottleneck cases, indicating the speedup came from cheaper propagation rather than heuristic drift. Restart-base and next-reduce sweeps did not beat the 64/256 defaults on the dominant cases."}
{"timestamp":"2026-03-20T02:21:23+01:00","experiment_id":"2026-03-20-ternary-propagation-fast-path","hypothesis":"Because 83.62% of the local benchmark clauses are ternary, a dedicated ternary watched-literal path should reduce propagation cost without changing the CDCL search path.","change_summary":"Measured clause-length distribution across the benchmark suite, confirmed the main bottlenecks are pure 3-SAT, and added a specialized ternary branch in propagate to avoid the generic replacement loop for length-3 clauses.","files_changed":["satsolver.py","out_extended.txt","agent_log.md","experiments.jsonl","benchmark_summary.md","next_steps.md"],"datasets":["small","medium","large","special","satlib_subset","satlib_more","large/test_6.cnf","special/hard.cnf","large/test_8.cnf","medium/test_4.cnf"],"commands":["python -m unittest discover -s tests -v","python satsolver.py small/test_1.cnf /tmp/satsolver_ternary_sat.txt","python satsolver.py special/tseitin.cnf /tmp/satsolver_ternary_unsat.txt","python tools/profile_solver.py large/test_6.cnf special/hard.cnf large/test_8.cnf medium/test_4.cnf","python benchmark_suite.py satsolver out_extended.txt small medium large special satlib_subset satlib_more"],"metrics_before":{"focused_cases_total_runtime_s":32.7784,"full_suite_total_runtime_s":38.6404,"medium_suite_total_runtime_s":3.1531,"large_suite_total_runtime_s":23.6089,"special_suite_total_runtime_s":10.7629,"large_test_6_runtime_s":16.2129,"special_hard_runtime_s":10.6399,"large_test_8_runtime_s":4.4817,"medium_test_4_runtime_s":2.2794},"metrics_after":{"focused_cases_total_runtime_s":31.3878,"full_suite_total_runtime_s":35.9565,"medium_suite_total_runtime_s":3.0701,"large_suite_total_runtime_s":22.0496,"special_suite_total_runtime_s":9.8684,"large_test_6_runtime_s":15.3465,"special_hard_runtime_s":9.7430,"large_test_8_runtime_s":4.0927,"medium_test_4_runtime_s":2.2056},"correctness_status":"passed regression tests, SAT/UNSAT CLI spot checks, and 59/59 benchmark semantic checks","decision":"keep","notes":"The profiler still reported the same decisions, conflicts, processed literals, propagations, restarts, and reductions on the bottleneck cases after the patch, supporting the conclusion that the gain came from cheaper ternary propagation. Cumulative full-suite improvement from the first archived snapshot is now 50.2815s -> 35.9565s."}
{"timestamp":"2026-03-20T02:32:40+01:00","experiment_id":"2026-03-20-validation-tooling","hypothesis":"A reusable checker plus stronger DIMACS regression coverage will catch output-format and parser-edge-case bugs earlier, making future solver optimization cycles safer even if solver runtime itself does not change.","change_summary":"Added tools/checker.py for SAT/UNSAT output validation, hardened parse_dimacs against clauses before the header, multiple problem lines, and literals outside the declared range, and added regression tests for parser and checker behavior.","files_changed":["satsolver.py","tools/checker.py","tests/test_validation_tools.py","out_extended.txt","agent_log.md","experiments.jsonl","benchmark_summary.md","next_steps.md"],"datasets":["/tmp/tiny_unsat.cnf","small/test_1.cnf","special/tseitin.cnf","small","medium","large","special","satlib_subset","satlib_more"],"commands":["python -m unittest discover -s tests -v","python satsolver.py small/test_1.cnf /tmp/check_sat.txt","python tools/checker.py small/test_1.cnf /tmp/check_sat.txt","python satsolver.py /tmp/tiny_unsat.cnf /tmp/check_unsat_small.txt","python tools/checker.py /tmp/tiny_unsat.cnf /tmp/check_unsat_small.txt","python satsolver.py special/tseitin.cnf /tmp/check_unsat_large.txt","python tools/checker.py special/tseitin.cnf /tmp/check_unsat_large.txt --bruteforce-var-limit 0","python benchmark_suite.py satsolver out_extended.txt small medium large special satlib_subset satlib_more"],"metrics_before":{"best_known_full_suite_total_runtime_s":35.9565},"metrics_after":{"regression_guard_full_suite_total_runtime_s":37.2362},"correctness_status":"passed 11 regression tests, SAT checker CLI validation, tiny-UNSAT brute-force checker validation, large-UNSAT format validation, and 59/59 benchmark semantic checks","decision":"keep","notes":"Two propagate-loop micro-optimizations were tested during this run and discarded after targeted timing regressions; they are not present in the final code. The benchmark rerun is treated as a regression guard, not a new best-known speed result, because solver runtime logic was intentionally unchanged in the final patch set."}
{"timestamp":"2026-03-20T02:37:53+01:00","experiment_id":"2026-03-20-benchmark-harness-validation","hypothesis":"If benchmark_suite.py validates actual written solver outputs through tools/checker.py and reports solved_correctly counts explicitly, benchmark results will become more trustworthy and useful for future optimization cycles.","change_summary":"Integrated checker-based validation into benchmark_suite.py, added a configurable brute-force UNSAT limit, recorded per-case validation labels, and updated folder/overall summaries to include solved_correctly, SAT, UNSAT, and error counts.","files_changed":["benchmark_suite.py","out_extended.txt","agent_log.md","experiments.jsonl","benchmark_summary.md","next_steps.md"],"datasets":["small","medium","large","special","satlib_subset","satlib_more"],"commands":["python -m unittest discover -s tests -v","python benchmark_suite.py satsolver /tmp/bench_small_validated.txt small --bruteforce-var-limit 4","python benchmark_suite.py satsolver out_extended.txt small medium large special satlib_subset satlib_more --bruteforce-var-limit 16","python benchmark_suite.py satsolver /tmp/out_validated_repeat.txt small medium large special satlib_subset satlib_more --bruteforce-var-limit 16"],"metrics_before":{"previous_best_known_full_suite_total_runtime_s":35.9565},"metrics_after":{"validated_harness_run_total_runtime_s":34.1905,"validated_harness_repeat_total_runtime_s":35.6674,"solved_correctly":59,"sat":28,"unsat":31,"errors":0},"correctness_status":"passed regression tests and produced validated benchmark reports with 59/59 cases marked solved correctly","decision":"keep","notes":"Solver search logic was intentionally unchanged this cycle. The two validated harness runs (34.1905s and 35.6674s) were both below the previous 35.9565s snapshot, but are recorded as measurement results from the upgraded harness rather than as a claimed solver-speed optimization."}
{"timestamp":"2026-03-20T02:44:27+01:00","experiment_id":"2026-03-20-exact-cli-benchmark-mode","hypothesis":"An optional exact-CLI mode in benchmark_suite.py will provide a realistic assignment-path runtime measurement while preserving the same checker-based correctness guarantees used by the in-process harness.","change_summary":"Added --cli-script and --python-executable options to benchmark_suite.py, implemented subprocess-based case execution through the exact solver CLI, and added a regression test that exercises SAT and UNSAT validation through the real satsolver.py command-line interface.","files_changed":["benchmark_suite.py","tests/test_benchmark_suite.py","out_cli_extended.txt","agent_log.md","experiments.jsonl","benchmark_summary.md","next_steps.md"],"datasets":["small","medium","large","special","satlib_subset","satlib_more"],"commands":["python -m unittest discover -s tests -v","python benchmark_suite.py satsolver /tmp/bench_small_cli.txt small --bruteforce-var-limit 4 --cli-script satsolver.py","python benchmark_suite.py satsolver out_cli_extended.txt small medium large special satlib_subset satlib_more --bruteforce-var-limit 16 --cli-script satsolver.py"],"metrics_before":{"best_in_process_validated_total_runtime_s":34.1905},"metrics_after":{"exact_cli_validated_total_runtime_s":43.0869,"solved_correctly":59,"sat":28,"unsat":31,"errors":0,"large_test_6_runtime_s":16.7068,"special_hard_runtime_s":11.0301,"large_test_8_runtime_s":4.6123,"medium_test_4_runtime_s":2.2514},"correctness_status":"passed 12 regression tests and completed a 59/59 validated exact-CLI benchmark run","decision":"keep","notes":"The exact-CLI path is intentionally slower than the in-process harness because it includes Python process startup and output-file I/O. Relative to the current best in-process validated snapshot, the CLI run added about 8.8964s across 59 cases, or roughly 0.1508s per case."}
{"timestamp":"2026-03-20T02:50:27+01:00","experiment_id":"2026-03-20-rejected-phase-bias-seeding","hypothesis":"Initializing saved phases from clause polarity bias may reduce search on the hard 3-SAT cases by replacing the all-positive default branch phase.","change_summary":"Tested seeding saved_phase from phase_bias during clause observation, validated correctness, then reverted the change after targeted and full-suite regressions.","files_changed":["satsolver.py","agent_log.md","experiments.jsonl","benchmark_summary.md","next_steps.md"],"datasets":["large/test_6.cnf","special/hard.cnf","large/test_8.cnf","medium/test_4.cnf","small","medium","large","special","satlib_subset","satlib_more"],"commands":["python -m unittest discover -s tests -v","python satsolver.py small/test_1.cnf /tmp/polarity_sat.txt","python tools/checker.py small/test_1.cnf /tmp/polarity_sat.txt","python satsolver.py /tmp/tiny_unsat.cnf /tmp/polarity_unsat.txt","python tools/checker.py /tmp/tiny_unsat.cnf /tmp/polarity_unsat.txt","python benchmark_suite.py satsolver /tmp/out_phase_bias_eval.txt small medium large special satlib_subset satlib_more --bruteforce-var-limit 16"],"metrics_before":{"best_in_process_validated_total_runtime_s":34.1905,"large_test_6_runtime_s":14.3542,"special_hard_runtime_s":9.4234,"large_test_8_runtime_s":3.9839,"medium_test_4_runtime_s":1.9977},"metrics_after":{"experimental_full_suite_total_runtime_s":38.5826,"large_test_6_runtime_s":17.9793,"special_hard_runtime_s":12.6070,"large_test_8_runtime_s":0.2990,"medium_test_4_runtime_s":2.7649},"correctness_status":"passed regression tests and validation checks, but benchmarked worse overall","decision":"discard","notes":"The experiment created a strong positive effect on one hard SAT instance but regressed the UNSAT-heavy slices too much to keep. The final repository state reverts this heuristic."}
{"timestamp":"2026-03-20T02:57:21+01:00","experiment_id":"2026-03-20-rejected-lazy-heap-branch-picker","hypothesis":"Replacing the linear scan in pick_branch_literal() with a lazy activity heap may cut decision-selection overhead on the current hotspot instances.","change_summary":"Implemented a lazy max-heap for branch-variable selection, validated correctness, then reverted it after focused hotspot regressions.","files_changed":["satsolver.py","agent_log.md","experiments.jsonl","benchmark_summary.md","next_steps.md"],"datasets":["large/test_6.cnf","special/hard.cnf","large/test_8.cnf","medium/test_4.cnf","small/test_1.cnf","/tmp/tiny_unsat.cnf"],"commands":["python -m unittest discover -s tests -v","python satsolver.py small/test_1.cnf /tmp/rollback_sat.txt","python tools/checker.py small/test_1.cnf /tmp/rollback_sat.txt","python satsolver.py /tmp/tiny_unsat.cnf /tmp/rollback_unsat.txt","python tools/checker.py /tmp/tiny_unsat.cnf /tmp/rollback_unsat.txt","python -u - <<'PY' ... focused timing script over large/test_6.cnf, special/hard.cnf, large/test_8.cnf, medium/test_4.cnf ... PY"],"metrics_before":{"post_revert_hotspot_total_runtime_s":29.4054,"post_revert_large_test_6_runtime_s":14.1826,"post_revert_special_hard_runtime_s":9.3919,"post_revert_large_test_8_runtime_s":3.8716,"post_revert_medium_test_4_runtime_s":1.9593},"metrics_after":{"experimental_hotspot_total_runtime_s":40.1544,"large_test_6_runtime_s":19.0991,"special_hard_runtime_s":12.6647,"large_test_8_runtime_s":5.6688,"medium_test_4_runtime_s":2.7218},"correctness_status":"passed regression tests and validation checks, but benchmarked worse overall and was reverted","decision":"discard","notes":"Heap maintenance and stale-entry churn cost more than the original linear scan in this Python solver, so the retained solver configuration is unchanged."}
{"timestamp":"2026-03-20T03:04:20+01:00","experiment_id":"2026-03-20-loop-bound-caching-and-decision-level","hypothesis":"Making decision level explicit and caching trail/watcher lengths inside propagate() should reduce Python bookkeeping overhead without changing the solver's search behavior.","change_summary":"Added an explicit decision_level field, stopped recomputing len(self.trail_limits) on every enqueue/backtrack/conflict check, and cached trail/watch-list lengths in propagate() so the inner loops avoid repeated len(...) calls while they mutate those lists in known ways.","files_changed":["satsolver.py","out_extended.txt","out_cli_extended.txt","agent_log.md","experiments.jsonl","benchmark_summary.md","next_steps.md"],"datasets":["large/test_6.cnf","special/hard.cnf","large/test_8.cnf","medium/test_4.cnf","small","medium","large","special","satlib_subset","satlib_more","small/test_1.cnf","/tmp/tiny_unsat.cnf"],"commands":["python -m unittest discover -s tests -v","python satsolver.py small/test_1.cnf /tmp/level_sat.txt","python tools/checker.py small/test_1.cnf /tmp/level_sat.txt","python satsolver.py /tmp/tiny_unsat.cnf /tmp/level_unsat.txt","python tools/checker.py /tmp/tiny_unsat.cnf /tmp/level_unsat.txt","python -u - <<'PY' ... focused timing script over large/test_6.cnf, special/hard.cnf, large/test_8.cnf, medium/test_4.cnf ... PY","python benchmark_suite.py satsolver out_extended.txt small medium large special satlib_subset satlib_more --bruteforce-var-limit 16","python benchmark_suite.py satsolver out_cli_extended.txt small medium large special satlib_subset satlib_more --bruteforce-var-limit 16 --cli-script satsolver.py"],"metrics_before":{"focused_cases_total_runtime_s":29.5186,"best_in_process_validated_total_runtime_s":34.1905,"exact_cli_validated_total_runtime_s":43.0869,"large_test_6_runtime_s":14.3542,"special_hard_runtime_s":9.4234,"large_test_8_runtime_s":3.9839,"medium_test_4_runtime_s":1.9977},"metrics_after":{"focused_cases_total_runtime_s":29.3325,"best_in_process_validated_total_runtime_s":33.1525,"exact_cli_validated_total_runtime_s":36.6379,"large_test_6_runtime_s":13.9059,"special_hard_runtime_s":9.2406,"large_test_8_runtime_s":3.7718,"medium_test_4_runtime_s":1.9209,"solved_correctly":59,"sat":28,"unsat":31,"errors":0},"correctness_status":"passed 12 regression tests, SAT/UNSAT checker spot checks, a focused hotspot rerun, and both validated 59/59 benchmark harnesses","decision":"keep","notes":"The change is a pure bookkeeping optimization rather than a heuristic shift, and it improved both the in-process and exact-CLI measurements. The exact-CLI gain was especially large because the hottest UNSAT cases also benefited, dropping the CLI total by 6.4490s."}
