{"timestamp":"2026-03-20T12:33:27+01:00","experiment_id":"2026-03-20-reject-unit-first-watch-tail","hypothesis":"Because units massively outnumber conflicts after failed ternary and large watched-clause replacement scans, flipping those no-replacement tails to check `UNASSIGNED` before conflict may cut Python branching overhead without changing the search path.","change_summary":"Measured an out-of-tree `UnitFirstPropSolver`, verified on profiled hard cases that it preserved decisions/conflicts/processed-literal counts, temporarily patched `satsolver.py` and `tools/profile_solver.py`, then reverted the branch after a stricter same-day repo-vs-baseline exact-CLI hotspot A/B came back mixed and slightly negative overall.","files_changed":["agent_log.md","experiments.jsonl","benchmark_summary.md","next_steps.md"],"datasets":["large/test_6.cnf","special/hard.cnf","medium/test_4.cnf","large/test_10.cnf","large/test_8.cnf","small/test_1.cnf","special/tseitin.cnf"],"commands":["python tools/profile_solver.py large/test_6.cnf special/hard.cnf medium/test_4.cnf large/test_8.cnf","python /tmp/unit_first_prop_eval.py","python /tmp/unit_first_profile_compare.py","python /tmp/unit_first_cli_ab.py","python -m py_compile satsolver.py tools/profile_solver.py","python -m unittest discover -s tests -v","python satsolver.py small/test_1.cnf /tmp/unit_first_sat.txt","python tools/checker.py small/test_1.cnf /tmp/unit_first_sat.txt","python satsolver.py special/tseitin.cnf /tmp/unit_first_unsat.txt","python tools/checker.py special/tseitin.cnf /tmp/unit_first_unsat.txt --bruteforce-var-limit 0","python satsolver.py large/test_8.cnf /tmp/unit_first_large_sat.txt","python tools/checker.py large/test_8.cnf /tmp/unit_first_large_sat.txt","python /tmp/unit_first_cli_repo_ab.py","python -m py_compile satsolver.py tools/profile_solver.py","python -m unittest discover -s tests -v","python satsolver.py small/test_1.cnf /tmp/unit_first_revert_sat.txt","python tools/checker.py small/test_1.cnf /tmp/unit_first_revert_sat.txt","python satsolver.py special/tseitin.cnf /tmp/unit_first_revert_unsat.txt","python tools/checker.py special/tseitin.cnf /tmp/unit_first_revert_unsat.txt --bruteforce-var-limit 0"],"metrics_before":{"serial_hotspot_forward_total_s":28.4036,"serial_hotspot_reverse_total_s":31.5306,"serial_hotspot_avg_total_s":29.9671,"temp_exact_cli_forward_total_s":25.0929,"temp_exact_cli_reverse_total_s":25.5556,"temp_exact_cli_avg_total_s":25.3243,"repo_exact_cli_forward_total_s":25.9713,"repo_exact_cli_reverse_total_s":25.5206,"repo_exact_cli_avg_total_s":25.7459,"profiled_large_test_6_time_s":21.5759,"profiled_large_test_6_decisions":72886,"profiled_large_test_6_conflicts":59201,"profiled_large_test_6_processed_literals":2431409,"profiled_special_hard_time_s":15.3495,"profiled_special_hard_decisions":54245,"profiled_special_hard_conflicts":44619,"profiled_special_hard_processed_literals":1737825,"profiled_large_test_8_time_s":5.5221,"profiled_large_test_8_decisions":21526,"profiled_large_test_8_conflicts":16430,"profiled_large_test_8_processed_literals":838303,"unit_test_count":27},"metrics_after":{"serial_hotspot_forward_total_s":28.9679,"serial_hotspot_reverse_total_s":28.9801,"serial_hotspot_avg_total_s":28.9740,"temp_exact_cli_forward_total_s":25.0728,"temp_exact_cli_reverse_total_s":24.8564,"temp_exact_cli_avg_total_s":24.9646,"repo_exact_cli_forward_total_s":25.5458,"repo_exact_cli_reverse_total_s":26.3185,"repo_exact_cli_avg_total_s":25.9322,"profiled_large_test_6_time_s":22.2770,"profiled_large_test_6_decisions":72886,"profiled_large_test_6_conflicts":59201,"profiled_large_test_6_processed_literals":2431409,"profiled_special_hard_time_s":14.8010,"profiled_special_hard_decisions":54245,"profiled_special_hard_conflicts":44619,"profiled_special_hard_processed_literals":1737825,"profiled_large_test_8_time_s":5.3649,"profiled_large_test_8_decisions":21526,"profiled_large_test_8_conflicts":16430,"profiled_large_test_8_processed_literals":838303,"unit_test_count":27},"correctness_status":"the temporary branch preserved exact decisions/conflicts/processed-literal counts on the main profiled cases, passed 27 regression tests plus SAT and UNSAT checker spot checks before evaluation, and after reverting the retained solver again passed the same 27 tests plus checker spot checks on `small/test_1.cnf` and `special/tseitin.cnf`","decision":"discard","notes":"This is another propagation measurement warning. A unit-first tail reorder looked mildly positive in one temporary exact-CLI wrapper run, but the stricter same-day repo-vs-baseline exact-CLI hotspot A/B came back mixed and slightly negative overall, so the production solver stays on the retained baseline."}
{"timestamp":"2026-03-20T12:45:44+01:00","experiment_id":"2026-03-20-reject-static-ternary-watch-order","hypothesis":"Because the retained profiler says the hard bottlenecks are overwhelmingly original-clause ternary traffic, statically reordering each ternary problem clause so the most phase-bias-aligned literals are watched may reduce future watched-clause work enough to beat the retained baseline.","change_summary":"Measured two out-of-tree ternary problem-clause ordering heuristics, then discarded the family after the seemingly promising `WatchBestScoreSolver` still regressed the real exact-CLI hotspot slice despite strong serial gains and checker-clean SAT/UNSAT spot checks.","files_changed":["agent_log.md","experiments.jsonl","benchmark_summary.md","next_steps.md"],"datasets":["large/test_6.cnf","special/hard.cnf","medium/test_4.cnf","large/test_10.cnf","large/test_8.cnf","small/test_1.cnf","special/tseitin.cnf"],"commands":["python /tmp/ternary_order_eval.py","python -m py_compile /tmp/satsolver_watch_best_candidate.py","python /tmp/watch_best_cli_ab.py","python /tmp/satsolver_watch_best_candidate.py small/test_1.cnf /tmp/watchbest_sat.txt","python tools/checker.py small/test_1.cnf /tmp/watchbest_sat.txt","python /tmp/satsolver_watch_best_candidate.py special/tseitin.cnf /tmp/watchbest_unsat.txt","python tools/checker.py special/tseitin.cnf /tmp/watchbest_unsat.txt --bruteforce-var-limit 0","python /tmp/satsolver_watch_best_candidate.py large/test_8.cnf /tmp/watchbest_large8.txt","python tools/checker.py large/test_8.cnf /tmp/watchbest_large8.txt"],"metrics_before":{"watch_best_serial_forward_total_s":26.7563,"watch_best_serial_reverse_total_s":26.2390,"watch_best_serial_avg_total_s":26.4977,"candidate_best_serial_forward_total_s":26.3339,"candidate_best_serial_reverse_total_s":26.8103,"candidate_best_serial_avg_total_s":26.5721,"watch_best_exact_cli_forward_total_s":23.7741,"watch_best_exact_cli_reverse_total_s":23.4966,"watch_best_exact_cli_avg_total_s":23.6354},"metrics_after":{"watch_best_serial_forward_total_s":24.3859,"watch_best_serial_reverse_total_s":24.7625,"watch_best_serial_avg_total_s":24.5742,"watch_best_serial_forward_large_test_6_s":13.5418,"watch_best_serial_forward_special_hard_s":6.4533,"watch_best_serial_forward_medium_test_4_s":1.5912,"watch_best_serial_forward_large_test_10_s":2.7040,"watch_best_serial_forward_large_test_8_s":0.0956,"watch_best_serial_reverse_large_test_6_s":13.5304,"watch_best_serial_reverse_special_hard_s":6.7534,"watch_best_serial_reverse_medium_test_4_s":1.5636,"watch_best_serial_reverse_large_test_10_s":2.8129,"watch_best_serial_reverse_large_test_8_s":0.1022,"candidate_best_serial_forward_total_s":38.4724,"candidate_best_serial_reverse_total_s":37.6784,"candidate_best_serial_avg_total_s":38.0754,"watch_best_exact_cli_forward_total_s":24.4516,"watch_best_exact_cli_reverse_total_s":26.4515,"watch_best_exact_cli_avg_total_s":25.4516,"watch_best_exact_cli_forward_large_test_6_s":13.6258,"watch_best_exact_cli_forward_special_hard_s":6.4320,"watch_best_exact_cli_forward_medium_test_4_s":1.5417,"watch_best_exact_cli_forward_large_test_10_s":2.6795,"watch_best_exact_cli_forward_large_test_8_s":0.1726,"watch_best_exact_cli_reverse_large_test_6_s":14.6885,"watch_best_exact_cli_reverse_special_hard_s":7.1502,"watch_best_exact_cli_reverse_medium_test_4_s":1.6015,"watch_best_exact_cli_reverse_large_test_10_s":2.8228,"watch_best_exact_cli_reverse_large_test_8_s":0.1885},"correctness_status":"both temporary clause-order candidates produced checker-valid SAT and UNSAT outputs on spot checks, and the retained production solver remained unchanged","decision":"discard","notes":"Raw phase-bias-driven static watch ordering is too family-specific. Watching the highest-score literals helped `special/hard.cnf` and crushed serial/CLI `large/test_8.cnf`, but it made `large/test_6.cnf` and `large/test_10.cnf` much worse and still lost the exact-CLI hotspot average overall. Putting the highest-score literal in the candidate slot was catastrophic."}
{"timestamp":"2026-03-20T12:59:32+01:00","experiment_id":"2026-03-20-reject-problem-ternary-fast-path","hypothesis":"Because the retained profiler says active ternary watch traffic on the hard UNSAT bottlenecks is overwhelmingly original-clause work, hoisting non-learnt ternary clauses into their own fast path ahead of the learnt/deleted/general watcher logic may cut enough overhead to beat the retained baseline without changing traversal order.","change_summary":"Measured an out-of-tree `ProblemTernaryFastSolver` that gave non-learnt ternary clauses a dedicated early propagation branch, then discarded it after the serial five-case hotspot slice regressed clearly in both orders.","files_changed":["agent_log.md","experiments.jsonl","benchmark_summary.md","next_steps.md"],"datasets":["large/test_6.cnf","special/hard.cnf","medium/test_4.cnf","large/test_10.cnf","large/test_8.cnf","small/test_1.cnf","special/tseitin.cnf"],"commands":["PYTHONPATH=. python scratch/exp_problem_ternary_fast.py","python -m unittest discover -s tests -v","python satsolver.py small/test_1.cnf /tmp/cycle_sat.txt","python tools/checker.py small/test_1.cnf /tmp/cycle_sat.txt","python satsolver.py special/tseitin.cnf /tmp/cycle_unsat.txt","python tools/checker.py special/tseitin.cnf /tmp/cycle_unsat.txt --bruteforce-var-limit 0"],"metrics_before":{"serial_hotspot_forward_total_s":29.4549,"serial_hotspot_reverse_total_s":29.3033,"serial_hotspot_avg_total_s":29.3791,"serial_hotspot_forward_large_test_6_s":13.6153,"serial_hotspot_forward_special_hard_s":8.8187,"serial_hotspot_forward_medium_test_4_s":1.7538,"serial_hotspot_forward_large_test_10_s":1.7851,"serial_hotspot_forward_large_test_8_s":3.4821,"serial_hotspot_reverse_large_test_8_s":3.5502,"serial_hotspot_reverse_large_test_10_s":1.7622,"serial_hotspot_reverse_medium_test_4_s":1.8487,"serial_hotspot_reverse_special_hard_s":8.3494,"serial_hotspot_reverse_large_test_6_s":13.7927,"unit_test_count":27},"metrics_after":{"serial_hotspot_forward_total_s":29.7187,"serial_hotspot_reverse_total_s":31.1485,"serial_hotspot_avg_total_s":30.4336,"serial_hotspot_forward_large_test_6_s":13.1510,"serial_hotspot_forward_special_hard_s":9.0637,"serial_hotspot_forward_medium_test_4_s":1.8856,"serial_hotspot_forward_large_test_10_s":1.8575,"serial_hotspot_forward_large_test_8_s":3.7609,"serial_hotspot_reverse_large_test_8_s":4.0964,"serial_hotspot_reverse_large_test_10_s":1.9135,"serial_hotspot_reverse_medium_test_4_s":2.2988,"serial_hotspot_reverse_special_hard_s":9.5655,"serial_hotspot_reverse_large_test_6_s":13.2743,"unit_test_count":27},"correctness_status":"the temporary branch produced checker-valid SAT and UNSAT spot-check outputs, and the retained production solver still passed all 27 regression tests plus SAT/UNSAT checker spot checks after the experiment script was removed","decision":"discard","notes":"This narrows the propagation target rather than widening it. A dedicated non-learnt ternary fast path did help `large/test_6.cnf`, but it made `special/hard.cnf`, `medium/test_4.cnf`, `large/test_10.cnf`, and `large/test_8.cnf` worse, so I rejected it before spending an exact-CLI suite run."}
{"timestamp":"2026-03-20T13:07:33+01:00","experiment_id":"2026-03-20-reject-no-copy-learnt-storage","hypothesis":"Because `analyze()` already builds a fresh learnt-clause list on every conflict, removing the extra `list(literals)` copy in `add_learnt_clause()` may shave allocation overhead without changing the search path.","change_summary":"Measured an out-of-tree `NoCopyLearntSolver` that stored the freshly-built learnt clause list directly in `Clause` instead of copying it again, then discarded it after the serial five-case hotspot slice split by order and regressed slightly on average.","files_changed":["agent_log.md","experiments.jsonl","benchmark_summary.md","next_steps.md"],"datasets":["large/test_6.cnf","special/hard.cnf","medium/test_4.cnf","large/test_10.cnf","large/test_8.cnf","small/test_1.cnf","special/tseitin.cnf"],"commands":["PYTHONPATH=. python scratch/exp_no_copy_learnt.py","python -m unittest discover -s tests -v","python satsolver.py small/test_1.cnf /tmp/cycle_sat.txt","python tools/checker.py small/test_1.cnf /tmp/cycle_sat.txt","python satsolver.py special/tseitin.cnf /tmp/cycle_unsat.txt","python tools/checker.py special/tseitin.cnf /tmp/cycle_unsat.txt --bruteforce-var-limit 0"],"metrics_before":{"serial_hotspot_forward_total_s":29.0194,"serial_hotspot_reverse_total_s":29.4177,"serial_hotspot_avg_total_s":29.2186,"serial_hotspot_forward_large_test_6_s":12.8255,"serial_hotspot_forward_special_hard_s":8.8504,"serial_hotspot_forward_medium_test_4_s":1.8816,"serial_hotspot_forward_large_test_10_s":1.8288,"serial_hotspot_forward_large_test_8_s":3.6330,"serial_hotspot_reverse_large_test_8_s":3.6292,"serial_hotspot_reverse_large_test_10_s":1.7451,"serial_hotspot_reverse_medium_test_4_s":1.7928,"serial_hotspot_reverse_special_hard_s":8.8920,"serial_hotspot_reverse_large_test_6_s":13.3586,"unit_test_count":27},"metrics_after":{"serial_hotspot_forward_total_s":29.9574,"serial_hotspot_reverse_total_s":29.0453,"serial_hotspot_avg_total_s":29.5014,"serial_hotspot_forward_large_test_6_s":13.2436,"serial_hotspot_forward_special_hard_s":9.3780,"serial_hotspot_forward_medium_test_4_s":1.8983,"serial_hotspot_forward_large_test_10_s":1.8042,"serial_hotspot_forward_large_test_8_s":3.6334,"serial_hotspot_reverse_large_test_8_s":3.6701,"serial_hotspot_reverse_large_test_10_s":1.7291,"serial_hotspot_reverse_medium_test_4_s":1.8686,"serial_hotspot_reverse_special_hard_s":8.6763,"serial_hotspot_reverse_large_test_6_s":13.1012,"unit_test_count":27},"correctness_status":"the out-of-tree benchmark verified SAT models with `model_satisfies()` on the hotspot slice, and the retained production solver still passed all 27 regression tests plus SAT/UNSAT checker spot checks after the scratch experiment was removed","decision":"discard","notes":"Even this very cheap-looking conflict-path cleanup was too weak to trust. The hotspot slice split by order and regressed slightly on average, so I rejected it before spending an exact-CLI suite run."}
{"timestamp":"2026-03-20T13:15:51+01:00","experiment_id":"2026-03-20-reject-problem-ternary-blocker-cache","hypothesis":"Because the retained profiler says the hard bottlenecks are dominated by original-clause ternary visits, a per-clause blocker literal for ternary problem clauses may let satisfied clauses bail out before the usual watched-slot normalization and propagation bookkeeping, reducing real propagation cost without changing the search path.","change_summary":"First ruled out duplicate-clause preprocessing by scanning the hotspot cases and full 59-case corpus and finding zero duplicate clauses, then measured an out-of-tree `ProblemTernaryBlockerSolver` that cached one known-satisfied literal per ternary problem clause and checked it before the normal ternary watcher path; discarded it after it catastrophically regressed the serial five-case hotspot slice.","files_changed":["agent_log.md","experiments.jsonl","benchmark_summary.md","next_steps.md"],"datasets":["large/test_6.cnf","special/hard.cnf","medium/test_4.cnf","large/test_10.cnf","large/test_8.cnf","small/test_1.cnf","special/tseitin.cnf","small","medium","large","special","satlib_subset","satlib_more"],"commands":["python - <<'PY' ... duplicate-clause scan on hotspot cases ... PY","python - <<'PY' ... duplicate-clause scan on the full 59-case corpus ... PY","python tools/profile_solver.py large/test_6.cnf special/hard.cnf medium/test_4.cnf large/test_8.cnf","python - <<'PY' ... refreshed cProfile on large/test_6.cnf, special/hard.cnf, and large/test_8.cnf ... PY","PYTHONPATH=. python scratch/exp_problem_ternary_blocker.py","python -m unittest discover -s tests -v","python satsolver.py small/test_1.cnf /tmp/cycle_sat.txt","python tools/checker.py small/test_1.cnf /tmp/cycle_sat.txt","python satsolver.py special/tseitin.cnf /tmp/cycle_unsat.txt","python tools/checker.py special/tseitin.cnf /tmp/cycle_unsat.txt --bruteforce-var-limit 0"],"metrics_before":{"serial_hotspot_forward_total_s":28.6845,"serial_hotspot_reverse_total_s":31.2633,"serial_hotspot_avg_total_s":29.9739,"serial_hotspot_forward_large_test_6_s":12.8951,"serial_hotspot_forward_special_hard_s":8.5803,"serial_hotspot_forward_medium_test_4_s":1.8636,"serial_hotspot_forward_large_test_10_s":1.7761,"serial_hotspot_forward_large_test_8_s":3.5694,"serial_hotspot_reverse_large_test_8_s":3.4577,"serial_hotspot_reverse_large_test_10_s":1.7603,"serial_hotspot_reverse_medium_test_4_s":1.8543,"serial_hotspot_reverse_special_hard_s":9.3545,"serial_hotspot_reverse_large_test_6_s":14.8364,"duplicate_extra_clauses_hotspot":0,"duplicate_extra_clauses_full_suite":0,"unit_test_count":27},"metrics_after":{"serial_hotspot_forward_total_s":64.5447,"serial_hotspot_reverse_total_s":71.4741,"serial_hotspot_avg_total_s":68.0094,"serial_hotspot_forward_large_test_6_s":24.4723,"serial_hotspot_forward_special_hard_s":12.8553,"serial_hotspot_forward_medium_test_4_s":2.4427,"serial_hotspot_forward_large_test_10_s":1.9860,"serial_hotspot_forward_large_test_8_s":22.7884,"serial_hotspot_reverse_large_test_8_s":24.5450,"serial_hotspot_reverse_large_test_10_s":2.2608,"serial_hotspot_reverse_medium_test_4_s":2.6889,"serial_hotspot_reverse_special_hard_s":15.0191,"serial_hotspot_reverse_large_test_6_s":26.9603,"unit_test_count":27},"correctness_status":"the out-of-tree benchmark stayed SAT/UNSAT-correct on the hotspot slice, and the retained production solver still passed all 27 regression tests plus SAT/UNSAT checker spot checks after the scratch experiment was removed","decision":"discard","notes":"This is a strong negative result. A naive blocker-style satisfied-literal cache for original ternary clauses is not just unhelpful in pure Python; it catastrophically regressed both SAT-like and UNSAT-heavy hotspot families."}
