{"timestamp":"2026-03-20T05:53:49+01:00","experiment_id":"2026-03-20-rejected-literal-var-abs-replacement","hypothesis":"Replacing repeated hot-loop abs() calls with the existing literal_var[...] lookup table might reduce Python overhead in backtrack(), analyze(), and learnt-clause cleanup without changing search behavior.","change_summary":"Temporarily replaced abs(literal) and abs(reason_literal) with literal_var[...] indexing in backtrack(), minimize_learnt(), prepare_learnt_clause(), and analyze(), validated correctness, benchmarked a dense hotspot slice, and then reverted because the wall-clock results stayed flat to slightly worse despite lower Python call counts.","files_changed":["satsolver.py","agent_log.md","experiments.jsonl","benchmark_summary.md","next_steps.md"],"datasets":["large/test_6.cnf","special/hard.cnf","medium/test_4.cnf","large/test_10.cnf","large/test_8.cnf","small/test_1.cnf","special/tseitin.cnf"],"commands":["python - <<'PY' ... synthetic timeit for abs(literal) vs literal_var[literal] ... PY","python - <<'PY' ... baseline serial timing script over large/test_6.cnf, special/hard.cnf, medium/test_4.cnf, large/test_10.cnf, large/test_8.cnf ... PY","python -m unittest discover -s tests -v","python satsolver.py small/test_1.cnf /tmp/cycle15_sat.txt","python tools/checker.py small/test_1.cnf /tmp/cycle15_sat.txt","python satsolver.py special/tseitin.cnf /tmp/cycle15_unsat.txt","python tools/checker.py special/tseitin.cnf /tmp/cycle15_unsat.txt --bruteforce-var-limit 0","python satsolver.py large/test_8.cnf /tmp/cycle15_large8.txt","python tools/checker.py large/test_8.cnf /tmp/cycle15_large8.txt","python - <<'PY' ... clean experimental serial timing script over large/test_6.cnf, special/hard.cnf, medium/test_4.cnf, large/test_10.cnf, large/test_8.cnf ... PY","python - <<'PY' ... cProfile solve_cnf_serial on large/test_6.cnf under the experimental solver ... PY","python -m unittest discover -s tests -v","python satsolver.py small/test_1.cnf /tmp/cycle15_revert_sat.txt","python tools/checker.py small/test_1.cnf /tmp/cycle15_revert_sat.txt","python satsolver.py special/tseitin.cnf /tmp/cycle15_revert_unsat.txt","python tools/checker.py special/tseitin.cnf /tmp/cycle15_revert_unsat.txt --bruteforce-var-limit 0","python satsolver.py large/test_8.cnf /tmp/cycle15_revert_large8.txt","python tools/checker.py large/test_8.cnf /tmp/cycle15_revert_large8.txt","python - <<'PY' ... post-revert serial sanity timing on large/test_6.cnf, special/hard.cnf, large/test_8.cnf ... PY","python tools/profile_solver.py large/test_6.cnf special/hard.cnf medium/test_4.cnf"],"metrics_before":{"synthetic_abs_time_s":0.6841103500046302,"synthetic_literal_var_lookup_time_s":0.6456926499959081,"dense_four_case_total_s":25.1159,"mixed_five_case_total_s":28.8763,"large_test_6_serial_s":12.7848,"special_hard_serial_s":8.6492,"medium_test_4_serial_s":1.9001,"large_test_10_serial_s":1.7818,"large_test_8_serial_s":3.7604,"baseline_large_test_6_profile_function_calls":60250635,"baseline_large_test_6_decisions":72886,"baseline_large_test_6_conflicts":59201,"baseline_large_test_6_processed_literals":2431409},"metrics_after":{"experimental_dense_four_case_total_s":25.317,"experimental_mixed_five_case_total_s":28.9259,"large_test_6_serial_s":13.0133,"special_hard_serial_s":8.6294,"medium_test_4_serial_s":1.9019,"large_test_10_serial_s":1.7724,"large_test_8_serial_s":3.6088,"experimental_large_test_6_profile_function_calls":48216924,"experimental_large_test_6_decisions":72886,"experimental_large_test_6_conflicts":59201,"experimental_large_test_6_processed_literals":2431409,"post_revert_large_test_6_serial_s":13.3934,"post_revert_special_hard_serial_s":8.7935,"post_revert_large_test_8_serial_s":3.712,"post_revert_large_test_6_decisions":72886,"post_revert_large_test_6_conflicts":59201,"post_revert_large_test_6_processed_literals":2431409,"post_revert_special_hard_decisions":54245,"post_revert_special_hard_conflicts":44619,"post_revert_special_hard_processed_literals":1737825,"post_revert_medium_test_4_decisions":13510,"post_revert_medium_test_4_conflicts":10995,"post_revert_medium_test_4_processed_literals":396463},"correctness_status":"passed 16 regression tests and SAT/UNSAT checker spot checks before and after revert; experiment was discarded because the wall-clock hotspot slice did not improve reliably","decision":"discard","notes":"The lookup-table substitution lowered Python call volume and removed abs() from the cProfile hot list, but that micro win did not translate into a meaningful solver-level speedup. Treat builtin-substitution tweaks outside propagate() as low-priority unless a future profile shows a much larger payoff."}
{"timestamp":"2026-03-20T06:05:49+01:00","experiment_id":"2026-03-20-rejected-shadow-clause-metadata","hypothesis":"Mirroring Clause state into parallel clause_lits/clause_sizes/clause_learnt/clause_deleted arrays might reduce object-attribute and len(clause.lits) overhead in propagate(), analyze(), and minimize_learnt() without changing watcher order or search counts.","change_summary":"Temporarily added parallel clause metadata arrays, switched the hot paths to read from them, added a temporary sync regression, benchmarked the hotspot slice twice, and then reverted because the wall-clock signal was too small and noisy to justify the added mirrored state.","files_changed":["satsolver.py","tests/test_solver_regressions.py","agent_log.md","experiments.jsonl","benchmark_summary.md","next_steps.md"],"datasets":["large/test_6.cnf","special/hard.cnf","medium/test_4.cnf","large/test_10.cnf","large/test_8.cnf","small/test_1.cnf","special/tseitin.cnf"],"commands":["rg -n \"\\\\.lits|\\\\.deleted|\\\\.learnt|\\\\.lbd|\\\\.activity\" satsolver.py tools/profile_solver.py tests -g '!__pycache__'","python tools/profile_solver.py large/test_6.cnf special/hard.cnf medium/test_4.cnf","python - <<'PY' ... clean serial timing script over large/test_6.cnf, special/hard.cnf, medium/test_4.cnf, large/test_10.cnf, large/test_8.cnf ... PY","python -m unittest discover -s tests -v","python satsolver.py small/test_1.cnf /tmp/cycle16_sat.txt","python tools/checker.py small/test_1.cnf /tmp/cycle16_sat.txt","python satsolver.py special/tseitin.cnf /tmp/cycle16_unsat.txt","python tools/checker.py special/tseitin.cnf /tmp/cycle16_unsat.txt --bruteforce-var-limit 0","python satsolver.py large/test_8.cnf /tmp/cycle16_large8.txt","python tools/checker.py large/test_8.cnf /tmp/cycle16_large8.txt","python - <<'PY' ... clean experimental serial timing script over the five-case slice ... PY","python - <<'PY' ... repeated clean experimental serial timing script over the five-case slice ... PY","python - <<'PY' ... cProfile solve_cnf_serial on large/test_6.cnf under the experimental solver ... PY","python -m unittest discover -s tests -v","python satsolver.py small/test_1.cnf /tmp/cycle16_revert_sat.txt","python tools/checker.py small/test_1.cnf /tmp/cycle16_revert_sat.txt","python satsolver.py special/tseitin.cnf /tmp/cycle16_revert_unsat.txt","python tools/checker.py special/tseitin.cnf /tmp/cycle16_revert_unsat.txt --bruteforce-var-limit 0","python satsolver.py large/test_8.cnf /tmp/cycle16_revert_large8.txt","python tools/checker.py large/test_8.cnf /tmp/cycle16_revert_large8.txt","python - <<'PY' ... clean post-revert serial timing script over the five-case slice ... PY","python tools/profile_solver.py large/test_6.cnf special/hard.cnf medium/test_4.cnf"],"metrics_before":{"baseline_dense_four_case_total_s":26.4422,"baseline_mixed_five_case_total_s":30.2029,"baseline_large_test_6_serial_s":13.9715,"baseline_special_hard_serial_s":8.8295,"baseline_medium_test_4_serial_s":1.87,"baseline_large_test_10_serial_s":1.7712,"baseline_large_test_8_serial_s":3.7607,"baseline_large_test_6_decisions":72886,"baseline_large_test_6_conflicts":59201,"baseline_large_test_6_processed_literals":2431409},"metrics_after":{"experimental_dense_four_case_total_run1_s":26.305,"experimental_mixed_five_case_total_run1_s":30.169,"experimental_large_test_6_serial_run1_s":13.6973,"experimental_special_hard_serial_run1_s":8.7611,"experimental_medium_test_4_serial_run1_s":1.9727,"experimental_large_test_10_serial_run1_s":1.8739,"experimental_large_test_8_serial_run1_s":3.864,"experimental_dense_four_case_total_run2_s":26.3659,"experimental_mixed_five_case_total_run2_s":30.2449,"experimental_large_test_6_serial_run2_s":13.8652,"experimental_special_hard_serial_run2_s":8.7458,"experimental_medium_test_4_serial_run2_s":1.8908,"experimental_large_test_10_serial_run2_s":1.8642,"experimental_large_test_8_serial_run2_s":3.8789,"experimental_large_test_6_profile_function_calls":48451744,"experimental_large_test_6_decisions":72886,"experimental_large_test_6_conflicts":59201,"experimental_large_test_6_processed_literals":2431409},"correctness_status":"passed 16 regression tests and SAT/UNSAT checker spot checks before and after revert; experiment was discarded because the wall-clock gain was too small and noisy to justify the extra mirrored state","decision":"discard","notes":"The shadow arrays materially reduced Python call counts and len() traffic, but the clean five-case timing slice only moved by about -0.52%..+0.14% depending on the run. That is too weak a signal to keep a more complex duplicated data layout."}
{"timestamp":"2026-03-20T06:15:42+01:00","experiment_id":"2026-03-20-rejected-active-trail-size","hypothesis":"Replacing repeated trail append/pop operations with an active trail_size index and slot reuse might remove a large chunk of raw list bookkeeping cost without changing solver behavior.","change_summary":"Temporarily rewrote enqueue(), backtrack(), propagate(), analyze(), and the profiler to use an active trail_size over a reusable trail buffer, added a temporary regression covering slot reuse, benchmarked the hotspot slice, and then reverted because the change made the dominant propagation loop slower overall.","files_changed":["satsolver.py","tools/profile_solver.py","tests/test_solver_regressions.py","agent_log.md","experiments.jsonl","benchmark_summary.md","next_steps.md"],"datasets":["large/test_6.cnf","special/hard.cnf","medium/test_4.cnf","large/test_10.cnf","large/test_8.cnf","small/test_1.cnf","special/tseitin.cnf"],"commands":["python - <<'PY' ... cProfile solve_cnf_serial on large/test_6.cnf baseline ... PY","python tools/profile_solver.py large/test_6.cnf special/hard.cnf medium/test_4.cnf","rg -n \"trail\\\\b|len\\\\(self\\\\.trail\\\\)|len\\\\(trail\\\\)\" satsolver.py tools tests","python -m unittest discover -s tests -v","python satsolver.py small/test_1.cnf /tmp/cycle17_sat.txt","python tools/checker.py small/test_1.cnf /tmp/cycle17_sat.txt","python satsolver.py special/tseitin.cnf /tmp/cycle17_unsat.txt","python tools/checker.py special/tseitin.cnf /tmp/cycle17_unsat.txt --bruteforce-var-limit 0","python satsolver.py large/test_8.cnf /tmp/cycle17_large8.txt","python tools/checker.py large/test_8.cnf /tmp/cycle17_large8.txt","python - <<'PY' ... clean experimental five-case serial timing script ... PY","python tools/profile_solver.py large/test_6.cnf special/hard.cnf medium/test_4.cnf","python - <<'PY' ... cProfile solve_cnf_serial on large/test_6.cnf experimental ... PY","python -m unittest discover -s tests -v","python satsolver.py small/test_1.cnf /tmp/cycle17_revert_sat.txt","python tools/checker.py small/test_1.cnf /tmp/cycle17_revert_sat.txt","python satsolver.py special/tseitin.cnf /tmp/cycle17_revert_unsat.txt","python tools/checker.py special/tseitin.cnf /tmp/cycle17_revert_unsat.txt --bruteforce-var-limit 0","python satsolver.py large/test_8.cnf /tmp/cycle17_revert_large8.txt","python tools/checker.py large/test_8.cnf /tmp/cycle17_revert_large8.txt","python - <<'PY' ... clean post-revert five-case serial timing script ... PY","python tools/profile_solver.py large/test_6.cnf special/hard.cnf medium/test_4.cnf"],"metrics_before":{"baseline_dense_four_case_total_s":26.3783,"baseline_mixed_five_case_total_s":30.1683,"baseline_large_test_6_serial_s":13.8129,"baseline_special_hard_serial_s":8.7927,"baseline_medium_test_4_serial_s":1.9625,"baseline_large_test_10_serial_s":1.8102,"baseline_large_test_8_serial_s":3.79,"baseline_profiled_hotspot_total_s":30.5425,"baseline_large_test_6_profile_s":16.6956,"baseline_special_hard_profile_s":11.5282,"baseline_medium_test_4_profile_s":2.3187,"baseline_large_test_6_cprofile_propagate_tottime_s":14.033,"baseline_large_test_6_cprofile_backtrack_tottime_s":2.09,"baseline_large_test_6_append_calls":13077170,"baseline_large_test_6_pop_calls":10107994},"metrics_after":{"experimental_dense_four_case_total_s":30.4033,"experimental_mixed_five_case_total_s":34.2696,"experimental_large_test_6_serial_s":15.4102,"experimental_special_hard_serial_s":10.4358,"experimental_medium_test_4_serial_s":2.5833,"experimental_large_test_10_serial_s":1.9739,"experimental_large_test_8_serial_s":3.8663,"experimental_profiled_hotspot_total_s":32.9161,"experimental_large_test_6_profile_s":17.6567,"experimental_special_hard_profile_s":12.8892,"experimental_medium_test_4_profile_s":2.3702,"experimental_large_test_6_cprofile_propagate_tottime_s":14.615,"experimental_large_test_6_cprofile_backtrack_tottime_s":1.045,"experimental_large_test_6_append_calls":9714896,"experimental_large_test_6_pop_calls":6745603,"experimental_large_test_6_decisions":72886,"experimental_large_test_6_conflicts":59201,"experimental_large_test_6_processed_literals":2431409},"correctness_status":"passed 17 regression tests and SAT/UNSAT checker spot checks before the revert, then passed 16 regression tests and the same checker spot checks after the revert; experiment was discarded for performance, not correctness","decision":"discard","notes":"The active-trail rewrite achieved the narrow goal of cutting append/pop traffic and backtrack time, but it made propagate() slower enough that the overall hotspot slice regressed badly. Treat active trail-size indexing with stale entries as another dead end."}
{"timestamp":"2026-03-20T06:25:22+01:00","experiment_id":"2026-03-20-rejected-keep-lbd3","hypothesis":"Because LBD=3 learnt clauses make up a large live cohort on the dense UNSAT families, globally protecting LBD<=3 clauses during reduce_database() might reduce future conflicts enough to offset the larger live learnt database.","change_summary":"Measured live/deleted learnt-clause LBD distributions, temporarily changed reduce_database() to keep all LBD<=3 clauses, validated correctness, benchmarked the hotspot slice, and then reverted after the broader live learnt database regressed overall runtime and especially hurt large/test_8.cnf.","files_changed":["satsolver.py","agent_log.md","experiments.jsonl","benchmark_summary.md","next_steps.md"],"datasets":["large/test_6.cnf","special/hard.cnf","medium/test_4.cnf","large/test_10.cnf","large/test_8.cnf","small/test_1.cnf","special/tseitin.cnf"],"commands":["python - <<'PY' ... inspect live/all learnt-clause LBD and length distributions on large/test_6.cnf, special/hard.cnf, medium/test_4.cnf, large/test_8.cnf ... PY","python - <<'PY' ... inspect reduction snapshots and deleted/kept candidate LBD histograms on large/test_6.cnf, special/hard.cnf, large/test_8.cnf ... PY","python -m unittest discover -s tests -v","python satsolver.py small/test_1.cnf /tmp/cycle18_sat.txt","python tools/checker.py small/test_1.cnf /tmp/cycle18_sat.txt","python satsolver.py special/tseitin.cnf /tmp/cycle18_unsat.txt","python tools/checker.py special/tseitin.cnf /tmp/cycle18_unsat.txt --bruteforce-var-limit 0","python satsolver.py large/test_8.cnf /tmp/cycle18_large8.txt","python tools/checker.py large/test_8.cnf /tmp/cycle18_large8.txt","python - <<'PY' ... clean experimental five-case serial timing script ... PY","python tools/profile_solver.py large/test_6.cnf special/hard.cnf medium/test_4.cnf","python - <<'PY' ... cProfile solve_cnf_serial on large/test_6.cnf experimental ... PY","python -m unittest discover -s tests -v","python satsolver.py small/test_1.cnf /tmp/cycle18_revert_sat.txt","python tools/checker.py small/test_1.cnf /tmp/cycle18_revert_sat.txt","python satsolver.py special/tseitin.cnf /tmp/cycle18_revert_unsat.txt","python tools/checker.py special/tseitin.cnf /tmp/cycle18_revert_unsat.txt --bruteforce-var-limit 0","python satsolver.py large/test_8.cnf /tmp/cycle18_revert_large8.txt","python tools/checker.py large/test_8.cnf /tmp/cycle18_revert_large8.txt","python - <<'PY' ... clean post-revert five-case serial timing script ... PY","python tools/profile_solver.py large/test_6.cnf special/hard.cnf medium/test_4.cnf"],"metrics_before":{"baseline_dense_four_case_total_s":26.8256,"baseline_mixed_five_case_total_s":30.5189,"baseline_large_test_6_serial_s":14.0012,"baseline_special_hard_serial_s":9.1264,"baseline_medium_test_4_serial_s":1.9549,"baseline_large_test_10_serial_s":1.7431,"baseline_large_test_8_serial_s":3.6933,"baseline_profiled_hotspot_total_s":30.7035,"baseline_large_test_6_profile_s":17.0456,"baseline_special_hard_profile_s":11.366,"baseline_medium_test_4_profile_s":2.2919,"baseline_large_test_6_live_learnts":970,"baseline_special_hard_live_learnts":874,"baseline_medium_test_4_live_learnts":401},"metrics_after":{"experimental_dense_four_case_total_s":28.7174,"experimental_mixed_five_case_total_s":34.8344,"experimental_large_test_6_serial_s":17.4093,"experimental_special_hard_serial_s":8.2053,"experimental_medium_test_4_serial_s":1.6306,"experimental_large_test_10_serial_s":1.4722,"experimental_large_test_8_serial_s":6.1171,"experimental_profiled_hotspot_total_s":41.7446,"experimental_large_test_6_profile_s":27.8761,"experimental_special_hard_profile_s":11.9098,"experimental_medium_test_4_profile_s":1.9587,"experimental_large_test_6_live_learnts":2624,"experimental_special_hard_live_learnts":2067,"experimental_medium_test_4_live_learnts":1110,"experimental_large_test_6_decisions":67795,"experimental_large_test_6_conflicts":55364,"experimental_large_test_6_processed_literals":2234167},"correctness_status":"passed 16 regression tests and SAT/UNSAT checker spot checks before and after revert; experiment was discarded because the broader retained database regressed overall wall-clock despite helping some UNSAT search counts","decision":"discard","notes":"A flat LBD<=3 protection rule is still too blunt. It improved some dense UNSAT search counts, but it expanded the live learnt database so much that propagation cost dominated and large/test_8.cnf regressed badly."}
