{"timestamp":"2026-03-21T01:15:40+01:00","experiment_id":"2026-03-21-reject-satsolver-fast-lazy-structural-v2","hypothesis":"Because `satsolver_fast.py` now already has the byte-level parser/output path, a new alternate exact-CLI wrapper that keeps local byte parsing/output plus local structural pigeonhole/XOR fast exits and only lazy-imports `satsolver_fast` for non-structural cases might recover structural-hit startup wins without the larger losses seen in the older lazy-import branch.","change_summary":"Created scratch candidate `scratch_satsolver_fast_lazy_v2.py` with local byte-level parse/output, local `has_pigeonhole_core(...)`, local `xor_system_unsat(...)`, and lazy import of `satsolver_fast` only after structural checks. Validated SAT and structural-UNSAT smoke cases, measured structural-hit, SAT-heavy root-hit, and mixed nine-case exact-CLI hotspot slices against the retained `satsolver_fast.py`, then deleted the scratch file after all three early gates regressed.","files_changed":["agent_log.md","experiments.jsonl","benchmark_summary.md","next_steps.md"],"datasets":["small/test_1.cnf","special/tseitin.cnf","special/pigeonhole.cnf","satlib_subset/dubois20.cnf","satlib_subset/dubois21.cnf","satlib_subset/hole8.cnf","satlib_subset/hole10.cnf","small/test_5.cnf","small/test_6.cnf","small/test_9.cnf","medium/test_8.cnf","medium/test_9.cnf","large/test_1.cnf","large/test_2.cnf","large/test_5.cnf","large/test_7.cnf","large/test_9.cnf","special/easy.cnf","small/test_10.cnf","medium/test_3.cnf","medium/test_4.cnf","large/test_6.cnf","large/test_8.cnf","large/test_10.cnf","special/hard.cnf"],"commands":["python -m py_compile scratch_satsolver_fast_lazy_v2.py","python scratch_satsolver_fast_lazy_v2.py small/test_1.cnf /tmp/scratch_fast_lazy_v2_sat.txt","python tools/checker.py small/test_1.cnf /tmp/scratch_fast_lazy_v2_sat.txt","python scratch_satsolver_fast_lazy_v2.py special/tseitin.cnf /tmp/scratch_fast_lazy_v2_unsat.txt","python tools/checker.py special/tseitin.cnf /tmp/scratch_fast_lazy_v2_unsat.txt --bruteforce-var-limit 0","python tools/hotspot_compare.py --baseline-cli-script satsolver_fast.py --candidate-cli-script scratch_satsolver_fast_lazy_v2.py --repeat 2 special/pigeonhole.cnf special/tseitin.cnf satlib_subset/dubois20.cnf satlib_subset/dubois21.cnf satlib_subset/hole8.cnf satlib_subset/hole10.cnf","python tools/hotspot_compare.py --baseline-cli-script satsolver_fast.py --candidate-cli-script scratch_satsolver_fast_lazy_v2.py --repeat 2 small/test_1.cnf small/test_5.cnf small/test_6.cnf small/test_9.cnf medium/test_8.cnf medium/test_9.cnf large/test_1.cnf large/test_2.cnf large/test_5.cnf large/test_7.cnf large/test_9.cnf special/easy.cnf","python tools/hotspot_compare.py --baseline-cli-script satsolver_fast.py --candidate-cli-script scratch_satsolver_fast_lazy_v2.py small/test_1.cnf small/test_10.cnf medium/test_3.cnf medium/test_4.cnf large/test_6.cnf large/test_8.cnf large/test_10.cnf special/hard.cnf special/tseitin.cnf"],"metrics_before":{"structural_hit_slice_two_order_avg_baseline_s":0.1857,"root_hit_slice_two_order_avg_baseline_s":0.4189,"mixed_slice_two_order_avg_baseline_s":24.3005},"metrics_after":{"structural_hit_slice_two_order_avg_candidate_s":0.1924,"root_hit_slice_two_order_avg_candidate_s":0.4208,"mixed_slice_two_order_avg_candidate_s":24.6247,"mixed_slice_forward_baseline_s":24.6047,"mixed_slice_forward_candidate_s":25.0922,"mixed_slice_reverse_baseline_s":23.9964,"mixed_slice_reverse_candidate_s":24.1572},"correctness_status":"the scratch candidate produced checker-valid SAT and structural-UNSAT smoke outputs, and the repository remained on the retained `satsolver_fast.py` baseline because the scratch file was deleted after the slice gates failed","decision":"discard","notes":"This second-generation lazy structural wrapper failed all three early gates and did not earn a full-suite run. The bytes-parser keep does not appear to make the old lazy-import structural idea viable again when the wrapper still ends up importing the current alternate solver for non-structural cases."}
{"timestamp":"2026-03-21T01:21:12+01:00","experiment_id":"2026-03-21-reject-satsolver-fast-stream-parse","hypothesis":"Because `satsolver_fast.py` already kept a byte-level parse/output win on the exact submission path, replacing `parse_dimacs_file()` with a streaming binary-line parser might shave more startup cost by avoiding the extra `read() + splitlines()` allocation without touching the solver core.","change_summary":"Created scratch candidate `scratch_satsolver_fast_streamparse.py` that kept the retained alternate exact-CLI behavior but replaced `parse_dimacs_file()` with a streaming binary-line parser over the input handle. Validated SAT and structural-UNSAT smoke cases, measured it against the retained `satsolver_fast.py` on the SAT-heavy root-hit exact-CLI slice, then deleted the scratch file after the first gate regressed.","files_changed":["agent_log.md","experiments.jsonl","benchmark_summary.md","next_steps.md"],"datasets":["small/test_1.cnf","special/tseitin.cnf","small/test_5.cnf","small/test_6.cnf","small/test_9.cnf","medium/test_8.cnf","medium/test_9.cnf","large/test_1.cnf","large/test_2.cnf","large/test_5.cnf","large/test_7.cnf","large/test_9.cnf","special/easy.cnf"],"commands":["python -m py_compile scratch_satsolver_fast_streamparse.py","python scratch_satsolver_fast_streamparse.py small/test_1.cnf /tmp/scratch_streamparse_sat.txt","python tools/checker.py small/test_1.cnf /tmp/scratch_streamparse_sat.txt","python scratch_satsolver_fast_streamparse.py special/tseitin.cnf /tmp/scratch_streamparse_unsat.txt","python tools/checker.py special/tseitin.cnf /tmp/scratch_streamparse_unsat.txt --bruteforce-var-limit 0","python tools/hotspot_compare.py --baseline-cli-script satsolver_fast.py --candidate-cli-script scratch_satsolver_fast_streamparse.py --repeat 2 small/test_1.cnf small/test_5.cnf small/test_6.cnf small/test_9.cnf medium/test_8.cnf medium/test_9.cnf large/test_1.cnf large/test_2.cnf large/test_5.cnf large/test_7.cnf large/test_9.cnf special/easy.cnf","python -m unittest discover -s tests -v"],"metrics_before":{"unit_test_count":48,"root_hit_slice_two_order_avg_baseline_s":0.3701,"root_hit_slice_forward_baseline_s":0.3721,"root_hit_slice_reverse_baseline_s":0.3680},"metrics_after":{"unit_test_count":48,"root_hit_slice_two_order_avg_candidate_s":0.3931,"root_hit_slice_forward_candidate_s":0.3778,"root_hit_slice_reverse_candidate_s":0.4083},"correctness_status":"the scratch candidate produced checker-valid SAT and structural-UNSAT smoke outputs, the repository remained on the retained `satsolver_fast.py` baseline because the scratch file was deleted after the first slice gate failed, and the retained repository still passed all 48 regression tests","decision":"discard","notes":"The earlier byte-parser keep was real, but this follow-up says a simple streamed-file loop is not another free startup win. The candidate lost the first exact-CLI gate overall and especially in reverse order, so it did not earn a mixed-slice or full-suite run."}
{"timestamp":"2026-03-21T01:27:12+01:00","experiment_id":"2026-03-21-reject-satsolver-fast-phase-serial-portfolio","hypothesis":"Because the current `satsolver_fast.py` portfolio gate effectively only exists for the `large/test_8.cnf` family, and prior measurements showed serial phase-biased search is unusually strong there, replacing the narrow two-worker portfolio with one serial `seed_phase_bias=True` solve might keep most of that win while reducing exact-CLI startup overhead.","change_summary":"Materialized the retained `satsolver_fast.py` into `_tmp_satsolver_fast_baseline_phase_serial.py`, temporarily patched the live `satsolver_fast.py` so the current portfolio gate called `solve_cnf_serial(..., seed_phase_bias=True)` instead of `solve_cnf_portfolio(...)`, validated SAT and UNSAT smoke cases, benchmarked exact-CLI A/B on `large/test_8.cnf` and the mixed nine-case hotspot slice, then reverted the change and deleted the temporary baseline after the broader slice regressed.","files_changed":["agent_log.md","experiments.jsonl","benchmark_summary.md","next_steps.md"],"datasets":["large/test_8.cnf","special/tseitin.cnf","small/test_1.cnf","small/test_10.cnf","medium/test_3.cnf","medium/test_4.cnf","large/test_6.cnf","large/test_10.cnf","special/hard.cnf"],"commands":["git show HEAD:satsolver_fast.py > /home/doomguy/Desktop/sat/satsolver/_tmp_satsolver_fast_baseline_phase_serial.py","python -m py_compile satsolver_fast.py","python satsolver_fast.py large/test_8.cnf /tmp/satsolver_fast_phase_serial_sat.txt","python tools/checker.py large/test_8.cnf /tmp/satsolver_fast_phase_serial_sat.txt","python satsolver_fast.py special/tseitin.cnf /tmp/satsolver_fast_phase_serial_unsat.txt","python tools/checker.py special/tseitin.cnf /tmp/satsolver_fast_phase_serial_unsat.txt --bruteforce-var-limit 0","python tools/hotspot_compare.py --baseline-cli-script /home/doomguy/Desktop/sat/satsolver/_tmp_satsolver_fast_baseline_phase_serial.py --candidate-cli-script satsolver_fast.py --repeat 4 large/test_8.cnf","python tools/hotspot_compare.py --baseline-cli-script /home/doomguy/Desktop/sat/satsolver/_tmp_satsolver_fast_baseline_phase_serial.py --candidate-cli-script satsolver_fast.py small/test_1.cnf small/test_10.cnf medium/test_3.cnf medium/test_4.cnf large/test_6.cnf large/test_8.cnf large/test_10.cnf special/hard.cnf special/tseitin.cnf","python -m unittest discover -s tests -v"],"metrics_before":{"unit_test_count":48,"large_test_8_two_order_avg_baseline_s":0.2922,"mixed_slice_two_order_avg_baseline_s":24.3702,"mixed_slice_forward_baseline_s":24.4601,"mixed_slice_reverse_baseline_s":24.2804},"metrics_after":{"unit_test_count":48,"large_test_8_two_order_avg_candidate_s":0.2207,"mixed_slice_two_order_avg_candidate_s":24.5513,"mixed_slice_forward_candidate_s":24.3689,"mixed_slice_reverse_candidate_s":24.7337},"correctness_status":"the temporary branch produced checker-valid SAT and UNSAT smoke outputs, the repository was reverted to the retained `satsolver_fast.py` baseline after the mixed-slice gate failed, and the reverted repository still passed all 48 regression tests","decision":"discard","notes":"This branch proved the intended local effect: exact-CLI `large/test_8.cnf` got materially faster. But the broader mixed nine-case hotspot slice still lost on the two-order average because the reverse heavy-case order regressed enough to outweigh the forward win. So avoiding `fork()` on the narrow portfolio gate is not a broad enough story by itself."}
{"timestamp":"2026-03-21T01:33:25+01:00","experiment_id":"2026-03-21-reject-main-reduce-database-more-aggressive","hypothesis":"Because learnt-large relocation is still a large secondary watcher-churn bucket on the profiled hotspots, deleting a larger share of ranked reduction candidates inside `reduce_database()` might shrink the live learnt-large set enough to help the hard cases without breaking correctness.","change_summary":"Materialized the retained `satsolver.py` into `_tmp_satsolver_baseline_reduce_aggr.py`, temporarily patched `satsolver.py` so `reduce_database()` kept only the top `40%` of ranked candidates instead of the top `50%`, validated SAT and UNSAT smoke cases, benchmarked exact-CLI A/B on the mixed nine-case hotspot slice, then reverted the change and deleted the temporary baseline after the candidate regressed catastrophically.","files_changed":["agent_log.md","experiments.jsonl","benchmark_summary.md","next_steps.md"],"datasets":["small/test_1.cnf","special/tseitin.cnf","small/test_10.cnf","medium/test_3.cnf","medium/test_4.cnf","large/test_6.cnf","large/test_8.cnf","large/test_10.cnf","special/hard.cnf"],"commands":["git show HEAD:satsolver.py > /home/doomguy/Desktop/sat/satsolver/_tmp_satsolver_baseline_reduce_aggr.py","python -m py_compile satsolver.py","python satsolver.py small/test_1.cnf /tmp/reduce_aggr_sat.txt","python tools/checker.py small/test_1.cnf /tmp/reduce_aggr_sat.txt","python satsolver.py special/tseitin.cnf /tmp/reduce_aggr_unsat.txt","python tools/checker.py special/tseitin.cnf /tmp/reduce_aggr_unsat.txt --bruteforce-var-limit 0","python tools/hotspot_compare.py --baseline-cli-script /home/doomguy/Desktop/sat/satsolver/_tmp_satsolver_baseline_reduce_aggr.py --candidate-cli-script satsolver.py small/test_1.cnf small/test_10.cnf medium/test_3.cnf medium/test_4.cnf large/test_6.cnf large/test_8.cnf large/test_10.cnf special/hard.cnf special/tseitin.cnf","python -m unittest discover -s tests -v"],"metrics_before":{"unit_test_count":48,"mixed_slice_two_order_avg_baseline_s":24.6309,"mixed_slice_forward_baseline_s":24.8483,"mixed_slice_reverse_baseline_s":24.4135,"large_test_8_forward_baseline_s":0.2769,"large_test_8_reverse_baseline_s":0.3061},"metrics_after":{"unit_test_count":48,"mixed_slice_two_order_avg_candidate_s":40.4076,"mixed_slice_forward_candidate_s":40.7003,"mixed_slice_reverse_candidate_s":40.1149,"large_test_8_forward_candidate_s":12.1894,"large_test_8_reverse_candidate_s":12.1799},"correctness_status":"the temporary branch produced checker-valid SAT and UNSAT smoke outputs, the repository was reverted to the retained `satsolver.py` baseline after the hotspot gate failed, and the reverted repository still passed all 48 regression tests","decision":"discard","notes":"This was not a marginal loss. The more aggressive reduction policy changed the search path badly enough to blow up SAT-like `large/test_8.cnf` by roughly forty-fold while also hurting the dense UNSAT cases. So broad “same ranking, keep fewer clauses” database trimming is another bad global retention direction."}
{"timestamp":"2026-03-21T01:39:06+01:00","experiment_id":"2026-03-21-reject-satsolver-fast-manual-scan-parser","hypothesis":"Because the retained `satsolver_fast.py` byte parser still uses `splitlines()` and per-line token splitting, a single-pass manual byte scanner might remove enough allocation and tokenization overhead to produce a stronger exact-CLI startup win on the SAT-heavy slice.","change_summary":"Created scratch candidate `scratch_satsolver_fast_scanparse.py` with a manual raw-byte scanner for `parse_dimacs_bytes()` while keeping the rest of the retained alternate exact-CLI behavior unchanged, validated SAT and structural-UNSAT smoke cases, benchmarked it against the retained `satsolver_fast.py` on the SAT-heavy root-hit exact-CLI slice, then deleted the scratch file after the first gate regressed.","files_changed":["agent_log.md","experiments.jsonl","benchmark_summary.md","next_steps.md"],"datasets":["small/test_1.cnf","special/tseitin.cnf","small/test_5.cnf","small/test_6.cnf","small/test_9.cnf","medium/test_8.cnf","medium/test_9.cnf","large/test_1.cnf","large/test_2.cnf","large/test_5.cnf","large/test_7.cnf","large/test_9.cnf","special/easy.cnf"],"commands":["python -m py_compile scratch_satsolver_fast_scanparse.py","python scratch_satsolver_fast_scanparse.py small/test_1.cnf /tmp/scratch_scanparse_sat.txt","python tools/checker.py small/test_1.cnf /tmp/scratch_scanparse_sat.txt","python scratch_satsolver_fast_scanparse.py special/tseitin.cnf /tmp/scratch_scanparse_unsat.txt","python tools/checker.py special/tseitin.cnf /tmp/scratch_scanparse_unsat.txt --bruteforce-var-limit 0","python tools/hotspot_compare.py --baseline-cli-script satsolver_fast.py --candidate-cli-script scratch_satsolver_fast_scanparse.py --repeat 2 small/test_1.cnf small/test_5.cnf small/test_6.cnf small/test_9.cnf medium/test_8.cnf medium/test_9.cnf large/test_1.cnf large/test_2.cnf large/test_5.cnf large/test_7.cnf large/test_9.cnf special/easy.cnf"],"metrics_before":{"root_hit_slice_two_order_avg_baseline_s":0.4605,"root_hit_slice_forward_baseline_s":0.4936,"root_hit_slice_reverse_baseline_s":0.4273},"metrics_after":{"root_hit_slice_two_order_avg_candidate_s":0.4908,"root_hit_slice_forward_candidate_s":0.5321,"root_hit_slice_reverse_candidate_s":0.4495},"correctness_status":"the scratch candidate produced checker-valid SAT and structural-UNSAT smoke outputs, the repository remained on the retained `satsolver_fast.py` baseline because the scratch file was deleted after the first slice gate failed","decision":"discard","notes":"This was a more structural parser attempt than the earlier streamed-line branch, but it still lost the same-day exact-CLI root-hit slice in both orders. The retained bytes parser now looks like the end of the easy parser wins rather than a starting point for further parser micro-work."}
{"timestamp":"2026-03-21T01:45:00+01:00","experiment_id":"2026-03-21-reject-main-reduce-database-earlier-schedule","hypothesis":"Because learnt-large relocation is still a major secondary watcher-churn bucket on the profiled hotspots, triggering `reduce_database()` earlier and more often with the same ranking and keep fraction might shrink the live learnt database enough to help the hard cases without the search damage seen from keeping a smaller fraction.","change_summary":"Materialized the retained `satsolver.py` into `_tmp_satsolver_baseline_reduce_schedule.py`, temporarily patched `reduce_database()` so the post-reduction schedule used `int(len(self.learnt_ids) * 1.25) + 64` instead of `int(len(self.learnt_ids) * 1.5) + 64`, validated SAT and UNSAT smoke cases, benchmarked exact-CLI A/B on the mixed nine-case hotspot slice, then reverted the change and deleted the temporary baseline after the candidate regressed broadly.","files_changed":["agent_log.md","experiments.jsonl","benchmark_summary.md","next_steps.md"],"datasets":["small/test_1.cnf","special/tseitin.cnf","small/test_10.cnf","medium/test_3.cnf","medium/test_4.cnf","large/test_6.cnf","large/test_8.cnf","large/test_10.cnf","special/hard.cnf"],"commands":["git show HEAD:satsolver.py > /home/doomguy/Desktop/sat/satsolver/_tmp_satsolver_baseline_reduce_schedule.py","python -m py_compile satsolver.py","python satsolver.py small/test_1.cnf /tmp/reduce_schedule_sat.txt","python tools/checker.py small/test_1.cnf /tmp/reduce_schedule_sat.txt","python satsolver.py special/tseitin.cnf /tmp/reduce_schedule_unsat.txt","python tools/checker.py special/tseitin.cnf /tmp/reduce_schedule_unsat.txt --bruteforce-var-limit 0","python tools/hotspot_compare.py --baseline-cli-script /home/doomguy/Desktop/sat/satsolver/_tmp_satsolver_baseline_reduce_schedule.py --candidate-cli-script satsolver.py --bruteforce-var-limit 0 small/test_1.cnf small/test_10.cnf medium/test_3.cnf medium/test_4.cnf large/test_6.cnf large/test_8.cnf large/test_10.cnf special/hard.cnf special/tseitin.cnf","python -m unittest discover -s tests -v"],"metrics_before":{"unit_test_count":48,"mixed_slice_two_order_avg_baseline_s":24.4791,"mixed_slice_forward_baseline_s":24.2045,"mixed_slice_reverse_baseline_s":24.7536,"large_test_8_forward_baseline_s":0.2864,"large_test_8_reverse_baseline_s":0.2913},"metrics_after":{"unit_test_count":48,"mixed_slice_two_order_avg_candidate_s":30.9079,"mixed_slice_forward_candidate_s":30.8099,"mixed_slice_reverse_candidate_s":31.0059,"large_test_8_forward_candidate_s":2.3767,"large_test_8_reverse_candidate_s":2.2581},"correctness_status":"the temporary branch produced checker-valid SAT and UNSAT smoke outputs, the repository was reverted to the retained `satsolver.py` baseline after the hotspot gate failed, and the reverted repository still passed all 48 regression tests","decision":"discard","notes":"This was the schedule-only counterpart to the earlier aggressive-trimming reject, and it still lost badly. Reducing sooner with the same classifier regressed both the dense UNSAT cases and the SAT-like `large/test_8.cnf`, so future learnt-database work needs a better classifier than a smaller `next_reduce` multiplier."}
