{"timestamp":"2026-03-20T21:32:50+01:00","experiment_id":"2026-03-20-keep-ternary-unit-conflict-family-split","hypothesis":"If non-satisfied original-ternary traffic is overwhelmingly relocation-only, then future work should mostly target the replacement path; if units are also a large share, then the next useful solver idea should consider both relocation and unit handling, while conflicts can stay deprioritized if they remain tiny.","change_summary":"Extended `tools/profile_solver.py` with problem-vs-learnt ternary unit/conflict counters plus CLI reporting, added regression coverage in `tests/test_profile_solver.py`, reran the hotspot profiler, and updated the repo notes. The production solver stayed unchanged.","files_changed":["tools/profile_solver.py","tests/test_profile_solver.py","agent_log.md","experiments.jsonl","benchmark_summary.md","next_steps.md"],"datasets":["large/test_6.cnf","special/hard.cnf","medium/test_4.cnf","large/test_8.cnf"],"commands":["python -m py_compile tools/profile_solver.py tests/test_profile_solver.py","python -m unittest discover -s tests -v","python tools/profile_solver.py large/test_6.cnf special/hard.cnf medium/test_4.cnf large/test_8.cnf"],"metrics_before":{"unit_test_count":37},"metrics_after":{"unit_test_count":37,"large_test_6_problem_ternary_relocation_share":0.6101,"large_test_6_problem_ternary_unit_share":0.3831,"large_test_6_problem_ternary_conflict_share":0.0068,"special_hard_problem_ternary_relocation_share":0.5391,"special_hard_problem_ternary_unit_share":0.4521,"special_hard_problem_ternary_conflict_share":0.0088,"medium_test_4_problem_ternary_relocation_share":0.5642,"medium_test_4_problem_ternary_unit_share":0.4267,"medium_test_4_problem_ternary_conflict_share":0.009,"large_test_8_problem_ternary_relocation_share":0.5134,"large_test_8_problem_ternary_unit_share":0.4792,"large_test_8_problem_ternary_conflict_share":0.0075},"correctness_status":"the production solver was unchanged and still passed 37 regression tests; the new ternary unit/conflict family counters are covered by the profiler regression suite","decision":"keep","notes":"This is a profiling upgrade, not a solver-speed keep. On the main hotspots, non-satisfied problem-ternary traffic is a relocation-plus-unit story with conflicts still under 1%, so future original-ternary work should target both relocation and unit-heavy paths rather than the rare conflict tail."}
{"timestamp":"2026-03-20T21:45:58+01:00","experiment_id":"2026-03-20-reject-ternary-destructure-propagate","hypothesis":"Because the remaining propagation hotspot is the shared ternary relocation/unit path, manually unpacking 3-literal clauses into locals and writing the watched order back explicitly might reduce repeated list-index overhead without changing traversal order or search counts.","change_summary":"Built and removed a temporary `scratch/exp_ternary_destructure.py` harness implementing an out-of-tree `DestructuredTernarySolver` that manually unpacked ternary clauses inside `propagate()`, then compared it against the retained solver on the serial five-case hotspot slice in forward and reverse order. The production solver stayed unchanged after the experiment.","files_changed":["agent_log.md","experiments.jsonl","benchmark_summary.md","next_steps.md"],"datasets":["large/test_6.cnf","special/hard.cnf","medium/test_4.cnf","large/test_10.cnf","large/test_8.cnf"],"commands":["python -m cProfile -s tottime satsolver.py large/test_6.cnf /tmp/cprofile_large6_cycle2.out","python -m py_compile scratch/exp_ternary_destructure.py","PYTHONPATH=. python scratch/exp_ternary_destructure.py","python -m unittest discover -s tests -v","python satsolver.py small/test_1.cnf /tmp/cycle_sat.txt","python tools/checker.py small/test_1.cnf /tmp/cycle_sat.txt","python satsolver.py special/tseitin.cnf /tmp/cycle_unsat.txt","python tools/checker.py special/tseitin.cnf /tmp/cycle_unsat.txt --bruteforce-var-limit 0"],"metrics_before":{"forward_total_s":29.6744,"forward_large_test_6_s":13.3523,"forward_special_hard_s":8.879,"forward_medium_test_4_s":1.862,"forward_large_test_10_s":1.8172,"forward_large_test_8_s":3.764,"reverse_total_s":28.783,"reverse_large_test_8_s":3.6064,"reverse_large_test_10_s":1.7487,"reverse_medium_test_4_s":1.8527,"reverse_special_hard_s":8.4614,"reverse_large_test_6_s":13.1138,"forward_large_test_6_conflicts":59201,"forward_special_hard_conflicts":44619,"forward_medium_test_4_conflicts":10995,"forward_large_test_10_conflicts":9650,"forward_large_test_8_conflicts":16430,"unit_test_count":37},"metrics_after":{"forward_total_s":31.0203,"forward_large_test_6_s":13.8948,"forward_special_hard_s":9.4342,"forward_medium_test_4_s":2.0278,"forward_large_test_10_s":1.8087,"forward_large_test_8_s":3.8548,"reverse_total_s":30.9007,"reverse_large_test_8_s":3.8677,"reverse_large_test_10_s":1.9465,"reverse_medium_test_4_s":1.9827,"reverse_special_hard_s":9.3049,"reverse_large_test_6_s":13.7989,"reverse_large_test_6_conflicts":59201,"reverse_special_hard_conflicts":44619,"reverse_medium_test_4_conflicts":10995,"reverse_large_test_10_conflicts":9650,"reverse_large_test_8_conflicts":16430,"same_conflicts_all_cases":true,"unit_test_count":37},"correctness_status":"the temporary branch preserved SAT/UNSAT outcomes and identical conflict counts on the full five-case serial hotspot slice, and the retained production solver still passed 37 regression tests plus SAT/UNSAT checker spot checks after the scratch harness was removed","decision":"discard","notes":"This was a clean same-search overhead regression. Manually unpacking ternary clauses into locals and writing them back made the hotspot slice slower in both orders, so trimming a few `lits[...]` reads is not enough by itself to produce a real end-to-end propagation win."}
{"timestamp":"2026-03-20T21:57:47+01:00","experiment_id":"2026-03-20-reject-normalized-clause-reuse","hypothesis":"Because the current serial solve path normalizes every clause once for root pure-literal discovery and then again during ingest, reusing normalized clauses end-to-end might preserve the same search path while shaving enough startup work to help the exact CLI suite.","change_summary":"Built and removed a temporary `scratch/exp_reuse_normalized_clauses.py` harness that normalizes clauses once, reuses those normalized clauses in root pure-literal discovery and problem-clause ingest, and exposes a CLI-compatible entrypoint for exact-CLI benchmarking. Compared it against the retained solver on the serial five-case hotspot slice and then on the full exact-CLI 59-case suite. The production solver stayed unchanged after the experiment.","files_changed":["agent_log.md","experiments.jsonl","benchmark_summary.md","next_steps.md"],"datasets":["small/test_1.cnf","large/test_6.cnf","special/hard.cnf","medium/test_4.cnf","large/test_10.cnf","large/test_8.cnf","small","medium","large","special","satlib_subset","satlib_more"],"commands":["rg -n \"normalize_clause_literals|find_iterative_root_pure_literals|add_problem_clause\\(|solve_cnf_serial\\(\" satsolver.py","python -m cProfile -s tottime satsolver.py small/test_1.cnf /tmp/cprofile_small1.out","python -m py_compile scratch/exp_reuse_normalized_clauses.py","PYTHONPATH=. python scratch/exp_reuse_normalized_clauses.py --benchmark","python benchmark_suite.py satsolver /tmp/baseline_cli_cycle.txt small medium large special satlib_subset satlib_more --bruteforce-var-limit 16 --cli-script satsolver.py","python benchmark_suite.py satsolver /tmp/candidate_cli_cycle.txt small medium large special satlib_subset satlib_more --bruteforce-var-limit 16 --cli-script scratch/exp_reuse_normalized_clauses.py","python -m unittest discover -s tests -v","python satsolver.py small/test_1.cnf /tmp/cycle_sat2.txt","python tools/checker.py small/test_1.cnf /tmp/cycle_sat2.txt","python satsolver.py special/tseitin.cnf /tmp/cycle_unsat2.txt","python tools/checker.py special/tseitin.cnf /tmp/cycle_unsat2.txt --bruteforce-var-limit 0"],"metrics_before":{"small_test_1_normalize_calls":52,"small_test_1_add_problem_clause_calls":26,"forward_total_s":28.4287,"forward_large_test_6_s":12.9979,"forward_special_hard_s":8.4602,"forward_medium_test_4_s":1.7992,"forward_large_test_10_s":1.701,"forward_large_test_8_s":3.4704,"reverse_total_s":28.202,"reverse_large_test_8_s":3.4466,"reverse_large_test_10_s":1.6985,"reverse_medium_test_4_s":1.8743,"reverse_special_hard_s":8.2723,"reverse_large_test_6_s":12.9102,"cli_full_total_s":29.7802,"cli_full_solved_correctly":59,"cli_full_errors":0,"unit_test_count":37},"metrics_after":{"forward_total_s":28.1825,"forward_large_test_6_s":12.7849,"forward_special_hard_s":8.3396,"forward_medium_test_4_s":1.7882,"forward_large_test_10_s":1.714,"forward_large_test_8_s":3.5558,"reverse_total_s":28.2754,"reverse_large_test_8_s":3.4911,"reverse_large_test_10_s":1.7379,"reverse_medium_test_4_s":1.7891,"reverse_special_hard_s":8.4085,"reverse_large_test_6_s":12.8489,"same_conflicts_all_hotspot_cases":true,"cli_full_total_s":29.8429,"cli_full_solved_correctly":59,"cli_full_errors":0,"unit_test_count":37},"correctness_status":"the temporary branch preserved SAT/UNSAT outcomes and identical conflict counts on the hotspot slice, solved the full exact-CLI 59-case suite correctly (`59/59`), and the retained production solver still passed 37 regression tests plus SAT/UNSAT checker spot checks after the scratch harness was removed","decision":"discard","notes":"This was a same-search startup cleanup that looked plausible but still failed the stricter submission-path gate. Removing the duplicate normalization pass was not enough by itself to beat the retained exact-CLI baseline."}
{"timestamp":"2026-03-20T22:07:22+01:00","experiment_id":"2026-03-20-keep-trail-append-profiler-split","hypothesis":"If the remaining list churn is mostly branch decisions or learnt-clause construction, future work should move toward branch picking or `analyze()` list building; if propagation trail growth and watch relocations still dominate, the next real win remains in the shared watched-clause relocation/unit path.","change_summary":"Extended `tools/profile_solver.py` to count decision-vs-propagation trail appends, split learnt-large watched-clause relocations/units/conflicts by clause family, and track non-pivot learnt-literal appends inside `analyze()`. Added decomposition-style regression coverage in `tests/test_profile_solver.py`, reran the hotspot profiler, and updated the repo notes. The production solver stayed unchanged.","files_changed":["tools/profile_solver.py","tests/test_profile_solver.py","agent_log.md","experiments.jsonl","benchmark_summary.md","next_steps.md"],"datasets":["large/test_6.cnf","special/hard.cnf","medium/test_4.cnf","large/test_8.cnf"],"commands":["python -m py_compile tools/profile_solver.py tests/test_profile_solver.py","python -m unittest discover -s tests -v","python tools/profile_solver.py large/test_6.cnf special/hard.cnf medium/test_4.cnf large/test_8.cnf"],"metrics_before":{"unit_test_count":37},"metrics_after":{"unit_test_count":37,"large_test_6_decision_trail_appends":72886,"large_test_6_propagation_trail_appends":3230374,"large_test_6_analyze_learnt_literal_appends":787921,"large_test_6_watch_relocations":6556559,"large_test_6_ternary_unit_share_of_propagation_trail_appends":0.9403,"special_hard_decision_trail_appends":54245,"special_hard_propagation_trail_appends":2191117,"special_hard_analyze_learnt_literal_appends":571151,"special_hard_watch_relocations":3919510,"special_hard_ternary_unit_share_of_propagation_trail_appends":0.9148,"medium_test_4_decision_trail_appends":13510,"medium_test_4_propagation_trail_appends":505286,"medium_test_4_analyze_learnt_literal_appends":126547,"medium_test_4_watch_relocations":826585,"medium_test_4_ternary_unit_share_of_propagation_trail_appends":0.9449,"large_test_8_decision_trail_appends":21526,"large_test_8_propagation_trail_appends":1024554,"large_test_8_analyze_learnt_literal_appends":287696,"large_test_8_watch_relocations":1340602,"large_test_8_ternary_unit_share_of_propagation_trail_appends":0.9592},"correctness_status":"the production solver was unchanged and still passed 37 regression tests; the new append/family counters are covered by the profiler regression suite","decision":"keep","notes":"This is a profiling upgrade, not a solver-speed keep. On the hotspot cases, propagation trail growth is much larger than `analyze()` learnt-literal construction, is overwhelmingly ternary-unit work, and still sits below raw watch relocations, so the remaining list churn is mainly watched-clause relocation plus original-ternary unit handling rather than decision enqueues or conflict-analysis list building."}
{"timestamp":"2026-03-20T22:17:04+01:00","experiment_id":"2026-03-20-keep-watcher-pop-profiler-split","hypothesis":"If watcher-list removals account for almost all of the remaining pop traffic, future list-operation work should stay focused on watched-clause relocation churn; if a larger second pop source remains, another bookkeeping path still deserves attention before the next solver experiment.","change_summary":"Extended `tools/profile_solver.py` with explicit watcher-list append/pop counters plus trail-limit push/pop counters and CLI reporting, added regression coverage in `tests/test_profile_solver.py`, reran the hotspot profiler, and updated the repo notes. The production solver stayed unchanged.","files_changed":["tools/profile_solver.py","tests/test_profile_solver.py","agent_log.md","experiments.jsonl","benchmark_summary.md","next_steps.md"],"datasets":["large/test_6.cnf","special/hard.cnf","medium/test_4.cnf","large/test_8.cnf"],"commands":["python -m cProfile -s tottime satsolver.py large/test_6.cnf /tmp/cprofile_cycle_next.out | head -n 40","python -m py_compile tools/profile_solver.py tests/test_profile_solver.py","python -m unittest discover -s tests -v","python tools/profile_solver.py large/test_6.cnf special/hard.cnf medium/test_4.cnf large/test_8.cnf"],"metrics_before":{"unit_test_count":37,"cprofile_large_test_6_pop_calls":6745604},"metrics_after":{"unit_test_count":37,"large_test_6_watcher_list_pops":6672717,"large_test_6_trail_limit_pops":72886,"large_test_6_watch_pop_share":0.9892,"large_test_6_watcher_list_appends":6556559,"large_test_6_watcher_append_to_propagation_trail_append_ratio":2.0297,"special_hard_watcher_list_pops":4006772,"special_hard_trail_limit_pops":54245,"special_hard_watch_pop_share":0.9866,"special_hard_watcher_list_appends":3919510,"special_hard_watcher_append_to_propagation_trail_append_ratio":1.788,"medium_test_4_watcher_list_pops":847698,"medium_test_4_trail_limit_pops":13510,"medium_test_4_watch_pop_share":0.9843,"medium_test_4_watcher_list_appends":826585,"medium_test_4_watcher_append_to_propagation_trail_append_ratio":1.6357,"large_test_8_watcher_list_pops":1372645,"large_test_8_trail_limit_pops":21473,"large_test_8_watch_pop_share":0.9846,"large_test_8_watcher_list_appends":1340602,"large_test_8_watcher_append_to_propagation_trail_append_ratio":1.3085},"correctness_status":"the production solver was unchanged and still passed 37 regression tests; the new watcher-pop and trail-limit counters are covered by the profiler regression suite","decision":"keep","notes":"This is a profiling upgrade, not a solver-speed keep. On the four hotspot cases, watcher-list pops account for about 98.4%..98.9% of the explicitly counted pop traffic, so the raw `pop()` hotspot is overwhelmingly watched-clause removal churn rather than decision-level stack maintenance."}
{"timestamp":"2026-03-20T22:30:12+01:00","experiment_id":"2026-03-20-reject-pop-return-watch-remove","hypothesis":"Because watcher-list removals dominate the remaining `pop()` hotspot, using the value returned by `watchers.pop()` for swap-removal might cut one indexed list read per removal while preserving the exact same search path.","change_summary":"Built and removed a temporary `scratch/exp_pop_return_watch_remove.py` harness implementing an out-of-tree `PopReturnWatchRemoveSolver` that uses a pop-return swap-removal pattern in the three watcher-removal sites inside `propagate()`. Compared it against the retained solver on the serial five-case hotspot slice in forward and reverse order, then revalidated the retained baseline after removing the scratch harness.","files_changed":["agent_log.md","experiments.jsonl","benchmark_summary.md","next_steps.md"],"datasets":["large/test_6.cnf","special/hard.cnf","medium/test_4.cnf","large/test_10.cnf","large/test_8.cnf","small/test_1.cnf","special/tseitin.cnf"],"commands":["python -m py_compile scratch/exp_pop_return_watch_remove.py","PYTHONPATH=. python scratch/exp_pop_return_watch_remove.py","python -m unittest discover -s tests -v","python satsolver.py small/test_1.cnf /tmp/cycle_sat_check.txt","python tools/checker.py small/test_1.cnf /tmp/cycle_sat_check.txt","python satsolver.py special/tseitin.cnf /tmp/cycle_unsat_check.txt","python tools/checker.py special/tseitin.cnf /tmp/cycle_unsat_check.txt --bruteforce-var-limit 0"],"metrics_before":{"forward_total_s":29.1168,"forward_large_test_6_s":13.0567,"forward_special_hard_s":8.5248,"forward_medium_test_4_s":1.8264,"forward_large_test_10_s":1.8289,"forward_large_test_8_s":3.8801,"reverse_total_s":26.7996,"reverse_large_test_8_s":3.5038,"reverse_large_test_10_s":1.6205,"reverse_medium_test_4_s":1.7077,"reverse_special_hard_s":8.074,"reverse_large_test_6_s":11.8937,"baseline_large_test_6_conflicts":59201,"baseline_special_hard_conflicts":44619,"baseline_medium_test_4_conflicts":10995,"baseline_large_test_10_conflicts":9650,"baseline_large_test_8_conflicts":16430,"unit_test_count":37},"metrics_after":{"forward_total_s":29.0476,"forward_large_test_6_s":13.9148,"forward_special_hard_s":8.3271,"forward_medium_test_4_s":1.7317,"forward_large_test_10_s":1.6393,"forward_large_test_8_s":3.4347,"reverse_total_s":27.2231,"reverse_large_test_8_s":3.4035,"reverse_large_test_10_s":1.6409,"reverse_medium_test_4_s":1.7559,"reverse_special_hard_s":8.2356,"reverse_large_test_6_s":12.1872,"candidate_large_test_6_conflicts":59201,"candidate_special_hard_conflicts":44619,"candidate_medium_test_4_conflicts":10995,"candidate_large_test_10_conflicts":9650,"candidate_large_test_8_conflicts":16430,"two_order_baseline_avg_s":27.9582,"two_order_candidate_avg_s":28.1354,"same_conflicts_all_cases":true,"unit_test_count":37},"correctness_status":"the temporary branch preserved SAT/UNSAT outcomes and exact conflict counts on the five-case hotspot slice, and the retained production solver still passed 37 regression tests plus SAT/UNSAT checker spot checks after the scratch harness was removed","decision":"discard","notes":"This was a clean same-search micro-optimization test, but the two-order average still regressed. Future watcher-churn work needs a larger structural reduction than shaving one indexed read off the current swap-pop removal path."}
