{"timestamp":"2026-03-20T14:22:52+01:00","experiment_id":"2026-03-20-reject-inline-problem-reasons","hypothesis":"Because `analyze()` and `minimize_learnt()` on the dense hotspots are dominated by original-clause binary/ternary reasons, storing problem reasons directly per variable during propagation may remove enough clause dereference and literal-loop overhead to beat the retained baseline without changing the search path.","change_summary":"Measured a temporary `InlineProblemReasonSolver` in `scratch/exp_inline_problem_reasons.py` that stored problem binary/ternary reasons as per-variable literals instead of clause ids, then discarded it after forward/reverse hotspot A/B regressed while preserving identical conflicts on every case. No production solver code was changed.","files_changed":["agent_log.md","experiments.jsonl","benchmark_summary.md","next_steps.md"],"datasets":["large/test_6.cnf","special/hard.cnf","medium/test_4.cnf","large/test_10.cnf","large/test_8.cnf","small/test_1.cnf","special/tseitin.cnf"],"commands":["python tools/profile_solver.py large/test_6.cnf special/hard.cnf medium/test_4.cnf large/test_8.cnf","python -m cProfile -s tottime satsolver.py large/test_6.cnf /tmp/profile_large6.out","python -m cProfile -s tottime satsolver.py special/hard.cnf /tmp/profile_hard.out","python -m py_compile scratch/exp_inline_problem_reasons.py","PYTHONPATH=. python scratch/exp_inline_problem_reasons.py","python -m unittest discover -s tests -v","python satsolver.py small/test_1.cnf /tmp/inline_problem_reason_sat.txt","python tools/checker.py small/test_1.cnf /tmp/inline_problem_reason_sat.txt","python satsolver.py special/tseitin.cnf /tmp/inline_problem_reason_unsat.txt","python tools/checker.py special/tseitin.cnf /tmp/inline_problem_reason_unsat.txt --bruteforce-var-limit 0"],"metrics_before":{"forward_baseline_total_s":28.7236,"forward_baseline_large_test_6_s":13.1154,"forward_baseline_special_hard_s":8.5334,"forward_baseline_medium_test_4_s":1.7851,"forward_baseline_large_test_10_s":1.7195,"forward_baseline_large_test_8_s":3.5703,"reverse_baseline_total_s":29.0555,"reverse_baseline_large_test_8_s":3.7153,"reverse_baseline_large_test_10_s":1.7781,"reverse_baseline_medium_test_4_s":1.8081,"reverse_baseline_special_hard_s":8.5123,"reverse_baseline_large_test_6_s":13.2417,"average_baseline_total_s":28.8895,"large_test_6_conflicts":59201,"special_hard_conflicts":44619,"medium_test_4_conflicts":10995,"large_test_10_conflicts":9650,"large_test_8_conflicts":16430,"unit_test_count":27},"metrics_after":{"forward_experimental_total_s":32.2391,"forward_experimental_large_test_6_s":14.6982,"forward_experimental_special_hard_s":9.5869,"forward_experimental_medium_test_4_s":2.0299,"forward_experimental_large_test_10_s":1.9032,"forward_experimental_large_test_8_s":4.0209,"reverse_experimental_total_s":31.5227,"reverse_experimental_large_test_8_s":3.9725,"reverse_experimental_large_test_10_s":1.8977,"reverse_experimental_medium_test_4_s":2.0177,"reverse_experimental_special_hard_s":9.3703,"reverse_experimental_large_test_6_s":14.2645,"average_experimental_total_s":31.8809,"large_test_6_conflicts":59201,"special_hard_conflicts":44619,"medium_test_4_conflicts":10995,"large_test_10_conflicts":9650,"large_test_8_conflicts":16430,"unit_test_count":27},"correctness_status":"the temporary branch preserved SAT/UNSAT outcomes and identical conflict counts on the hotspot slice, and the retained production solver still passed all 27 regression tests plus SAT/UNSAT checker spot checks after the scratch experiment was removed","decision":"discard","notes":"This was a pure-overhead structural miss. Removing clause lookups on the problem binary/ternary reason path was not enough to pay for the extra per-variable side state and propagation bookkeeping, so future reason-traversal work needs a stronger simplification story than inline-problem-reason arrays."}
{"timestamp":"2026-03-20T14:31:02+01:00","experiment_id":"2026-03-20-keep-ternary-relocation-outcome-profiler","hypothesis":"If a large share of ternary relocations goes to already-`TRUE` candidate literals, then a selective satisfied-candidate propagation idea might still be viable; if relocations overwhelmingly go to `UNASSIGNED` candidates, then satisfied-candidate work is a minority path and future propagation work should target the larger branch instead.","change_summary":"Extended `tools/profile_solver.py` to split ternary relocations by candidate literal value (`TRUE` vs `UNASSIGNED`) and by problem-clause versus learnt-clause family, added regression coverage in `tests/test_profile_solver.py`, and reran the profiler on the main hotspot cases. The production solver was unchanged.","files_changed":["tools/profile_solver.py","tests/test_profile_solver.py","agent_log.md","experiments.jsonl","benchmark_summary.md","next_steps.md"],"datasets":["large/test_6.cnf","special/hard.cnf","medium/test_4.cnf","large/test_8.cnf","small/test_1.cnf","special/tseitin.cnf"],"commands":["python -m py_compile tools/profile_solver.py tests/test_profile_solver.py","python -m unittest discover -s tests -v","python tools/profile_solver.py large/test_6.cnf special/hard.cnf medium/test_4.cnf large/test_8.cnf","python satsolver.py small/test_1.cnf /tmp/profile_reloc_sat.txt","python tools/checker.py small/test_1.cnf /tmp/profile_reloc_sat.txt","python satsolver.py special/tseitin.cnf /tmp/profile_reloc_unsat.txt","python tools/checker.py special/tseitin.cnf /tmp/profile_reloc_unsat.txt --bruteforce-var-limit 0"],"metrics_before":{"unit_test_count":27},"metrics_after":{"unit_test_count":28,"large_test_6_problem_ternary_true_relocations":616978,"large_test_6_problem_ternary_unassigned_relocations":4017481,"large_test_6_learnt_ternary_true_relocations":33768,"large_test_6_learnt_ternary_unassigned_relocations":145267,"large_test_6_ternary_true_relocation_share":0.1352,"special_hard_problem_ternary_true_relocations":382668,"special_hard_problem_ternary_unassigned_relocations":1878564,"special_hard_learnt_ternary_true_relocations":28132,"special_hard_learnt_ternary_unassigned_relocations":94498,"special_hard_ternary_true_relocation_share":0.1723,"medium_test_4_problem_ternary_true_relocations":99743,"medium_test_4_problem_ternary_unassigned_relocations":499626,"medium_test_4_learnt_ternary_true_relocations":6528,"medium_test_4_learnt_ternary_unassigned_relocations":19684,"medium_test_4_ternary_true_relocation_share":0.1699,"large_test_8_problem_ternary_true_relocations":149235,"large_test_8_problem_ternary_unassigned_relocations":865273,"large_test_8_learnt_ternary_true_relocations":6675,"large_test_8_learnt_ternary_unassigned_relocations":26262,"large_test_8_ternary_true_relocation_share":0.1488},"correctness_status":"the production solver was unchanged and still passed 28 regression tests plus SAT/UNSAT checker spot checks; the new profiler counters are covered by the profiler regression suite","decision":"keep","notes":"This is a measurement upgrade, not a solver-speed change. The new data says only about 13.5%..17.2% of ternary relocations target already-TRUE candidates, so narrowly satisfied-candidate propagation ideas are aimed at the minority path rather than the bulk of relocation work."}
{"timestamp":"2026-03-20T14:39:12+01:00","experiment_id":"2026-03-20-keep-ternary-relocation-other-state-profiler","hypothesis":"If many ternary relocations happen with the other watched literal already `FALSE`, then rescue-path propagation ideas might still matter; if that share is tiny, then future propagation work should stop focusing on the no-replacement tail and target the broader relocation path instead.","change_summary":"Extended `tools/profile_solver.py` to split ternary relocations by the other watched literal state (`FALSE` vs `UNASSIGNED`) in addition to candidate value and clause family, added regression coverage in `tests/test_profile_solver.py`, and reran the profiler on the main hotspot cases. The production solver was unchanged.","files_changed":["tools/profile_solver.py","tests/test_profile_solver.py","agent_log.md","experiments.jsonl","benchmark_summary.md","next_steps.md"],"datasets":["large/test_6.cnf","special/hard.cnf","medium/test_4.cnf","large/test_8.cnf","small/test_1.cnf","special/tseitin.cnf"],"commands":["python -m py_compile tools/profile_solver.py tests/test_profile_solver.py","python -m unittest discover -s tests -v","python tools/profile_solver.py large/test_6.cnf special/hard.cnf medium/test_4.cnf large/test_8.cnf","python satsolver.py small/test_1.cnf /tmp/profile_reloc2_sat.txt","python tools/checker.py small/test_1.cnf /tmp/profile_reloc2_sat.txt","python satsolver.py special/tseitin.cnf /tmp/profile_reloc2_unsat.txt","python tools/checker.py special/tseitin.cnf /tmp/profile_reloc2_unsat.txt --bruteforce-var-limit 0"],"metrics_before":{"unit_test_count":28},"metrics_after":{"unit_test_count":28,"large_test_6_problem_ternary_false_other_relocations":76358,"large_test_6_problem_ternary_unassigned_other_relocations":4558101,"large_test_6_learnt_ternary_false_other_relocations":2982,"large_test_6_learnt_ternary_unassigned_other_relocations":176053,"large_test_6_ternary_false_other_relocation_share":0.0165,"special_hard_problem_ternary_false_other_relocations":42944,"special_hard_problem_ternary_unassigned_other_relocations":2218288,"special_hard_learnt_ternary_false_other_relocations":2129,"special_hard_learnt_ternary_unassigned_other_relocations":120501,"special_hard_ternary_false_other_relocation_share":0.0189,"medium_test_4_problem_ternary_false_other_relocations":11900,"medium_test_4_problem_ternary_unassigned_other_relocations":587469,"medium_test_4_learnt_ternary_false_other_relocations":542,"medium_test_4_learnt_ternary_unassigned_other_relocations":25670,"medium_test_4_ternary_false_other_relocation_share":0.0199,"large_test_8_problem_ternary_false_other_relocations":15495,"large_test_8_problem_ternary_unassigned_other_relocations":999013,"large_test_8_learnt_ternary_false_other_relocations":486,"large_test_8_learnt_ternary_unassigned_other_relocations":32451,"large_test_8_ternary_false_other_relocation_share":0.0153},"correctness_status":"the production solver was unchanged and still passed 28 regression tests plus SAT/UNSAT checker spot checks; the new profiler counters are covered by the profiler regression suite","decision":"keep","notes":"This is another measurement upgrade, not a solver-speed change. The new data says only about 1.5%..2.0% of ternary relocations happen with the other watched literal already FALSE, so rescue-path relocation ideas are aimed at a tiny minority of the real ternary relocation workload."}
{"timestamp":"2026-03-20T15:00:25+01:00","experiment_id":"2026-03-20-keep-gated-root-pure-presolve","hypothesis":"Iterative root pure-literal elimination may be worthwhile on the real corpus, but low-yield one-literal root simplifications are likely to perturb the dense hotspot search paths more than they help, so any production keep may need an explicit assignment-count gate rather than an always-on presolve.","change_summary":"Added iterative root pure-literal discovery over normalized clauses in `satsolver.py`, initially tested it as an always-on root presolve, rejected that ungated form after a same-day exact-CLI mixed slice regressed badly, then kept a gated version that only applies when the root fixpoint reaches at least two assignments. Mirrored the same gate in `tools/profile_solver.py`, added fixpoint and gate regressions in `tests/test_solver_regressions.py`, and refreshed both repeat-aware benchmark artifacts.","files_changed":["satsolver.py","tools/profile_solver.py","tests/test_solver_regressions.py","tests/test_profile_solver.py","agent_log.md","experiments.jsonl","benchmark_summary.md","next_steps.md","out_extended.txt","out_cli_extended.txt"],"datasets":["small/test_5.cnf","small/test_6.cnf","medium/test_8.cnf","large/test_1.cnf","large/test_2.cnf","large/test_7.cnf","special/easy.cnf","satlib_more/uf125-01.cnf","large/test_6.cnf","special/hard.cnf","medium/test_4.cnf","large/test_8.cnf","small/test_1.cnf","special/tseitin.cnf","small","medium","large","special","satlib_subset","satlib_more"],"commands":["python - <<'PY' ... iterative root pure-literal scan over the 59-case corpus ... PY","python - <<'PY' ... same-day exact-CLI mixed-slice baseline timing ... PY","python -m py_compile satsolver.py tools/profile_solver.py tests/test_solver_regressions.py tests/test_profile_solver.py","python -m unittest discover -s tests -v","python satsolver.py small/test_1.cnf /tmp/pure_cycle_sat.txt","python tools/checker.py small/test_1.cnf /tmp/pure_cycle_sat.txt","python satsolver.py special/tseitin.cnf /tmp/pure_cycle_unsat.txt","python tools/checker.py special/tseitin.cnf /tmp/pure_cycle_unsat.txt --bruteforce-var-limit 0","python - <<'PY' ... same-day exact-CLI mixed-slice timing for the ungated pure-literal branch ... PY","python - <<'PY' ... same-day exact-CLI mixed-slice timing for the gated >=2-assignment branch ... PY","python benchmark_suite.py satsolver out_extended.txt small medium large special satlib_subset satlib_more --bruteforce-var-limit 16 --repeat 2","python benchmark_suite.py satsolver out_cli_extended.txt small medium large special satlib_subset satlib_more --bruteforce-var-limit 16 --cli-script satsolver.py --repeat 2","python benchmark_suite.py satsolver out_cli_extended.txt small medium large special satlib_subset satlib_more --bruteforce-var-limit 16 --cli-script satsolver.py --repeat 2"],"metrics_before":{"exact_cli_mixed_slice_total_s":22.2586,"exact_cli_mixed_slice_large_test_6_s":11.8230,"exact_cli_mixed_slice_special_hard_s":8.0775,"exact_cli_mixed_slice_medium_test_4_s":1.6898,"exact_cli_mixed_slice_large_test_8_s":0.2907,"repeat2_inprocess_total_s":25.2549,"repeat2_exact_cli_best_total_s":27.1974,"unit_test_count":28},"metrics_after":{"pure_literal_cases":16,"pure_literal_total_assignments":285,"ungated_exact_cli_mixed_slice_total_s":25.1953,"ungated_exact_cli_mixed_slice_large_test_6_s":14.8664,"ungated_exact_cli_mixed_slice_large_test_8_s":0.3593,"gated_exact_cli_mixed_slice_total_s":22.0635,"gated_exact_cli_mixed_slice_large_test_6_s":11.9292,"gated_exact_cli_mixed_slice_special_hard_s":7.8507,"gated_exact_cli_mixed_slice_medium_test_4_s":1.6477,"gated_exact_cli_mixed_slice_large_test_8_s":0.2873,"repeat2_inprocess_total_s":25.1541,"repeat2_inprocess_measured_total_s":50.3082,"repeat2_exact_cli_rerun1_total_s":27.7868,"repeat2_exact_cli_rerun1_measured_total_s":55.5737,"repeat2_exact_cli_rerun2_total_s":27.6136,"repeat2_exact_cli_rerun2_measured_total_s":55.2273,"unit_test_count":31},"correctness_status":"passed 31 regression tests including new pure-fixpoint and gate invariants, SAT/UNSAT checker spot checks, and validated 59/59 repeat-aware full-suite runs in both module and exact-CLI modes; the profiler path now mirrors the same gated root presolve as the production solver","decision":"keep","notes":"The ungated idea is a dead end, but the >=2-assignment gate makes it worth keeping. Same-day exact-CLI mixed-slice A/B turned positive again after the gate, and the repeat-aware in-process full suite set a new local best. The exact-CLI repeat-aware full-suite signal remained mixed across two reruns, so future presolve work should demand stronger same-day exact-CLI evidence before broadening this presolve beyond the current gate."}
{"timestamp":"2026-03-20T15:11:38+01:00","experiment_id":"2026-03-20-reject-root-pure-threshold-5","hypothesis":"Because the current `>= 2` root pure-literal gate still admits a few low-shrink pure-hit cases, raising the gate to `>= 5` assignments might preserve the large simplification wins while improving the exact required CLI path overall.","change_summary":"Benchmarked temporary `/tmp/satsolver_rootpure_*.py` variants with root pure gates `>= 2`, `>= 5`, `>= 10`, and `>= 20` on exact-CLI pure-hit slices, then compared `>= 2` vs `>= 5` on the same-day exact-CLI mixed slice and a full repeat-aware exact-CLI 59-case suite. Discarded the `>= 5` variant after it lost the real full-suite gate despite looking better on the smaller slices. The production solver stayed unchanged.","files_changed":["agent_log.md","experiments.jsonl","benchmark_summary.md","next_steps.md"],"datasets":["small/test_1.cnf","small/test_5.cnf","small/test_6.cnf","small/test_9.cnf","medium/test_8.cnf","large/test_1.cnf","large/test_2.cnf","large/test_7.cnf","large/test_9.cnf","special/easy.cnf","large/test_6.cnf","special/hard.cnf","medium/test_4.cnf","large/test_8.cnf","small","medium","large","special","satlib_subset","satlib_more"],"commands":["python - <<'PY' ... per-case root pure assignment and clause-removal stats over the corpus ... PY","python - <<'PY' ... in-process pure-hit gate sweep for current_ge2, ge5, ge2_frac10, ge2_removed20, ge5_or_removed50 ... PY","python - <<'PY' ... build temporary /tmp/satsolver_rootpure_{2,5,10,20}.py variants and benchmark the exact-CLI pure-hit slice ... PY","python - <<'PY' ... exact-CLI mixed-slice compare for /tmp/satsolver_rootpure_2.py vs /tmp/satsolver_rootpure_5.py ... PY","python benchmark_suite.py satsolver /tmp/out_cli_threshold5.txt small medium large special satlib_subset satlib_more --bruteforce-var-limit 16 --cli-script /tmp/satsolver_rootpure_5.py --repeat 2","python -m unittest discover -s tests -v"],"metrics_before":{"exact_cli_pure_hit_threshold2_total_s":0.4591,"exact_cli_mixed_threshold2_total_s":22.5906,"exact_cli_mixed_threshold2_large_test_6_s":12.1779,"exact_cli_mixed_threshold2_special_hard_s":7.8172,"exact_cli_mixed_threshold2_medium_test_4_s":1.8268,"exact_cli_mixed_threshold2_large_test_8_s":0.3040,"repeat2_exact_cli_retained_total_s":27.6136,"historical_repeat2_exact_cli_best_total_s":27.1974,"unit_test_count":31},"metrics_after":{"exact_cli_pure_hit_threshold5_total_s":0.4217,"exact_cli_pure_hit_threshold10_total_s":0.4657,"exact_cli_pure_hit_threshold20_total_s":0.4921,"exact_cli_mixed_threshold5_total_s":22.1814,"exact_cli_mixed_threshold5_large_test_6_s":12.0150,"exact_cli_mixed_threshold5_special_hard_s":7.8153,"exact_cli_mixed_threshold5_medium_test_4_s":1.6548,"exact_cli_mixed_threshold5_large_test_8_s":0.3067,"repeat2_exact_cli_threshold5_total_s":27.7944,"repeat2_exact_cli_threshold5_measured_total_s":55.5889,"unit_test_count":31},"correctness_status":"the temporary `>= 5` variant still solved 59/59 correctly on the repeat-aware exact-CLI full suite, and the retained production solver continued to pass all 31 regression tests","decision":"discard","notes":"This is a useful anti-cherrypicking result. A larger pure-assignment threshold looked clearly better on both the exact-CLI pure-hit slice and the mixed hotspot slice, but still lost the real repeat-aware exact-CLI suite. Future root pure-literal gate tuning needs a classifier stronger than assignment count alone and still has to earn a full exact-CLI win before changing the retained solver."}
{"timestamp":"2026-03-20T15:11:38+01:00","experiment_id":"2026-03-20-reject-root-pure-initialscreen","hypothesis":"Because every currently useful corpus case with total root pure assignments `>= 2` already has at least two first-round pure literals, a cheap first-round purity screen might skip the full iterative presolve on most no-op cases without sacrificing the real presolve wins.","change_summary":"Measured first-round pure counts against total iterative pure counts across the 59-case corpus, built a temporary `/tmp/satsolver_rootpure_initialscreen.py` that adds an extra first-round polarity scan before the current iterative pure-literal presolve, then discarded it after a slight mixed-slice gain failed badly on the repeat-aware exact-CLI 59-case suite. The production solver stayed unchanged.","files_changed":["agent_log.md","experiments.jsonl","benchmark_summary.md","next_steps.md"],"datasets":["small","medium","large","special","satlib_subset","satlib_more","small/test_1.cnf","small/test_5.cnf","small/test_6.cnf","small/test_9.cnf","medium/test_8.cnf","large/test_1.cnf","large/test_2.cnf","large/test_7.cnf","large/test_9.cnf","special/easy.cnf","large/test_6.cnf","special/hard.cnf","medium/test_4.cnf","large/test_8.cnf"],"commands":["python - <<'PY' ... first-round pure counts vs total iterative pure counts across the 59-case corpus ... PY","python - <<'PY' ... build /tmp/satsolver_rootpure_initialscreen.py with an extra first-round polarity prescan ... PY","python - <<'PY' ... exact-CLI mixed-slice compare for current satsolver.py vs /tmp/satsolver_rootpure_initialscreen.py ... PY","python benchmark_suite.py satsolver /tmp/out_cli_initialscreen.txt small medium large special satlib_subset satlib_more --bruteforce-var-limit 16 --cli-script /tmp/satsolver_rootpure_initialscreen.py --repeat 2","python -m unittest discover -s tests -v"],"metrics_before":{"exact_cli_mixed_current_total_s":23.4612,"repeat2_exact_cli_retained_total_s":27.6136,"historical_repeat2_exact_cli_best_total_s":27.1974,"unit_test_count":31},"metrics_after":{"useful_cases_with_first_round_ge2":12,"useful_cases_with_first_round_lt2":0,"one_pure_cases_total":4,"exact_cli_mixed_initialscreen_total_s":23.3365,"repeat2_exact_cli_initialscreen_total_s":29.3678,"repeat2_exact_cli_initialscreen_measured_total_s":58.7356,"unit_test_count":31},"correctness_status":"the temporary initial-screen variant still solved 59/59 correctly on the repeat-aware exact-CLI full suite, and the retained production solver continued to pass all 31 regression tests","decision":"discard","notes":"Another anti-cherrypicking result. The screen predicted the current corpus shape perfectly and still lost badly because the extra whole-formula normalization/polarity pass cost more than it saved on the full submission path. Future root pure-literal gating should avoid additional front-loaded passes unless they remove much larger downstream work."}
