{"timestamp":"2026-03-20T22:38:00+01:00","experiment_id":"2026-03-20-keep-watcher-pop-cause-split","hypothesis":"If watcher-list removals are dominated by deleted learnt cleanup or learnt-side relocations, future propagation work should revisit those paths; if original-clause ternary relocations dominate, the next meaningful propagation experiment should target that bucket first.","change_summary":"Extended `tools/profile_solver.py` with watcher-pop cause/family counters that split deleted learnt cleanup from problem-ternary, learnt-ternary, and learnt-large relocation removals. Added matching regression invariants in `tests/test_profile_solver.py`, reran the hotspot profiler, extracted per-bucket watcher-pop shares, and updated the repo notes. The production solver stayed unchanged.","files_changed":["tools/profile_solver.py","tests/test_profile_solver.py","agent_log.md","experiments.jsonl","benchmark_summary.md","next_steps.md"],"datasets":["large/test_6.cnf","special/hard.cnf","medium/test_4.cnf","large/test_8.cnf"],"commands":["python -m py_compile tools/profile_solver.py tests/test_profile_solver.py","python -m unittest discover -s tests -v","python tools/profile_solver.py large/test_6.cnf special/hard.cnf medium/test_4.cnf large/test_8.cnf","python - <<'PY' ... solve_with_profile(...) ... PY"],"metrics_before":{"unit_test_count":37,"large_test_6_watcher_list_pops":6672717,"special_hard_watcher_list_pops":4006772,"medium_test_4_watcher_list_pops":847698,"large_test_8_watcher_list_pops":1372645},"metrics_after":{"unit_test_count":37,"large_test_6_deleted_watch_pop_share":0.0174,"large_test_6_problem_ternary_relocation_pop_share":0.6945,"large_test_6_learnt_ternary_relocation_pop_share":0.0268,"large_test_6_learnt_large_relocation_pop_share":0.2612,"special_hard_deleted_watch_pop_share":0.0218,"special_hard_problem_ternary_relocation_pop_share":0.5644,"special_hard_learnt_ternary_relocation_pop_share":0.0306,"special_hard_learnt_large_relocation_pop_share":0.3833,"medium_test_4_deleted_watch_pop_share":0.0249,"medium_test_4_problem_ternary_relocation_pop_share":0.7071,"medium_test_4_learnt_ternary_relocation_pop_share":0.0309,"medium_test_4_learnt_large_relocation_pop_share":0.2371,"large_test_8_deleted_watch_pop_share":0.0233,"large_test_8_problem_ternary_relocation_pop_share":0.7391,"large_test_8_learnt_ternary_relocation_pop_share":0.024,"large_test_8_learnt_large_relocation_pop_share":0.2136,"problem_large_relocation_pops_all_hotspots":0},"correctness_status":"the production solver was unchanged and still passed 37 regression tests; the new watcher-pop cause counters are covered by profiler invariants and the hotspot profiler rerun completed cleanly","decision":"keep","notes":"This is a profiling upgrade, not a solver-speed keep. On the main hotspots, deleted-watch cleanup is only about 1.7%..2.5% of watcher pops, while original problem-ternary relocations account for about 56.4%..73.9% and learnt-large relocations account for another 21.4%..38.3%, so future watcher-churn work should target original-ternary relocation first."}
{"timestamp":"2026-03-20T22:48:54+01:00","experiment_id":"2026-03-20-keep-ternary-normalized-outcome-split","hypothesis":"If most original-ternary relocations and units still arrive through watched-slot normalization, then watch-order or swap-avoidance ideas might still cover a large fraction of the hotspot; if only a minority does, then those ideas are even lower value than the earlier lazy-normalization reject already suggested.","change_summary":"Extended `tools/profile_solver.py` with problem-vs-learnt ternary relocation/unit/conflict counters that track whether the clause first passed through watched-slot normalization. Added matching regression invariants in `tests/test_profile_solver.py`, reran the hotspot profiler through `solve_with_profile(...)`, and updated the repo notes. The production solver stayed unchanged.","files_changed":["tools/profile_solver.py","tests/test_profile_solver.py","agent_log.md","experiments.jsonl","benchmark_summary.md","next_steps.md"],"datasets":["large/test_6.cnf","special/hard.cnf","medium/test_4.cnf","large/test_8.cnf"],"commands":["python -m py_compile tools/profile_solver.py tests/test_profile_solver.py","python -m unittest discover -s tests -v","python - <<'PY' ... solve_with_profile(...) ... PY"],"metrics_before":{"unit_test_count":37},"metrics_after":{"unit_test_count":37,"large_test_6_problem_normalized_relocation_share":0.334,"large_test_6_problem_normalized_unit_share":0.2962,"large_test_6_problem_normalized_conflict_share":0.4754,"large_test_6_learnt_normalized_relocation_share":0.3431,"large_test_6_learnt_normalized_unit_share":0.2881,"large_test_6_learnt_normalized_conflict_share":0.4505,"special_hard_problem_normalized_relocation_share":0.3226,"special_hard_problem_normalized_unit_share":0.284,"special_hard_problem_normalized_conflict_share":0.4784,"special_hard_learnt_normalized_relocation_share":0.3387,"special_hard_learnt_normalized_unit_share":0.2869,"special_hard_learnt_normalized_conflict_share":0.4473,"medium_test_4_problem_normalized_relocation_share":0.3365,"medium_test_4_problem_normalized_unit_share":0.2981,"medium_test_4_problem_normalized_conflict_share":0.4803,"medium_test_4_learnt_normalized_relocation_share":0.3511,"medium_test_4_learnt_normalized_unit_share":0.2875,"medium_test_4_learnt_normalized_conflict_share":0.4693,"large_test_8_problem_normalized_relocation_share":0.3116,"large_test_8_problem_normalized_unit_share":0.2711,"large_test_8_problem_normalized_conflict_share":0.4759,"large_test_8_learnt_normalized_relocation_share":0.3304,"large_test_8_learnt_normalized_unit_share":0.2879,"large_test_8_learnt_normalized_conflict_share":0.4716},"correctness_status":"the production solver was unchanged and still passed 37 regression tests; the new normalized-outcome counters are covered by profiler invariants and the hotspot share extraction completed cleanly","decision":"keep","notes":"This is a profiling upgrade, not a solver-speed keep. Only about 31.2%..33.7% of problem-ternary relocations and 27.1%..29.8% of problem-ternary units happen after watched-slot normalization, so future watch-order, watched-slot, or swap-avoidance ideas would only reach a minority of the dominant original-ternary relocation/unit workload."}
{"timestamp":"2026-03-20T23:06:07+01:00","experiment_id":"2026-03-20-reject-problem-ternary-watch-position-side-arrays","hypothesis":"Keeping problem ternary clauses in fixed literal order and updating only watched-position side arrays might reduce hot-loop Python overhead in the dominant original-ternary relocation/unit path while preserving the exact same search path.","change_summary":"Benchmarked an out-of-tree `OrientationSolver` scratch variant that attaches non-learnt ternary problem clauses through watched-position side arrays and handles their propagation without mutating `clause.lits`. Revalidated the retained production solver after discarding the branch.","files_changed":["agent_log.md","experiments.jsonl","benchmark_summary.md","next_steps.md"],"datasets":["large/test_6.cnf","special/hard.cnf","medium/test_4.cnf","large/test_8.cnf","large/test_10.cnf","small/test_1.cnf","special/tseitin.cnf"],"commands":["python - <<'PY' ... OrientationSolver hotspot A/B under bash ... PY","python -m unittest discover -s tests -v","python satsolver.py small/test_1.cnf /tmp/cycle_sat_keep.txt","python tools/checker.py small/test_1.cnf /tmp/cycle_sat_keep.txt","python satsolver.py special/tseitin.cnf /tmp/cycle_unsat_keep.txt","python tools/checker.py special/tseitin.cnf /tmp/cycle_unsat_keep.txt --bruteforce-var-limit 0"],"metrics_before":{"forward_total_s":35.4075,"forward_large_test_6_s":15.3857,"forward_special_hard_s":10.8601,"forward_medium_test_4_s":2.2061,"forward_large_test_8_s":4.9113,"forward_large_test_10_s":2.0443,"reverse_total_s":33.8519,"reverse_large_test_10_s":2.0709,"reverse_large_test_8_s":4.0539,"reverse_medium_test_4_s":2.1234,"reverse_special_hard_s":9.9794,"reverse_large_test_6_s":15.6243,"baseline_large_test_6_conflicts":59201,"baseline_special_hard_conflicts":44619,"baseline_medium_test_4_conflicts":10995,"baseline_large_test_8_conflicts":16430,"baseline_large_test_10_conflicts":9650,"unit_test_count":37},"metrics_after":{"forward_total_s":38.7377,"forward_large_test_6_s":18.0354,"forward_special_hard_s":11.4496,"forward_medium_test_4_s":2.3032,"forward_large_test_8_s":4.6278,"forward_large_test_10_s":2.3216,"reverse_total_s":37.5611,"reverse_large_test_10_s":2.5155,"reverse_large_test_8_s":4.7267,"reverse_medium_test_4_s":2.5006,"reverse_special_hard_s":11.6768,"reverse_large_test_6_s":16.1414,"candidate_large_test_6_conflicts":59201,"candidate_special_hard_conflicts":44619,"candidate_medium_test_4_conflicts":10995,"candidate_large_test_8_conflicts":16430,"candidate_large_test_10_conflicts":9650,"same_conflicts_all_cases":true,"unit_test_count":37},"correctness_status":"the scratch branch preserved SAT/UNSAT correctness and exact conflict counts on the hotspot slice, and the retained production solver still passed 37 regression tests plus SAT/UNSAT checker spot checks after the branch was discarded","decision":"discard","notes":"This was a clean same-search structural propagation experiment, but fixed-order problem ternary clauses plus watched-position side state still regressed badly in both orders. Replacing `clause.lits` mutation with extra watched-position state is not enough by itself."}
{"timestamp":"2026-03-20T23:13:51+01:00","experiment_id":"2026-03-20-reject-satsolver-blaze-as-alternate-worker","hypothesis":"If `satsolver_blaze.py` still beats the retained solver on some of the live hotspot cases, it may still justify alternate-worker or portfolio attention; if the current solver now dominates it broadly, that older benchmark note is stale as a lead.","change_summary":"Compared module-mode `satsolver.solve_cnf_serial(...)` directly against `satsolver_blaze.solve_cnf(...)` on the five-case hotspot slice in forward and reverse order, validating each produced model. Revalidated the retained production solver after treating the sibling solver as a rejected alternate-worker lead.","files_changed":["agent_log.md","experiments.jsonl","benchmark_summary.md","next_steps.md"],"datasets":["large/test_6.cnf","special/hard.cnf","medium/test_4.cnf","large/test_8.cnf","large/test_10.cnf","small/test_1.cnf","special/tseitin.cnf"],"commands":["python - <<'PY' ... compare satsolver.solve_cnf_serial(...) vs satsolver_blaze.solve_cnf(...) ... PY","python -m unittest discover -s tests -v","python satsolver.py small/test_1.cnf /tmp/cycle_sat_continue.txt","python tools/checker.py small/test_1.cnf /tmp/cycle_sat_continue.txt","python satsolver.py special/tseitin.cnf /tmp/cycle_unsat_continue.txt","python tools/checker.py special/tseitin.cnf /tmp/cycle_unsat_continue.txt --bruteforce-var-limit 0"],"metrics_before":{"forward_current_total_s":29.8179,"forward_large_test_6_current_s":13.1016,"forward_special_hard_current_s":8.8253,"forward_medium_test_4_current_s":1.7094,"forward_large_test_8_current_s":3.822,"forward_large_test_10_current_s":2.3596,"reverse_current_total_s":35.8424,"reverse_large_test_10_current_s":1.7615,"reverse_large_test_8_current_s":4.1164,"reverse_medium_test_4_current_s":2.3242,"reverse_special_hard_current_s":11.8989,"reverse_large_test_6_current_s":15.7414,"unit_test_count":37},"metrics_after":{"forward_blaze_total_s":35.5141,"forward_large_test_6_blaze_s":15.3041,"forward_special_hard_blaze_s":10.3121,"forward_medium_test_4_blaze_s":2.1534,"forward_large_test_8_blaze_s":5.5525,"forward_large_test_10_blaze_s":2.192,"reverse_blaze_total_s":43.0727,"reverse_large_test_10_blaze_s":2.4557,"reverse_large_test_8_blaze_s":5.5901,"reverse_medium_test_4_blaze_s":2.8587,"reverse_special_hard_blaze_s":13.5085,"reverse_large_test_6_blaze_s":18.6597,"all_models_valid":true,"unit_test_count":37},"correctness_status":"both solvers produced valid SAT/UNSAT answers on the compared hotspot cases, and the retained production solver still passed 37 regression tests plus SAT/UNSAT checker spot checks","decision":"discard","notes":"On the current hotspot slice, the retained solver now beats `satsolver_blaze.py` clearly in both orders, so the sibling solver is not a strong alternate-worker lead anymore. Future portfolio work needs a more materially different and current search identity."}
{"timestamp":"2026-03-20T23:16:56+01:00","experiment_id":"2026-03-20-keep-problem-ternary-watch-batch-mix-split","hypothesis":"If active watcher batches that contain problem ternary clauses are already mostly homogeneous, then separate physical watch lists are probably another dead end before implementation; if they are frequently mixed with learnt-large traffic, then a true list split may still remove real mixed-list traversal work even though branch-hoisting inside the current mixed lists already lost.","change_summary":"Extended `tools/profile_solver.py` with problem-ternary watch-batch family-mix counters and CLI reporting, added regression invariants in `tests/test_profile_solver.py`, reran the hotspot profiler, and extracted batch-mix shares on the main cases. The production solver stayed unchanged.","files_changed":["tools/profile_solver.py","tests/test_profile_solver.py","agent_log.md","experiments.jsonl","benchmark_summary.md","next_steps.md"],"datasets":["large/test_6.cnf","special/hard.cnf","medium/test_4.cnf","large/test_8.cnf"],"commands":["python -m py_compile tools/profile_solver.py tests/test_profile_solver.py","python -m unittest discover -s tests -v","python tools/profile_solver.py large/test_6.cnf special/hard.cnf medium/test_4.cnf large/test_8.cnf","python - <<'PY' ... solve_with_profile(...) ... PY"],"metrics_before":{"unit_test_count":37},"metrics_after":{"unit_test_count":37,"large_test_6_problem_ternary_watch_batches":2305785,"large_test_6_problem_ternary_mixed_batch_share":0.6193,"large_test_6_avg_problem_ternary_batch_size":5.89,"large_test_6_avg_problem_ternary_batch_other_watchers":1.73,"large_test_6_problem_ternary_batch_learnt_large_share":0.2498,"special_hard_problem_ternary_watch_batches":1630366,"special_hard_problem_ternary_mixed_batch_share":0.7078,"special_hard_avg_problem_ternary_batch_size":5.9,"special_hard_avg_problem_ternary_batch_other_watchers":2.36,"special_hard_problem_ternary_batch_learnt_large_share":0.3461,"medium_test_4_problem_ternary_watch_batches":375152,"medium_test_4_problem_ternary_mixed_batch_share":0.5785,"medium_test_4_avg_problem_ternary_batch_size":5.3,"medium_test_4_avg_problem_ternary_batch_other_watchers":1.48,"medium_test_4_problem_ternary_batch_learnt_large_share":0.2186,"large_test_8_problem_ternary_watch_batches":781481,"large_test_8_problem_ternary_mixed_batch_share":0.4721,"large_test_8_avg_problem_ternary_batch_size":4.33,"large_test_8_avg_problem_ternary_batch_other_watchers":0.96,"large_test_8_problem_ternary_batch_learnt_large_share":0.1768},"correctness_status":"the production solver was unchanged and still passed 37 regression tests; the new batch-mix counters are covered by profiler invariants and the hotspot profiler rerun completed cleanly","decision":"keep","notes":"This is a profiling upgrade, not a solver-speed keep. Active watcher batches containing problem ternary clauses are frequently mixed with other families, especially learnt-large traffic, so a true physical watch-list split is not ruled out on homogeneity grounds alone even though branch-hoisting and per-clause-side-state ideas remain rejected."}
{"timestamp":"2026-03-20T23:18:27+01:00","experiment_id":"2026-03-20-keep-hotspot-compare-tool","hypothesis":"Because recent solver decisions depend on small forward/reverse hotspot A/B signals, a reusable comparison tool should reduce measurement friction and avoid ad hoc shell-snippet mistakes while preserving checker-backed validation.","change_summary":"Added `tools/hotspot_compare.py`, a reusable forward/reverse hotspot comparison runner supporting module-vs-module, module-vs-CLI, and CLI-vs-CLI checks with repeat-aware representative times and validation through the existing benchmark helpers. Added regression coverage in `tests/test_hotspot_compare.py`, ran a smoke comparison, and updated the repo notes. The production solver stayed unchanged.","files_changed":["tools/hotspot_compare.py","tests/test_hotspot_compare.py","agent_log.md","experiments.jsonl","benchmark_summary.md","next_steps.md"],"datasets":["small/test_1.cnf","special/tseitin.cnf"],"commands":["python -m py_compile tools/hotspot_compare.py tests/test_hotspot_compare.py","python -m unittest discover -s tests -v","python tools/hotspot_compare.py --baseline-module satsolver --candidate-cli-script satsolver.py small/test_1.cnf special/tseitin.cnf"],"metrics_before":{"unit_test_count":37},"metrics_after":{"unit_test_count":40,"forward_module_total_s":0.0013,"forward_cli_total_s":0.0761,"reverse_module_total_s":0.001,"reverse_cli_total_s":0.0834,"two_order_avg_module_s":0.0011,"two_order_avg_cli_s":0.0798},"correctness_status":"the production solver was unchanged and still passed 40 regression tests; the new tool smoke run validated SAT and UNSAT outputs cleanly in both orders","decision":"keep","notes":"This is a workflow upgrade, not a solver-speed keep. Future hotspot A/B checks should use the new tool instead of one-off shell snippets before spending full-suite benchmark time on small candidate changes."}
{"timestamp":"2026-03-20T23:37:45+01:00","experiment_id":"2026-03-20-reject-physical-problem-ternary-watch-split","hypothesis":"Because active watcher batches containing original problem ternary clauses are often mixed with learnt-large traffic, a true physical split between problem-ternary and general watcher lists might simplify the dominant propagation path more effectively than earlier branch-hoisting or clause-local-side-state variants.","change_summary":"Built and removed temporary `scratch/exp_problem_ternary_watch_split.py`, a `SplitWatchSolver` scratch module that keeps original non-learnt ternary clauses in dedicated watch lists while leaving the rest of the propagation path intact. Compared it against the retained serial baseline on representative hotspot cases with direct timing plus conflict counts, then updated the repo notes. The production solver stayed unchanged.","files_changed":["agent_log.md","experiments.jsonl","benchmark_summary.md","next_steps.md","scratch/exp_problem_ternary_watch_split.py"],"datasets":["large/test_6.cnf","special/hard.cnf","large/test_8.cnf"],"commands":["python -m py_compile scratch/exp_problem_ternary_watch_split.py","python -m unittest discover -s tests -v","python -u - <<'PY' ... baseline-vs-candidate serial compare on large/test_6.cnf, special/hard.cnf, large/test_8.cnf with conflict counts ... PY"],"metrics_before":{"unit_test_count":40,"large_test_6_baseline_s":11.9614,"large_test_6_baseline_conflicts":59201,"special_hard_baseline_s":7.9703,"special_hard_baseline_conflicts":44619,"large_test_8_baseline_s":3.3173,"large_test_8_baseline_conflicts":16430},"metrics_after":{"unit_test_count":40,"large_test_6_candidate_s":16.9394,"large_test_6_candidate_conflicts":81161,"special_hard_candidate_s":6.8413,"special_hard_candidate_conflicts":39511,"large_test_8_candidate_s":9.2863,"large_test_8_candidate_conflicts":44287},"correctness_status":"the scratch branch still returned valid SAT/UNSAT answers on the measured cases, and the retained production solver remained unchanged while the regression suite still passed 40 tests","decision":"discard","notes":"This is not just a Python-overhead loss. The split changes the search path in a family-specific way: it helps `special/hard.cnf`, but badly worsens `large/test_6.cnf` and `large/test_8.cnf`. Mixed-batch statistics alone are therefore not enough justification for a physical watcher split."}
