{"timestamp":"2026-03-20T23:37:45+01:00","experiment_id":"2026-03-20-keep-satsolver-fast-alt-cli-candidate","hypothesis":"Because the current root pure-literal presolve remains a real startup/search-path tradeoff and the historical best exact-CLI snapshot predates the current narrow root-pure keep, a lean alternate solver file that removes root-pure preprocessing while keeping the current CDCL core may beat the current real submission path even if the dense hotspot slice is only near-tied.","change_summary":"Added `satsolver_fast.py` as a lean alternate exact-CLI solver file that wraps the current solver core, presolvers, and portfolio path but skips root pure-literal presolve. Validated it on SAT and UNSAT smoke cases, added `tests/test_solver_fast.py`, compared it against `satsolver.py` on exact-CLI hotspot slices, ran same-day full exact-CLI single runs for both files, and saved a repeat-aware exact-CLI benchmark artifact to `out_fast_cli_extended.txt`. The production solver stayed unchanged.","files_changed":["satsolver_fast.py","tests/test_solver_fast.py","out_fast_cli_extended.txt","agent_log.md","experiments.jsonl","benchmark_summary.md","next_steps.md"],"datasets":["small/test_1.cnf","special/tseitin.cnf","large/test_6.cnf","special/hard.cnf","medium/test_4.cnf","large/test_10.cnf","large/test_8.cnf","small","medium","large","special","satlib_subset","satlib_more"],"commands":["python -m py_compile satsolver_fast.py","python satsolver_fast.py small/test_1.cnf /tmp/satsolver_fast_sat.txt","python tools/checker.py small/test_1.cnf /tmp/satsolver_fast_sat.txt","python satsolver_fast.py special/tseitin.cnf /tmp/satsolver_fast_unsat.txt","python tools/checker.py special/tseitin.cnf /tmp/satsolver_fast_unsat.txt --bruteforce-var-limit 0","python tools/hotspot_compare.py --baseline-cli-script satsolver.py --candidate-cli-script satsolver_fast.py small/test_1.cnf special/tseitin.cnf","python tools/hotspot_compare.py --baseline-cli-script satsolver.py --candidate-cli-script satsolver_fast.py large/test_6.cnf special/hard.cnf medium/test_4.cnf large/test_10.cnf large/test_8.cnf","python benchmark_suite.py satsolver /tmp/current_cli_suite.txt small medium large special satlib_subset satlib_more --bruteforce-var-limit 16 --cli-script satsolver.py","python benchmark_suite.py satsolver_fast /tmp/fast_cli_suite.txt small medium large special satlib_subset satlib_more --bruteforce-var-limit 16 --cli-script satsolver_fast.py","python benchmark_suite.py satsolver_fast /tmp/fast_cli_suite_repeat2.txt small medium large special satlib_subset satlib_more --bruteforce-var-limit 16 --cli-script satsolver_fast.py --repeat 2","python -m unittest discover -s tests -v"],"metrics_before":{"unit_test_count":40,"tiny_cli_two_order_baseline_avg_s":0.0825,"hotspot_cli_two_order_baseline_avg_s":24.1051,"same_day_current_cli_single_run_s":29.3963,"historical_best_exact_cli_repeat2_s":27.1974},"metrics_after":{"unit_test_count":43,"tiny_cli_two_order_candidate_avg_s":0.0627,"hotspot_cli_two_order_candidate_avg_s":24.0114,"same_day_fast_cli_single_run_s":28.4781,"same_day_fast_cli_single_run_delta_s":0.9182,"same_day_fast_cli_single_run_delta_pct":3.12,"fast_cli_repeat2_representative_s":27.3829,"fast_cli_repeat2_measured_s":54.7658,"fast_cli_repeat2_wall_clock_s":55.0034,"fast_cli_repeat2_solved_correctly":59},"correctness_status":"`satsolver_fast.py` produced valid SAT and UNSAT outputs on smoke checks, the exact-CLI benchmark harness solved 59/59 cases correctly in both single-run and repeat-aware modes, and the full regression suite now passes 43 tests including dedicated wrapper coverage","decision":"keep","notes":"This is an alternate exact-CLI solver keep, not a replacement for `satsolver.py`. The lean wrapper beats the current same-day exact-CLI full run and the latest current reruns, but it still does not beat the historical best exact-CLI repeat-aware snapshot for the main solver, so the right next move is smarter root-pure tuning rather than blindly deleting the presolve from the production file."}
{"timestamp":"2026-03-21T00:00:40+01:00","experiment_id":"2026-03-21-reject-satsolver-fast-no-model-self-check","hypothesis":"Because `satsolver_fast.py` is already a lean exact-CLI wrapper, removing the post-solve `model_satisfies(...)` sanity check might shave enough SAT-only CLI overhead to matter without changing the underlying search path.","change_summary":"Temporarily removed the internal SAT self-check from `satsolver_fast.py`, validated SAT and UNSAT smoke cases through `tools/checker.py`, reran the regression suite, measured exact-CLI hotspot slices, ran a repeat-aware exact-CLI 59-case suite, then directly timed cumulative `model_satisfies(...)` cost across the current SAT benchmark corpus. Restored the self-check after the measurements showed the removed work was too small to justify weakening the wrapper.","files_changed":["agent_log.md","experiments.jsonl","benchmark_summary.md","next_steps.md"],"datasets":["small/test_1.cnf","special/tseitin.cnf","small/test_5.cnf","small/test_6.cnf","small/test_9.cnf","medium/test_8.cnf","medium/test_9.cnf","large/test_1.cnf","large/test_2.cnf","large/test_5.cnf","large/test_7.cnf","large/test_9.cnf","special/easy.cnf","small/test_10.cnf","medium/test_3.cnf","medium/test_4.cnf","large/test_6.cnf","large/test_8.cnf","large/test_10.cnf","special/hard.cnf","small","medium","large","special","satlib_subset","satlib_more"],"commands":["python -m py_compile satsolver_fast.py","python satsolver_fast.py small/test_1.cnf /tmp/satsolver_fast_sat.txt","python tools/checker.py small/test_1.cnf /tmp/satsolver_fast_sat.txt","python satsolver_fast.py special/tseitin.cnf /tmp/satsolver_fast_unsat.txt","python tools/checker.py special/tseitin.cnf /tmp/satsolver_fast_unsat.txt --bruteforce-var-limit 0","python -m unittest discover -s tests -v","python tools/hotspot_compare.py --baseline-cli-script satsolver.py --candidate-cli-script satsolver_fast.py small/test_1.cnf small/test_5.cnf small/test_6.cnf small/test_9.cnf medium/test_8.cnf medium/test_9.cnf large/test_1.cnf large/test_2.cnf large/test_5.cnf large/test_7.cnf large/test_9.cnf special/easy.cnf","python tools/hotspot_compare.py --baseline-cli-script satsolver.py --candidate-cli-script satsolver_fast.py small/test_1.cnf small/test_10.cnf medium/test_3.cnf medium/test_4.cnf large/test_6.cnf large/test_8.cnf large/test_10.cnf special/hard.cnf special/tseitin.cnf","python benchmark_suite.py satsolver_fast /tmp/fast_cli_suite_repeat2_20260320_nomodelcheck.txt small medium large special satlib_subset satlib_more --bruteforce-var-limit 16 --cli-script satsolver_fast.py --repeat 2","python - <<'PY' ... solve SAT cases with satsolver_fast.solve_cnf(...) and time cumulative satsolver.model_satisfies(...) cost ... PY"],"metrics_before":{"retained_fast_cli_repeat2_s":27.3829,"retained_fast_cli_repeat2_measured_s":54.7658,"historical_best_exact_cli_repeat2_s":27.1974,"unit_test_count":43},"metrics_after":{"unit_test_count":43,"sat_root_hit_slice_two_order_avg_baseline_s":0.5238,"sat_root_hit_slice_two_order_avg_candidate_s":0.4232,"mixed_cli_slice_two_order_avg_baseline_s":24.4615,"mixed_cli_slice_two_order_avg_candidate_s":24.2157,"candidate_full_exact_cli_repeat2_s":27.6785,"candidate_full_exact_cli_repeat2_measured_s":55.3569,"candidate_full_exact_cli_repeat2_wall_clock_s":55.5967,"candidate_full_exact_cli_repeat2_solved_correctly":59,"sat_case_count":28,"sat_model_satisfies_total_s":0.005311,"sat_model_satisfies_max_case_s":0.000713,"sat_model_satisfies_max_case":"large/test_8.cnf"},"correctness_status":"the temporary no-self-check variant still produced checker-valid SAT and UNSAT outputs and the regression suite remained green during the experiment; after reverting, the retained `satsolver_fast.py` still passes 43 tests unchanged","decision":"discard","notes":"This branch only removed a millisecond-scale SAT-only postcheck. The explicit timing proved the removed work was tiny across the whole benchmark corpus, and the repeat-aware exact-CLI suite did not improve. So the self-check stays in `satsolver_fast.py` and future exact-CLI work should target larger levers."}
{"timestamp":"2026-03-21T00:10:14+01:00","experiment_id":"2026-03-21-reject-satsolver-fast-parse-time-first-pure-gate","hypothesis":"Because every current root-pure hit case already has at least two first-round pure literals, collecting first-round polarity counts during DIMACS parsing might let `satsolver_fast.py` reintroduce iterative root-pure preprocessing only on likely-hit formulas while keeping the no-root-pure startup win elsewhere.","change_summary":"Backed up the retained `satsolver_fast.py`, temporarily added parse-time first-round-pure counting plus a gated call to `find_iterative_root_pure_literals(...)`, validated SAT and UNSAT smoke cases, measured old-vs-new exact-CLI hotspot slices, then restored the retained no-root-pure wrapper after the signal failed to clear the bar.","files_changed":["agent_log.md","experiments.jsonl","benchmark_summary.md","next_steps.md"],"datasets":["small/test_1.cnf","special/tseitin.cnf","small/test_5.cnf","small/test_6.cnf","small/test_9.cnf","medium/test_8.cnf","medium/test_9.cnf","large/test_1.cnf","large/test_2.cnf","large/test_5.cnf","large/test_7.cnf","large/test_9.cnf","special/easy.cnf","small/test_10.cnf","medium/test_3.cnf","medium/test_4.cnf","large/test_6.cnf","large/test_8.cnf","large/test_10.cnf","special/hard.cnf"],"commands":["python - <<'PY' ... scan benchmark corpus for first_round_pure_count vs len(find_iterative_root_pure_literals(...)) ... PY","cp satsolver_fast.py /tmp/satsolver_fast_before_firstpure.py","python -m py_compile satsolver_fast.py","python satsolver_fast.py small/test_1.cnf /tmp/satsolver_fast_sat.txt","python tools/checker.py small/test_1.cnf /tmp/satsolver_fast_sat.txt","python satsolver_fast.py special/tseitin.cnf /tmp/satsolver_fast_unsat.txt","python tools/checker.py special/tseitin.cnf /tmp/satsolver_fast_unsat.txt --bruteforce-var-limit 0","cp /tmp/satsolver_fast_before_firstpure.py scratch_satsolver_fast_before_firstpure.py","python tools/hotspot_compare.py --baseline-cli-script scratch_satsolver_fast_before_firstpure.py --candidate-cli-script satsolver_fast.py small/test_1.cnf small/test_5.cnf small/test_6.cnf small/test_9.cnf medium/test_8.cnf medium/test_9.cnf large/test_1.cnf large/test_2.cnf large/test_5.cnf large/test_7.cnf large/test_9.cnf special/easy.cnf","python tools/hotspot_compare.py --baseline-cli-script scratch_satsolver_fast_before_firstpure.py --candidate-cli-script satsolver_fast.py small/test_1.cnf small/test_10.cnf medium/test_3.cnf medium/test_4.cnf large/test_6.cnf large/test_8.cnf large/test_10.cnf special/hard.cnf special/tseitin.cnf","cp scratch_satsolver_fast_before_firstpure.py satsolver_fast.py && rm scratch_satsolver_fast_before_firstpure.py","python -m py_compile satsolver_fast.py","python -m unittest discover -s tests -v"],"metrics_before":{"unit_test_count":43,"root_hit_slice_two_order_avg_baseline_s":0.4382,"mixed_slice_two_order_avg_baseline_s":24.6599},"metrics_after":{"unit_test_count":43,"root_hit_slice_two_order_avg_candidate_s":0.4407,"mixed_slice_two_order_avg_candidate_s":24.6480,"root_hit_slice_forward_baseline_s":0.4034,"root_hit_slice_forward_candidate_s":0.4552,"root_hit_slice_reverse_baseline_s":0.4729,"root_hit_slice_reverse_candidate_s":0.4263,"mixed_slice_forward_baseline_s":24.8187,"mixed_slice_forward_candidate_s":24.7334,"mixed_slice_reverse_baseline_s":24.5012,"mixed_slice_reverse_candidate_s":24.5626},"correctness_status":"the temporary parser-gated variant produced checker-valid SAT and UNSAT outputs on smoke checks, and after restoring the retained wrapper the alternate solver still passed all 43 regression tests","decision":"discard","notes":"This branch was too close to call and not strong enough to justify a full-suite benchmark. Even with parser-integrated first-round pure counts, reintroducing root-pure preprocessing into `satsolver_fast.py` still came out as a root-hit near-tie and a mixed-slice near-tie, so the simpler no-root-pure wrapper remains the better retained alternate baseline."}
{"timestamp":"2026-03-21T00:15:44+01:00","experiment_id":"2026-03-21-reject-satsolver-fast-standalone-copy","hypothesis":"Because the current `satsolver_fast.py` is just a thin wrapper that imports the main solver, replacing it with a standalone no-root-pure copy of `satsolver.py` might reduce exact-CLI startup/import overhead enough to improve the alternate submission path.","change_summary":"Backed up the retained wrapper as `scratch_satsolver_fast_before_standalone.py`, copied `satsolver.py` into `satsolver_fast.py`, removed root-pure presolve from `solve_cnf_serial()`, validated SAT and UNSAT smoke cases, measured wrapper-vs-standalone exact-CLI hotspot slices, then restored the retained wrapper after the standalone copy failed to show a strong enough signal.","files_changed":["agent_log.md","experiments.jsonl","benchmark_summary.md","next_steps.md"],"datasets":["small/test_1.cnf","special/tseitin.cnf","small/test_5.cnf","small/test_6.cnf","small/test_9.cnf","medium/test_8.cnf","medium/test_9.cnf","large/test_1.cnf","large/test_2.cnf","large/test_5.cnf","large/test_7.cnf","large/test_9.cnf","special/easy.cnf","small/test_10.cnf","medium/test_3.cnf","medium/test_4.cnf","large/test_6.cnf","large/test_8.cnf","large/test_10.cnf","special/hard.cnf"],"commands":["cp satsolver_fast.py scratch_satsolver_fast_before_standalone.py","cp satsolver.py satsolver_fast.py","python -m py_compile satsolver_fast.py scratch_satsolver_fast_before_standalone.py","python satsolver_fast.py small/test_1.cnf /tmp/satsolver_fast_sat.txt","python tools/checker.py small/test_1.cnf /tmp/satsolver_fast_sat.txt","python satsolver_fast.py special/tseitin.cnf /tmp/satsolver_fast_unsat.txt","python tools/checker.py special/tseitin.cnf /tmp/satsolver_fast_unsat.txt --bruteforce-var-limit 0","python tools/hotspot_compare.py --baseline-cli-script scratch_satsolver_fast_before_standalone.py --candidate-cli-script satsolver_fast.py small/test_1.cnf small/test_5.cnf small/test_6.cnf small/test_9.cnf medium/test_8.cnf medium/test_9.cnf large/test_1.cnf large/test_2.cnf large/test_5.cnf large/test_7.cnf large/test_9.cnf special/easy.cnf","python tools/hotspot_compare.py --baseline-cli-script scratch_satsolver_fast_before_standalone.py --candidate-cli-script satsolver_fast.py small/test_1.cnf small/test_10.cnf medium/test_3.cnf medium/test_4.cnf large/test_6.cnf large/test_8.cnf large/test_10.cnf special/hard.cnf special/tseitin.cnf","cp scratch_satsolver_fast_before_standalone.py satsolver_fast.py && rm scratch_satsolver_fast_before_standalone.py","python -m py_compile satsolver_fast.py","python -m unittest discover -s tests -v"],"metrics_before":{"unit_test_count":43,"root_hit_slice_two_order_avg_baseline_s":0.4336,"mixed_slice_two_order_avg_baseline_s":24.4869},"metrics_after":{"unit_test_count":43,"root_hit_slice_two_order_avg_candidate_s":0.4996,"mixed_slice_two_order_avg_candidate_s":24.4441,"root_hit_slice_forward_baseline_s":0.4131,"root_hit_slice_forward_candidate_s":0.4667,"root_hit_slice_reverse_baseline_s":0.4540,"root_hit_slice_reverse_candidate_s":0.5324,"mixed_slice_forward_baseline_s":24.4603,"mixed_slice_forward_candidate_s":24.6531,"mixed_slice_reverse_baseline_s":24.5135,"mixed_slice_reverse_candidate_s":24.2351},"correctness_status":"the temporary standalone copy produced checker-valid SAT and UNSAT smoke outputs, and after restoring the retained wrapper the alternate solver still passed all 43 regression tests","decision":"discard","notes":"The standalone copy was not a clean startup win. It regressed heavily on the SAT-heavy exact-CLI root-hit slice and only improved slightly on the mixed hotspot slice, so duplicating the whole solver file is not enough by itself to beat the retained wrapper-style alternate file."}
{"timestamp":"2026-03-21T00:24:22+01:00","experiment_id":"2026-03-21-reject-satsolver-fast-min-wrapper","hypothesis":"Because the retained `satsolver_fast.py` is still a wrapper around `satsolver`, trimming the wrapper down further and removing extra alias boilerplate might reduce exact-CLI startup enough to beat the current alternate file without changing solver behavior.","change_summary":"Measured full-corpus structural presolver costs, created a smaller scratch wrapper `scratch_satsolver_fast_minwrap.py` around `satsolver`, added the `parse_dimacs_file`/`write_result` aliases needed by `benchmark_suite.py`, validated SAT and UNSAT smoke cases, compared the retained wrapper versus the scratch min-wrapper on exact-CLI hotspot slices, ran a repeat-aware exact-CLI 59-case suite for the scratch candidate, then deleted the scratch file after the full-suite result regressed overall.","files_changed":["agent_log.md","experiments.jsonl","benchmark_summary.md","next_steps.md"],"datasets":["small/test_1.cnf","special/tseitin.cnf","small/test_5.cnf","small/test_6.cnf","small/test_9.cnf","medium/test_8.cnf","medium/test_9.cnf","large/test_1.cnf","large/test_2.cnf","large/test_5.cnf","large/test_7.cnf","large/test_9.cnf","special/easy.cnf","small/test_10.cnf","medium/test_3.cnf","medium/test_4.cnf","large/test_6.cnf","large/test_8.cnf","large/test_10.cnf","special/hard.cnf","small","medium","large","special","satlib_subset","satlib_more"],"commands":["python - <<'PY' ... time full-corpus has_pigeonhole_core(...) and xor_system_unsat(...) totals across the 59 benchmark cases ... PY","python -m py_compile scratch_satsolver_fast_minwrap.py","python scratch_satsolver_fast_minwrap.py small/test_1.cnf /tmp/scratch_fast_minwrap_sat.txt","python tools/checker.py small/test_1.cnf /tmp/scratch_fast_minwrap_sat.txt","python scratch_satsolver_fast_minwrap.py special/tseitin.cnf /tmp/scratch_fast_minwrap_unsat.txt","python tools/checker.py special/tseitin.cnf /tmp/scratch_fast_minwrap_unsat.txt --bruteforce-var-limit 0","python tools/hotspot_compare.py --baseline-cli-script satsolver_fast.py --candidate-cli-script scratch_satsolver_fast_minwrap.py small/test_1.cnf small/test_5.cnf small/test_6.cnf small/test_9.cnf medium/test_8.cnf medium/test_9.cnf large/test_1.cnf large/test_2.cnf large/test_5.cnf large/test_7.cnf large/test_9.cnf special/easy.cnf","python tools/hotspot_compare.py --baseline-cli-script satsolver_fast.py --candidate-cli-script scratch_satsolver_fast_minwrap.py small/test_1.cnf small/test_10.cnf medium/test_3.cnf medium/test_4.cnf large/test_6.cnf large/test_8.cnf large/test_10.cnf special/hard.cnf special/tseitin.cnf","python benchmark_suite.py scratch_satsolver_fast_minwrap /tmp/scratch_fast_minwrap_cli_repeat2.txt small medium large special satlib_subset satlib_more --bruteforce-var-limit 16 --cli-script scratch_satsolver_fast_minwrap.py --repeat 2","rm scratch_satsolver_fast_minwrap.py","python -m unittest discover -s tests -v"],"metrics_before":{"retained_fast_cli_repeat2_s":27.3829,"retained_fast_cli_repeat2_measured_s":54.7658,"unit_test_count":43,"root_hit_slice_two_order_avg_baseline_s":0.4159,"mixed_slice_two_order_avg_baseline_s":24.8028},"metrics_after":{"unit_test_count":43,"root_hit_slice_two_order_avg_candidate_s":0.4511,"mixed_slice_two_order_avg_candidate_s":24.5644,"root_hit_slice_forward_baseline_s":0.4419,"root_hit_slice_forward_candidate_s":0.4353,"root_hit_slice_reverse_baseline_s":0.3899,"root_hit_slice_reverse_candidate_s":0.4668,"mixed_slice_forward_baseline_s":25.2360,"mixed_slice_forward_candidate_s":24.5026,"mixed_slice_reverse_baseline_s":24.3697,"mixed_slice_reverse_candidate_s":24.6262,"candidate_full_exact_cli_repeat2_s":27.5180,"candidate_full_exact_cli_repeat2_measured_s":55.0360,"candidate_full_exact_cli_repeat2_wall_clock_s":55.2908,"candidate_full_exact_cli_repeat2_solved_correctly":59,"full_corpus_pigeonhole_presolver_total_s":0.019156,"full_corpus_xor_presolver_total_s":0.045146},"correctness_status":"the temporary scratch min-wrapper produced checker-valid SAT and UNSAT smoke outputs, the repeat-aware exact-CLI full suite still solved 59/59 correctly, and after deleting the scratch file the retained baseline still passed all 43 regression tests","decision":"discard","notes":"This branch proved that wrapper reshaping alone is not enough. The scratch candidate was mildly better on the mixed exact-CLI hotspot slice, but it lost the SAT-heavy root-hit slice and then lost the real repeat-aware exact-CLI full suite (`27.3829s -> 27.5180s`). The separate presolver timing also says structural pigeonhole/XOR checks are only about 0.0643s total across the whole current corpus, so they are unlikely to be the next alternate-file lever either."}
