{"timestamp":"2026-03-21T15:43:49+01:00","experiment_id":"2026-03-21-reject-array-backed-hot-state","hypothesis":"Because `propagate()`, `analyze()`, and `pick_branch_literal()` do huge numbers of indexed reads and writes against small-integer solver state, moving that state onto stdlib `array(...)` / `bytearray` containers might cut enough Python object overhead to help the exact-CLI core path without changing search behavior.","change_summary":"Collected a fresh retained-baseline `large/test_6.cnf` profile, froze a `HEAD` baseline in `/tmp/satsolver_arraystate_baseline/`, temporarily patched `satsolver_core.py` so `literal_values`, `literal_var`, `literal_sign`, `literal_watch_index`, `negated_watch_index`, `values`, `level`, `phase_bias`, `saved_phase`, `seen`, and `lbd_marks` use typed arrays, validated with `py_compile`, the full unit suite, and checker-backed SAT/UNSAT smoke checks, benchmarked the frozen baseline vs candidate on the mixed nine-case exact-CLI hotspot slice, then reverted the patch immediately after the mixed gate regressed and reran retained-baseline validation.","files_changed":["agent_log.md","benchmark_summary.md","experiments.jsonl","next_steps.md"],"datasets":["large/test_6.cnf","small/test_1.cnf","special/tseitin.cnf","medium/test_4.cnf","medium/test_8.cnf","small/test_5.cnf","large/test_8.cnf","large/test_10.cnf","special/hard.cnf"],"commands":["python -m cProfile -s tottime satsolver.py large/test_6.cnf /tmp/current_cycle_profile3.txt | head -n 35","mkdir -p /tmp/satsolver_arraystate_baseline && git show HEAD:satsolver.py > /tmp/satsolver_arraystate_baseline/satsolver.py && git show HEAD:satsolver_core.py > /tmp/satsolver_arraystate_baseline/satsolver_core.py && git show HEAD:satsolver_fast.py > /tmp/satsolver_arraystate_baseline/satsolver_fast.py","python -m py_compile satsolver.py satsolver_core.py satsolver_fast.py","python -m unittest discover -s tests -v","python satsolver.py small/test_1.cnf /tmp/array_state_sat.txt && python tools/checker.py small/test_1.cnf /tmp/array_state_sat.txt","python satsolver.py special/tseitin.cnf /tmp/array_state_unsat.txt && python tools/checker.py special/tseitin.cnf /tmp/array_state_unsat.txt --bruteforce-var-limit 0","python tools/hotspot_compare.py --baseline-cli-script /tmp/satsolver_arraystate_baseline/satsolver.py --candidate-cli-script satsolver.py large/test_6.cnf special/hard.cnf medium/test_4.cnf large/test_10.cnf large/test_8.cnf small/test_1.cnf small/test_5.cnf medium/test_8.cnf special/tseitin.cnf","python -m py_compile satsolver.py satsolver_core.py satsolver_fast.py","python -m unittest discover -s tests -v","python satsolver.py small/test_1.cnf /tmp/reject_sat_check.txt && python tools/checker.py small/test_1.cnf /tmp/reject_sat_check.txt","python satsolver.py special/tseitin.cnf /tmp/reject_unsat_check.txt && python tools/checker.py special/tseitin.cnf /tmp/reject_unsat_check.txt --bruteforce-var-limit 0"],"metrics_before":{"unit_test_count":55,"large_test_6_profile_total_s":36.424,"large_test_6_profile_propagate_tottime_s":20.33,"large_test_6_profile_analyze_tottime_s":3.348,"large_test_6_profile_list_append_tottime_s":2.885,"large_test_6_profile_pick_branch_literal_tottime_s":1.658,"large_test_6_profile_list_pop_tottime_s":1.595,"large_test_6_profile_abs_tottime_s":1.303,"large_test_6_profile_len_tottime_s":1.064,"large_test_6_profile_minimize_learnt_tottime_s":1.034,"large_test_6_profile_backtrack_tottime_s":0.988,"mixed_slice_two_order_avg_baseline_s":25.5674,"mixed_slice_forward_baseline_s":24.8951,"mixed_slice_reverse_baseline_s":26.2398},"metrics_after":{"unit_test_count":55,"mixed_slice_two_order_avg_candidate_s":31.1749,"mixed_slice_forward_candidate_s":30.3363,"mixed_slice_reverse_candidate_s":32.0135,"large_test_6_forward_candidate_s":16.2617,"large_test_6_reverse_candidate_s":16.3599,"special_hard_forward_candidate_s":9.6518,"special_hard_reverse_candidate_s":11.0078,"medium_test_4_forward_candidate_s":2.0213,"medium_test_4_reverse_candidate_s":2.1286,"large_test_10_forward_candidate_s":1.981,"large_test_10_reverse_candidate_s":2.083},"correctness_status":"the array-backed candidate compiled cleanly, passed all 55 unit tests, stayed checker-valid on SAT and UNSAT smoke cases, and preserved outputs on the mixed exact-CLI gate, but it regressed badly enough that no broader suite run was warranted","decision":"discard","notes":"This was not a near miss. The candidate lost in both orders and especially hurt the dense UNSAT cases, so future pure-Python data-layout work should be skeptical of stdlib typed arrays unless the branch removes materially more real solver work than a container substitution."}
{"timestamp":"2026-03-21T15:53:51+01:00","experiment_id":"2026-03-21-reject-isolated-reason-sentinel","hypothesis":"Because `reason` is read and written across `enqueue()`, `backtrack()`, `minimize_learnt()`, `analyze()`, `reduce_database()`, and the profiled solver, replacing `None` with `NO_REASON = -1` might remove enough mixed-type overhead to help the exact-CLI core path without changing search behavior.","change_summary":"Collected a fresh retained-baseline `large/test_6.cnf` profile, froze a `HEAD` baseline in `/tmp/satsolver_reasonsolo_baseline/`, temporarily patched `satsolver_core.py`, `satsolver.py`, `tools/profile_solver.py`, and `tests/test_solver_regressions.py` so solver reasons use `NO_REASON = -1` internally, validated with `py_compile`, the full unit suite, and checker-backed SAT/UNSAT smoke checks, benchmarked the frozen baseline vs candidate on the mixed nine-case exact-CLI hotspot slice, then ran repeat-aware exact-CLI 35-case suites for both before reverting the patch after the broader suite regressed and rerunning retained-baseline validation.","files_changed":["agent_log.md","benchmark_summary.md","experiments.jsonl","next_steps.md"],"datasets":["large/test_6.cnf","small/test_1.cnf","special/tseitin.cnf","medium/test_4.cnf","medium/test_8.cnf","small/test_5.cnf","large/test_8.cnf","large/test_10.cnf","special/hard.cnf","small","medium","large","special"],"commands":["python -m cProfile -s tottime satsolver.py large/test_6.cnf /tmp/reason_solo_profile.txt | head -n 35","mkdir -p /tmp/satsolver_reasonsolo_baseline && git show HEAD:satsolver.py > /tmp/satsolver_reasonsolo_baseline/satsolver.py && git show HEAD:satsolver_core.py > /tmp/satsolver_reasonsolo_baseline/satsolver_core.py && git show HEAD:satsolver_fast.py > /tmp/satsolver_reasonsolo_baseline/satsolver_fast.py","python -m py_compile satsolver.py satsolver_core.py satsolver_fast.py tools/profile_solver.py tests/test_solver_regressions.py","python -m unittest discover -s tests -v","python satsolver.py small/test_1.cnf /tmp/reason_solo_sat.txt && python tools/checker.py small/test_1.cnf /tmp/reason_solo_sat.txt","python satsolver.py special/tseitin.cnf /tmp/reason_solo_unsat.txt && python tools/checker.py special/tseitin.cnf /tmp/reason_solo_unsat.txt --bruteforce-var-limit 0","python tools/hotspot_compare.py --baseline-cli-script /tmp/satsolver_reasonsolo_baseline/satsolver.py --candidate-cli-script satsolver.py large/test_6.cnf special/hard.cnf medium/test_4.cnf large/test_10.cnf large/test_8.cnf small/test_1.cnf small/test_5.cnf medium/test_8.cnf special/tseitin.cnf","python benchmark_suite.py satsolver /tmp/reasonsolo_baseline_cli_repeat2.txt small medium large special --bruteforce-var-limit 16 --cli-script /tmp/satsolver_reasonsolo_baseline/satsolver.py --repeat 2","python benchmark_suite.py satsolver /tmp/reasonsolo_candidate_cli_repeat2.txt small medium large special --bruteforce-var-limit 16 --cli-script satsolver.py --repeat 2","python -m py_compile satsolver.py satsolver_core.py satsolver_fast.py tools/profile_solver.py tests/test_solver_regressions.py","python -m unittest discover -s tests -v","python satsolver.py small/test_1.cnf /tmp/revert_reason_solo_sat.txt && python tools/checker.py small/test_1.cnf /tmp/revert_reason_solo_sat.txt","python satsolver.py special/tseitin.cnf /tmp/revert_reason_solo_unsat.txt && python tools/checker.py special/tseitin.cnf /tmp/revert_reason_solo_unsat.txt --bruteforce-var-limit 0"],"metrics_before":{"unit_test_count":55,"large_test_6_profile_total_s":23.459,"large_test_6_profile_propagate_tottime_s":12.337,"large_test_6_profile_analyze_tottime_s":2.352,"large_test_6_profile_list_append_tottime_s":1.971,"large_test_6_profile_list_pop_tottime_s":1.162,"large_test_6_profile_pick_branch_literal_tottime_s":1.112,"large_test_6_profile_abs_tottime_s":0.961,"large_test_6_profile_len_tottime_s":0.765,"large_test_6_profile_minimize_learnt_tottime_s":0.711,"large_test_6_profile_backtrack_tottime_s":0.679,"mixed_slice_two_order_avg_baseline_s":24.3347,"mixed_slice_forward_baseline_s":23.9083,"mixed_slice_reverse_baseline_s":24.7612,"suite35_repeat2_baseline_s":25.4875,"suite35_large_test_6_baseline_s":11.6523,"suite35_special_hard_baseline_s":7.8904,"suite35_medium_test_4_baseline_s":1.7178,"suite35_large_test_8_baseline_s":0.2732},"metrics_after":{"unit_test_count":55,"mixed_slice_two_order_avg_candidate_s":24.1806,"mixed_slice_forward_candidate_s":24.2229,"mixed_slice_reverse_candidate_s":24.1384,"suite35_repeat2_candidate_s":25.9045,"suite35_large_test_6_candidate_s":11.8537,"suite35_special_hard_candidate_s":8.0711,"suite35_medium_test_4_candidate_s":1.7716,"suite35_large_test_8_candidate_s":0.2928},"correctness_status":"the isolated sentinel patch compiled cleanly, passed all 55 unit tests, stayed checker-valid on SAT and UNSAT smoke cases, and still solved the repeat-aware exact-CLI 35-case suite correctly at 35/35, but the broader suite regressed, so the patch was reverted and the retained baseline restored unchanged","decision":"discard","notes":"This isolates the old bundled lane cleanly. The mixed exact-CLI hotspot slice was mildly positive, but the broader repeat-aware exact-CLI suite still lost, so integer-only `reason` storage should now be treated as a dead micro-optimization lane by itself."}
{"timestamp":"2026-03-21T16:01:21+01:00","experiment_id":"2026-03-21-reject-global-phase-bias-main-path","hypothesis":"Because `phase_bias` is already accumulated during problem-clause ingest and the solver now always branches from `saved_phase`, turning on `seed_phase_bias=True` for the default exact-CLI `solve_cnf_fast_serial()` path might broaden the old phase-bias signal into a real mixed-gate search win instead of leaving it confined to the narrow portfolio worker.","change_summary":"Collected a fresh retained-baseline `large/test_6.cnf` profile, froze a `HEAD` baseline in `/tmp/satsolver_phasebiasmain_baseline/`, temporarily patched `satsolver.py` so the default `solve_cnf()` path calls `solve_cnf_fast_serial(..., seed_phase_bias=True)`, validated with `py_compile`, the full unit suite, and checker-backed SAT/UNSAT smoke checks, benchmarked the frozen baseline vs candidate on the mixed nine-case exact-CLI hotspot slice, then reverted the wrapper patch immediately after the mixed gate regressed and reran retained-baseline validation.","files_changed":["agent_log.md","benchmark_summary.md","experiments.jsonl","next_steps.md"],"datasets":["large/test_6.cnf","small/test_1.cnf","special/tseitin.cnf","medium/test_4.cnf","medium/test_8.cnf","small/test_5.cnf","large/test_8.cnf","large/test_10.cnf","special/hard.cnf"],"commands":["python -m cProfile -s tottime satsolver.py large/test_6.cnf /tmp/phasebiasmain_profile.txt | head -n 35","mkdir -p /tmp/satsolver_phasebiasmain_baseline && git show HEAD:satsolver.py > /tmp/satsolver_phasebiasmain_baseline/satsolver.py && git show HEAD:satsolver_core.py > /tmp/satsolver_phasebiasmain_baseline/satsolver_core.py && git show HEAD:satsolver_fast.py > /tmp/satsolver_phasebiasmain_baseline/satsolver_fast.py","python -m py_compile satsolver.py satsolver_core.py satsolver_fast.py","python -m unittest discover -s tests -v","python satsolver.py small/test_1.cnf /tmp/phasebiasmain_sat.txt && python tools/checker.py small/test_1.cnf /tmp/phasebiasmain_sat.txt","python satsolver.py special/tseitin.cnf /tmp/phasebiasmain_unsat.txt && python tools/checker.py special/tseitin.cnf /tmp/phasebiasmain_unsat.txt --bruteforce-var-limit 0","python tools/hotspot_compare.py --baseline-cli-script /tmp/satsolver_phasebiasmain_baseline/satsolver.py --candidate-cli-script satsolver.py large/test_6.cnf special/hard.cnf medium/test_4.cnf large/test_10.cnf large/test_8.cnf small/test_1.cnf small/test_5.cnf medium/test_8.cnf special/tseitin.cnf","python -m py_compile satsolver.py satsolver_core.py satsolver_fast.py","python -m unittest discover -s tests -v","python satsolver.py small/test_1.cnf /tmp/revert_phasebiasmain_sat.txt && python tools/checker.py small/test_1.cnf /tmp/revert_phasebiasmain_sat.txt","python satsolver.py special/tseitin.cnf /tmp/revert_phasebiasmain_unsat.txt && python tools/checker.py special/tseitin.cnf /tmp/revert_phasebiasmain_unsat.txt --bruteforce-var-limit 0"],"metrics_before":{"unit_test_count":55,"large_test_6_profile_total_s":36.222,"large_test_6_profile_propagate_tottime_s":20.285,"large_test_6_profile_analyze_tottime_s":3.275,"large_test_6_profile_list_append_tottime_s":2.883,"large_test_6_profile_pick_branch_literal_tottime_s":1.648,"large_test_6_profile_list_pop_tottime_s":1.625,"large_test_6_profile_abs_tottime_s":1.297,"large_test_6_profile_len_tottime_s":1.058,"large_test_6_profile_minimize_learnt_tottime_s":1.023,"large_test_6_profile_backtrack_tottime_s":0.957,"mixed_slice_two_order_avg_baseline_s":31.7103,"mixed_slice_forward_baseline_s":32.3513,"mixed_slice_reverse_baseline_s":31.0694},"metrics_after":{"unit_test_count":55,"mixed_slice_two_order_avg_candidate_s":37.6381,"mixed_slice_forward_candidate_s":36.0224,"mixed_slice_reverse_candidate_s":39.2538,"large_test_6_forward_candidate_s":17.5613,"large_test_6_reverse_candidate_s":19.2728,"special_hard_forward_candidate_s":13.4149,"special_hard_reverse_candidate_s":14.9598,"medium_test_4_forward_candidate_s":2.4407,"medium_test_4_reverse_candidate_s":2.6837,"large_test_10_forward_candidate_s":2.1127,"large_test_10_reverse_candidate_s":1.8062},"correctness_status":"the wrapper patch compiled cleanly, passed all 55 unit tests, stayed checker-valid on SAT and UNSAT smoke cases, and preserved outputs on the mixed exact-CLI gate, but the search policy regressed badly enough that no broader suite run was warranted","decision":"discard","notes":"This confirms the earlier heuristic warning in a cleaner main-path form: phase-bias seeding is still too narrow and unstable to turn on globally. One `large/test_6.cnf` forward improvement was overwhelmed by broad losses, especially on `special/hard.cnf`."}
{"timestamp":"2026-03-21T16:07:23+01:00","experiment_id":"2026-03-21-reject-portfolio-fast-workers","hypothesis":"Because the current portfolio gate effectively only fires on the all-3-SAT `large/test_8.cnf` family, and because that family is already on the no-root-pure exact-CLI fast path outside the worker wrapper, switching portfolio workers from `solve_cnf_serial()` to `solve_cnf_fast_serial()` might remove enough wrapper overhead to improve the one remaining gated case.","change_summary":"Temporarily patched `solve_cnf_portfolio()` in `satsolver_core.py` so both workers call `solve_cnf_fast_serial()` instead of `solve_cnf_serial()`, validated with `py_compile`, the full unit suite, and checker-backed SAT smoke on `large/test_8.cnf`, benchmarked the frozen retained baseline vs candidate on `large/test_8.cnf` via `tools/hotspot_compare.py --repeat 2`, then reverted the worker patch immediately after the one-case gate regressed and reran retained-baseline validation.","files_changed":["agent_log.md","benchmark_summary.md","experiments.jsonl","next_steps.md"],"datasets":["large/test_8.cnf"],"commands":["python -m py_compile satsolver.py satsolver_core.py satsolver_fast.py","python -m unittest discover -s tests -v","python satsolver.py large/test_8.cnf /tmp/portfolio_fast8_sat.txt && python tools/checker.py large/test_8.cnf /tmp/portfolio_fast8_sat.txt","python tools/hotspot_compare.py --baseline-cli-script /tmp/satsolver_phasebiasmain_baseline/satsolver.py --candidate-cli-script satsolver.py --repeat 2 large/test_8.cnf","python -m py_compile satsolver.py satsolver_core.py satsolver_fast.py","python -m unittest discover -s tests -v","python satsolver.py large/test_8.cnf /tmp/revert_fast_portfolio8_sat.txt && python tools/checker.py large/test_8.cnf /tmp/revert_fast_portfolio8_sat.txt"],"metrics_before":{"unit_test_count":55,"large_test_8_two_order_avg_baseline_s":0.2924,"large_test_8_forward_baseline_s":0.2772,"large_test_8_reverse_baseline_s":0.3075},"metrics_after":{"unit_test_count":55,"large_test_8_two_order_avg_candidate_s":0.295,"large_test_8_forward_candidate_s":0.3008,"large_test_8_reverse_candidate_s":0.2892},"correctness_status":"the worker-swap candidate compiled cleanly, passed all 55 unit tests, and stayed checker-valid on `large/test_8.cnf`, but it still lost slightly on the exact one-case gate it was meant to help, so the patch was reverted and the retained baseline restored unchanged","decision":"discard","notes":"This is a very narrow reject, but it matters because the current portfolio gate now effectively matches only this one case. Even here, swapping workers to the lighter fast-serial path did not produce a reliable win."}
{"timestamp":"2026-03-21T16:18:37+01:00","experiment_id":"2026-03-21-reject-binary-deleted-check-removal","hypothesis":"Because `reduce_database()` never deletes binary clauses, removing the per-implication `clause.deleted` guard and its clause fetch from the binary implication loop in `propagate()` might shave enough hot-path overhead to help the exact-CLI mixed gate without changing search behavior.","change_summary":"Froze a retained baseline in `/tmp/sat_binary_deletedcheck_baseline/`, temporarily patched only the binary implication loop in `satsolver_core.py` to remove the binary-clause `deleted` guard, validated with `py_compile` and the full unit suite, benchmarked the frozen baseline vs candidate on a mixed nine-case exact-CLI hotspot slice, then reverted the patch immediately after the mixed gate regressed and reran retained-baseline validation.","files_changed":["agent_log.md","benchmark_summary.md","experiments.jsonl","next_steps.md"],"datasets":["large/test_6.cnf","special/hard.cnf","medium/test_4.cnf","large/test_10.cnf","medium/test_3.cnf","large/test_8.cnf","small/test_5.cnf","special/tseitin.cnf","small/test_1.cnf"],"commands":["mkdir -p /tmp/sat_binary_deletedcheck_baseline && cp satsolver.py satsolver_core.py satsolver_fast.py /tmp/sat_binary_deletedcheck_baseline/","python -m py_compile satsolver.py satsolver_core.py satsolver_fast.py","python -m unittest discover -s tests -v","python tools/hotspot_compare.py --baseline-cli-script /tmp/sat_binary_deletedcheck_baseline/satsolver.py --candidate-cli-script satsolver.py large/test_6.cnf special/hard.cnf medium/test_4.cnf large/test_10.cnf medium/test_3.cnf large/test_8.cnf small/test_5.cnf special/tseitin.cnf small/test_1.cnf","python -m py_compile satsolver.py satsolver_core.py satsolver_fast.py","python -m unittest discover -s tests -v"],"metrics_before":{"unit_test_count":55,"mixed_slice_two_order_avg_baseline_s":32.4733,"mixed_slice_forward_baseline_s":29.7849,"mixed_slice_reverse_baseline_s":35.1617,"large_test_6_forward_baseline_s":13.4145,"large_test_6_reverse_baseline_s":17.6973,"special_hard_forward_baseline_s":10.5046,"special_hard_reverse_baseline_s":11.3143,"medium_test_4_forward_baseline_s":2.2717,"medium_test_4_reverse_baseline_s":2.4905,"medium_test_3_forward_baseline_s":0.8197,"medium_test_3_reverse_baseline_s":0.8943,"large_test_8_forward_baseline_s":0.3576,"large_test_8_reverse_baseline_s":0.4065},"metrics_after":{"unit_test_count":55,"mixed_slice_two_order_avg_candidate_s":32.7124,"mixed_slice_forward_candidate_s":30.9033,"mixed_slice_reverse_candidate_s":34.5214,"large_test_6_forward_candidate_s":13.6184,"large_test_6_reverse_candidate_s":17.2971,"special_hard_forward_candidate_s":11.1995,"special_hard_reverse_candidate_s":11.3473,"medium_test_4_forward_candidate_s":2.3859,"medium_test_4_reverse_candidate_s":2.3513,"medium_test_3_forward_candidate_s":0.8904,"medium_test_3_reverse_candidate_s":0.8321,"large_test_8_forward_candidate_s":0.3695,"large_test_8_reverse_candidate_s":0.3710},"correctness_status":"the temporary patch compiled cleanly and passed all 55 unit tests, but it regressed the mixed exact-CLI hotspot gate overall, so it was reverted immediately and the retained baseline restored unchanged","decision":"discard","notes":"This closes another tiny propagation-cleanup lane: even when the branch looks semantically redundant, removing one deleted-clause guard from the binary path was still not a free win on the real exact-CLI gate."}
