{"timestamp":"2026-03-20T04:09:57+01:00","experiment_id":"2026-03-20-rejected-local-decay-sweep","hypothesis":"A small heuristic sweep around the current var_decay=0.95 and clause_decay=0.999 defaults might reveal a nearby setting that improves the dense UNSAT-heavy hotspot slice without requiring a structural solver rewrite.","change_summary":"Ran a bounded hotspot-only sweep around the current activity-decay defaults using tools.profile_solver.solve_with_profile(), then rejected the local neighborhood after every nearby setting lost to the baseline.","files_changed":["agent_log.md","experiments.jsonl","benchmark_summary.md","next_steps.md"],"datasets":["large/test_6.cnf","special/hard.cnf","medium/test_4.cnf","large/test_10.cnf","small/test_1.cnf","special/tseitin.cnf"],"commands":["python tools/profile_solver.py large/test_6.cnf special/hard.cnf medium/test_4.cnf large/test_10.cnf","SATSOLVER_DISABLE_PORTFOLIO=1 python - <<'PY' ... cProfile solve_cnf on large/test_6.cnf ... PY","python - <<'PY' ... bounded tools.profile_solver.solve_with_profile() sweep over var_decay/clause_decay neighbors ... PY","python -m unittest discover -s tests -v","python satsolver.py small/test_1.cnf /tmp/cycle4_sat.txt","python tools/checker.py small/test_1.cnf /tmp/cycle4_sat.txt","python satsolver.py special/tseitin.cnf /tmp/cycle4_unsat.txt","python tools/checker.py special/tseitin.cnf /tmp/cycle4_unsat.txt --bruteforce-var-limit 0"],"metrics_before":{"bounded_sweep_baseline_total_runtime_s":33.3481,"bounded_sweep_baseline_large_test_6_runtime_s":17.5434,"bounded_sweep_baseline_special_hard_runtime_s":11.3483,"bounded_sweep_baseline_medium_test_4_runtime_s":2.3136,"bounded_sweep_baseline_large_test_10_runtime_s":2.1429},"metrics_after":{"var_decay_0_96_clause_decay_0_9990_total_runtime_s":36.0523,"var_decay_0_96_clause_decay_0_9990_large_test_6_runtime_s":17.1095,"var_decay_0_96_clause_decay_0_9990_special_hard_runtime_s":14.9108,"var_decay_0_96_clause_decay_0_9990_medium_test_4_runtime_s":2.0278,"var_decay_0_96_clause_decay_0_9990_large_test_10_runtime_s":2.0042,"var_decay_0_95_clause_decay_0_9992_total_runtime_s":40.6508,"var_decay_0_95_clause_decay_0_9992_large_test_6_runtime_s":25.4444,"var_decay_0_95_clause_decay_0_9992_special_hard_runtime_s":11.0012,"var_decay_0_95_clause_decay_0_9992_medium_test_4_runtime_s":2.4469,"var_decay_0_95_clause_decay_0_9992_large_test_10_runtime_s":1.7583,"aborted_var_decay_0_94_clause_decay_0_9990_first_two_cases_runtime_s":39.7922,"aborted_clause_decay_0_9980_large_test_6_runtime_s":19.2330},"correctness_status":"passed 13 regression tests and SAT/UNSAT checker spot checks; solver code remained unchanged","decision":"discard","notes":"The immediate heuristic neighborhood around 0.95/0.999 is now measured and unpromising on the main UNSAT-heavy cases. Nearby settings either lost overall or blew up early on large/test_6.cnf and special/hard.cnf, so future heuristic work should be more qualitative than a small local decay sweep."}
{"timestamp":"2026-03-20T04:18:22+01:00","experiment_id":"2026-03-20-rejected-blocker-watchers","hypothesis":"If watched-clause entries carry blocker literals, propagate() may skip many clause touches when the other watched side is already satisfied, reducing hot-path work on the dense pure-3-SAT UNSAT cases.","change_summary":"Reworked non-binary watcher entries to store a blocker literal and use a blocker-true short-circuit in propagate(), validated correctness, then reverted the change after a large focused serial regression.","files_changed":["satsolver.py","agent_log.md","experiments.jsonl","benchmark_summary.md","next_steps.md"],"datasets":["large/test_6.cnf","special/hard.cnf","medium/test_4.cnf","large/test_10.cnf","small/test_1.cnf","special/tseitin.cnf"],"commands":["SATSOLVER_DISABLE_PORTFOLIO=1 python -u - <<'PY' ... focused timing script over large/test_6.cnf, special/hard.cnf, medium/test_4.cnf, large/test_10.cnf ... PY","python -m unittest discover -s tests -v","python satsolver.py small/test_1.cnf /tmp/cycle5_sat.txt","python tools/checker.py small/test_1.cnf /tmp/cycle5_sat.txt","python satsolver.py special/tseitin.cnf /tmp/cycle5_unsat.txt","python tools/checker.py special/tseitin.cnf /tmp/cycle5_unsat.txt --bruteforce-var-limit 0"],"metrics_before":{"focused_serial_hotspot_total_runtime_s":27.1935,"large_test_6_runtime_s":14.3134,"special_hard_runtime_s":9.1207,"medium_test_4_runtime_s":1.8979,"large_test_10_runtime_s":1.8615},"metrics_after":{"experimental_focused_serial_hotspot_total_runtime_s":36.5950,"large_test_6_runtime_s":16.6738,"special_hard_runtime_s":14.9529,"medium_test_4_runtime_s":3.0757,"large_test_10_runtime_s":1.8926,"post_revert_focused_serial_hotspot_total_runtime_s":26.7368},"correctness_status":"passed 13 regression tests and SAT/UNSAT checker spot checks, but benchmarked much worse overall and was reverted","decision":"discard","notes":"The extra watcher-entry structure and blocker checks cost more than they saved on the measured dense 3-SAT UNSAT cases, so the retained solver configuration is unchanged."}
{"timestamp":"2026-03-20T04:18:22+01:00","experiment_id":"2026-03-20-rejected-dense-unsat-alt-worker","hypothesis":"A narrowly gated second worker with var_decay=0.96 might be worth adding for large dense pure-3-SAT UNSAT-like formulas if its wall-clock benefit is strong enough on those families.","change_summary":"Compared a baseline worker against a var_decay=0.96 alternate worker on the dense large pure-3-SAT cases, including a temporary two-process wall-clock portfolio check, and rejected the idea because the gain was too narrow and inconsistent.","files_changed":["agent_log.md","experiments.jsonl","benchmark_summary.md","next_steps.md"],"datasets":["large/test_6.cnf","large/test_10.cnf","large/test_3.cnf"],"commands":["python - <<'PY' ... solve_with_profile() comparison for large/test_6.cnf and large/test_10.cnf at var_decay 0.95 vs 0.96 ... PY","python - <<'PY' ... solve_with_profile() comparison for large/test_3.cnf and large/test_10.cnf at var_decay 0.95 vs 0.96 ... PY","python - <<'PY' ... temporary two-process wall-clock portfolio check on large/test_6.cnf and large/test_10.cnf ... PY"],"metrics_before":{"large_test_6_serial_wall_s":14.0442,"large_test_10_serial_wall_s":1.9148,"large_test_3_baseline_cpu_s":0.3269,"large_test_6_baseline_cpu_s":18.0827,"large_test_10_baseline_cpu_s":2.0791},"metrics_after":{"large_test_6_alt096_cpu_s":17.2411,"large_test_10_alt096_cpu_s":1.9824,"large_test_3_alt096_cpu_s":0.3653,"large_test_6_portfolio_wall_s":14.2078,"large_test_10_portfolio_wall_s":1.7882},"correctness_status":"measurement-only experiment on unchanged solver code; no correctness regressions observed","decision":"discard","notes":"The alternate worker did help large/test_10.cnf a little, but it still lost on large/test_6.cnf wall-clock and regressed large/test_3.cnf, so the per-family win was too small and inconsistent to justify extra portfolio complexity."}
{"timestamp":"2026-03-20T04:27:29+01:00","experiment_id":"2026-03-20-rejected-mirrored-ternary-arrays","hypothesis":"Mirroring ternary watched state into flatter solver-owned arrays, while skipping redundant binary-clause deletion checks, might cut Clause/list indirection in propagate() enough to help the dense pure-3-SAT UNSAT hotspot family without changing the search path.","change_summary":"Added solver-owned arrays for ternary watched literals and the third literal, routed ternary propagation through those arrays, temporarily removed binary-clause deletion checks from the implication path, then reverted the solver change after a focused serial regression. Kept a direct small pure-ternary SAT/UNSAT regression test.","files_changed":["satsolver.py","tests/test_solver_regressions.py","agent_log.md","experiments.jsonl","benchmark_summary.md","next_steps.md"],"datasets":["large/test_6.cnf","special/hard.cnf","medium/test_4.cnf","large/test_10.cnf","small/test_1.cnf","special/tseitin.cnf"],"commands":["SATSOLVER_DISABLE_PORTFOLIO=1 python - <<'PY' ... focused timing script over large/test_6.cnf, special/hard.cnf, medium/test_4.cnf, large/test_10.cnf ... PY","python tools/profile_solver.py large/test_6.cnf special/hard.cnf medium/test_4.cnf large/test_10.cnf","python -m unittest discover -s tests -v","python satsolver.py small/test_1.cnf /tmp/cycle6_sat.txt","python tools/checker.py small/test_1.cnf /tmp/cycle6_sat.txt","python satsolver.py special/tseitin.cnf /tmp/cycle6_unsat.txt","python tools/checker.py special/tseitin.cnf /tmp/cycle6_unsat.txt --bruteforce-var-limit 0","python satsolver.py small/test_1.cnf /tmp/cycle6_revert_sat.txt","python tools/checker.py small/test_1.cnf /tmp/cycle6_revert_sat.txt","python satsolver.py special/tseitin.cnf /tmp/cycle6_revert_unsat.txt","python tools/checker.py special/tseitin.cnf /tmp/cycle6_revert_unsat.txt --bruteforce-var-limit 0"],"metrics_before":{"focused_serial_hotspot_total_runtime_s":25.1295,"large_test_6_runtime_s":12.9543,"special_hard_runtime_s":8.5760,"medium_test_4_runtime_s":1.8451,"large_test_10_runtime_s":1.7541,"large_test_6_decisions":72886,"large_test_6_conflicts":59201,"large_test_6_processed_literals":2431409},"metrics_after":{"experimental_focused_serial_hotspot_total_runtime_s":28.2180,"large_test_6_runtime_s":14.6584,"special_hard_runtime_s":9.5948,"medium_test_4_runtime_s":1.9931,"large_test_10_runtime_s":1.9717,"large_test_6_profile_time_s":17.4947,"special_hard_profile_time_s":11.7030,"medium_test_4_profile_time_s":2.3141,"large_test_10_profile_time_s":2.1228,"large_test_6_decisions":72886,"large_test_6_conflicts":59201,"large_test_6_processed_literals":2431409,"post_revert_focused_serial_hotspot_total_runtime_s":27.2997},"correctness_status":"passed 14 regression tests and SAT/UNSAT checker spot checks, but the solver rewrite benchmarked worse overall and was reverted","decision":"discard","notes":"Duplicating mutable ternary watched state alongside existing Clause objects cost more synchronization and list work than it saved. The only retained artifact from the cycle is a direct small pure-ternary SAT/UNSAT regression test."}
{"timestamp":"2026-03-20T04:39:07+01:00","experiment_id":"2026-03-20-rejected-root-failed-literal-probe","hypothesis":"If the dense pure-3-SAT UNSAT bottlenecks contain easy root-level failed literals among their highest-activity variables, a small failed-literal probe could become a viable targeted presolve or restart heuristic.","change_summary":"Probed both polarities of the top 24 activity-ranked variables at the root on the main dense 3-SAT bottlenecks, then discarded the idea after finding no failed literals at all.","files_changed":["agent_log.md","experiments.jsonl","benchmark_summary.md","next_steps.md"],"datasets":["large/test_6.cnf","special/hard.cnf","medium/test_4.cnf","large/test_10.cnf","large/test_8.cnf"],"commands":["python - <<'PY' ... build Solver, probe both polarities of the top 24 activity-ranked variables at root, propagate, then backtrack ... PY"],"metrics_before":{"probed_variables_per_case":24,"probed_polarities_per_case":48},"metrics_after":{"large_test_6_failed_literals":0,"special_hard_failed_literals":0,"medium_test_4_failed_literals":0,"large_test_10_failed_literals":0,"large_test_8_failed_literals":0},"correctness_status":"measurement-only experiment on unchanged solver code; no correctness regressions observed","decision":"discard","notes":"The absence of even one failed literal across the top-ranked root variables makes simple root probing look too weak to justify production overhead on the remaining dense bottlenecks."}
{"timestamp":"2026-03-20T04:39:07+01:00","experiment_id":"2026-03-20-rejected-dense-phase-seeding-sweep","hypothesis":"A fixed initial phase on dense pure-3-SAT formulas might bias the CDCL search enough to help the remaining UNSAT-heavy cases if clause density can separate those families from the SAT-like portfolio cases.","change_summary":"Measured baseline, phase-bias, all-false, and all-true initial phase policies on the main dense pure-3-SAT cases, then evaluated an all-false density-gated slice and rejected the idea because the wins were too inconsistent and the SAT regressions were too large.","files_changed":["agent_log.md","experiments.jsonl","benchmark_summary.md","next_steps.md"],"datasets":["large/test_6.cnf","special/hard.cnf","medium/test_4.cnf","large/test_10.cnf","large/test_3.cnf","large/test_8.cnf","small","medium","large","special","satlib_subset","satlib_more"],"commands":["python - <<'PY' ... per-case baseline/bias/false/true timing sweep over large/test_6.cnf, special/hard.cnf, medium/test_4.cnf, large/test_10.cnf, large/test_3.cnf, large/test_8.cnf ... PY","python - <<'PY' ... evaluate all-false seeding over the density>=4.5 pure-3-SAT slice ... PY"],"metrics_before":{"density_gte_4_5_slice_total_baseline_s":20.0405,"large_test_6_baseline_s":14.6468,"medium_test_4_baseline_s":1.9790,"large_test_8_baseline_s":3.7206,"special_dense_baseline_s":0.1005},"metrics_after":{"density_gte_4_5_slice_total_false_seed_s":21.7522,"large_test_6_false_seed_s":16.7511,"medium_test_4_false_seed_s":1.7017,"large_test_8_false_seed_s":15.7795,"special_dense_false_seed_s":0.0771,"large_test_8_bias_seed_s":0.2260},"correctness_status":"measurement-only experiment on unchanged solver code; no correctness regressions observed","decision":"discard","notes":"Fixed-polarity seeding is too unstable to gate with clause density alone. All-false helps some dense UNSAT formulas, but it loses overall on the dense slice and is catastrophic on large/test_8.cnf; all-true only helped a subset inconsistently."}
{"timestamp":"2026-03-20T04:39:07+01:00","experiment_id":"2026-03-20-rejected-binary-path-delete-check-removal","hypothesis":"Because reduce_database() never deletes binary learnt clauses, removing the deleted-clause object lookup from binary implication propagation might shave hot-path overhead without affecting the search path.","change_summary":"Removed the binary-clause deleted check from propagate(), added a regression test that reduce_database() preserves binary learnt clauses, benchmarked the isolated micro-optimization, then reverted the solver change after a slight hotspot regression while keeping the new test.","files_changed":["satsolver.py","tests/test_solver_regressions.py","agent_log.md","experiments.jsonl","benchmark_summary.md","next_steps.md"],"datasets":["large/test_6.cnf","special/hard.cnf","medium/test_4.cnf","large/test_10.cnf","small/test_1.cnf","special/tseitin.cnf"],"commands":["python - <<'PY' ... focused timing script over large/test_6.cnf, special/hard.cnf, medium/test_4.cnf, large/test_10.cnf ... PY","python tools/profile_solver.py large/test_6.cnf special/hard.cnf medium/test_4.cnf large/test_10.cnf","python -m unittest discover -s tests -v","python satsolver.py small/test_1.cnf /tmp/cycle7_sat.txt","python tools/checker.py small/test_1.cnf /tmp/cycle7_sat.txt","python satsolver.py special/tseitin.cnf /tmp/cycle7_unsat.txt","python tools/checker.py special/tseitin.cnf /tmp/cycle7_unsat.txt --bruteforce-var-limit 0","python satsolver.py small/test_1.cnf /tmp/cycle7_revert_sat.txt","python tools/checker.py small/test_1.cnf /tmp/cycle7_revert_sat.txt","python satsolver.py special/tseitin.cnf /tmp/cycle7_revert_unsat.txt","python tools/checker.py special/tseitin.cnf /tmp/cycle7_revert_unsat.txt --bruteforce-var-limit 0"],"metrics_before":{"focused_serial_hotspot_total_runtime_s":27.1002,"large_test_6_runtime_s":14.1977,"special_hard_runtime_s":9.1067,"medium_test_4_runtime_s":1.9205,"large_test_10_runtime_s":1.8754,"large_test_6_profile_time_s":16.9565,"large_test_6_decisions":72886,"large_test_6_conflicts":59201,"large_test_6_processed_literals":2431409},"metrics_after":{"experimental_focused_serial_hotspot_total_runtime_s":27.1624,"large_test_6_runtime_s":14.2137,"special_hard_runtime_s":9.1394,"medium_test_4_runtime_s":1.9097,"large_test_10_runtime_s":1.8996,"experimental_large_test_6_profile_time_s":18.1694,"post_revert_focused_serial_hotspot_total_runtime_s":27.5902,"regression_test_count":15},"correctness_status":"passed 15 regression tests and SAT/UNSAT checker spot checks, but the isolated micro-optimization benchmarked slightly worse and was reverted","decision":"discard","notes":"The binary-path search counts stayed identical, so the slight slowdown was real overhead noise or missed cache effects rather than a search-path difference. The only retained artifact is the binary-learnt retention regression test."}
{"timestamp":"2026-03-20T04:51:26+01:00","experiment_id":"2026-03-20-measured-stale-watcher-occupancy","hypothesis":"If stale watcher occupancy remains high on the dense UNSAT-heavy pure-3-SAT end states, a different lazy cleanup strategy might still be worth pursuing despite the earlier immediate-detachment regression.","change_summary":"Measured end-state watcher occupancy after solving the main dense bottlenecks to estimate how much deleted learnt-clause residue is actually left in watcher lists.","files_changed":["agent_log.md","experiments.jsonl","benchmark_summary.md","next_steps.md"],"datasets":["large/test_6.cnf","special/hard.cnf","medium/test_4.cnf","large/test_10.cnf"],"commands":["python - <<'PY' ... solve each dense bottleneck, then count total watcher entries, stale watcher entries, and binary implication entries ... PY"],"metrics_before":{"priority_assumption":"stale watcher cleanup might still be a high-value follow-up after the earlier immediate-detachment regression"},"metrics_after":{"large_test_6_stale_watch_ratio":0.061035,"special_hard_stale_watch_ratio":0.062988,"medium_test_4_stale_watch_ratio":0.028131,"large_test_10_stale_watch_ratio":0.031604,"large_test_6_total_binary_entries":56,"special_hard_total_binary_entries":74,"medium_test_4_total_binary_entries":34,"large_test_10_total_binary_entries":50},"correctness_status":"measurement-only experiment on unchanged solver code; no correctness regressions observed","decision":"discard as a near-term focus","notes":"The measured stale occupancy is real but modest enough that stale-watcher cleanup looks lower priority than other structural propagation or conflict-analysis work, unless a future touched-entry profile reveals a much higher active stale-hit rate than the end-state occupancy suggests."}
{"timestamp":"2026-03-20T04:51:26+01:00","experiment_id":"2026-03-20-rejected-small-learnt-minimization-cutoff","hypothesis":"Because most minimization value seems to come from larger learnt clauses, skipping minimize_learnt() only for very small learnt clauses might save time without causing the severe regressions seen with the earlier blunt reason-size cutoff.","change_summary":"Surveyed minimization yield by learnt-clause length, then tested a temporary solver subclass that skips minimization for small learnt clauses. Threshold 6 looked good on one dense-UNSAT slice but regressed badly on mixed SAT/UNSAT subsets and the full 59-case benchmark, so the idea was discarded without changing production code.","files_changed":["agent_log.md","experiments.jsonl","benchmark_summary.md","next_steps.md"],"datasets":["large/test_6.cnf","special/hard.cnf","medium/test_4.cnf","large/test_10.cnf","medium/test_3.cnf","large/test_8.cnf","special/dense.cnf","small","medium","large","special","satlib_subset","satlib_more"],"commands":["python - <<'PY' ... minimization-yield survey by learnt-clause length on dense UNSAT bottlenecks ... PY","python - <<'PY' ... temporary solver subclass sweep for skip_len in {0,6,8,10} on large/test_6.cnf, special/hard.cnf, medium/test_4.cnf, large/test_10.cnf ... PY","python - <<'PY' ... repeat mixed subset comparison for skip_len in {0,6} over large/test_6.cnf, special/hard.cnf, medium/test_4.cnf, large/test_10.cnf, medium/test_3.cnf, large/test_8.cnf, special/dense.cnf ... PY","python - <<'PY' ... full 59-case measurement-only comparison for skip_len in {0,6} ... PY"],"metrics_before":{"focused_four_case_baseline_total_s":28.3715,"mixed_subset_repeat1_baseline_total_s":31.9765,"mixed_subset_repeat2_baseline_total_s":30.5272,"full_suite_measurement_only_baseline_total_s":32.2658,"large_test_8_baseline_repeat1_s":3.8318,"large_test_8_baseline_repeat2_s":3.6688},"metrics_after":{"skip_len_6_focused_four_case_total_s":26.3752,"skip_len_8_focused_four_case_total_s":30.5124,"skip_len_10_focused_four_case_total_s":43.1014,"skip_len_6_mixed_subset_repeat1_total_s":41.3415,"skip_len_6_mixed_subset_repeat2_total_s":39.8114,"skip_len_6_full_suite_measurement_only_total_s":43.2184,"large_test_8_skip_len_6_repeat1_s":14.3613,"large_test_8_skip_len_6_repeat2_s":13.5829},"correctness_status":"measurement-only experiment on unchanged solver code; no correctness regressions observed","decision":"discard","notes":"Small-learnt minimization cutoffs are too family-sensitive. The narrow cutoff helped some dense UNSAT cases, but it catastrophically hurt the SAT-like large/test_8.cnf family and lost badly overall, so global learnt-size gating is now another measured dead end."}
