{"timestamp":"2026-03-20T11:06:34+01:00","experiment_id":"2026-03-20-keep-analyze-drop-touched-cleanup","hypothesis":"Because `analyze()` already scopes `seen` membership with `seen_token`, the end-of-conflict touched-list cleanup may be redundant, and removing it may cut conflict-analysis overhead without changing the search path.","change_summary":"Dropped the end-of-`analyze()` touched-list bookkeeping in `satsolver.py` and `tools/profile_solver.py`, kept only the pivot-variable unmarking needed within a single analysis, added a regression asserting that stale old-token `seen` values do not break `analyze()`, and validated the change against both hotspot A/B slices and refreshed full-suite repeat-aware runs.","files_changed":["satsolver.py","tools/profile_solver.py","tests/test_solver_regressions.py","agent_log.md","experiments.jsonl","benchmark_summary.md","next_steps.md","out_extended.txt","out_cli_extended.txt"],"datasets":["large/test_6.cnf","special/hard.cnf","medium/test_4.cnf","large/test_10.cnf","large/test_8.cnf","small/test_1.cnf","special/tseitin.cnf","small","medium","large","special","satlib_subset","satlib_more"],"commands":["python - <<'PY' ... temporary NoTouchCleanupSolver vs retained baseline on the five hotspot cases in forward and reverse order ... PY","python - <<'PY' ... temporary NoTouchCleanupProfiledSolver vs ProfiledSolver on large/test_6.cnf, special/hard.cnf, and large/test_8.cnf ... PY","python - <<'PY' ... exact-CLI hotspot A/B against /tmp/satsolver_no_touch_cleanup.py in forward and reverse order ... PY","python -m unittest discover -s tests -v","python satsolver.py small/test_1.cnf /tmp/cycle_sat.txt","python tools/checker.py small/test_1.cnf /tmp/cycle_sat.txt","python satsolver.py special/tseitin.cnf /tmp/cycle_unsat.txt","python tools/checker.py special/tseitin.cnf /tmp/cycle_unsat.txt --bruteforce-var-limit 0","python benchmark_suite.py satsolver out_extended.txt small medium large special satlib_subset satlib_more --bruteforce-var-limit 16 --repeat 2","python benchmark_suite.py satsolver out_cli_extended.txt small medium large special satlib_subset satlib_more --bruteforce-var-limit 16 --cli-script satsolver.py --repeat 2"],"metrics_before":{"serial_hotspot_forward_total_s":26.7637,"serial_hotspot_reverse_total_s":26.5209,"serial_hotspot_avg_total_s":26.6423,"exact_cli_hotspot_forward_total_s":23.6775,"exact_cli_hotspot_reverse_total_s":23.5558,"exact_cli_hotspot_avg_total_s":23.6167,"profiled_large_test_6_time_s":20.9460,"profiled_large_test_6_decisions":72886,"profiled_large_test_6_conflicts":59201,"profiled_large_test_6_processed_literals":2431409,"profiled_special_hard_time_s":13.8799,"profiled_special_hard_decisions":54245,"profiled_special_hard_conflicts":44619,"profiled_special_hard_processed_literals":1737825,"profiled_large_test_8_time_s":5.0918,"profiled_large_test_8_decisions":21526,"profiled_large_test_8_conflicts":16430,"profiled_large_test_8_processed_literals":838303,"repeat2_inprocess_total_s":26.4982,"repeat2_inprocess_measured_total_s":52.9964,"repeat2_exact_cli_total_s":28.7536,"repeat2_exact_cli_measured_total_s":57.5073,"unit_test_count":26},"metrics_after":{"serial_hotspot_forward_total_s":26.3862,"serial_hotspot_reverse_total_s":25.9334,"serial_hotspot_avg_total_s":26.1598,"exact_cli_hotspot_forward_total_s":23.2600,"exact_cli_hotspot_reverse_total_s":23.2509,"exact_cli_hotspot_avg_total_s":23.2555,"profiled_large_test_6_time_s":20.9149,"profiled_large_test_6_decisions":72886,"profiled_large_test_6_conflicts":59201,"profiled_large_test_6_processed_literals":2431409,"profiled_special_hard_time_s":13.3554,"profiled_special_hard_decisions":54245,"profiled_special_hard_conflicts":44619,"profiled_special_hard_processed_literals":1737825,"profiled_large_test_8_time_s":5.1076,"profiled_large_test_8_decisions":21526,"profiled_large_test_8_conflicts":16430,"profiled_large_test_8_processed_literals":838303,"repeat2_inprocess_total_s":25.2549,"repeat2_inprocess_measured_total_s":50.5099,"repeat2_exact_cli_total_s":27.3138,"repeat2_exact_cli_measured_total_s":54.6276,"unit_test_count":27},"correctness_status":"passed 27 regression tests including a new stale-seen-token regression, SAT/UNSAT checker spot checks, and validated 59/59 repeat-aware full-suite runs in both module and exact-CLI modes; the profiled hotspot cases kept identical decisions/conflicts/processed-literal counts","decision":"keep","notes":"This keep is stronger than the last couple of `analyze()` micro-optimizations because it stayed positive on both the direct serial hotspot slice and the exact required CLI hotspot slice in both orders, then also improved both refreshed repeat-aware 59-case artifacts. The key lesson is that token-scoped conflict-analysis state can sometimes be left stale safely, which is a better direction than more clause-shape unrolling."}
{"timestamp":"2026-03-20T12:00:53+01:00","experiment_id":"2026-03-20-reject-rawfork-portfolio-plumbing","hypothesis":"Because the current narrow portfolio gate matches only `large/test_8.cnf`, replacing the lazy `multiprocessing` queue/process setup with raw `os.fork()` plus pipes might make that one parallel case cheap enough to improve the exact CLI benchmark path overall.","change_summary":"Tested a temporary raw-`fork`/pipe rewrite of the existing two-worker portfolio path inspired by `maybe.md`, compared it against a same-day baseline on repeated exact-CLI `large/test_8.cnf` runs and a same-day repeat-aware exact-CLI 59-case suite, then reverted it after the suite-level signal stayed negative overall.","files_changed":["agent_log.md","experiments.jsonl","benchmark_summary.md","next_steps.md","out_cli_extended.txt"],"datasets":["large/test_8.cnf","small","medium","large","special","satlib_subset","satlib_more"],"commands":["python - <<'PY' ... repeated exact-CLI timing of large/test_8.cnf for satsolver.py and /tmp/satsolver_rawfork_portfolio.py ... PY","python /tmp/satsolver_rawfork_portfolio.py large/test_8.cnf /tmp/rawfork_large8.txt","python tools/checker.py large/test_8.cnf /tmp/rawfork_large8.txt","python - <<'PY' ... same-day exact-CLI timing of large/test_8.cnf for /tmp/satsolver_baseline_before_rawfork.py and patched satsolver.py ... PY","python benchmark_suite.py satsolver /tmp/out_cli_baseline_rawfork_eval.txt small medium large special satlib_subset satlib_more --bruteforce-var-limit 16 --cli-script /tmp/satsolver_baseline_before_rawfork.py --repeat 2","python benchmark_suite.py satsolver out_cli_extended.txt small medium large special satlib_subset satlib_more --bruteforce-var-limit 16 --cli-script satsolver.py --repeat 2","python -m unittest discover -s tests -v","python satsolver.py large/test_8.cnf /tmp/rawfork_revert_large8.txt","python tools/checker.py large/test_8.cnf /tmp/rawfork_revert_large8.txt"],"metrics_before":{"large_test_8_baseline_avg_s":0.2892,"large_test_8_baseline_median_s":0.2889,"same_day_repeat2_exact_cli_total_s":27.1974,"same_day_repeat2_exact_cli_measured_total_s":54.3948,"same_day_repeat2_exact_cli_wall_clock_s":54.6329,"same_day_repeat2_exact_cli_large_test_8_s":0.2909,"unit_test_count":27},"metrics_after":{"large_test_8_rawfork_avg_s":0.2626,"large_test_8_rawfork_median_s":0.2591,"same_day_repeat2_exact_cli_total_s":27.8860,"same_day_repeat2_exact_cli_measured_total_s":55.7719,"same_day_repeat2_exact_cli_wall_clock_s":56.0236,"same_day_repeat2_exact_cli_large_test_8_s":0.2823,"unit_test_count":27},"correctness_status":"the raw-`fork` temporary solver produced valid SAT output on `large/test_8.cnf`, the retained solver passed 27 regression tests after reverting, and the reverted retained solver still passed the SAT checker on `large/test_8.cnf`","decision":"discard","notes":"This was a narrow single-case win that did not survive the broader same-day exact-CLI benchmark. `large/test_8.cnf` got faster, but the repeat-aware 59-case suite still lost overall, so the production solver stays on the existing lazy `multiprocessing` portfolio path."}
{"timestamp":"2026-03-20T11:40:14+01:00","experiment_id":"2026-03-20-reject-inline-prepare-learnt","hypothesis":"Because `prepare_learnt_clause()` runs after every non-unit conflict and only finalizes backtrack level plus LBD, inlining that loop directly into `analyze()` might remove helper-call overhead without changing the search path.","change_summary":"Patched `satsolver.py` and `tools/profile_solver.py` to inline the final learnt-clause preparation step inside `analyze()`, added a regression covering a multi-literal analyze result, then reverted the branch after the same-day exact-CLI repeat-aware 59-case suite regressed clearly despite a mildly positive module hotspot A/B average.","files_changed":["agent_log.md","experiments.jsonl","benchmark_summary.md","next_steps.md"],"datasets":["large/test_6.cnf","special/hard.cnf","medium/test_4.cnf","large/test_10.cnf","large/test_8.cnf","small/test_1.cnf","special/tseitin.cnf","small","medium","large","special","satlib_subset","satlib_more"],"commands":["python -m unittest discover -s tests -v","python /tmp/compare_inline_prepare.py","python benchmark_suite.py satsolver /tmp/out_cli_inline_prepare_candidate.txt small medium large special satlib_subset satlib_more --bruteforce-var-limit 16 --cli-script satsolver.py --repeat 2","python satsolver.py small/test_1.cnf /tmp/cycle_sat_revert.txt","python tools/checker.py small/test_1.cnf /tmp/cycle_sat_revert.txt","python satsolver.py special/tseitin.cnf /tmp/cycle_unsat_revert.txt","python tools/checker.py special/tseitin.cnf /tmp/cycle_unsat_revert.txt --bruteforce-var-limit 0","python -m unittest discover -s tests -v"],"metrics_before":{"serial_hotspot_forward_total_s":26.8101,"serial_hotspot_reverse_total_s":27.1963,"serial_hotspot_avg_total_s":27.0032,"repeat2_exact_cli_total_s":27.1974,"repeat2_exact_cli_measured_total_s":54.3948,"repeat2_exact_cli_wall_clock_s":54.6329,"repeat2_exact_cli_worst_case_s":11.5797,"unit_test_count":27},"metrics_after":{"serial_hotspot_forward_total_s":26.8457,"serial_hotspot_reverse_total_s":26.7666,"serial_hotspot_avg_total_s":26.8062,"repeat2_exact_cli_total_s":28.2602,"repeat2_exact_cli_measured_total_s":56.5204,"repeat2_exact_cli_wall_clock_s":56.7485,"repeat2_exact_cli_worst_case_s":12.2066,"unit_test_count":27},"correctness_status":"the temporary inline branch passed the regression suite before evaluation, and after reverting the retained solver again passed 27 regression tests plus SAT and UNSAT checker spot checks on `small/test_1.cnf` and `special/tseitin.cnf`","decision":"discard","notes":"This branch is a useful measurement warning: a small helper-boundary removal inside `analyze()` looked mildly positive on the module hotspot slice, but the same-day repeat-aware exact-CLI suite regressed clearly enough to reject it. The production solver stays on the retained baseline."}
{"timestamp":"2026-03-20T11:56:52+01:00","experiment_id":"2026-03-20-reject-pick-branch-locals","hypothesis":"Because `pick_branch_literal()` still spends real time scanning every variable on the hard cases, moving `values`, `activity`, and `num_vars` into locals and reusing `best_activity` for the zero-activity polarity check might trim Python overhead without changing the actual branch choices.","change_summary":"Tested a temporary local-alias rewrite of `pick_branch_literal()`, patched `satsolver.py`, validated it, compared it against the saved same-day baseline on serial and exact-CLI hotspot slices, then reverted it after the repeat-aware exact-CLI 59-case suite regressed slightly overall.","files_changed":["agent_log.md","experiments.jsonl","benchmark_summary.md","next_steps.md"],"datasets":["large/test_6.cnf","special/hard.cnf","medium/test_4.cnf","large/test_10.cnf","large/test_8.cnf","small/test_1.cnf","special/tseitin.cnf","small","medium","large","special","satlib_subset","satlib_more"],"commands":["python - <<'PY' ... refreshed cProfile on large/test_6.cnf, special/hard.cnf, and large/test_8.cnf ... PY","python tools/profile_solver.py large/test_6.cnf special/hard.cnf medium/test_4.cnf large/test_8.cnf","python /tmp/owned_learnt_eval.py","python - <<'PY' ... temporary LocalPickSolver vs baseline on the five hotspot cases in forward and reverse order ... PY","python - <<'PY' ... exact-CLI hotspot A/B against /tmp/satsolver_baseline_before_pick_locals.py in forward and reverse order ... PY","python -m unittest discover -s tests -v","python satsolver.py small/test_1.cnf /tmp/pick_local_sat.txt","python tools/checker.py small/test_1.cnf /tmp/pick_local_sat.txt","python satsolver.py special/tseitin.cnf /tmp/pick_local_unsat.txt","python tools/checker.py special/tseitin.cnf /tmp/pick_local_unsat.txt --bruteforce-var-limit 0","python benchmark_suite.py satsolver /tmp/out_cli_pick_locals_candidate.txt small medium large special satlib_subset satlib_more --bruteforce-var-limit 16 --cli-script satsolver.py --repeat 2","python -m unittest discover -s tests -v","python satsolver.py small/test_1.cnf /tmp/pick_local_revert_sat.txt","python tools/checker.py small/test_1.cnf /tmp/pick_local_revert_sat.txt","python satsolver.py special/tseitin.cnf /tmp/pick_local_revert_unsat.txt","python tools/checker.py special/tseitin.cnf /tmp/pick_local_revert_unsat.txt --bruteforce-var-limit 0"],"metrics_before":{"serial_hotspot_forward_total_s":26.6866,"serial_hotspot_reverse_total_s":26.6863,"serial_hotspot_avg_total_s":26.6864,"exact_cli_hotspot_forward_total_s":23.8194,"exact_cli_hotspot_reverse_total_s":23.5785,"exact_cli_hotspot_avg_total_s":23.6990,"repeat2_exact_cli_total_s":27.1974,"repeat2_exact_cli_measured_total_s":54.3948,"repeat2_exact_cli_wall_clock_s":54.6329,"repeat2_exact_cli_worst_case_s":11.5797,"unit_test_count":27},"metrics_after":{"serial_hotspot_forward_total_s":25.9296,"serial_hotspot_reverse_total_s":26.6985,"serial_hotspot_avg_total_s":26.3141,"exact_cli_hotspot_forward_total_s":23.2287,"exact_cli_hotspot_reverse_total_s":23.6858,"exact_cli_hotspot_avg_total_s":23.4572,"repeat2_exact_cli_total_s":27.3229,"repeat2_exact_cli_measured_total_s":54.6459,"repeat2_exact_cli_wall_clock_s":54.8865,"repeat2_exact_cli_worst_case_s":11.8111,"unit_test_count":27},"correctness_status":"the temporary branch passed 27 regression tests plus SAT and UNSAT checker spot checks before evaluation, and after reverting the retained solver again passed the same 27 tests plus checker spot checks on `small/test_1.cnf` and `special/tseitin.cnf`","decision":"discard","notes":"This branch is another good measurement warning: a local-alias cleanup in `pick_branch_literal()` looked mildly positive on both hotspot slices, but the repeat-aware exact-CLI 59-case suite still regressed overall. The production solver stays on the retained baseline."}
{"timestamp":"2026-03-20T12:07:39+01:00","experiment_id":"2026-03-20-reject-solve-helper-cleanup","hypothesis":"Because `solve()` still pays two tiny decay helper calls and one `reduce_database()` helper call on every conflict, inlining the decay divisions and gating the reduction call on `len(self.learnt_ids) >= self.next_reduce` might cut call overhead without changing the search path.","change_summary":"Measured a reduction-gate-only out-of-tree solver first, then a combined `solve()` cleanup that gated `reduce_database()` and inlined the two decay divisions, patched `satsolver.py` and `tools/profile_solver.py`, validated the branch, compared it against the saved same-day baseline on the exact-CLI hotspot slice, and reverted it after the exact-CLI signal stayed effectively tied overall.","files_changed":["agent_log.md","experiments.jsonl","benchmark_summary.md","next_steps.md"],"datasets":["large/test_6.cnf","special/hard.cnf","medium/test_4.cnf","large/test_10.cnf","large/test_8.cnf","small/test_1.cnf","special/tseitin.cnf"],"commands":["python - <<'PY' ... refreshed cProfile on large/test_6.cnf, special/hard.cnf, and large/test_8.cnf ... PY","python tools/profile_solver.py large/test_6.cnf special/hard.cnf medium/test_4.cnf large/test_8.cnf","python - <<'PY' ... temporary GatedReduceSolver vs baseline on the five hotspot cases in forward and reverse order ... PY","python - <<'PY' ... temporary SolveCleanupSolver vs baseline on the five hotspot cases in forward and reverse order ... PY","python -m unittest discover -s tests -v","python satsolver.py small/test_1.cnf /tmp/solve_cleanup_sat.txt","python tools/checker.py small/test_1.cnf /tmp/solve_cleanup_sat.txt","python satsolver.py special/tseitin.cnf /tmp/solve_cleanup_unsat.txt","python tools/checker.py special/tseitin.cnf /tmp/solve_cleanup_unsat.txt --bruteforce-var-limit 0","python - <<'PY' ... exact-CLI hotspot A/B against /tmp/satsolver_baseline_before_pick_locals.py in forward and reverse order ... PY","python -m unittest discover -s tests -v","python satsolver.py small/test_1.cnf /tmp/solve_cleanup_revert_sat.txt","python tools/checker.py small/test_1.cnf /tmp/solve_cleanup_revert_sat.txt","python satsolver.py special/tseitin.cnf /tmp/solve_cleanup_revert_unsat.txt","python tools/checker.py special/tseitin.cnf /tmp/solve_cleanup_revert_unsat.txt --bruteforce-var-limit 0"],"metrics_before":{"gated_only_serial_hotspot_forward_total_s":26.4710,"gated_only_serial_hotspot_reverse_total_s":26.0871,"gated_only_serial_hotspot_avg_total_s":26.2790,"serial_hotspot_forward_total_s":26.3407,"serial_hotspot_reverse_total_s":26.9017,"serial_hotspot_avg_total_s":26.6212,"exact_cli_hotspot_forward_total_s":23.4780,"exact_cli_hotspot_reverse_total_s":23.3016,"exact_cli_hotspot_avg_total_s":23.3898,"unit_test_count":27},"metrics_after":{"gated_only_serial_hotspot_forward_total_s":26.4074,"gated_only_serial_hotspot_reverse_total_s":26.2571,"gated_only_serial_hotspot_avg_total_s":26.3322,"serial_hotspot_forward_total_s":26.4330,"serial_hotspot_reverse_total_s":26.4196,"serial_hotspot_avg_total_s":26.4263,"exact_cli_hotspot_forward_total_s":23.0781,"exact_cli_hotspot_reverse_total_s":23.6969,"exact_cli_hotspot_avg_total_s":23.3875,"unit_test_count":27},"correctness_status":"the temporary patched branch passed 27 regression tests plus SAT and UNSAT checker spot checks before evaluation, and after reverting the retained solver again passed the same 27 tests plus checker spot checks on `small/test_1.cnf` and `special/tseitin.cnf`","decision":"discard","notes":"This was not strong enough to justify a keep. The combined branch did look mildly positive on the serial hotspot average, but the exact-CLI hotspot A/B was effectively tied overall and mixed by order, so I reverted it without spending another full repeat-aware 59-case run."}
